time,journal,doi_info,authors,key words,title,abstract
2021,"IEEE access : practical innovations, open solutions",IEEE Access. 2021 Mar 4;9:40496-40510. doi: 10.1109/ACCESS.2021.3063716. ,"['Jha, Debesh', 'Ali, Sharib', 'Tomar, Nikhil Kumar', 'Johansen, Havard D', 'Johansen, Dag', 'Rittscher, Jens', 'Riegler, Michael A', 'Halvorsen, Pal']","['colonsegnet', 'kvasir-seg', 'medical image segmentation', 'benchmarking', 'colonoscopy', 'deep learning', 'detection', 'localisation', 'polyps']","Real-Time Polyp Detection, Localization and Segmentation in Colonoscopy Using Deep Learning.","Computer-aided detection, localisation, and segmentation methods can help improve colonoscopy procedures. Even though many methods have been built to tackle automatic detection and segmentation of polyps, benchmarking of state-of-the-art methods still remains an open problem. This is due to the increasing number of researched computer vision methods that can be applied to polyp datasets. Benchmarking of novel methods can provide a direction to the development of automated polyp detection and segmentation tasks. Furthermore, it ensures that the produced results in the community are reproducible and provide a fair comparison of developed methods. In this paper, we benchmark several recent state-of-the-art methods using Kvasir-SEG, an open-access dataset of colonoscopy images for polyp detection, localisation, and segmentation evaluating both method accuracy and speed. Whilst, most methods in literature have competitive performance over accuracy, we show that the proposed ColonSegNet achieved a better trade-off between an average precision of 0.8000 and mean IoU of 0.8100, and the fastest speed of 180 frames per second for the detection and localisation task. Likewise, the proposed ColonSegNet achieved a competitive dice coefficient of 0.8206 and the best average speed of 182.38 frames per second for the segmentation task. Our comprehensive comparison with various state-of-the-art methods reveals the importance of benchmarking the deep learning methods for automated real-time polyp identification and delineations that can potentially transform current clinical practices and minimise miss-detection rates."
2021 May,Medical image analysis,Med Image Anal. 2021 May;70:102002. doi: 10.1016/j.media.2021.102002. Epub 2021 ,"['Ali, Sharib', 'Dmitrieva, Mariia', 'Ghatwary, Noha', 'Bano, Sophia', 'Polat, Gorkem', 'Temizel, Alptekin', 'Krenzer, Adrian', 'Hekalo, Amar', 'Guo, Yun Bo', 'Matuszewski, Bogdan', 'Gridach, Mourad', 'Voiculescu, Irina', 'Yoganand, Vishnusai', 'Chavan, Arnav', 'Raj, Aryan', 'Nguyen, Nhan T', 'Tran, Dat Q', 'Huynh, Le Duy', 'Boutry, Nicolas', 'Rezvy, Shahadate', 'Chen, Haijian', 'Choi, Yoon Ho', 'Subramanian, Anand', 'Balasubramanian, Velmurugan', 'Gao, Xiaohong W', 'Hu, Hongyu', 'Liao, Yusheng', 'Stoyanov, Danail', 'Daul, Christian', 'Realdon, Stefano', 'Cannizzaro, Renato', 'Lamarque, Dominique', 'Tran-Nguyen, Terry', 'Bailey, Adam', 'Braden, Barbara', 'East, James E', 'Rittscher, Jens']","['algorithms', ' artifacts', ' deep learning', 'endoscopy, gastrointestinal', 'humans', 'artefact', 'challenge', 'deep learning', 'detection', 'disease', 'endoscopy', 'gastroenterology', 'segmentation']",Deep learning for detection and segmentation of artefact and disease instances in gastrointestinal endoscopy.,"The Endoscopy Computer Vision Challenge (EndoCV) is a crowd-sourcing initiative to address eminent problems in developing reliable computer aided detection and diagnosis endoscopy systems and suggest a pathway for clinical translation of technologies. Whilst endoscopy is a widely used diagnostic and treatment tool for hollow-organs, there are several core challenges often faced by endoscopists, mainly: 1) presence of multi-class artefacts that hinder their visual interpretation, and 2) difficulty in identifying subtle precancerous precursors and cancer abnormalities. Artefacts often affect the robustness of deep learning methods applied to the gastrointestinal tract organs as they can be confused with tissue of interest. EndoCV2020 challenges are designed to address research questions in these remits. In this paper, we present a summary of methods developed by the top 17 teams and provide an objective comparison of state-of-the-art methods and methods designed by the participants for two sub-challenges: i) artefact detection and segmentation (EAD2020), and ii) disease detection and segmentation (EDD2020). Multi-center, multi-organ, multi-class, and multi-modal clinical endoscopy datasets were compiled for both EAD2020 and EDD2020 sub-challenges. The out-of-sample generalization ability of detection algorithms was also evaluated. Whilst most teams focused on accuracy improvements, only a few methods hold credibility for clinical usability. The best performing teams provided solutions to tackle class imbalance, and variabilities in size, origin, modality and occurrences by exploring data augmentation, data fusion, and optimal class thresholding techniques."
2021 Feb,Medical image analysis,Med Image Anal. 2021 Feb;68:101900. doi: 10.1016/j.media.2020.101900. Epub 2020 ,"['Ali, Sharib', 'Zhou, Felix', 'Bailey, Adam', 'Braden, Barbara', 'East, James E', 'Lu, Xin', 'Rittscher, Jens']","['artifacts', ' deep learning', 'endoscopy', 'image processing, computer-assisted', 'neural networks, computer', 'convolution neural networks', 'frame restoration', 'multi-class artifact detection', 'multi-class artifact segmentation', 'video endoscopy']",A deep learning framework for quality assessment and restoration in video endoscopy.,"Endoscopy is a routine imaging technique used for both diagnosis and minimally invasive surgical treatment. Artifacts such as motion blur, bubbles, specular reflections, floating objects and pixel saturation impede the visual interpretation and the automated analysis of endoscopy videos. Given the widespread use of endoscopy in different clinical applications, robust and reliable identification of such artifacts and the automated restoration of corrupted video frames is a fundamental medical imaging problem. Existing state-of-the-art methods only deal with the detection and restoration of selected artifacts. However, typically endoscopy videos contain numerous artifacts which motivates to establish a comprehensive solution. In this paper, a fully automatic framework is proposed that can: 1) detect and classify six different artifacts, 2) segment artifact instances that have indefinable shapes, 3) provide a quality score for each frame, and 4) restore partially corrupted frames. To detect and classify different artifacts, the proposed framework exploits fast, multi-scale and single stage convolution neural network detector. In addition, we use an encoder-decoder model for pixel-wise segmentation of irregular shaped artifacts. A quality score is introduced to assess video frame quality and to predict image restoration success. Generative adversarial networks with carefully chosen regularization and training strategies for discriminator-generator networks are finally used to restore corrupted frames. The detector yields the highest mean average precision (mAP) of 45.7 and 34.7, respectively for 25% and 50% IoU thresholds, and the lowest computational time of 88 ms allowing for near real-time processing. The restoration models for blind deblurring, saturation correction and inpainting demonstrate significant improvements over previous methods. On a set of 10 test videos, an average of 68.7% of video frames successfully passed the quality score (≥0.9) after applying the proposed restoration framework thereby retaining 25% more frames compared to the raw videos. The importance of artifacts detection and their restoration on improved robustness of image analysis methods is also demonstrated in this work."
2020 Oct,Journal of gastroenterology and hepatology,J Gastroenterol Hepatol. 2020 Oct;35(10):1663-1664. doi: 10.1111/jgh.15262.,"['East, James E', 'Rittscher, Jens']","['adenoma epidemiology etiology  prevention & control', ' artificial intelligence', 'colonoscopy  methods', 'colorectal neoplasms epidemiology etiology  prevention & control', 'diagnosis, computer-assisted  methods', ' human characteristics', 'humans', 'intestinal polyps complications  diagnosis  surgery', 'quality assurance, health care']",Artificial intelligence for colonoscopic polyp detection: High performance versus human nature.,
2020,Computational and structural biotechnology journal,Comput Struct Biotechnol J. 2020 Aug 29;18:2501-2509. doi: ,"['Javer, Avelino', 'Rittscher, Jens', 'Sailem, Heba Z']","['cdc42', 'cdh5', 'endothelial cells', 'image analysis', 'migration tissue toplogy', 'wound healing']",DeepScratch: Single-cell based topological metrics of scratch wound assays.,"Changes in tissue architecture and multicellular organisation contribute to many diseases, including cancer and cardiovascular diseases. Scratch wound assay is a commonly used tool that assesses cells' migratory ability based on the area of a wound they cover over a certain time. However, analysis of changes in the organisational patterns formed by migrating cells following genetic or pharmacological perturbations are not well explored in these assays, in part because analysing the resulting imaging data is challenging. Here we present DeepScratch, a neural network that accurately detects the cells in scratch assays based on a heterogeneous set of markers. We demonstrate the utility of DeepScratch by analysing images of more than 232,000 lymphatic endothelial cells. In addition, we propose various topological measures of cell connectivity and local cell density (LCD) to characterise tissue remodelling during wound healing. We show that LCD-based metrics allow classification of CDH5 and CDC42 genetic perturbations that are known to affect cell migration through different biological mechanisms. Such differences cannot be captured when considering only the wound area. Taken together, single-cell detection using DeepScratch allows more detailed investigation of the roles of various genetic components in tissue topology and the biological mechanisms underlying their effects on collective cell migration."
2020 Jul 28,Blood advances,Blood Adv. 2020 Jul 28;4(14):3284-3294. doi: 10.1182/bloodadvances.2020002230.,"['Sirinukunwattana, Korsuk', 'Aberdeen, Alan', 'Theissen, Helen', 'Sousos, Nikolaos', 'Psaila, Bethan', 'Mead, Adam J', 'Turner, Gareth D H', 'Rees, Gabrielle', 'Rittscher, Jens', 'Royston, Daniel']","['artificial intelligence', 'humans', 'megakaryocytes', ' myeloproliferative disorders diagnosis genetics', ' polycythemia vera', ' thrombocythemia, essential']",Artificial intelligence-based morphological fingerprinting of megakaryocytes: a new tool for assessing disease in MPN patients.,"Accurate diagnosis and classification of myeloproliferative neoplasms (MPNs) requires integration of clinical, morphological, and genetic findings. Despite major advances in our understanding of the molecular and genetic basis of MPNs, the morphological assessment of bone marrow trephines (BMT) is critical in differentiating MPN subtypes and their reactive mimics. However, morphological assessment is heavily constrained by a reliance on subjective, qualitative, and poorly reproducible criteria. To improve the morphological assessment of MPNs, we have developed a machine learning approach for the automated identification, quantitative analysis, and abstract representation of megakaryocyte features using reactive/nonneoplastic BMT samples (n = 43) and those from patients with established diagnoses of essential thrombocythemia (n = 45), polycythemia vera (n = 18), or myelofibrosis (n = 25). We describe the application of an automated workflow for the identification and delineation of relevant histological features from routinely prepared BMTs. Subsequent analysis enabled the tissue diagnosis of MPN with a high predictive accuracy (area under the curve = 0.95) and revealed clear evidence of the potential to discriminate between important MPN subtypes. Our method of visually representing abstracted megakaryocyte features in the context of analyzed patient cohorts facilitates the interpretation and monitoring of samples in a manner that is beyond conventional approaches. The automated BMT phenotyping approach described here has significant potential as an adjunct to standard genetic and molecular testing in established or suspected MPN patients, either as part of the routine diagnostic pathway or in the assessment of disease progression/response to treatment."
2021 Mar,Gut,Gut. 2021 Mar;70(3):544-554. doi: 10.1136/gutjnl-2019-319866. Epub 2020 Jul 20.,"['Sirinukunwattana, Korsuk', 'Domingo, Enric', 'Richman, Susan D', 'Redmond, Keara L', 'Blake, Andrew', 'Verrill, Clare', 'Leedham, Simon J', 'Chatzipli, Aikaterini', 'Hardy, Claire', 'Whalley, Celina M', 'Wu, Chieh-Hsi', 'Beggs, Andrew D', 'McDermott, Ultan', 'Dunne, Philip D', 'Meade, Angela', 'Walker, Steven M', 'Murray, Graeme I', 'Samuel, Leslie', 'Seymour, Matthew', 'Tomlinson, Ian', 'Quirke, Phil', 'Maughan, Timothy', 'Rittscher, Jens', 'Koelzer, Viktor H']","['biomarkers, tumor genetics', 'biopsy', 'colorectal neoplasms  genetics  pathology', 'consensus', 'datasets as topic', ' deep learning', 'disease progression', 'gene expression profiling', 'gene expression regulation, neoplastic  genetics', 'humans', 'neoplasm grading', 'phenotype', 'predictive value of tests', 'prognosis', 'rna  genetics', 'colorectal pathology', 'computerised image analysis', 'molecular pathology']",Image-based consensus molecular subtype (imCMS) classification of colorectal cancer using deep learning.,"OBJECTIVE: Complex phenotypes captured on histological slides represent the biological processes at play in individual cancers, but the link to underlying molecular classification has not been clarified or systematised. In colorectal cancer (CRC), histological grading is a poor predictor of disease progression, and consensus molecular subtypes (CMSs) cannot be distinguished without gene expression profiling. We hypothesise that image analysis is a cost-effective tool to associate complex features of tissue organisation with molecular and outcome data and to resolve unclassifiable or heterogeneous cases. In this study, we present an image-based approach to predict CRC CMS from standard H&E sections using deep learning. DESIGN: Training and evaluation of a neural network were performed using a total of n=1206 tissue sections with comprehensive multi-omic data from three independent datasets (training on FOCUS trial, n=278 patients; test on rectal cancer biopsies, GRAMPIAN cohort, n=144 patients; and The Cancer Genome Atlas (TCGA), n=430 patients). Ground truth CMS calls were ascertained by matching random forest and single sample predictions from CMS classifier. RESULTS: Image-based CMS (imCMS) accurately classified slides in unseen datasets from TCGA (n=431 slides, AUC)=0.84) and rectal cancer biopsies (n=265 slides, AUC=0.85). imCMS spatially resolved intratumoural heterogeneity and provided secondary calls correlating with bioinformatic prediction from molecular data. imCMS classified samples previously unclassifiable by RNA expression profiling, reproduced the expected correlations with genomic and epigenetic alterations and showed similar prognostic associations as transcriptomic CMS. CONCLUSION: This study shows that a prediction of RNA expression classifiers can be made from H&E images, opening the door to simple, cheap and reliable biological stratification within routine workflows."
2021 Jul,Journal of clinical pathology,J Clin Pathol. 2021 Jul;74(7):443-447. doi: 10.1136/jclinpath-2020-206854. Epub ,"['Browning, Lisa', 'Colling, Richard', 'Rakha, Emad', 'Rajpoot, Nasir', 'Rittscher, Jens', 'James, Jacqueline A', 'Salto-Tellez, Manuel', 'Snead, David R J', 'Verrill, Clare']","[' artificial intelligence', ' covid-19', 'humans', 'image processing, computer-assisted  methods', ' pathology, clinical', 'sars-cov-2', 'computer systems', 'image processing, computer-assisted', 'pathology, surgical']",Digital pathology and artificial intelligence will be key to supporting clinical and academic cellular pathology through COVID-19 and future crises: the PathLAKE consortium perspective.,"The measures to control the COVID-19 outbreak will likely remain a feature of our working lives until a suitable vaccine or treatment is found. The pandemic has had a substantial impact on clinical services, including cancer pathways. Pathologists are working remotely in many circumstances to protect themselves, colleagues, family members and the delivery of clinical services. The effects of COVID-19 on research and clinical trials have also been significant with changes to protocols, suspensions of studies and redeployment of resources to COVID-19. In this article, we explore the specific impact of COVID-19 on clinical and academic pathology and explore how digital pathology and artificial intelligence can play a key role to safeguarding clinical services and pathology-based research in the current climate and in the future."
2021 Feb,Journal of clinical pathology,J Clin Pathol. 2021 Feb;74(2):129-132. doi: 10.1136/jclinpath-2020-206786. Epub ,"['Browning, Lisa', 'Fryer, Eve', 'Roskell, Derek', 'White, Kieron', 'Colling, Richard', 'Rittscher, Jens', 'Verrill, Clare']","[' covid-19', 'humans', 'pathologists', 'pathology, clinical  methods', 'sars-cov-2', 'surveys and questionnaires', 'telepathology  methods', 'tertiary care centers', 'united kingdom', 'education', 'hospital', 'information technology', 'pathology', 'pathology department', 'surgical']",Role of digital pathology in diagnostic histopathology in the response to COVID-19: results from a survey of experience in a UK tertiary referral hospital.,"The COVID-19 pandemic has challenged our diagnostic services at a time when many histopathology departments already faced a diminishing workforce and increasing workload. Digital pathology (DP) has been hailed as a potential solution to at least some of the challenges faced. We present a survey of pathologists within a UK National Health Service cellular pathology department with access to DP, in which we ascertain the role of DP in clinical services during this current pandemic and explore challenges encountered. This survey indicates an increase in uptake of diagnostic DP during this period, with increased remote access. Half of respondents agreed that DP had facilitated maintenance of diagnostic practice. While challenges have been encountered, these are remediable, and none have impacted on the uptake of DP during this period. We conclude that in our institution, DP has demonstrated current and future potential to increase resilience in diagnostic practice and have highlighted some of the challenges that need to be considered."
2020 May 19,Immunity,Immunity. 2020 May 19;52(5):794-807.e7. doi: 10.1016/j.immuni.2020.03.010. Epub ,"['Chauveau, Anne', 'Pirgova, Gabriela', 'Cheng, Hung-Wei', 'De Martin, Angelina', 'Zhou, Felix Y', 'Wideman, Sarah', 'Rittscher, Jens', 'Ludewig, Burkhard', 'Arnon, Tal I']","['animals', 'b-lymphocytes cytology immunology metabolism', 'cell movement  immunology', 'humans', 'immunologic surveillance immunology', 'intravital microscopy', 'luminescent proteins genetics metabolism', 'lymphocytes cytology immunology metabolism', 'mice, inbred c57bl', 'mice, transgenic', 'receptors, ccr7 genetics  immunology metabolism', 'signal transduction immunology', 'spleen cytology  immunology metabolism', 't-lymphocytes cytology  immunology metabolism', 'gpcrs', 't cells', 'bridging channels', 'intravital imaging', 'lymphocyte trafficking', 'spleen', 'vascular-guided migration']",Visualization of T Cell Migration in the Spleen Reveals a Network of Perivascular Pathways that Guide Entry into T Zones.,"Lymphocyte homeostasis and immune surveillance require that T and B cells continuously recirculate between secondary lymphoid organs. Here, we used intravital microscopy to define lymphocyte trafficking routes within the spleen, an environment of open blood circulation and shear forces unlike other lymphoid organs. Upon release from arterioles into the red pulp sinuses, T cells latched onto perivascular stromal cells in a manner that was independent of the chemokine receptor CCR7 but sensitive to Gi protein-coupled receptor inhibitors. This latching sheltered T cells from blood flow and enabled unidirectional migration to the bridging channels and then to T zones, entry into which required CCR7. Inflammatory responses modified the chemotactic cues along the perivascular homing paths, leading to rapid block of entry. Our findings reveal a role for vascular structures in lymphocyte recirculation through the spleen, indicating the existence of separate entry and exit routes and that of a checkpoint located at the gate to the T zone."
2020 May,The Journal of molecular diagnostics : JMD,J Mol Diagn. 2020 May;22(5):652-669. doi: 10.1016/j.jmoldx.2020.02.012. Epub 2020 ,"['Rao, Srinivasa R', 'Alham, Nasullah K', 'Upton, Elysia', 'McIntyre, Stacey', 'Bryant, Richard J', 'Cerundolo, Lucia', 'Bowes, Emma', 'Jones, Stephanie', 'Browne, Molly', 'Mills, Ian', 'Lamb, Alastair', 'Tomlinson, Ian', 'Wedge, David', 'Browning, Lisa', 'Sirinukunwattana, Korsuk', 'Palles, Claire', 'Hamdy, Freddie C', 'Rittscher, Jens', 'Verrill, Clare']","[' biomarkers, tumor', 'class ia phosphatidylinositol 3-kinase genetics', 'dna helicases genetics', 'dna mismatch repair', 'dna-binding proteins genetics', 'gene expression profiling', 'gene expression regulation, neoplastic', 'high-throughput nucleotide sequencing', 'humans', 'indel mutation', 'immunohistochemistry', 'lymphocytes immunology metabolism pathology', 'male', 'oncogene proteins, fusion  genetics', 'polymorphism, single nucleotide', 'prostatic neoplasms  genetics immunology pathology', 'sequence analysis, rna', 'serine endopeptidases  genetics', 'transcriptional regulator erg genetics']",Detailed Molecular and Immune Marker Profiling of Archival Prostate Cancer Samples Reveals an Inverse Association between TMPRSS2:ERG Fusion Status and Immune Cell Infiltration.,"Prostate cancer is a significant global health issue, and limitations to current patient management pathways often result in overtreatment or undertreatment. New ways to stratify patients are urgently needed. We conducted a feasibility study of such novel assessments, looking for associations between genomic changes and lymphocyte infiltration. An innovative workflow using an in-house targeted sequencing panel, immune cell profiling using an image analysis pipeline, RNA sequencing, and exome sequencing in select cases was tested. Gene fusions were profiled by RNA sequencing in 27 of 27 cases, and a significantly higher tumor-infiltrating lymphocyte (TIL) count was noted in tumors without a TMPRSS2:ERG fusion compared with those with the fusion (P = 0.01). Although this finding was not replicated in a larger validation set (n = 436) of The Cancer Genome Atlas images, there was a trend in the same direction. Differential expression analysis of TIL-high and TIL-low tumors revealed the enrichment of both innate and adaptive immune response pathways. Mutations in mismatch repair genes (MLH1 and MSH6 mutations in 1 of 27 cases) were identified. We describe a potential immune escape mechanism in TMPRSS2:ERG fusion-positive tumors. Detailed profiling, as shown herein, can provide novel insights into tumor biology. Likely differences with findings with other cohorts are related to methods used to define region of interest, but this warrants further study in a larger cohort."
2020 Mar,Molecular systems biology,Mol Syst Biol. 2020 Mar;16(3):e9083. doi: 10.15252/msb.20199083.,"['Sailem, Heba Z', 'Rittscher, Jens', 'Pelkmans, Lucas']","['cell line, tumor', 'colorectal neoplasms genetics metabolism  pathology', 'gene expression regulation, neoplastic', ' gene regulatory networks', 'hct116 cells', 'humans', 'mcf-7 cells', 'neoplasm grading', 'phenotype', 'prognosis', 'receptors, odorant genetics', 'signal transduction', 'support vector machine', 'systems biology  methods', 'transforming growth factor beta genetics', 'wnt signaling pathway', 'crispr and sirna screening', 'cell morphology and microenvironment', 'functional genomics', 'high content screening', 'olfactory receptors']",KCML: a machine-learning framework for inference of multi-scale gene functions from genetic perturbation screens.,"Characterising context-dependent gene functions is crucial for understanding the genetic bases of health and disease. To date, inference of gene functions from large-scale genetic perturbation screens is based on ad hoc analysis pipelines involving unsupervised clustering and functional enrichment. We present Knowledge- and Context-driven Machine Learning (KCML), a framework that systematically predicts multiple context-specific functions for a given gene based on the similarity of its perturbation phenotype to those with known function. As a proof of concept, we test KCML on three datasets describing phenotypes at the molecular, cellular and population levels and show that it outperforms traditional analysis pipelines. In particular, KCML identified an abnormal multicellular organisation phenotype associated with the depletion of olfactory receptors, and TGFβ and WNT signalling genes in colorectal cancer cells. We validate these predictions in colorectal cancer patients and show that olfactory receptors expression is predictive of worse patient outcomes. These results highlight KCML as a systematic framework for discovering novel scale-crossing and context-dependent gene functions. KCML is highly generalisable and applicable to various large-scale genetic perturbation screens."
