time,journal,doi_info,authors,key words,title,abstract
2020 Feb 17,Scientific reports,Sci Rep. 2020 Feb 17;10(1):2748. doi: 10.1038/s41598-020-59413-5.,"['Ali, Sharib', 'Zhou, Felix', 'Braden, Barbara', 'Bailey, Adam', 'Yang, Suhui', 'Cheng, Guanju', 'Zhang, Pengyi', 'Li, Xiaoqiong', 'Kayser, Maxime', 'Soberanis-Mukul, Roger D', 'Albarqouni, Shadi', 'Wang, Xiaokang', 'Wang, Chunqing', 'Watanabe, Seiryo', 'Oksuz, Ilkay', 'Ning, Qingtian', 'Yang, Shufan', 'Khan, Mohammad Azam', 'Gao, Xiaohong W', 'Realdon, Stefano', 'Loshchenov, Maxim', 'Schnabel, Julia A', 'East, James E', 'Wagnieres, Georges', 'Loschenov, Victor B', 'Grisan, Enrico', 'Daul, Christian', 'Blondel, Walter', 'Rittscher, Jens']","[' algorithms', ' artifacts', 'colon diagnostic imaging pathology', 'datasets as topic', 'endoscopy  standards statistics & numerical data', 'esophagus diagnostic imaging pathology', 'female', 'humans', 'image interpretation, computer-assisted  standards statistics & numerical data', 'imaging, three-dimensional  standards statistics & numerical data', 'international cooperation', 'male', ' neural networks, computer', 'stomach diagnostic imaging pathology', 'urinary bladder diagnostic imaging pathology', 'uterus diagnostic imaging pathology']",An objective comparison of detection and segmentation algorithms for artefacts in clinical endoscopy.,"We present a comprehensive analysis of the submissions to the first edition of the Endoscopy Artefact Detection challenge (EAD). Using crowd-sourcing, this initiative is a step towards understanding the limitations of existing state-of-the-art computer vision methods applied to endoscopy and promoting the development of new approaches suitable for clinical translation. Endoscopy is a routine imaging technique for the detection, diagnosis and treatment of diseases in hollow-organs; the esophagus, stomach, colon, uterus and the bladder. However the nature of these organs prevent imaged tissues to be free of imaging artefacts such as bubbles, pixel saturation, organ specularity and debris, all of which pose substantial challenges for any quantitative analysis. Consequently, the potential for improved clinical outcomes through quantitative assessment of abnormal mucosal surface observed in endoscopy videos is presently not realized accurately. The EAD challenge promotes awareness of and addresses this key bottleneck problem by investigating methods that can accurately classify, localize and segment artefacts in endoscopy frames as critical prerequisite tasks. Using a diverse curated multi-institutional, multi-modality, multi-organ dataset of video frames, the accuracy and performance of 23 algorithms were objectively ranked for artefact detection and segmentation. The ability of methods to generalize to unseen datasets was also evaluated. The best performing methods (top 15%) propose deep learning strategies to reconcile variabilities in artefact appearance with respect to size, modality, occurrence and organ type. However, no single method outperformed across all tasks. Detailed analyses reveal the shortcomings of current training strategies and highlight the need for developing new optimal metrics to accurately quantify the clinical applicability of methods."
2020 Sep,Acta ophthalmologica,Acta Ophthalmol. 2020 Sep;98(6):e715-e721. doi: 10.1111/aos.14353. Epub 2020 Jan ,"['Shah, Mital', 'Roomans Ledo, Ana', 'Rittscher, Jens']","['adult', 'case-control studies', ' deep learning', 'female', 'humans', 'image processing, computer-assisted methods', 'male', 'middle aged', 'roc curve', 'severity of illness index', 'stargardt disease  diagnostic imaging pathology', 'tomography, optical coherence  methods', 'stargardt disease', 'deep learning', 'image analysis', 'machine learning', 'optical coherence tomography', 'retinal degeneration']",Automated classification of normal and Stargardt disease optical coherence tomography images using deep learning.,"PURPOSE: Recent advances in deep learning have seen an increase in its application to automated image analysis in ophthalmology for conditions with a high prevalence. We wanted to identify whether deep learning could be used for the automated classification of optical coherence tomography (OCT) images from patients with Stargardt disease (STGD) using a smaller dataset than traditionally used. METHODS: Sixty participants with STGD and 33 participants with a normal retinal OCT were selected, and a single OCT scan containing the centre of the fovea was selected as the input data. Two approaches were used: Model 1 - a pretrained convolutional neural network (CNN); Model 2 - a new CNN architecture. Both models were evaluated on their accuracy, sensitivity, specificity and Jaccard similarity score (JSS). RESULTS: About 102 OCT scans from participants with a normal retinal OCT and 647 OCT scans from participants with STGD were selected. The highest results were achieved when both models were implemented as a binary classifier: Model 1 - accuracy 99.6%, sensitivity 99.8%, specificity 98.0% and JSS 0.990; Model 2 - accuracy 97.9%, sensitivity 97.9%, specificity 98.0% and JSS 0.976. CONCLUSION: The deep learning classification models used in this study were able to achieve high accuracy despite using a smaller dataset than traditionally used and are effective in differentiating between normal OCT scans and those from patients with STGD. This preliminary study provides promising results for the application of deep learning to classify OCT images from patients with inherited retinal diseases."
2020 Apr,Journal of clinical pathology,J Clin Pathol. 2020 Apr;73(4):223-227. doi: 10.1136/jclinpath-2019-206137. Epub ,"['Browning, Lisa', 'Colling, Richard', 'Rittscher, Jens', 'Winter, Lucinda', 'McEntyre, Nicholas', 'Verrill, Clare']","[' attitude of health personnel', 'clinical competence  standards', 'humans', 'pathologists education  psychology standards', 'pathology, clinical education standards', 'perception', 'telepathology', 'workload', 'digital pathology', 'histopathology trainees', 'training']",Implementation of digital pathology into diagnostic practice: perceptions and opinions of histopathology trainees and implications for training.,"There is increasing interest in the utility of digital pathology in the diagnostic setting. Successful transition requires guidance and training, but additionally an understanding of opinions and attitudes of histopathologists to ensure that potential barriers are addressed. Histopathology trainees as a group are likely to be at the forefront of this revolution, and have specific and as yet largely neglected training needs in this context. We designed an online survey for trainees within our region to capture their opinions and attitudes to digital pathology in the diagnostic setting, and to assess their perceived training needs. This survey indicates overall that these trainees have similar aspirations with regard to the predicted utility of digital pathology and the challenges faced as have been recognised among consultant histopathologists. While their training needs are also largely similar, there are specific additional considerations based around training in multiple centres with varying exposure to digital pathology."
2019 Sep 20,Bio-protocol,Bio Protoc. 2019 Sep 20;9(18):e3365. doi: 10.21769/BioProtoc.3365. eCollection ,"['Zhou, Felix Y', 'Ruiz-Puig, Carlos', 'Owen, Richard P', 'White, Michael J', 'Rittscher, Jens', 'Lu, Xin']","['biological motion', 'cell tracking', 'dynamic mesh', 'high-throughput screening', 'motion map', 'superpixels']",Characterization of Biological Motion Using Motion Sensing Superpixels.,"Precise spatiotemporal regulation is the foundation for the healthy development and maintenance of living organisms. All cells must correctly execute their function in the right place at the right time. Cellular motion is thus an important dynamic readout of signaling in key disease-relevant molecular pathways. However despite the rapid advancement of imaging technology, a comprehensive quantitative description of motion imaged under different imaging modalities at all spatiotemporal scales; molecular, cellular and tissue-level is still lacking. Generally, cells move either 'individually' or 'collectively' as a group with nearby cells. Current computational tools specifically focus on one or the other regime, limiting their general applicability. To address this, we recently developed and reported a new computational framework, Motion Sensing Superpixels (MOSES). Incorporating the individual advantages of single cell trackers for individual cell and particle image velocimetry (PIV) for collective cell motion analyses, MOSES enables 'mesoscale' analysis of both single-cell and collective motion over arbitrarily long times. At the same time, MOSES readily complements existing single-cell tracking workflows with additional characterization of global motion patterns and interaction analysis between cells and also operates directly on PIV extracted motion fields to yield rich motion trajectories analogous for single-cell tracks suitable for high-throughput motion phenotyping. This protocol provides a step-by-step practical guide for those interested in applying MOSES to their own datasets. The protocol highlights the salient features of a MOSES analysis and demonstrates the ease-of-use and wide applicability of MOSES to biological imaging through demo experimental analyses with ready-to-use code snippets of four datasets from different microscope modalities; phase-contrast, fluorescent, lightsheet and intra-vital microscopy. In addition we discuss critical points of consideration in the analysis."
2019 Feb 26,eLife,Elife. 2019 Feb 26;8:e40162. doi: 10.7554/eLife.40162.,"['Zhou, Felix Y', 'Ruiz-Puig, Carlos', 'Owen, Richard P', 'White, Michael J', 'Rittscher, Jens', 'Lu, Xin']","[' cell communication', ' cell movement', 'cytological techniques  methods', 'epithelial cells  physiology', 'esophagus cytology', 'humans', 'image processing, computer-assisted  methods', 'phenotype', 'boundary formation', 'collective motion', 'computational biology', 'developmental biology', 'dynamic graphs', 'human', 'motion analysis', 'motion maps', 'superpixels', 'systems biology']",Motion sensing superpixels (MOSES) is a systematic computational framework to quantify and discover cellular motion phenotypes.,"Correct cell/cell interactions and motion dynamics are fundamental in tissue homeostasis, and defects in these cellular processes cause diseases. Therefore, there is strong interest in identifying factors, including drug candidates that affect cell/cell interactions and motion dynamics. However, existing quantitative tools for systematically interrogating complex motion phenotypes in timelapse datasets are limited. We present Motion Sensing Superpixels (MOSES), a computational framework that measures and characterises biological motion with a unique superpixel 'mesh' formulation. Using published datasets, MOSES demonstrates single-cell tracking capability and more advanced population quantification than Particle Image Velocimetry approaches. From > 190 co-culture videos, MOSES motion-mapped the interactions between human esophageal squamous epithelial and columnar cells mimicking the esophageal squamous-columnar junction, a site where Barrett's esophagus and esophageal adenocarcinoma often arise clinically. MOSES is a powerful tool that will facilitate unbiased, systematic analysis of cellular dynamics from high-content time-lapse imaging screens with little prior knowledge and few assumptions."
2019 Apr,The journal of pathology. Clinical research,J Pathol Clin Res. 2019 Apr;5(2):81-90. doi: 10.1002/cjp2.127. Epub 2019 Mar 25.,"['Pell, Robert', 'Oien, Karin', 'Robinson, Max', 'Pitman, Helen', 'Rajpoot, Nasir', 'Rittscher, Jens', 'Snead, David', 'Verrill, Clare']","['algorithms', 'clinical trials as topic', 'humans', ' image interpretation, computer-assisted methods', ' image processing, computer-assisted methods', 'microscopy', ' pathologists', ' telepathology methods', 'computerised image analysis', 'digital image analysis', 'digital microscopy']",The use of digital pathology and image analysis in clinical trials.,"Digital pathology and image analysis potentially provide greater accuracy, reproducibility and standardisation of pathology-based trial entry criteria and endpoints, alongside extracting new insights from both existing and novel features. Image analysis has great potential to identify, extract and quantify features in greater detail in comparison to pathologist assessment, which may produce improved prediction models or perform tasks beyond manual capability. In this article, we provide an overview of the utility of such technologies in clinical trials and provide a discussion of the potential applications, current challenges, limitations and remaining unanswered questions that require addressing prior to routine adoption in such studies. We reiterate the value of central review of pathology in clinical trials, and discuss inherent logistical, cost and performance advantages of using a digital approach. The current and emerging regulatory landscape is outlined. The role of digital platforms and remote learning to improve the training and performance of clinical trial pathologists is discussed. The impact of image analysis on quantitative tissue morphometrics in key areas such as standardisation of immunohistochemical stain interpretation, assessment of tumour cellularity prior to molecular analytical applications and the assessment of novel histological features is described. The standardisation of digital image production, establishment of criteria for digital pathology use in pre-clinical and clinical studies, establishment of performance criteria for image analysis algorithms and liaison with regulatory bodies to facilitate incorporation of image analysis applications into clinical practice are key issues to be addressed to improve digital pathology incorporation into clinical trials."
2019 Apr,Virchows Archiv : an international journal of pathology,Virchows Arch. 2019 Apr;474(4):511-522. doi: 10.1007/s00428-018-2485-z. Epub 2018 ,"['Koelzer, Viktor H', 'Sirinukunwattana, Korsuk', 'Rittscher, Jens', 'Mertz, Kirsten D']","[' artificial intelligence', 'biomarkers, tumor  analysis immunology', 'humans', 'image processing, computer-assisted  methods', 'immunophenotyping  methods', 'precision medicine  methods', 'artificial intelligence', 'digital pathology', 'image analysis', 'immuno-oncology', 'immunotherapy', 'machine learning', 'personalized medicine']",Precision immunoprofiling by image analysis and artificial intelligence.,"Clinical success of immunotherapy is driving the need for new prognostic and predictive assays to inform patient selection and stratification. This requirement can be met by a combination of computational pathology and artificial intelligence. Here, we critically assess computational approaches supporting the development of a standardized methodology in the assessment of immune-oncology biomarkers, such as PD-L1 and immune cell infiltrates. We examine immunoprofiling through spatial analysis of tumor-immune cell interactions and multiplexing technologies as a predictor of patient response to cancer treatment. Further, we discuss how integrated bioinformatics can enable the amalgamation of complex morphological phenotypes with the multiomics datasets that drive precision medicine. We provide an outline to machine learning (ML) and artificial intelligence tools and illustrate fields of application in immune-oncology, such as pattern-recognition in large and complex datasets and deep learning approaches for survival analysis. Synergies of surgical pathology and computational analyses are expected to improve patient stratification in immuno-oncology. We propose that future clinical demands will be best met by (1) dedicated research at the interface of pathology and bioinformatics, supported by professional societies, and (2) the integration of data sciences and digital image analysis in the professional education of pathologists."
2017 Feb 15,"Methods (San Diego, Calif.)",Methods. 2017 Feb 15;115:65-79. doi: 10.1016/j.ymeth.2017.02.007. Epub 2017 Feb ,"['Nketia, Thomas A', 'Sailem, Heba', 'Rohde, Gustavo', 'Machiraju, Raghu', 'Rittscher, Jens']","['animals', 'biosensing techniques instrumentation methods', 'cell culture techniques', 'cell tracking instrumentation methods', 'eukaryotic cells metabolism ultrastructure', 'humans', 'image processing, computer-assisted  methods statistics & numerical data', ' machine learning', 'microscopy instrumentation  methods', 'molecular imaging instrumentation  methods', 'signal-to-noise ratio', ' software', 'biological image analysis', 'cell segmentation', 'cell tracking', 'live cell imaging', 'machine learning', 'quantitative biological imaging']","Analysis of live cell images: Methods, tools and opportunities.","Advances in optical microscopy, biosensors and cell culturing technologies have transformed live cell imaging. Thanks to these advances live cell imaging plays an increasingly important role in basic biology research as well as at all stages of drug development. Image analysis methods are needed to extract quantitative information from these vast and complex data sets. The aim of this review is to provide an overview of available image analysis methods for live cell imaging, in particular required preprocessing image segmentation, cell tracking and data visualisation methods. The potential opportunities recent advances in machine learning, especially deep learning, and computer vision provide are being discussed. This review includes overview of the different available software packages and toolkits."
