time,journal,doi_info,authors,key words,title,abstract
2020 Apr,Antibody therapeutics,Antib Ther. 2020 Apr;3(2):80-94. doi: 10.1093/abt/tbaa006. Epub 2020 Apr 18.,"['Jalil, AbdelAziz R', 'Andrechak, Jason C', 'Discher, Dennis E']","['cd47', 'sirpα', 'immune checkpoint', 'phagocytosis']","Macrophage checkpoint blockade: results from initial clinical trials, binding analyses, and CD47-SIRPα structure-function.","The macrophage checkpoint is an anti-phagocytic interaction between signal regulatory protein alpha (SIRPα) on a macrophage and CD47 on all types of cells - ranging from blood cells to cancer cells. This interaction has emerged over the last decade as a potential co-target in cancer when combined with other anti-cancer agents, with antibodies against CD47 and SIRPα currently in preclinical and clinical development for a variety of hematological and solid malignancies. Monotherapy with CD47 blockade is ineffective in human clinical trials against many tumor types tested to date, except for rare cutaneous and peripheral lymphomas. In contrast, pre-clinical results show efficacy in multiple syngeneic mouse models of cancer, suggesting that many of these tumor models are more immunogenic and likely artificial compared to human tumors. However, combination therapies in humans of anti-CD47 with agents such as the anti-tumor antibody rituximab do show efficacy against liquid tumors (lymphoma) and are promising. Here, we review such trials as well as key interaction and structural features of CD47-SIRPα."
2020 Mar 6,Journal of cell science,J Cell Sci. 2020 Mar 6;133(5):jcs237800. doi: 10.1242/jcs.237800.,"['Hayes, Brandon H', 'Tsai, Richard K', 'Dooling, Lawrence J', 'Kadu, Siddhant', 'Lee, Justine Y', 'Pantano, Diego', 'Rodriguez, Pia L', 'Subramanian, Shyamsundar', 'Shin, Jae-Won', 'Discher, Dennis E']","['animals', ' antigens, differentiation', ' cd47 antigen genetics', 'cho cells', 'cricetinae', 'cricetulus', 'macrophages', 'phagocytosis', 'receptors, immunologic genetics', 'erythrocyte', 'inhibitory receptor', 'phagocytosis', '‘marker of self’']",Macrophages show higher levels of engulfment after disruption of cis interactions between CD47 and the checkpoint receptor SIRPα.,"The macrophage checkpoint receptor SIRPα signals against phagocytosis by binding CD47 expressed on all cells - including macrophages. Here, we found that inhibiting cis interactions between SIRPα and CD47 on the same macrophage increased engulfment ('eating') by approximately the same level as inhibiting trans interactions. Antibody blockade of CD47, as pursued in clinical trials against cancer, was applied separately to human-derived macrophages and to red blood cell (RBC) targets for phagocytosis, and both scenarios produced surprisingly similar increases in RBC engulfment. Blockade of both macrophages and targets resulted in hyper-phagocytosis, and knockdown of macrophage-CD47 likewise increased engulfment of 'foreign' cells and particles, decreased the baseline inhibitory signaling of SIRPα, and linearly increased binding of soluble CD47 in trans, consistent with cis-trans competition. Many cell types express both SIRPα and CD47, including mouse melanoma B16 cells, and CRISPR-mediated deletions modulate B16 phagocytosis, consistent with cis-trans competition. Additionally, soluble SIRPα binding to human CD47 displayed on Chinese hamster ovary (CHO) cells was suppressed by SIRPα co-display, and atomistic computations confirm SIRPα bends and binds CD47 in cis Safety and efficacy profiles for CD47-SIRPα blockade might therefore reflect a disruption of both cis and trans interactions."
2019,NPJ Regenerative medicine,NPJ Regen Med. 2019 Dec 2;4:22. doi: 10.1038/s41536-019-0083-6. eCollection 2019.,"['Pittenger, Mark F', 'Discher, Dennis E', 'Péault, Bruno M', 'Phinney, Donald G', 'Hare, Joshua M', 'Caplan, Arnold I']","['mesenchymal stem cells', 'stem-cell research']",Mesenchymal stem cell perspective: cell biology to clinical progress.,"The terms MSC and MSCs have become the preferred acronym to describe a cell and a cell population of multipotential stem/progenitor cells commonly referred to as mesenchymal stem cells, multipotential stromal cells, mesenchymal stromal cells, and mesenchymal progenitor cells. The MSCs can differentiate to important lineages under defined conditions in vitro and in limited situations after implantation in vivo. MSCs were isolated and described about 30 years ago and now there are over 55,000 publications on MSCs readily available. Here, we have focused on human MSCs whenever possible. The MSCs have broad anti-inflammatory and immune-modulatory properties. At present, these provide the greatest focus of human MSCs in clinical testing; however, the properties of cultured MSCs in vitro suggest they can have broader applications. The medical utility of MSCs continues to be investigated in over 950 clinical trials. There has been much progress in understanding MSCs over the years, and there is a strong foundation for future scientific research and clinical applications, but also some important questions remain to be answered. Developing further methods to understand and unlock MSC potential through intracellular and intercellular signaling, biomedical engineering, delivery methods and patient selection should all provide substantial advancements in the coming years and greater clinical opportunities. The expansive and growing field of MSC research is teaching us basic human cell biology as well as how to use this type of cell for cellular therapy in a variety of clinical settings, and while much promise is evident, careful new work is still needed."
2019 Dec 10,Biochemistry,Biochemistry. 2019 Dec 10;58(49):4893-4902. doi: 10.1021/acs.biochem.9b00839. ,"['Saini, Karanvir', 'Discher, Dennis E']","['animals', 'biomechanical phenomena', 'humans', 'protein conformation', 'protein unfolding', 'proteins  chemistry']",Forced Unfolding of Proteins Directs Biochemical Cascades.,"Many proteins in cells and in the extracellular matrix assemble into force-bearing networks, and some proteins clearly transduce mechanical stimuli into biochemical signals. Although structural mechanisms remain poorly understood, the designs of such proteins enable mechanical forces to either inhibit or facilitate interactions of protein domains with other proteins, including small molecules and enzymes, including proteases and kinases. Here, we review some of the structural proteins and processes that exhibit distinct modes of force-dependent signal conversion."
2018 Dec,Emerging topics in life sciences,Emerg Top Life Sci. 2018 Dec;2(5):713-725. doi: 10.1042/ETLS20180051. Epub 2018 ,"['Xia, Yuntao', 'Pfeifer, Charlotte R', 'Cho, Sangkyun', 'Discher, Dennis E', 'Irianto, Jerome']",[],Nuclear mechanosensing.,"Structural links from the nucleus to the cytoskeleton and to the extracellular environment play a role in direct mechanosensing by nuclear factors. Here, we highlight recent studies that illustrate nuclear mechanosensation processes ranging from DNA repair and nuclear protein phospho-modulation to chromatin reorganization, lipase activation by dilation, and reversible rupture with the release of nuclear factors. Recent progresses demonstrate that these mechanosensing processes lead to modulation of gene expression such as those involved in the regulation of cytoskeletal programs and introduce copy number variations. The nuclear lamina protein lamin A has a recurring role, and various biophysical analyses prove helpful in clarifying mechanisms. The various recent observations provide further motivation to understand the regulation of nuclear mechanosensing pathways in both physiological and pathological contexts."
2019,Advances in experimental medicine and biology,Adv Exp Med Biol. 2019;1146:117-130. doi: 10.1007/978-3-030-17593-1_8.,"['Pfeifer, Charlotte R', 'Irianto, Jerome', 'Discher, Dennis E']","['animals', ' cell movement', ' cell nucleus metabolism', 'chromatin', 'humans', ' neoplasm metastasis', 'nuclear envelope', 'cell cycle', 'constricted migration', 'dna damage', 'genome instability', 'nuclear lamina rupture', 'nuclear mechanics']",Nuclear Mechanics and Cancer Cell Migration.,"As a cancer cell invades adjacent tissue, penetrates a basement membrane barrier, or squeezes into a blood capillary, its nucleus can be greatly constricted. Here, we examine: (1) the passive and active deformation of the nucleus during 3D migration; (2) the nuclear structures-namely, the lamina and chromatin-that govern nuclear deformability; (3) the effect of large nuclear deformation on DNA and nuclear factors; and (4) the downstream consequences of mechanically stressing the nucleus. We focus especially on recent studies showing that constricted migration causes nuclear envelope rupture and excess DNA damage, leading to cell cycle suppression, possibly cell death, and ultimately it seems to heritable genomic variation. We first review the latest understanding of nuclear dynamics during cell migration, and then explore the functional effects of nuclear deformation, especially in relation to genome integrity and potentially cancerous mutations."
2019 Aug 19,"Philosophical transactions of the Royal Society of London. Series B, Biological ",Philos Trans R Soc Lond B Biol Sci. 2019 Aug 19;374(1779):20180217. doi: ,"['Andrechak, Jason C', 'Dooling, Lawrence J', 'Discher, Dennis E']","['antibodies, blocking  immunology', 'biophysical phenomena', 'cd47 antigen  metabolism', 'cell communication immunology', 'humans', 'macrophages  metabolism', 'neoplasms  immunology', 'phagocytosis immunology', 'signal transduction immunology', 'adhesion', 'blockade', 'plasticity', 'signalling']",The macrophage checkpoint CD47 : SIRPα for recognition of 'self' cells: from clinical trials of blocking antibodies to mechanobiological fundamentals.,"Immunotherapies against some solid tumour types have recently shown unprecedented, durable cures in the clinic, and the most successful thus far involves blocking inhibitory receptor 'checkpoints' on T cells. A similar approach with macrophages is emerging by blocking the ubiquitously expressed 'marker of self' CD47 from binding the inhibitory receptor SIRPα on macrophages. Here, we first summarize available information on the safety and efficacy of CD47 blockade, which raises some safety concerns with the clearance of 'self' cells but also suggests some success against haematological (liquid) and solid cancers. Checkpoint blockade generally benefits from parallel activation of the immune cell, which can occur for macrophages in multiple ways, such as by combination with a second, tumour-opsonizing antibody and perhaps also via rigidity sensing. Cytoskeletal forces in phagocytosis and inhibitory 'self'-signalling are thus reviewed together with macrophage mechanosensing, which extends to regulating levels of SIRPα and the nuclear protein lamin A, which affects phenotype and cell trafficking. Considerations of such physical factors in cancer and the immune system can inform the design of new immunotherapies and help to refine existing therapies to improve safety and efficacy. This article is part of a discussion meeting issue 'Forces in cancer: interdisciplinary approaches in tumour mechanobiology'."
2019 Oct 31,Essays in biochemistry,Essays Biochem. 2019 Oct 31;63(5):569-577. doi: 10.1042/EBC20190007.,"['Pfeifer, Charlotte R', 'Vashisth, Manasvita', 'Xia, Yuntao', 'Discher, Dennis E']","['animals', 'cell cycle  physiology', 'cell movement  physiology', 'chromatin  metabolism', 'constriction', 'dna metabolism', 'dna damage physiology', 'humans', 'lamin type a metabolism', 'lamin type b metabolism', 'nuclear lamina  metabolism', 'dna repair', 'nuclear strength', 'confined migration']","Nuclear failure, DNA damage, and cell cycle disruption after migration through small pores: a brief review.","In many contexts of development, regeneration, or disease such as cancer, a cell squeezes through a dense tissue or a basement membrane, constricting its nucleus. Here, we describe how the severity of nuclear deformation depends on a nucleus' mechanical properties that are mostly determined by the density of chromatin and by the nuclear lamina. We explain how constriction-induced nuclear deformation affects nuclear contents by causing (i) local density changes in chromatin and (ii) rupture of the nuclear lamina and envelope. Both processes mislocalize diffusible nuclear factors including key DNA repair and regulatory proteins. Importantly, these effects of constricted migration are accompanied by excess DNA damage, marked by phosphorylated histone γH2AX in fixed cells. Rupture has a number of downstream consequences that include a delayed cell cycle-consistent with a damage checkpoint-and modulation of differentiation, both of which are expected to affect migration-dependent processes ranging from wound healing to tumorigenic invasion."
2019 Jul 22,Developmental cell,Dev Cell. 2019 Jul 22;50(2):130-131. doi: 10.1016/j.devcel.2019.07.003.,"['Pfeifer, Charlotte R', 'Discher, Dennis E']","[' actomyosin', ' cell nucleus', 'epithelium', 'mechanical phenomena', 'morphogenesis']",Pulling the Roof Down on Anchored Nuclei.,"How a smooth epithelium becomes topographically patterned in development remains incompletely understood. In this issue of Developmental Cell,Ambrosini et al. (2019) investigate how dying cells specifically indent the apical surface, finding that apical actomyosin cables contract against the apoptotic nucleus, which itself is anchored basally to the extracellular matrix."
2019 Jul 22,Molecular biology of the cell,Mol Biol Cell. 2019 Jul 22;30(16):1879-1881. doi: 10.1091/mbc.E19-06-0338.,"['Discher, Dennis E']","['animals', 'biomechanical phenomena', 'cell nucleus metabolism', 'cytoskeleton metabolism', ' dna damage', 'epithelial cells  pathology', 'humans', 'stem cells metabolism']",From DNA damage to epithelial integrity: new roles for cell forces.,
2019 Aug 5,The Journal of cell biology,J Cell Biol. 2019 Aug 5;218(8):2545-2563. doi: 10.1083/jcb.201811100. Epub 2019 ,"['Xia, Yuntao', 'Pfeifer, Charlotte R', 'Zhu, Kuangzheng', 'Irianto, Jerome', 'Liu, Dazhen', 'Pannell, Kalia', 'Chen, Emily J', 'Dooling, Lawrence J', 'Tobin, Michael P', 'Wang, Mai', 'Ivanovska, Irena L', 'Smith, Lucas R', 'Greenberg, Roger A', 'Discher, Dennis E']","['animals', 'antioxidants metabolism', ' cell cycle', 'cell line, tumor', ' cell movement', ' dna damage', 'dna repair', 'exodeoxyribonucleases metabolism', 'humans', 'ku autoantigen metabolism', 'lamin type b metabolism', ' mechanotransduction, cellular', 'mice', 'mutagenesis', 'myosin type ii metabolism', 'nuclear pore metabolism ultrastructure', 'nucleotidyltransferases metabolism', 'phosphoproteins metabolism']",Rescue of DNA damage after constricted migration reveals a mechano-regulated threshold for cell cycle.,"Migration through 3D constrictions can cause nuclear rupture and mislocalization of nuclear proteins, but damage to DNA remains uncertain, as does any effect on cell cycle. Here, myosin II inhibition rescues rupture and partially rescues the DNA damage marker γH2AX, but an apparent block in cell cycle appears unaffected. Co-overexpression of multiple DNA repair factors or antioxidant inhibition of break formation also exert partial effects, independently of rupture. Combined treatments completely rescue cell cycle suppression by DNA damage, revealing a sigmoidal dependence of cell cycle on excess DNA damage. Migration through custom-etched pores yields the same damage threshold, with ∼4-µm pores causing intermediate levels of both damage and cell cycle suppression. High curvature imposed rapidly by pores or probes or else by small micronuclei consistently associates nuclear rupture with dilution of stiff lamin-B filaments, loss of repair factors, and entry from cytoplasm of chromatin-binding cGAS (cyclic GMP-AMP synthase). The cell cycle block caused by constricted migration is nonetheless reversible, with a potential for DNA misrepair and genome variation."
2020 Jan,Matrix biology : journal of the International Society for Matrix Biology,Matrix Biol. 2020 Jan;85-86:34-46. doi: 10.1016/j.matbio.2019.06.001. Epub 2019 ,"['Saini, Karanvir', 'Cho, Sangkyun', 'Dooling, Lawrence J', 'Discher, Dennis E']","['collagenases  metabolism', 'extracellular matrix metabolism', 'fibrillar collagens  metabolism', 'humans', 'stress, mechanical', 'collagen', 'collagenase', 'degradation', 'extracellular matrix,', 'matrix metalloproteinases (mmps)', 'strain', 'tissue']",Tension in fibrils suppresses their enzymatic degradation - A molecular mechanism for 'use it or lose it'.,"Tissue homeostasis depends on a balance of synthesis and degradation of constituent proteins, with turnover of a given protein potentially regulated by its use. Extracellular matrix (ECM) is predominantly composed of fibrillar collagens that exhibit tension-sensitive degradation, which we review here at different levels of hierarchy. Past experiments and recent proteomics measurements together suggest that mechanical strain stabilizes collagen against enzymatic degradation at the scale of tissues and fibrils whereas isolated collagen molecules exhibit a biphasic behavior that depends on load magnitude. Within a Michaelis-Menten framework, collagenases at constant concentration effectively exhibit a low activity on substrate fibrils when the fibrils are strained by tension. Mechanisms of such mechanosensitive regulation are surveyed together with relevant interactions of collagen fibrils with cells."
2019 Jul 22,Molecular biology of the cell,Mol Biol Cell. 2019 Jul 22;30(16):1985-1999. doi: 10.1091/mbc.E19-02-0090. Epub ,"['Smith, Lucas R', 'Irianto, Jerome', 'Xia, Yuntao', 'Pfeifer, Charlotte R', 'Discher, Dennis E']","['animals', 'cell count', 'cell cycle drug effects', ' cell differentiation drug effects', ' cell movement drug effects', 'cell nucleus drug effects metabolism', 'cells, cultured', 'dna damage', 'heterocyclic compounds, 4 or more rings pharmacology', 'humans', 'mesenchymal stem cells  cytology drug effects metabolism', 'mice', 'muscles physiology', 'myod protein metabolism', 'myoblasts cytology drug effects metabolism', 'myosin type ii metabolism', 'osteogenesis drug effects', 'regeneration drug effects']",Constricted migration modulates stem cell differentiation.,"Tissue regeneration at an injured site depends on proliferation, migration, and differentiation of resident stem or progenitor cells, but solid tissues are often sufficiently dense and constricting that nuclei are highly stressed by migration. In this study, constricted migration of myoblastic cell types and mesenchymal stem cells (MSCs) increases nuclear rupture, increases DNA damage, and modulates differentiation. Fewer myoblasts fuse into regenerating muscle in vivo after constricted migration in vitro, and myodifferentiation in vitro is likewise suppressed. Myosin II inhibition rescues rupture and DNA damage, implicating nuclear forces, while mitosis and the cell cycle are suppressed by constricted migration, consistent with a checkpoint. Although perturbed proliferation fails to explain defective differentiation, nuclear rupture mislocalizes differentiation-relevant MyoD and KU80 (a DNA repair factor), with nuclear entry of the DNA-binding factor cGAS. Human MSCs exhibit similar damage, but osteogenesis increases-which is relevant to bone and to calcified fibrotic tissues, including diseased muscle. Tissue repair can thus be modulated up or down by the curvature of pores through which stem cells squeeze."
2019 Jun 17,Developmental cell,Dev Cell. 2019 Jun 17;49(6):920-935.e5. doi: 10.1016/j.devcel.2019.04.020. Epub ,"['Cho, Sangkyun', 'Vashisth, Manasvita', 'Abbas, Amal', 'Majkut, Stephanie', 'Vogel, Kenneth', 'Xia, Yuntao', 'Ivanovska, Irena L', 'Irianto, Jerome', 'Tewari, Manorama', 'Zhu, Kuangzheng', 'Tichy, Elisia D', 'Mourkioti, Foteini', 'Tang, Hsin-Yao', 'Greenberg, Roger A', 'Prosser, Benjamin L', 'Discher, Dennis E']","['animals', ' cell cycle checkpoints', 'cell differentiation', 'cell nucleus  metabolism', 'chick embryo', 'chickens', ' dna damage', 'dna repair', 'extracellular matrix', 'heart  embryology physiology', 'humans', 'lamin type a  metabolism', ' mechanotransduction, cellular', 'nuclear lamina  metabolism', 'organogenesis', 'phosphorylation', 'collagen-i', 'contractility', 'development', 'heart', 'lamin-a', 'matrix', 'mechanobiology']","Mechanosensing by the Lamina Protects against Nuclear Rupture, DNA Damage, and Cell-Cycle Arrest.","Whether cell forces or extracellular matrix (ECM) can impact genome integrity is largely unclear. Here, acute perturbations (∼1 h) to actomyosin stress or ECM elasticity cause rapid and reversible changes in lamin-A, DNA damage, and cell cycle. The findings are especially relevant to organs such as the heart because DNA damage permanently arrests cardiomyocyte proliferation shortly after birth and thereby eliminates regeneration after injury including heart attack. Embryonic hearts, cardiac-differentiated iPS cells (induced pluripotent stem cells), and various nonmuscle cell types all show that actomyosin-driven nuclear rupture causes cytoplasmic mis-localization of DNA repair factors and excess DNA damage. Binucleation and micronuclei increase as telomeres shorten, which all favor cell-cycle arrest. Deficiencies in lamin-A and repair factors exacerbate these effects, but lamin-A-associated defects are rescued by repair factor overexpression and also by contractility modulators in clinical trials. Contractile cells on stiff ECM normally exhibit low phosphorylation and slow degradation of lamin-A by matrix-metalloprotease-2 (MMP2), and inhibition of this lamin-A turnover and also actomyosin contractility are seen to minimize DNA damage. Lamin-A is thus stress stabilized to mechano-protect the genome."
2018 Sep,APL bioengineering,APL Bioeng. 2018 Sep 26;2(3):031601. doi: 10.1063/1.5056176. eCollection 2018 ,"['Engler, Adam J', 'Discher, Dennis E']",[],Rationally engineered advances in cancer research.,"The physical and engineering sciences have much to offer in understanding, diagnosing, and even treating cancer. Microfluidics, imaging, materials, and diverse measurement devices are all helping to shift paradigms of tumorigenesis and dissemination. Using materials and micro-probes of elasticity, for example, epithelia have been shown to transform into mesenchymal cells when the elasticity of adjacent tissue increases. Approaches common in engineering science enable such discoveries, and further application of such tools and principles will likely improve existing cancer models in vivo and also create better models for high throughput analyses in vitro. As profiled in this special topic issue composed of more than a dozen manuscripts, opportunities abound for the creativity and analytics of engineering and the physical sciences to make advances in and against cancer."
2019 Apr,Trends in cancer,Trends Cancer. 2019 Apr;5(4):197-199. doi: 10.1016/j.trecan.2019.02.005. Epub ,"['Dooling, Lawrence J', 'Discher, Dennis E']","['actomyosin', 'cell survival', 'fibrosis', 'humans', 'receptors, g-protein-coupled', ' tamoxifen', ' tumor microenvironment']",Inhibiting Tumor Fibrosis and Actomyosin through GPCR activation.,"Myofibroblasts produce desmoplastic stroma around tumors and have emerged as therapeutic targets in pancreatic ductal adenocarcinoma (PDAC) and other cancers. Differentiation of pancreatic stellate cells (PSCs) into myofibroblasts is inhibited by the estrogen-receptor modulator, tamoxifen, which activates a G-protein-coupled receptor (GPCR) for estrogen (GPER). This negatively regulates actomyosin contractility and downstream mechanosensitive signaling to profoundly alter the tumor microenvironment, which appears less fibrotic, less immunosuppressive, and more vascularized."
2019 Mar 15,"Methods (San Diego, Calif.)",Methods. 2019 Mar 15;157:3-14. doi: 10.1016/j.ymeth.2018.12.009. Epub 2018 Dec ,"['Xia, Yuntao', 'Cho, Sangkyun', 'Vashisth, Manasvita', 'Ivanovska, Irena L', 'Dingal, P C Dave P', 'Discher, Dennis E']","['anisotropy', ' cell biology', 'cytological techniques  methods', 'extracellular matrix genetics  ultrastructure', 'gene expression regulation genetics', 'hydrogels chemistry', 'mechanical phenomena']",Manipulating the mechanics of extracellular matrix to study effects on the nucleus and its structure.,"Tissues such as brain, muscle, and bone differ greatly not only in their biological functions but also in their mechanical properties. Brain is far softer than muscle while bone is the stiffest tissue. Stiffness of extracellular microenvironments affects fundamental cell biological processes such as polarization and DNA replication, which affect nuclear size, shape, and levels of nuclear proteins such as the lamins that modulate gene expression. Reductionist approaches have helped dissect the effects of matrix mechanics away from confounding biochemical signals. Here, we summarize materials and methods for synthesizing and characterizing soft and stiff synthetic hydrogels widely used for mechanobiological studies. Such gels are also easily made to mimic the mechanical heterogeneity of fibrotic tissues. We further describe a nano-thin collagen fiber system, which enables control of anisotropy in addition to stiffness. With the different systems, we illustrate the effects of matrix mechanics on nuclear size, shape, and proteins including the lamins."
