time,journal,doi_info,authors,key words,title,abstract
2018 Oct 2,Biophysical journal,Biophys J. 2018 Oct 2;115(7):1292-1306. doi: 10.1016/j.bpj.2018.08.006. Epub 2018 ,"['Agudo-Canalejo, Jaime', 'Discher, Dennis E']","['adhesiveness', 'cell membrane  chemistry', 'lipid bilayers chemistry', ' nanotechnology']",Biomembrane Adhesion to Substrates Topographically Patterned with Nanopits.,"We examine the adhesion of biomembranes to substrates topographically patterned with concave nanopits and identify several universal features in the adhesion process. We find three distinct states, depending on whether the membrane remains flat above the nanopit, partially enters it, or completely adheres to it, and derive analytical conditions for the stability of these states valid for a very general class of nanopit shapes. Surprisingly, completely adhered states are always (meta)stable. We also show that the presence of many nanopits can increase or decrease the effective adhesiveness of a substrate, depending on the tension of the membrane and the strength of the membrane-substrate attraction. Our results have implications regarding several experimental methods, which involve the formation of supported lipid bilayers on substrates patterned with nanopits, as well as observations of decreased spreading of cells and migration of cells toward regions of lower nanopit density on topographically patterned substrates. Furthermore, our predictions can also be directly tested in experiments exploring the adhesion of micropipette-aspirated giant vesicles to such substrates."
2018 Nov 5,The Journal of cell biology,J Cell Biol. 2018 Nov 5;217(11):3796-3808. doi: 10.1083/jcb.201711161. Epub 2018 ,"['Xia, Yuntao', 'Ivanovska, Irena L', 'Zhu, Kuangzheng', 'Smith, Lucas', 'Irianto, Jerome', 'Pfeifer, Charlotte R', 'Alvey, Cory M', 'Ji, Jiazheng', 'Liu, Dazhen', 'Cho, Sangkyun', 'Bennett, Rachel R', 'Liu, Andrea J', 'Greenberg, Roger A', 'Discher, Dennis E']","['a549 cells', 'cell nucleus genetics  metabolism', ' dna repair', 'histones genetics  metabolism', 'humans', 'lamin type a genetics  metabolism']",Nuclear rupture at sites of high curvature compromises retention of DNA repair factors.,"The nucleus is physically linked to the cytoskeleton, adhesions, and extracellular matrix-all of which sustain forces, but their relationships to DNA damage are obscure. We show that nuclear rupture with cytoplasmic mislocalization of multiple DNA repair factors correlates with high nuclear curvature imposed by an external probe or by cell attachment to either aligned collagen fibers or stiff matrix. Mislocalization is greatly enhanced by lamin A depletion, requires hours for nuclear reentry, and correlates with an increase in pan-nucleoplasmic foci of the DNA damage marker γH2AX. Excess DNA damage is rescued in ruptured nuclei by cooverexpression of multiple DNA repair factors as well as by soft matrix or inhibition of actomyosin tension. Increased contractility has the opposite effect, and stiff tumors with low lamin A indeed exhibit increased nuclear curvature, more frequent nuclear rupture, and excess DNA damage. Additional stresses likely play a role, but the data suggest high curvature promotes nuclear rupture, which compromises retention of DNA repair factors and favors sustained damage."
2018 Jul 16,Journal of cell science,J Cell Sci. 2018 Jul 16;132(4):jcs216770. doi: 10.1242/jcs.216770.,"['Steinkühler, Jan', 'Różycki, Bartosz', 'Alvey, Cory', 'Lipowsky, Reinhard', 'Weikl, Thomas R', 'Dimova, Rumiana', 'Discher, Dennis E']","['acidosis  metabolism', 'antigens, differentiation  metabolism', 'biomarkers metabolism', 'cd47 antigen  metabolism', 'humans', 'macrophages  metabolism', 'neoplasms metabolism', 'phagocytosis physiology', 'protein binding physiology', 'receptors, immunologic  metabolism', 'signal transduction physiology', 'adhesion', 'cooperative binding', 'elasticity', 'gpmv', 'vesicles']",Membrane fluctuations and acidosis regulate cooperative binding of 'marker of self' protein CD47 with the macrophage checkpoint receptor SIRPα.,"Cell-cell interactions that result from membrane proteins binding weakly in trans can cause accumulations in cis that suggest cooperativity and thereby an acute sensitivity to environmental factors. The ubiquitous 'marker of self' protein CD47 binds weakly to SIRPα on macrophages, which leads to accumulation of SIRPα (also known as SHPS-1, CD172A and SIRPA) at phagocytic synapses and ultimately to inhibition of engulfment of 'self' cells - including cancer cells. We reconstituted this macrophage checkpoint with GFP-tagged CD47 on giant vesicles generated from plasma membranes and then imaged vesicles adhering to SIRPα immobilized on a surface. CD47 diffusion is impeded near the surface, and the binding-unbinding events reveal cooperative interactions as a concentration-dependent two-dimensional affinity. Membrane fluctuations out-of-plane link cooperativity to membrane flexibility with suppressed fluctuations in the vicinity of bound complexes. Slight acidity (pH 6) stiffens membranes, diminishes cooperative interactions and also reduces 'self' signaling of cancer cells in phagocytosis. Sensitivity of cell-cell interactions to microenvironmental factors - such as the acidity of tumors and other diseased or inflamed sites - can thus arise from the collective cooperative properties of flexible membranes.This article has an associated First Person interview with the first author of the paper."
2018 Aug 8,Molecular biology of the cell,Mol Biol Cell. 2018 Aug 8;29(16):1948-1962. doi: 10.1091/mbc.E18-02-0079. Epub ,"['Pfeifer, Charlotte R', 'Xia, Yuntao', 'Zhu, Kuangzheng', 'Liu, Dazhen', 'Irianto, Jerome', 'García, Victor M Morales', 'Millán, Leeza M Santiago', 'Niese, Brandon', 'Harding, Shane', 'Deviri, Dan', 'Greenberg, Roger A', 'Discher, Dennis E']","['ataxia telangiectasia mutated proteins metabolism', ' cell cycle', 'cell line, tumor', ' cell movement', 'cell nucleus metabolism', 'cell proliferation', ' dna damage', 'dna repair', 'gene knockdown techniques', 'histones metabolism', 'humans']",Constricted migration increases DNA damage and independently represses cell cycle.,"Cell migration through dense tissues or small capillaries can elongate the nucleus and even damage it, and any impact on cell cycle has the potential to affect various processes including carcinogenesis. Here, nuclear rupture and DNA damage increase with constricted migration in different phases of cell cycle-which we show is partially repressed. We study several cancer lines that are contact inhibited or not and that exhibit diverse frequencies of nuclear lamina rupture after migration through small pores. DNA repair factors invariably mislocalize after migration, and an excess of DNA damage is evident as pan--nucleoplasmic foci of phosphoactivated ATM and γH2AX. Foci counts are suppressed in late cell cycle as expected of mitotic checkpoints, and migration of contact-inhibited cells through large pores into sparse microenvironments leads also as expected to cell-cycle reentry and no effect on a basal level of damage foci. Constricting pores delay such reentry while excess foci occur independent of cell-cycle phase. Knockdown of repair factors increases DNA damage independent of cell cycle, consistent with effects of constricted migration. Because such migration causes DNA damage and impedes proliferation, it illustrates a cancer cell fate choice of ""go or grow."""
2018 Jan 1,"Nucleus (Austin, Tex.)",Nucleus. 2018 Jan 1;9(1):230-245. doi: 10.1080/19491034.2018.1460185.,"['Cho, Sangkyun', 'Abbas, Amal', 'Irianto, Jerome', 'Ivanovska, Irena L', 'Xia, Yuntao', 'Tewari, Manu', 'Discher, Dennis E']","['actomyosin pharmacology', 'humans', 'induced pluripotent stem cells drug effects  metabolism', 'lamin type a antagonists & inhibitors  metabolism', ' mechanotransduction, cellular drug effects', 'mesenchymal stem cells drug effects  metabolism', 'phosphorylation drug effects', 'hgps', 'lamin-a', 'matrix', 'mechanobiology', 'progeria', 'stiffness']","Progerin phosphorylation in interphase is lower and less mechanosensitive than lamin-A,C in iPS-derived mesenchymal stem cells.","Interphase phosphorylation of lamin-A,C depends dynamically on a cell's microenvironment, including the stiffness of extracellular matrix. However, phosphorylation dynamics is poorly understood for diseased forms such as progerin, a permanently farnesylated mutant of LMNA that accelerates aging of stiff and mechanically stressed tissues. Here, fine-excision alignment mass spectrometry (FEA-MS) is developed to quantify progerin and its phosphorylation levels in patient iPS cells differentiated to mesenchymal stem cells (MSCs). The stoichiometry of total A-type lamins (including progerin) versus B-type lamins measured for Progeria iPS-MSCs prove similar to that of normal MSCs, with total A-type lamins more abundant than B-type lamins. However, progerin behaves more like farnesylated B-type lamins in mechanically-induced segregation from nuclear blebs. Phosphorylation of progerin at multiple sites in iPS-MSCs cultured on rigid plastic is also lower than that of normal lamin-A and C. Reduction of nuclear tension upon i) cell rounding/detachment from plastic, ii) culture on soft gels, and iii) inhibition of actomyosin stress increases phosphorylation and degradation of lamin-C > lamin-A > progerin. Such mechano-sensitivity diminishes, however, with passage as progerin and DNA damage accumulate. Lastly, transcription-regulating retinoids exert equal effects on both diseased and normal A-type lamins, suggesting a differential mechano-responsiveness might best explain the stiff tissue defects in Progeria."
2018 Apr 18,Bioconjugate chemistry,Bioconjug Chem. 2018 Apr 18;29(4):914-927. doi: 10.1021/acs.bioconjchem.7b00816. ,"['Nair, Praful R', 'Alvey, Cory', 'Jin, Xiaoling', 'Irianto, Jerome', 'Ivanovska, Irena', 'Discher, Dennis E']","['animals', 'antineoplastic agents  administration & dosage therapeutic use', 'cell line, tumor', 'drug carriers  chemistry', 'humans', 'liver drug effects pathology', 'liver neoplasms  drug therapy pathology', 'mice', 'mice, inbred nod', 'mice, scid', 'micelles', 'paclitaxel  administration & dosage therapeutic use', 'polyesters  chemistry', 'polyethylene glycols  chemistry', 'tretinoin  administration & dosage therapeutic use']",Filomicelles Deliver a Chemo-Differentiation Combination of Paclitaxel and Retinoic Acid That Durably Represses Carcinomas in Liver to Prolong Survival.,"Drug resistance and relapse is common in cancer treatments with chemotherapeutics, and while drug combinations with naturally occurring, differentiation-inducing retinoic acid (RA) provide remission-free cures for one type of liquid tumor, solid tumors present major problems for delivery. Here, inspired by filoviruses that can be microns in length, flexible filomicelles that self-assemble from an amphiphilic block copolymer (PEG-PCL) are shown to effectively deliver RA and paclitaxel (TAX) to several solid tumor models, particularly in the liver. These hydrophobic compounds synergistically load into the cores of the elongated micelles, and the coloaded micelles prove most effective at causing cell death, ploidy, and durable regression of tumors compared to free drugs or to separately loaded drugs. RA-TAX filomicelles also reduce mortality of human lung or liver derived cancers engrafted at liver, intraperitoneal, and subcutaneous sites in immunodeficient mice. In vitro studies show that the dual drug micelles effectively suppress proliferation while upregulating a generic differentiation marker. The results highlight the potency of dual-loaded filomicelles in killing cancer cells or else driving their differentiation away from growth."
2018 Jan 1,"Physiology (Bethesda, Md.)",Physiology (Bethesda). 2018 Jan 1;33(1):16-25. doi: 10.1152/physiol.00026.2017.,"['Smith, Lucas R', 'Cho, Sangkyun', 'Discher, Dennis E']","['animals', 'cell adhesion', ' cell differentiation', 'cytoskeleton physiology', 'extracellular matrix  physiology', 'humans', 'mechanotransduction, cellular', 'stem cells  physiology']",Stem Cell Differentiation is Regulated by Extracellular Matrix Mechanics.,"Stem cells mechanosense the stiffness of their microenvironment, which impacts differentiation. Although tissue hydration anti-correlates with stiffness, extracellular matrix (ECM) stiffness is clearly transduced into gene expression via adhesion and cytoskeleton proteins that tune fates. Cytoskeletal reorganization of ECM can create heterogeneity and influence fates, with fibrosis being one extreme."
2017 Apr,Current opinion in systems biology,Curr Opin Syst Biol. 2017 Apr;2:103-114. doi: 10.1016/j.coisb.2017.04.005. Epub ,"['Pfeifer, Charlotte R', 'Alvey, Cory M', 'Irianto, Jerome', 'Discher, Dennis E']",[],Genome variation across cancers scales with tissue stiffness - an invasion-mutation mechanism and implications for immune cell infiltration.,"Many different types of soft and solid tumors have now been sequenced, and meta-analyses suggest that genomic variation across tumors scales with the stiffness of the tumors' tissues of origin. The opinion expressed here is based on a review of current genomics data, and it considers multiple 'mechanogenomics' mechanisms to potentially explain this scaling of mutation rate with tissue stiffness. Since stiff solid tissues have higher density of fibrous collagen matrix, which should decrease tissue porosity, cancer cell proliferation could be affected and so could invasion into stiff tissues as the nucleus is squeezed sufficiently to enhance DNA damage. Diversification of a cancer genome after constricted migration is now clear. Understanding genome changes that give rise to neo-antigens is important to selection as well as to the development of immunotherapies, and we discuss engineered monocytes/macrophages as particularly relevant to understanding infiltration into solid tumors."
2017 Nov 7,Molecular biology of the cell,Mol Biol Cell. 2017 Nov 7;28(23):3333-3348. doi: 10.1091/mbc.E17-06-0393. Epub ,"['Buxboim, Amnon', 'Irianto, Jerome', 'Swift, Joe', 'Athirasala, Avathamsa', 'Shin, Jae-Won', 'Rehfeldt, Florian', 'Discher, Dennis E']","['adipogenesis physiology', 'adipose tissue physiology', 'animals', 'cell differentiation', 'cell nucleus metabolism', 'elasticity', 'extracellular matrix metabolism physiology', 'humans', 'lamin type a  metabolism physiology', 'lamin type b  metabolism physiology', 'lamins metabolism', 'mesenchymal stem cells metabolism', 'nuclear envelope metabolism', 'osteogenesis physiology', 'receptors, cytoplasmic and nuclear metabolism', 'lamin b receptor']",Coordinated increase of nuclear tension and lamin-A with matrix stiffness outcompetes lamin-B receptor that favors soft tissue phenotypes.,"Matrix stiffness that is sensed by a cell or measured by a purely physical probe reflects the intrinsic elasticity of the matrix and also how thick or thin the matrix is. Here, mesenchymal stem cells (MSCs) and their nuclei spread in response to thickness-corrected matrix microelasticity, with increases in nuclear tension and nuclear stiffness resulting from increases in myosin-II and lamin-A,C. Linearity between the widely varying projected area of a cell and its nucleus across many matrices, timescales, and myosin-II activity levels indicates a constant ratio of nucleus-to-cell volume, despite MSCs' lineage plasticity. Nuclear envelope fluctuations are suppressed on the stiffest matrices, and fluctuation spectra reveal a high nuclear tension that matches trends from traction force microscopy and from increased lamin-A,C. Transcriptomes of many diverse tissues and MSCs further show that lamin-A,C's increase with tissue or matrix stiffness anti-correlates with lamin-B receptor (LBR), which contributes to lipid/sterol biosynthesis. Adipogenesis (a soft lineage) indeed increases LBR:lamin-A,C protein stoichiometry in MSCs versus osteogenesis (stiff). The two factors compete for lamin-B in response to matrix elasticity, knockdown, myosin-II inhibition, and even constricted migration that disrupts and segregates lamins in situ. Matrix stiffness-driven contractility thus tenses the nucleus to favor lamin-A,C accumulation and suppress soft tissue phenotypes."
2017 Sep 5,Biophysical journal,Biophys J. 2017 Sep 5;113(5):1060-1071. doi: 10.1016/j.bpj.2017.07.014.,"['Deviri, Dan', 'Discher, Dennis E', 'Safran, Sam A']","['algorithms', 'animals', 'biomechanical phenomena', ' chromatin metabolism', 'computer simulation', 'elasticity', 'hydrodynamics', ' models, biological', ' nuclear lamina metabolism', 'polymers', 'viscosity']",Rupture Dynamics and Chromatin Herniation in Deformed Nuclei.,"During migration of cells in vivo, in both pathological processes such as cancer metastasis or physiological events such as immune cell migration through tissue, the cells must move through narrow interstitial spaces that can be smaller than the nucleus. This can induce deformation of the nucleus which, according to recent experiments, may result in rupture of the nuclear envelope that can lead to cell death, if not prevented or healed within an appropriate time. The nuclear envelope, which can be modeled as a double lipid bilayer attached to a viscoelastic gel (lamina) whose elasticity and viscosity primarily depend on the lamin composition, may utilize mechanically induced, self-healing mechanisms that allow the hole to be closed after the deformation-induced strains are reduced by leakage of the internal fluid. Here, we present a viscoelastic model of the evolution of a hole nucleated by deformations of the nuclear lamina and estimate the herniation of chromatin through the hole and its relation to the lamin expression levels in the nuclear envelope."
2017 Aug 21,Developmental cell,Dev Cell. 2017 Aug 21;42(4):313-315. doi: 10.1016/j.devcel.2017.08.005.,"['Discher, Dennis E', 'Dooling, Lawrence J']","[' epithelium', ' mesoderm', 'muscle contraction', 'myosin type ii']",Optimal Contractile Forces for a Mesenchymal Engine.,"The cell and molecular mechanisms that cause a smooth epithelium to become topographically patterned during development are poorly understood. In a recent issue of Science, Shyer et al. (2017) show that myosin II contractility drives the smooth dermal mesenchyme into a pattern of surface bumps that triggers epithelial gene expression."
2017 Aug 24,Nature,Nature. 2017 Aug 24;548(7668):466-470. doi: 10.1038/nature23470. Epub 2017 Jul ,"['Harding, Shane M', 'Benci, Joseph L', 'Irianto, Jerome', 'Discher, Dennis E', 'Minn, Andy J', 'Greenberg, Roger A']","['animals', 'ctla-4 antigen antagonists & inhibitors', 'cell cycle checkpoints', 'cell line, tumor', 'dna breaks, double-stranded', ' dna damage', 'disease models, animal', 'female', 'humans', 'inflammation  metabolism pathology', 'interferons metabolism', 'melanoma, experimental drug therapy metabolism pathology', 'membrane proteins metabolism', 'mice', 'mice, inbred c57bl', ' micronuclei, chromosome-defective', ' mitosis', 'nucleotidyltransferases metabolism', 'receptors, pattern recognition  metabolism', ' signal transduction']",Mitotic progression following DNA damage enables pattern recognition within micronuclei.,"Inflammatory gene expression following genotoxic cancer therapy is well documented, yet the events underlying its induction remain poorly understood. Inflammatory cytokines modify the tumour microenvironment by recruiting immune cells and are critical for both local and systemic (abscopal) tumour responses to radiotherapy. A poorly understood feature of these responses is the delayed onset (days), in contrast to the acute DNA-damage responses that occur in minutes to hours. Such dichotomous kinetics implicate additional rate-limiting steps that are essential for DNA-damage-induced inflammation. Here we show that cell cycle progression through mitosis following double-stranded DNA breaks leads to the formation of micronuclei, which precede activation of inflammatory signalling and are a repository for the pattern-recognition receptor cyclic GMP-AMP synthase (cGAS). Inhibiting progression through mitosis or loss of pattern recognition by stimulator of interferon genes (STING)-cGAS impaired interferon signalling. Moreover, STING loss prevented the regression of abscopal tumours in the context of ionizing radiation and immune checkpoint blockade in vivo. These findings implicate temporal modulation of the cell cycle as an important consideration in the context of therapeutic strategies that combine genotoxic agents with immune checkpoint blockade."
2017 Jul 24,Current biology : CB,Curr Biol. 2017 Jul 24;27(14):2065-2077.e6. doi: 10.1016/j.cub.2017.06.005. Epub ,"['Alvey, Cory M', 'Spinler, Kyle R', 'Irianto, Jerome', 'Pfeifer, Charlotte R', 'Hayes, Brandon', 'Xia, Yuntao', 'Cho, Sangkyun', 'Dingal, P C P Dave', 'Hsu, Jake', 'Smith, Lucas', 'Tewari, Manu', 'Discher, Dennis E']","['animals', 'antigens, differentiation  genetics metabolism', 'bone marrow', 'cell differentiation', 'cell line', 'humans', 'macrophages immunology physiology', 'mice', 'neoplasms  metabolism', 'receptors, immunologic  genetics metabolism', 'signal transduction', 'immunotherapy', 'lamins', 'mechanobiology', 'motility', 'phagocytosis']","SIRPA-Inhibited, Marrow-Derived Macrophages Engorge, Accumulate, and Differentiate in Antibody-Targeted Regression of Solid Tumors.","Marrow-derived macrophages are highly phagocytic, but whether they can also traffic into solid tumors and engulf cancer cells is questionable, given the well-known limitations of tumor-associated macrophages (TAMs). Here, SIRPα on macrophages from mouse and human marrow was inhibited to block recognition of its ligand, the ""marker of self"" CD47 on all other cells. These macrophages were then systemically injected into mice with fluorescent human tumors that had been antibody targeted. Within days, the tumors regressed, and single-cell fluorescence analyses showed that the more the macrophages engulfed, the more they accumulated within regressing tumors. Human-marrow-derived macrophages engorged on the human tumors, while TAMs were minimally phagocytic, even toward CD47-knockdown tumors. Past studies had opsonized tumors in situ with antibody and/or relied on mouse TAMs but had not injected SIRPα-inhibited cells; also, unlike past injections of anti-CD47, blood parameters remained normal and safe. Consistent with tumor-selective engorge-and-accumulate processes in vivo, phagocytosis in vitro inhibited macrophage migration through micropores that mimic features of dense 3D tissue. Accumulation of SIRPα-inhibited macrophages in tumors favored tumor regression for 1-2 weeks, but donor macrophages quickly differentiated toward non-phagocytic, high-SIRPα TAMs. Analyses of macrophages on soft (like marrow) or stiff (like solid tumors) collagenous gels demonstrated a stiffness-driven, retinoic-acid-modulated upregulation of SIRPα and the mechanosensitive nuclear marker lamin-A. Mechanosensitive differentiation was similarly evident in vivo and likely limited the anti-tumor effects, as confirmed by re-initiation of tumor regression by fresh injections of SIRPα-inhibited macrophages. Macrophage motility, phagocytosis, and differentiation in vivo are thus coupled."
2017 Jun 6,Biophysical journal,Biophys J. 2017 Jun 6;112(11):2271-2279. doi: 10.1016/j.bpj.2017.04.037.,"['Bennett, Rachel R', 'Pfeifer, Charlotte R', 'Irianto, Jerome', 'Xia, Yuntao', 'Discher, Dennis E', 'Liu, Andrea J']","['animals', 'cell movement  genetics  physiology', 'cell nucleus  physiology', ' dna damage', 'elasticity', 'kinetics', ' models, biological', ' mutation', 'neoplasms genetics physiopathology']",Elastic-Fluid Model for DNA Damage and Mutation from Nuclear Fluid Segregation Due to Cell Migration.,"When cells migrate through constricting pores, they incur DNA damage and develop genomic variation. Experiments show that this damage is not due to DNA breakage from mechanical stress on chromatin in the deformed nucleus. Here we propose a model for a mechanism by which nuclear deformation can lead to DNA damage. We treat the nucleus as an elastic-fluid system with an elastic component (chromatin) and fluid component that can be squeezed out when the nucleus is deformed. We couple the elastic-fluid model to the kinetics of DNA breakage and repair by assuming that the local volume fraction of the elastic component controls the rate of damage per unit volume due to naturally occurring DNA breaks, whereas the volume fraction of the fluid component controls the rate of repair of DNA breaks per unit volume by repair factors, which are soluble in the fluid. By comparing our results to a number of experiments on controlled migration through pores, we show that squeeze-out of the fluid, and hence of the mobile repair factors, is sufficient to account for the extent of DNA damage and genomic variation observed experimentally. We also use our model for migration through a cylindrical pore to estimate the variation with tissue stiffness of the mutation rate in tumors."
