time,journal,doi_info,authors,key words,title,abstract
2016 Dec,Journal of orthopaedic research : official publication of the Orthopaedic ,J Orthop Res. 2016 Dec;34(12):2172-2180. doi: 10.1002/jor.23253. Epub 2016 Apr ,"['Freedman, Benjamin R', 'Gordon, Joshua A', 'Bhatt, Pankti R', 'Pardes, Adam M', 'Thomas, Stephen J', 'Sarver, Joseph J', 'Riggin, Corinne N', 'Tucker, Jennica J', 'Williams, Alexis W', 'Zanes, Robert C', 'Hast, Michael W', 'Farber, Daniel C', 'Silbernagel, Karin G', 'Soslowsky, Louis J']","['achilles tendon  injuries physiology surgery', 'animals', 'early ambulation', 'fatigue physiopathology', 'male', 'random allocation', 'rats, sprague-dawley', 'tendon injuries  surgery', 'collagen', 'fatigue', 'mechanics', 'structure-function', 'ultrasound']",Nonsurgical treatment and early return to activity leads to improved Achilles tendon fatigue mechanics and functional outcomes during early healing in an animal model.,"Achilles tendon ruptures are common and devastating injuries; however, an optimized treatment and rehabilitation protocol has yet to be defined. Therefore, the objective of this study was to investigate the effects of surgical repair and return to activity on joint function and Achilles tendon properties after 3 weeks of healing. Sprague-Dawley rats (N = 100) received unilateral blunt transection of their Achilles tendon. Animals were then randomized into repaired or non-repaired treatments, and further randomized into groups that returned to activity after 1 week (RTA1) or after 3 weeks (RTA3) of limb casting in plantarflexion. Limb function, passive joint mechanics, and tendon properties (mechanical, organizational using high frequency ultrasound, histological, and compositional) were evaluated. Results showed that both treatment and return to activity collectively affected limb function, passive joint mechanics, and tendon properties. Functionally, RTA1 animals had increased dorsiflexion ROM and weight bearing of the injured limb compared to RTA3 animals 3-weeks post-injury. Such functional improvements in RTA1 tendons were evidenced in their mechanical fatigue properties and increased cross sectional area compared to RTA3 tendons. When RTA1 was coupled with nonsurgical treatment, superior fatigue properties were achieved compared to repaired tendons. No differences in cell shape, cellularity, GAG, collagen type I, or TGF-β staining were identified between groups, but collagen type III was elevated in RTA3 repaired tendons. The larger tissue area and increased fatigue resistance created in RTA1 tendons may prove critical for optimized outcomes in early Achilles tendon healing following complete rupture. © 2016 Orthopaedic Research Society. Published by Wiley Periodicals, Inc. J Orthop Res 34:2172-2180, 2016."
2016 Nov,Journal of orthopaedic research : official publication of the Orthopaedic ,J Orthop Res. 2016 Nov;34(11):2009-2015. doi: 10.1002/jor.23225. Epub 2016 Apr 6.,"['Tucker, Jennica J', 'Soslowsky, Louis J']","['animals', 'hydroxymethylglutaryl-coa reductase inhibitors pharmacology  therapeutic use', 'hypercholesterolemia  drug therapy pathology', 'male', 'rats, sprague-dawley', 'rotator cuff  drug effects pathology', 'simvastatin pharmacology  therapeutic use', 'animal model', 'hypercholesterolemia', 'simvastatin', 'statin', 'supraspinatus']",Effect of simvastatin on rat supraspinatus tendon mechanical and histological properties in a diet-induced hypercholesterolemia model.,"Hypercholesterolemia is a common condition and is a risk factor for tendon rupture, specifically in the supraspinatus tendon. In the clinic, statins are commonly prescribed to lower cholesterol, but little information is available examining the effect of statin treatment on the musculoskeletal system. Therefore, the objective of this study was to determine the biomechanical and histological effects of statin treatment in a diet-induced hypercholesterolemia model. We hypothesized that hypercholesterolemic rats treated with statins would have improved tendon biomechanical and histological properties compared to hypercholesterolemic rats not receiving daily statin treatment. Thirty adult male Sprague-Dawley rats ate either high-cholesterol (HC) diet (n = 20) or normal chow (CTL, n = 10). After 6 months, a subset of HC rats began daily oral simvastatin dosing (HC+S) at 20 mg/kg. All rats were sacrificed after a total of 9 months (3 months of statin treatment) and evaluated for histology and mechanics. For mechanics, at the insertion region, HC+S group had increased tendon cross-sectional area decreased and modulus. No differences were noted in mechanical properties at the midsubstance. For histology, no differences were noted in the insertion region. In the midsubstance region, HC+S group had more spindle shaped cells. Our results suggest that 3 months of simvastatin treatment in a diet-induced hypercholesterolemia rat model alters some tendon mechanical and histological properties, although a strong conclusion in support of improved parameters cannot be drawn. Therefore, we conclude that simvastatin treatment does not negatively affect tendon properties. © 2016 Orthopaedic Research Society. Published by Wiley Periodicals, Inc. J Orthop Res 34:2009-2015, 2016."
2016 Feb 6,Interface focus,Interface Focus. 2016 Feb 6;6(1):20150043. doi: 10.1098/rsfs.2015.0043.,"['Connizzo, Brianne K', 'Han, Lin', 'Birk, David E', 'Soslowsky, Louis J']","['ehlers–danlos syndrome', 'fibril sliding', 'multiscale mechanics', 're-alignment', 'supraspinatus', 'tendon']",Collagen V-heterozygous and -null supraspinatus tendons exhibit altered dynamic mechanical behaviour at multiple hierarchical scales.,"Tendons function using a unique set of mechanical properties governed by the extracellular matrix and its ability to respond to varied multi-axial loads. Reduction of collagen V expression, such as in classic Ehlers-Danlos syndrome, results in altered fibril morphology and altered macroscale mechanical function in both clinical and animal studies, yet the mechanism by which changes at the fibril level lead to macroscale functional changes has not yet been investigated. This study addresses this by defining the multiscale mechanical response of wild-type, collagen V-heterozygous and -null supraspinatus tendons. Tendons were subjected to mechanical testing and analysed for macroscale properties, as well as microscale (fibre re-alignment) and nanoscale (fibril deformation and sliding) responses. In many macroscale parameters, results showed a dose-dependent response with severely decreased properties in the null group. In addition, both heterozygous and null groups responded to load faster than in wild-type tendons via earlier fibre re-alignment and fibril stretch. However, the heterozygous group exhibited increased fibril sliding, while the null group exhibited no fibril sliding. These studies demonstrate that dynamic responses play an important role in determining overall function and that collagen V is a critical regulator in the development of these relationships."
2016 May-Jul,Matrix biology : journal of the International Society for Matrix Biology,Matrix Biol. 2016 May-Jul;52-54:325-338. doi: 10.1016/j.matbio.2016.01.016. Epub ,"['Marinovich, Ryan', 'Soenjaya, Yohannes', 'Wallace, Gregory Q', 'Zuskov, Andre', 'Dunkman, Andrew', 'Foster, Brian L', 'Ao, Min', 'Bartman, Kevin', 'Lam, Vida', 'Rizkalla, Amin', 'Beier, Frank', 'Somerman, Martha J', 'Holdsworth, David W', 'Soslowsky, Louis J', 'Lagugné-Labarthet, François', 'Goldberg, Harvey A']","['animals', 'bone and bones metabolism  ultrastructure', 'calcification, physiologic', 'integrin-binding sialoprotein  metabolism', 'mice', 'osteopontin  metabolism', 'spectrum analysis, raman', 'tendons metabolism  ultrastructure', 'x-ray microtomography', 'bone sialoprotein', 'calcified fibrocartilage', 'enthesis', 'osteopontin', 'quadriceps tendon', 'supraspinatus tendon']",The role of bone sialoprotein in the tendon-bone insertion.,"Tendons/ligaments insert into bone via a transitional structure, the enthesis, which is susceptible to injury and difficult to repair. Fibrocartilaginous entheses contain fibrocartilage in their transitional zone, part of which is mineralized. Mineral-associated proteins within this zone have not been adequately characterized. Members of the Small Integrin Binding Ligand N-linked Glycoprotein (SIBLING) family are acidic phosphoproteins expressed in mineralized tissues. Here we show that two SIBLING proteins, bone sialoprotein (BSP) and osteopontin (OPN), are present in the mouse enthesis. Histological analyses indicate that the calcified zone of the quadriceps tendon enthesis is longer in Bsp(-/-) mice, however no difference is apparent in the supraspinatus tendon enthesis. In an analysis of mineral content within the calcified zone, micro-CT and Raman spectroscopy reveal that the mineral content in the calcified fibrocartilage of the quadriceps tendon enthesis are similar between wild type and Bsp(-/-) mice. Mechanical testing of the patellar tendon shows that while the tendons fail under similar loads, the Bsp(-/-) patellar tendon is 7.5% larger in cross sectional area than wild type tendons, resulting in a 16.5% reduction in failure stress. However, Picrosirius Red staining shows no difference in collagen organization. Data collected here indicate that BSP is present in the calcified fibrocartilage of murine entheses and suggest that BSP plays a regulatory role in this structure, influencing the growth of the calcified fibrocartilage in addition to the weakening of the tendon mechanical properties. Based on the phenotype of the Bsp(-/-) mouse enthesis, and the known in vitro functional properties of the protein, BSP may be a useful therapeutic molecule in the reattachment of tendons and ligaments to bone."
2016 May-Jul,Matrix biology : journal of the International Society for Matrix Biology,Matrix Biol. 2016 May-Jul;52-54:315-324. doi: 10.1016/j.matbio.2016.01.015. Epub ,"['Zhang, Kairui', 'Asai, Shuji', 'Hast, Michael W', 'Liu, Min', 'Usami, Yu', 'Iwamoto, Masahiro', 'Soslowsky, Louis J', 'Enomoto-Iwamoto, Motomi']","['achilles tendon  injuries pathology physiopathology', 'animals', 'biomechanical phenomena', 'bone morphogenetic proteins  metabolism', 'calcinosis metabolism  physiopathology', 'disease models, animal', 'gene expression regulation', 'humans', 'mice', 'phosphorylation', 'signal transduction', 'smad proteins  metabolism', 'tendon injuries pathology  physiopathology', 'wound healing', 'achilles tendon', 'bmp', 'biomechanics', 'ectopic mineralization', 'injury', 'smad']","Tendon mineralization is progressive and associated with deterioration of tendon biomechanical properties, and requires BMP-Smad signaling in the mouse Achilles tendon injury model.","Ectopic tendon mineralization can develop following tendon rupture or trauma surgery. The pathogenesis of ectopic tendon mineralization and its clinical impact have not been fully elucidated yet. In this study, we utilized a mouse Achilles tendon injury model to determine whether ectopic tendon mineralization alters the biomechanical properties of the tendon and whether BMP signaling is involved in this condition. A complete transverse incision was made at the midpoint of the right Achilles tendon in 8-week-old CD1 mice and the gap was left open. Ectopic cartilaginous mass formation was found in the injured tendon by 4weeks post-surgery and ectopic mineralization was detected at 8 to 10weeks post-surgery. Ectopic mineralization grew over time and volume of the mineralized materials of 25-weeks samples was about 2.5 fold bigger than that of 10-weeks samples, indicating that injury-induced ectopic tendon mineralization is progressive. In vitro mechanical testing showed that max force, max stress and mid-substance modulus in the 25-weeks samples were significantly lower than the 10-weeks samples. We observed substantial increases in expression of bone morphogenetic protein family genes in injured tendons 1week post-surgery. Immunohistochemical analysis showed that phosphorylation of both Smad1 and Smad3 was highly increased in injured tendons as early as 1week post-injury and remained high in ectopic chondrogenic lesions 4-weeks post-injury. Treatment with the BMP receptor kinase inhibitor (LDN193189) significantly inhibited injury-induced tendon mineralization. These findings indicate that injury-induced ectopic tendon mineralization is progressive, involves BMP signaling and associated with deterioration of tendon biomechanical properties."
2016 Mar,Wound repair and regeneration : official publication of the Wound Healing Society ,Wound Repair Regen. 2016 Mar;24(2):237-46. doi: 10.1111/wrr.12412. Epub 2016 Mar ,"['Zgheib, Carlos', 'Hodges, Maggie', 'Hu, Junyi', 'Beason, David P', 'Soslowsky, Louis J', 'Liechty, Kenneth W', 'Xu, Junwang']","['animals', 'blotting, western', 'collagen type i metabolism', 'collagen type iii metabolism', 'diabetes mellitus genetics  pathology', 'disease models, animal', 'female', 'humans', 'mesenchymal stem cell transplantation', 'mesenchymal stem cells  physiology', 'mice', 'mice, inbred c57bl', 'mice, inbred nod', 'micrornas  genetics', 'signal transduction', 'skin injuries  pathology', 'up-regulation', 'wound healing  genetics', 'wounds and injuries genetics  pathology therapy']",Mechanisms of mesenchymal stem cell correction of the impaired biomechanical properties of diabetic skin: The role of miR-29a.,"Diabetic skin has impaired wound healing properties following injury. We have further shown that diabetic skin has weakened biomechanical properties at baseline. We hypothesize that the biomechanical properties of diabetic skin decline during the progression of the diabetic phenotype, and that this decline is due to the dysregulation of miR-29a, resulting in decreased collagen content. We further hypothesize that treatment with mesenchymal stem cells (MSCs) may improve diabetic wound healing by correction of the dysregulated miR-29a expression. We analyzed the biomechanical properties, collagen gene expression, collagen protein production, and miR-29a levels in skin harvested from 6 to 18 week old mice during the development of the diabetic phenotype. We also examined the correction of these impairments by both MSC treatment and the inhibition of miR-29a. Diabetic skin demonstrated a progressive impairment of biomechanical properties, decreased collagen content, and increased miR-29a levels during the development of the diabetic phenotype. MSC treatment decreased miR-29a levels, increased collagen content, and corrected the impaired biomechanical properties of diabetic skin. Additionally, direct inhibition of miR-29a also increased collagen content in diabetic skin. This decline in the biomechanical properties of diabetic skin during the progression of diabetes may increase the susceptibility of diabetic skin to injury and miR-29a appears to play a key role in this process."
2016 Jul,Journal of orthopaedic research : official publication of the Orthopaedic ,J Orthop Res. 2016 Jul;34(7):1256-63. doi: 10.1002/jor.23144. Epub 2016 Jan 18.,"['Mienaltowski, Michael J', 'Dunkman, Andrew A', 'Buckley, Mark R', 'Beason, David P', 'Adams, Sheila M', 'Birk, David E', 'Soslowsky, Louis J']","['aging  physiology', 'animals', 'female', 'mice, inbred c57bl', 'patellar ligament  injuries metabolism pathology physiopathology', ' regeneration', 'small leucine-rich proteoglycans metabolism', 'tendon injuries metabolism pathology  physiopathology', 'aging', 'injury', 'small leucine rich repeat proteoglycans', 'tendon']",Injury response of geriatric mouse patellar tendons.,"Injury adversely impacts the structure and mechanical properties of a tendon, thus causing pain and disability. Previously, we demonstrated that patellar tendons in mature (P150) and aged (P300) mice do not recover original functionality, even 6 weeks after injury, and that uninjured geriatric tendons (P570) are functionally inferior to uninjured mature tendons. In this study, we hypothesized that the repair response in injured geriatric mice would be further compromised, thus undermining patellar tendon function post-injury. Patellar tendons from wild-type mice were injured at 540 days. At 3 and 6 weeks post-surgery, structural, mechanical, and biochemical analyses were performed and compared to uninjured controls. Mechanical properties of geriatric tendons failed to improve after injury. When compared to mature and aged tendons post-injury, it was determined that at no age was there a suitable repair response. In previous studies, we were able to associate the absence of SLRPs with phenotypic changes both early and late in repair. Here we found that SLRPs were significantly decreased after injury, thus offering a possible explanation for why geriatric tendons were unable to mount an adequate repair response. Thus, we conclude that regardless of age after maturity, tendon healing ultimately results in a substandard outcome. © 2015 Orthopaedic Research Society. Published by Wiley Periodicals, Inc. J Orthop Res 34:1256-1263, 2016."
2015,PloS one,PLoS One. 2015 Oct 8;10(10):e0139880. doi: 10.1371/journal.pone.0139880. ,"['Rooney, Sarah Ilkhanipour', 'Tobias, John W', 'Bhatt, Pankti R', 'Kuntz, Andrew F', 'Soslowsky, Louis J']","['animals', 'collagen metabolism', 'male', 'matrix metalloproteinases metabolism', 'muscle, skeletal metabolism', 'physical conditioning, animal', 'principal component analysis', 'rna isolation & purification metabolism', 'rats', 'rats, sprague-dawley', 'tendons  metabolism', 'transcriptome']",Genetic Response of Rat Supraspinatus Tendon and Muscle to Exercise.,"Inflammation is a complex, biologic event that aims to protect and repair tissue. Previous studies suggest that inflammation is critical to induce a healing response following acute injury; however, whether similar inflammatory responses occur as a result of beneficial, non-injurious loading is unknown. The objective of this study was to screen for alterations in a subset of inflammatory and extracellular matrix genes to identify the responses of rat supraspinatus tendon and muscle to a known, non-injurious loading condition. We sought to define how a subset of genes representative of specific inflammation and matrix turnover pathways is altered in supraspinatus tendon and muscle 1) acutely following a single loading bout and 2) chronically following repeated loading bouts. In this study, Sprague-Dawley rats in the acute group ran a single bout of non-injurious exercise on a flat treadmill (10 m/min, 1 hour) and were sacrificed 12 or 24 hours after. Rats in the chronic group ran 5 days/wk for 1 or 8 weeks. A control group maintained normal cage activity. Supraspinatus muscle and tendon were harvested for RNA extractions, and a custom Panomics QuantiGene 2.0 multiplex assay was used to detect 48 target and 3 housekeeping genes. Muscle/tendon and acute/chronic groups had distinct gene expression. Components of the arachidonic acid cascade and matrix metalloproteinases and their inhibitors were altered with acute and chronic exercise. Collagen expression increased. Using a previously validated model of non-injurious exercise, we have shown that supraspinatus tendon and muscle respond to acute and chronic exercise by regulating inflammatory- and matrix turnover-related genes, suggesting that these pathways are involved in the beneficial adaptations to exercise."
2016 Jan,Journal of orthopaedic research : official publication of the Orthopaedic ,J Orthop Res. 2016 Jan;34(1):161-6. doi: 10.1002/jor.22993. Epub 2015 Aug 19.,"['Tucker, Jennica J', 'Riggin, Corinne N', 'Connizzo, Brianne K', 'Mauck, Robert L', 'Steinberg, David R', 'Kuntz, Andrew F', 'Soslowsky, Louis J', 'Bernstein, Joseph']","['animals', 'cumulative trauma disorders metabolism  pathology physiopathology', 'disease models, animal', 'interleukin-1beta metabolism', 'leukocyte common antigens metabolism', 'male', 'rats, sprague-dawley', 'rotator cuff metabolism pathology physiopathology', ' rotator cuff injuries', 'tendinopathy metabolism  pathology physiopathology', 'tendon injuries metabolism  pathology physiopathology', 'tumor necrosis factor-alpha metabolism', 'animal model', 'overuse', 'supraspinatus tendon repair']",Effect of overuse-induced tendinopathy on tendon healing in a rat supraspinatus repair model.,"Supraspinatus tears often result in the setting of chronic tendinopathy. However, the typical repair model utilizes an acute injury. In recognition of that distinction, our laboratory developed an overuse animal model; however it is unclear whether induced overuse is necessary in the repair model. We studied the repair properties of overuse-induced tendons compared to normal tendons. We hypothesized that histological and mechanical properties would not be altered between the overuse-induced and normal tendons 1 and 4 weeks after repair. Thirty-one adult male Sprague-Dawley rats were subjected to either overuse or cage activity for 4 weeks prior to bilateral supraspinatus tendon repair surgery. Rats were sacrificed at 1 and 4 weeks post-surgery and evaluated for histology and mechanics. Results at 1 week showed no clear histologic changes, but increased inflammatory protein expression in overuse tendons. At 4 weeks, percent relaxation was slightly increased in the overuse group. No other alterations in mechanics or histology were observed. Our results suggest that the effects of the surgical injury overshadow the changes evoked by overuse. Because clinically relevant mechanical parameters were not altered in the overuse group, we conclude that when examining tendons 4 weeks after repair in the classic rat supraspinatus model, inducing overuse prior to surgery is likely to be unnecessary."
2015 Oct,Clinical orthopaedics and related research,Clin Orthop Relat Res. 2015 Oct;473(10):3321-2. doi: 10.1007/s11999-015-4429-0.,"['Thomas, Stephen J', 'Reuther, Katherine E', 'Tucker, Jennica J', 'Sarver, Joseph J', 'Yannascoli, Sarah M', 'Caro, Adam C', 'Voleti, Pramod B', 'Rooney, Sarah I', 'Glaser, David L', 'Soslowsky, Louis J']",[],Erratum to: Biceps Detachment Decreases Joint Damage in a Rotator Cuff Tear Rat Model.,
2015 Aug,Acta biomaterialia,Acta Biomater. 2015 Aug;22:83-91. doi: 10.1016/j.actbio.2015.04.035. Epub 2015 ,"['Ahmadzadeh, Hossein', 'Freedman, Benjamin R', 'Connizzo, Brianne K', 'Soslowsky, Louis J', 'Shenoy, Vivek B']","['biomechanical phenomena', 'elasticity', ' finite element analysis', ' models, biological', 'porosity', 'rheology', 'tendons  physiology', ' tensile strength', 'extracellular matrix', 'finite element modeling', 'poisson’s ratio', 'poroelasticity', 'tendon']",Micromechanical poroelastic finite element and shear-lag models of tendon predict large strain dependent Poisson's ratios and fluid expulsion under tensile loading.,"As tendons are loaded, they reduce in volume and exude fluid to the surrounding medium. Experimental studies have shown that tendon stretching results in a Poisson's ratio greater than 0.5, with a maximum value at small strains followed by a nonlinear decay. Here we present a computational model that attributes this macroscopic observation to the microscopic mechanism of the load transfer between fibrils under stretch. We develop a finite element model based on the mechanical role of the interfibrillar-linking elements, such as thin fibrils that bridge the aligned fibrils or macromolecules such as glycosaminoglycans (GAGs) in the interfibrillar sliding and verify it with a theoretical shear-lag model. We showed the existence of a previously unappreciated structure-function mechanism whereby the Poisson's ratio in tendon is affected by the strain applied and interfibrillar-linker properties, and together these features predict tendon volume shrinkage under tensile loading. During loading, the interfibrillar-linkers pulled fibrils toward each other and squeezed the matrix, leading to the Poisson's ratio larger than 0.5 and fluid expulsion. In addition, the rotation of the interfibrillar-linkers with respect to the fibrils at large strains caused a reduction in the volume shrinkage and eventual nonlinear decay in Poisson's ratio at large strains. Our model also predicts a fluid flow that has a radial pattern toward the surrounding medium, with the larger fluid velocities in proportion to the interfibrillar sliding."
