time,journal,doi_info,authors,key words,title,abstract
2018 Jul 18,Scientific reports,Sci Rep. 2018 Jul 18;8(1):10854. doi: 10.1038/s41598-018-29060-y.,"['Freedman, Benjamin R', 'Rodriguez, Ashley B', 'Leiphart, Ryan J', 'Newton, Joseph B', 'Ban, Ehsan', 'Sarver, Joseph J', 'Mauck, Robert L', 'Shenoy, Vivek B', 'Soslowsky, Louis J']","['animals', 'extracellular matrix  pathology', 'female', 'mice', 'mice, inbred c57bl', 'plastic surgery procedures', ' stress, mechanical', 'tendon injuries  pathology  therapy', 'tendons  physiology', ' wound healing']",Dynamic Loading and Tendon Healing Affect Multiscale Tendon Properties and ECM Stress Transmission.,"The extracellular matrix (ECM) is the primary biomechanical environment that interacts with tendon cells (tenocytes). Stresses applied via muscle contraction during skeletal movement transfer across structural hierarchies to the tenocyte nucleus in native uninjured tendons. Alterations to ECM structural and mechanical properties due to mechanical loading and tissue healing may affect this multiscale strain transfer and stress transmission through the ECM. This study explores the interface between dynamic loading and tendon healing across multiple length scales using living tendon explants. Results show that macroscale mechanical and structural properties are inferior following high magnitude dynamic loading (fatigue) in uninjured living tendon and that these effects propagate to the microscale. Although similar macroscale mechanical effects of dynamic loading are present in healing tendon compared to uninjured tendon, the microscale properties differed greatly during early healing. Regression analysis identified several variables (collagen and nuclear disorganization, cellularity, and F-actin) that directly predict nuclear deformation under loading. Finite element modeling predicted deficits in ECM stress transmission following fatigue loading and during healing. Together, this work identifies the multiscale response of tendon to dynamic loading and healing, and provides new insight into microenvironmental features that tenocytes may experience following injury and after cell delivery therapies."
2018 Jul,The American journal of sports medicine,Am J Sports Med. 2018 Jul;46(9):2222-2231. doi: 10.1177/0363546518778789. Epub ,"['Zhang, Kairui', 'Hast, Michael W', 'Izumi, Soutarou', 'Usami, Yu', 'Shetye, Snehal', 'Akabudike, Ngozi', 'Philp, Nancy J', 'Iwamoto, Masahiro', 'Nissim, Itzhak', 'Soslowsky, Louis J', 'Enomoto-Iwamoto, Motomi']","['achilles tendon  injuries', 'animals', 'biomechanical phenomena', 'collagen metabolism', 'dichloroacetic acid', 'disease models, animal', 'female', 'glucose  metabolism', 'glycolysis', 'lactates  metabolism', 'mice', 'mice, inbred c57bl', 'random allocation', 'tendon injuries  rehabilitation', 'wound healing  physiology', 'achilles tendon', 'biology', 'biomechanics', 'metabolism', 'microscopic pathology']","Modulating Glucose Metabolism and Lactate Synthesis in Injured Mouse Tendons: Treatment With Dichloroacetate, a Lactate Synthesis Inhibitor, Improves Tendon Healing.","BACKGROUND: Tendon injuries are common problems among athletes. Complete recovery of the mechanical structure and function of ruptured tendons is challenging. It has been demonstrated that upregulation of glycolysis and lactate production occurs in wounds, inflammation sites, and cancerous tumors, and these metabolic changes also control growth and differentiation of stem and progenitor cells. Similar metabolic changes have been reported in human healing tendons. In addition, lactate production has increased in progenitors isolated from injured tendons after treatment with IL-1β. It is thought that the metabolic changes play a role in tendon healing after injury. HYPOTHESIS: Glucose metabolism is altered during tendon injury and healing, and modulation of this altered metabolism improves tendon repair. STUDY DESIGN: Controlled laboratory study. METHODS: The authors used the tendon injury model involving a complete incision of the Achilles tendon in C57BL/6J female mice and studied alterations of glucose metabolism in injured tendons with [U-(13)C]glucose and metabolomics analysis 1 and 4 weeks after surgery. They also examined the effects of dichloroacetate (DCA; an indirect lactate synthesis inhibitor) treatment on the recovery of structure and mechanical properties of injured tendons 4 weeks after surgery in the same mouse model. RESULTS: Significant changes in glucose metabolism in tendons after injury surgery were detected. (13)C enrichment of metabolites and intermediates, flux through glycolysis, and lactate synthesis, as well as tricarboxylic acid cycle activity, were acutely increased 1 week after injury. Increased glycolysis and lactate generation were also found 4 weeks after injury. DCA-treated injured tendons showed decreased cross-sectional area and higher values of modulus, maximum stress, and maximum force when compared with vehicle-treated injured tendons. Improved alignment of the collagen fibers was also observed in the DCA group. Furthermore, DCA treatment reduced mucoid accumulation and ectopic calcification in injured tendons. CONCLUSION: The findings indicate that injured tendons acutely increase glycolysis and lactate synthesis after injury and that the inhibition of lactate synthesis by DCA is beneficial for tendon healing. CLINICAL RELEVANCE: Changing metabolism in injured tendons may be a therapeutic target for tendon repair."
2018 Feb,"Journal of the Royal Society, Interface",J R Soc Interface. 2018 Feb;15(139):20170880. doi: 10.1098/rsif.2017.0880.,"['Freedman, Benjamin R', 'Rodriguez, Ashley B', 'Hillin, Cody D', 'Weiss, Stephanie N', 'Han, Biao', 'Han, Lin', 'Soslowsky, Louis J']","['animals', ' extracellular matrix metabolism pathology', 'female', 'mice', ' models, biological', ' regeneration', ' stress, mechanical', ' tendon injuries metabolism pathology physiopathology therapy', 'tendons pathology  physiology', 'collagen', 'extracellular matrix', 'function', 'ligament', 'mechanics']","Tendon healing affects the multiscale mechanical, structural and compositional response of tendon to quasi-static tensile loading.","Tendon experiences a variety of multiscale changes to its extracellular matrix during mechanical loading at the fascicle, fibre and fibril levels. For example, tensile loading of tendon increases its stiffness, with organization of collagen fibres, and increases cell strain in the direction of loading. Although applied macroscale strains correlate to cell and nuclear strains in uninjured tendon, the multiscale response during tendon healing remains unknown and may affect cell mechanosensing and response. Therefore, this study evaluated multiscale structure-function mechanisms in response to quasi-static tensile loading in uninjured and healing tendons. We found that tendon healing affected the macroscale mechanical and structural response to mechanical loading, evidenced by decreases in strain stiffening and collagen fibre realignment. At the micro- and nanoscales, healing resulted in increased collagen fibre disorganization, nuclear disorganization, decreased change in nuclear aspect ratio with loading, and decreased indentation modulus compared to uninjured tendons. Taken together, this work supports a new concept of nuclear strain transfer attenuation during tendon healing and identifies several multiscale properties that may contribute. Our work also provides benchmarks for the biomechanical microenvironments that tendon cells may experience following cell delivery therapies."
2018,PloS one,PLoS One. 2018 Jan 18;13(1):e0191524. doi: 10.1371/journal.pone.0191524. ,"['Sierra, Luz-Jeannette', 'Brown, Amy G', 'Barilá, Guillermo O', 'Anton, Lauren', 'Barnum, Carrie E', 'Shetye, Snehal S', 'Soslowsky, Louis J', 'Elovitz, Michal A']","['animals', 'biomechanical phenomena', 'cervix uteri  microbiology pathology', 'cytokines metabolism', 'enzyme-linked immunosorbent assay', 'female', 'gardnerella vaginalis genetics growth & development  isolation & purification', 'inflammation  microbiology', 'mice', 'pregnancy', 'real-time polymerase chain reaction', 'vagina  microbiology', 'vaginosis, bacterial microbiology']",Colonization of the cervicovaginal space with Gardnerella vaginalis leads to local inflammation and cervical remodeling in pregnant mice.,"The role of the cervicovaginal (CV) microbiome in regulating cervical function during pregnancy is poorly understood. Gardnerella vaginalis (G. vaginalis) is the most common bacteria associated with the diagnosis of bacterial vaginosis (BV). While BV has been associated with preterm birth (PTB), clinical trials targeting BV do not decrease PTB rates. It remains unknown if G. vaginalis is capable of triggering molecular, biomechanical and cellular events that could lead to PTB. The objective of this study was to determine if cervicovaginal colonization with G. vaginalis, in pregnant mice, induced cervical remodeling and modified cervical function. CD-1 timed-pregnant mice received a 5X108 CFU/mL intravaginal inoculation of G. vaginalis or control on embryonic day 12 (E12) and E13. On E15, the mice were sacrificed and cervicovaginal fluid (CVF), amniotic fluid (AF), cervix, uterus, placentas and fetal membranes (FM) were collected. Genomic DNA was isolated from the CVF, placenta, uterus and FM and QPCR was performed to confirm colonization. IL-6 was measured in the CVF and AF and soluble e-cadherin (seCAD) was assessed in the CVF by ELISA. RNA was extracted from the cervices to evaluate IL-10, IL-8, IL-1β, TNF-α, Tff-1, SPINK-5, HAS-1 and LOX expression via QPCR. Mucicarmine and trichrome staining was used to assess cervical mucin and collagen. Biomechanical properties of the cervix were studied using quasi-static tensile load-to-failure biomechanical tests. G. vaginalis successfully colonized the CV space. This colonization induced immune responses (increased IL-6 levels in CVF and AF, increased mRNA expression of cervical cytokines), altered the epithelial barrier (increased seCAD in the CVF), induced cervical remodeling (increased mucin production, altered collagen) and altered cervical biomechanical properties (a decrease in biomechanical modulus and an increase in maximum strain). The ability of G. vaginalis to induce these molecular, immune, cellular and biomechanical changes suggests that this bacterium may play a pathogenic role in premature cervical remodeling leading to PTB."
2018 Mar,Journal of shoulder and elbow surgery,J Shoulder Elbow Surg. 2018 Mar;27(3):553-560. doi: 10.1016/j.jse.2017.09.024. ,"['Huegel, Julianne', 'Choi, Daniel S', 'Nuss, Courtney A', 'Minnig, Mary C C', 'Tucker, Jennica J', 'Kuntz, Andrew F', 'Waldorff, Erik I', 'Zhang, Nianli', 'Ryaby, James T', 'Soslowsky, Louis J']","['animals', 'disease models, animal', 'magnetic field therapy  methods', 'male', 'rats', 'rats, sprague-dawley', 'plastic surgery procedures', 'rotator cuff surgery', 'rotator cuff injuries  therapy', 'tendons surgery', ' wound healing', 'pemf', 'animal model', 'rat', 'rotator cuff', 'supraspinatus repair', 'tendon healing']",Effects of pulsed electromagnetic field therapy at different frequencies and durations on rotator cuff tendon-to-bone healing in a rat model.,"BACKGROUND: Rotator cuff tears affect millions of individuals each year, often requiring surgical intervention. However, repair failure remains common. We have previously shown that pulsed electromagnetic field (PEMF) therapy improved tendon-to-bone healing in a rat rotator cuff model. The purpose of this study was to determine the influence of both PEMF frequency and exposure time on rotator cuff healing. METHODS: Two hundred ten Sprague-Dawley rats underwent acute bilateral supraspinatus injury and repair followed by either Physio-Stim PEMF or high-frequency PEMF therapy for 1, 3, or 6 hours daily. Control animals did not receive PEMF therapy. Mechanical and histologic properties were assessed at 4, 8, and 16 weeks. RESULTS: Improvements in different mechanical properties at various endpoints were identified for all treatment modalities when compared with untreated animals, regardless of PEMF frequency or duration. Of note, 1 hour of Physio-Stim treatment showed significant improvements in tendon mechanical properties across all time points, including increases in both modulus and stiffness as early as 4 weeks. Collagen organization improved for several of the treatment groups compared with controls. In addition, improvements in type I collagen and fibronectin expression were identified with PEMF treatment. An important finding was that no adverse effects were identified in any mechanical or histologic property. CONCLUSIONS: Overall, our results suggest that PEMF therapy has a positive effect on rat rotator cuff healing for each electromagnetic fundamental pulse frequency and treatment duration tested in this study."
2018 Apr,Journal of orthopaedic research : official publication of the Orthopaedic ,J Orthop Res. 2018 Apr;36(4):1069-1077. doi: 10.1002/jor.23810. Epub 2018 Jan 5.,"['Patel, Sahishnu', 'Caldwell, Jon-Michael', 'Doty, Stephen B', 'Levine, William N', 'Rodeo, Scott', 'Soslowsky, Louis J', 'Thomopoulos, Stavros', 'Lu, Helen H']","['animals', ' composite tissue allografts', 'enthesopathy  therapy', 'humans', 'ligaments physiology', 'tendons physiology', ' tissue engineering', ' tissue scaffolds', ' wound healing', 'biomaterials', 'hard-to-soft-tissue repair', 'igament', 'tendon', 'tissue engineering']",Integrating soft and hard tissues via interface tissue engineering.,"The enthesis, or interface between bone and soft tissues such as ligament and tendon, is prone to injury and often does not heal, even post surgical intervention. Interface tissue engineering represents an integrative strategy for regenerating the native enthesis by functionally connecting soft and hard tissues and thereby improving clinical outcome. This review focuses on integrative and cell-instructive scaffold designs that target the healing of the two most commonly injured soft tissue-bone junctions: tendon-bone interface (e.g., rotator cuff) and ligament-bone interface (e.g., anterior cruciate ligament). The inherent connectivity between soft and hard tissues is instrumental for musculoskeletal motion and is therefore a key design criterion for soft tissue regeneration. To this end, scaffold design for soft tissue regeneration have progressed from single tissue systems to the emerging focus on pre-integrated and functional composite tissue units. Specifically, a multifaceted, bioinspired approach has been pursued wherein scaffolds are tailored to stimulate relevant cell responses using spatially patterned structural and chemical cues, growth factors, and/or mechanical stimulation. Moreover, current efforts to elucidate the essential scaffold design criteria via strategic biomimicry are emphasized as these will reduce complexity in composite tissue regeneration and ease the related burden for clinical translation. These innovative studies underscore the clinical relevance of engineering connective tissue integration and have broader impact in the formation of complex tissues and total joint regeneration. © 2017 Orthopaedic Research Society. Published by Wiley Periodicals, Inc. J Orthop Res 36:1069-1077, 2018."
2017 Oct 3,Journal of biomechanics,J Biomech. 2017 Oct 3;63:151-157. doi: 10.1016/j.jbiomech.2017.08.021. Epub 2017 ,"['Beach, Zakary M', 'Tucker, Jennica J', 'Thomas, Stephen J', 'Reuther, Katherine E', 'Gray, Chancellor F', 'Lee, Chang-Soo', 'Glaser, David L', 'Soslowsky, Louis J']","['animals', 'biomechanical phenomena', 'cartilage, articular  pathology physiopathology', 'male', 'muscle, skeletal physiopathology', 'rats', 'rats, sprague-dawley', 'rotator cuff physiopathology', 'rotator cuff injuries  physiopathology', 'scapula physiopathology', 'shoulder joint pathology physiopathology', 'tendons physiopathology  surgery', 'tenotomy', 'animal model', 'overuse injury', 'rotator cuff']",Biceps tenotomy in the presence of a supraspinatus tear alters the adjacent intact tendons and glenoid cartilage.,"A rotator cuff tear is a common injury in athletes and workers who repeatedly perform overhead movements, and it is not uncommon for this demographic to return to activity shortly after treatment. A biceps tenotomy is often performed in the presence of a rotator cuff tear to help reduce pain and improve joint function. However, the effect of this procedure on the surrounding tissues in the glenohumeral joint is unknown. Therefore, the purpose of this study was to investigate the effect of a biceps tenotomy in the presence of a supraspinatus rotator cuff tear followed by overuse activity on ambulatory function and mechanical and histologic properties of the remaining rotator cuff tendons and glenoid cartilage. 46 rats underwent 4weeks of overuse activity to create a tendinopathic condition, then were randomized into two groups: unilateral detachment of the supraspinatus tendon or detachment of the supraspinatus and long head of the biceps tendons. Ambulatory measurements were performed throughout the 8weeks prior to euthanasia, followed by analysis of the properties of the remaining intact tendons and glenoid cartilage. Results demonstrate that shoulder function was not effected in the biceps tenotomy group. However, the intact tendons and glenoid cartilage showed altered mechanical and histologic properties. This study provides evidence from an animal model that does not support the use of tenotomy in the presence of a supraspinatus tendon rotator cuff tear, and provides a framework for physicians to better prescribe long-term treatment strategies for patients."
2017 Dec,Matrix biology : journal of the International Society for Matrix Biology,Matrix Biol. 2017 Dec;64:81-93. doi: 10.1016/j.matbio.2017.08.004. Epub 2017 Sep ,"['Robinson, Kelsey A', 'Sun, Mei', 'Barnum, Carrie E', 'Weiss, Stephanie N', 'Huegel, Julianne', 'Shetye, Snehal S', 'Lin, Linda', 'Saez, Daniel', 'Adams, Sheila M', 'Iozzo, Renato V', 'Soslowsky, Louis J', 'Birk, David E']","['animals', 'biglycan  genetics metabolism', 'biomechanical phenomena', 'collagen  chemistry', 'decorin  genetics metabolism', 'gene knockout techniques', 'homeostasis', 'mice', 'patellar ligament  physiopathology', 'biglycan', 'collagen fibril', 'conditional knockout mice', 'decorin', 'fiber realignment', 'mechanical properties', 'structure', 'tendon']","Decorin and biglycan are necessary for maintaining collagen fibril structure, fiber realignment, and mechanical properties of mature tendons.","The small leucine-rich proteoglycans (SLRPs), decorin and biglycan, are key regulators of collagen fibril and matrix assembly. The goal of this work was to elucidate the roles of decorin and biglycan in tendon homeostasis. Our central hypothesis is that decorin and biglycan expression in the mature tendon would be critical for the maintenance of the structural and mechanical properties of healthy tendons. Defining the function(s) of these SLRPs in tendon homeostasis requires that effects in the mature tendon be isolated from their influence on development. Thus, we generated an inducible knockout mouse model that permits genetic ablation of decorin and biglycan expression in the mature tendon, while maintaining normal expression during development. Decorin and biglycan expression were knocked out in the mature patellar tendon with the subsequent turnover of endogenous SLRPs deposited prior to induction. The acute absence of SLRP expression was associated with changes in fibril structure with a general shift to larger diameter fibrils in the compound knockout tendons, together with fibril diameter heterogeneity. In addition, tendon mechanical properties were altered. Compared to wild-type controls, acute ablation of both genes resulted in failure of the tendon at lower loads, decreased stiffness, a trend towards decreased dynamic modulus, as well as a significant increase in percent relaxation and tissue viscosity. Collagen fiber realignment was also increased with a delayed and slower in response to load in the absence of expression. These structural and functional changes in response to an acute loss of decorin and biglycan expression in the mature tendon demonstrate a significant role for these SLRPs in adult tendon homeostasis."
2017 Oct 1,"Journal of applied physiology (Bethesda, Md. : 1985)",J Appl Physiol (1985). 2017 Oct 1;123(4):757-763. doi: ,"['Rooney, Sarah Ilkhanipour', 'Torino, Daniel J', 'Baskin, Rachel', 'Vafa, Rameen P', 'Kuntz, Andrew F', 'Soslowsky, Louis J']","['adaptation, physiological', 'animals', 'male', 'matrix metalloproteinases  metabolism', ' physical conditioning, animal', 'rats', 'rats, sprague-dawley', 'rotator cuff  physiology', 'tendons  physiology', 'exercise', 'matrix metalloproteinases', 'mechanics', 'rotator cuff', 'tendon']",Rat supraspinatus tendon responds acutely and chronically to exercise.,"The objective of this study was to identify acute responses and chronic adaptations of supraspinatus tendon to noninjurious exercise. We hypothesized that chronic exercise (EX) increases tendon mechanical properties, and a single exercise bout increases matrix metalloproteinase (MMP) activity acutely. Rats were divided into acute or chronic EX or cage activity groups. Animals in acute EX groups were euthanized, 3, 12, 24, 48, or 72 h upon completion of a single bout of exercise (10 m/min, 1 h) on a flat treadmill. Animals in chronic EX groups walked on a flat treadmill for 3 days or 1, 2, or 8 wk. Tendon histology, MMP activity, and mechanics were measured. A single bout of exercise trended toward reducing tendon mechanical properties, but 2 or 8 wk of chronic EX increased tendon mechanics. Cell density was not affected. Cells became rounder with chronic EX. All tendons were highly organized. MMP activity decreased after a single bout of exercise and returned to baseline by 72 h. MMP activity decreased after 8 wk of chronic EX. Decreased MMP activity may indicate an anabolic instead of catabolic response in contrast to injury. Results suggest that mild, acute decreases in MMP activity and tendon mechanics following a single exercise bout lead to enhanced tendon mechanical adaptations with repeated exercise bouts. This study defines acute and chronic changes of MMP activity, mechanical properties, and histology of the rat supraspinatus tendon in response to beneficial exercise and proposes a mechanism by which acute responses translate to chronic adaptations.NEW & NOTEWORTHY The line between beneficial exercise and overuse has not been elucidated. This study defines the acute and chronic temporal response to exercise of supraspinatus tendon in an in vivo model. We found that decreased matrix metalloproteinase activity and tendon mechanics after a single bout of exercise are followed by beneficial chronic adaptations of the tendon with repeated bouts. How the acute responses to exercise lead to chronic adaptations may distinguish beneficial exercise from overuse."
2017 Oct,Annals of biomedical engineering,Ann Biomed Eng. 2017 Oct;45(10):2348-2359. doi: 10.1007/s10439-017-1876-7. Epub ,"['Riggin, Corinne N', 'Qu, Feini', 'Kim, Dong Hwa', 'Huegel, Julianne', 'Steinberg, David R', 'Kuntz, Andrew F', 'Soslowsky, Louis J', 'Mauck, Robert L', 'Bernstein, Joseph']","['animals', 'drug implants', 'ibuprofen chemistry pharmacokinetics pharmacology', ' lactic acid chemistry pharmacokinetics pharmacology', ' nanofibers chemistry therapeutic use', ' polyglycolic acid chemistry pharmacokinetics pharmacology', 'polylactic acid-polyglycolic acid copolymer', 'rats', 'rats, sprague-dawley', 'nsaid', 'polymer scaffold', 'tendon healing']",Electrospun PLGA Nanofiber Scaffolds Release Ibuprofen Faster and Degrade Slower After In Vivo Implantation.,"While delayed delivery of non-steroidal anti-inflammatory drugs (NSAIDs) has been associated with improved tendon healing, early delivery has been associated with impaired healing. Therefore, NSAID use is appropriate only if the dose, timing, and mode of delivery relieves pain but does not impede tissue repair. Because delivery parameters can be controlled using drug-eluting nanofibrous scaffolds, our objective was to develop a scaffold for local controlled release of ibuprofen (IBP), and characterize the release profile and degradation both in vitro and in vivo. We found that when incubated in vitro in saline, scaffolds containing IBP had a linear release profile. However, when implanted subcutaneously in vivo or when incubated in vitro in serum, scaffolds showed a rapid burst release. These data demonstrate that scaffold properties are dependent on the environment in which they are placed and the importance of using serum, rather than saline, for initial in vitro evaluation of biofactor release from biodegradable scaffolds."
