time,journal,doi_info,authors,key words,title,abstract
2021 Sep 20,Biosensors,Biosensors (Basel). 2021 Sep 20;11(9):348. doi: 10.3390/bios11090348.,"['Tan, Chao', 'Kushwah, Neetu', 'Cui, Xinyan Tracy']","['animals', 'bridged bicyclo compounds, heterocyclic', 'coated materials, biocompatible', ' drug delivery systems', 'electric impedance', 'electrodes, implanted', 'endothelial cells', ' microelectrodes', 'nanoparticles', 'neurons', 'platinum', 'polymers', 'biosensing', 'cell culture', 'drug delivery', 'fluorescence imaging']",Electrically Controlled Neurochemical Delivery from Microelectrodes for Focal and Transient Modulation of Cellular Behavior.,"Electrically controlled drug delivery of neurochemicals and biomolecules from conducting polymer microelectrode coatings hold great potentials in dissecting neural circuit or treating neurological disorders with high spatial and temporal resolution. The direct doping of a drug into a conducting polymer often results in low loading capacity, and the type of molecule that can be released is limited. Poly(3,4-ethylenedioxythiophene) (PEDOT) doped with sulfonated silica nanoparticles (SNP) has been developed as a more versatile platform for drug delivery. In this work, we demonstrate that neurochemicals with different surface charge, e.g., glutamate (GLU), gamma-Aminobutyric acid (GABA), dopamine (DA), 6,7-Dinitroquinoxaline- 2,3-dione (DNQX) and bicuculline, can be, respectively, incorporated into the SNP and electrically triggered to release repeatedly. The drug loaded SNPs were incorporated in PEDOT via electrochemical deposition on platinum microelectrodes. After PEDOT/SNP(drug) coating, the charge storage capacity (CSC) increased 10-fold to 55 ± 3 mC/cm(2), and the impedance at 1 kHz was also reduced approximately 6-fold. With the aid of a porous SNP, the loading capacity and number of releases of GLU was increased >4-fold and 66-fold, respectively, in comparison to the direct doping of PEDOT with GLU (PEDOT/GLU). The focal release of GLU and GABA from a PEDOT/SNP (drug) coated microelectrode were tested in cultured neurons using Ca imaging. The change in fluo-4 fluorescence intensity after electrically triggered GLU (+6.7 ± 2.9%) or GABA (-6.8 ± 1.6%) release indicated the successful modulation of neural activities by neurotransmitter release. In addition to activating neural activities, glutamate can also act on endothelial cells to stimulate nitric oxide (NO) release. A dual functional device with two adjacent sensing and releasing electrodes was constructed and we tested this mechanism in endothelial cell cultures. In endothelial cells, approximately 7.6 ± 0.6 nM NO was detected in the vicinity of the NO sensor within 6.2 ± 0.5 s of GLU release. The rise time of NO signal, T(0-100), was 14.5 ± 2.2 s. In summary, our work has demonstrated (1) a platform that is capable of loading and releasing drugs with different charges; (2) proof of concept demonstrations of how focal release of drugs can be used as a pharmacological manipulation to study neural circuitry or NO's effect on endothelial cells."
2021 Sep,Biomaterials,Biomaterials. 2021 Sep;276:121060. doi: 10.1016/j.biomaterials.2021.121060. Epub ,"['Yang, Qianru', 'Vazquez, Alberto L', 'Cui, Xinyan Tracy']","['animals', 'brain', 'inflammation diagnostic imaging', 'mice', ' microglia', 'photons', ' wakefulness', 'blood brain barrier', 'brain inflammation', 'microglia', 'microprism', 'two-photon imaging']",Long-term in vivo two-photon imaging of the neuroinflammatory response to intracortical implants and micro-vessel disruptions in awake mice.,"Our understanding of biomaterials in the brain have been greatly enhanced by advancements in in vivo imaging technologies such as two-photon microscopy. However, when applied to chronic studies, two-photon microscopy enables high-resolution imaging only in superficial regions due to inflammatory responses introduced by the craniotomy and insertion of foreign biomaterials. Microprisms provide a unique vertical view from brain surface to ~1 mm deep or more (depending on the size of the microprisms) which may break through this limitation on imaging depth. Although microprism has been used in the field of neuroscience, the in vivo foreign body responses to the microprism implant have yet to be fully elucidated. This is of important concern in broader applications of this approach, especially for neuroinflammation-sensitive studies. In this work, we first assessed the activation of microglia/macrophages for 16 weeks after microprism implantation using two-photon microscopy in awake CX3CR1-GFP mice. The imaging window became clear from bleedings after ~2 weeks and the maximum imaging distance (in the horizontal direction) stabilized at around 500 μm after ~5 weeks. We also quantified the microglial morphology from week 3 to week 16 post-implantation. Compared to non-implant controls, microglia near the microprism showed higher cell density, smaller soma, and shorter and less branched processes in the early-chronic phase. After week 5, microglial morphology further than 100 μm from the microprism was generally similar to microglia in the control group. In addition, time-lapse imaging confirmed that microglial processes were surveying normally from week 3, even for microglia as close as 50 μm away. These morphological analyses and dynamic imaging results suggest that microglia around chronically implanted microprism eventually exhibit inactive phenotypes. Next, we examined microglial/macrophage responses following laser induced micro-vessel disruptions as an example application of microprism implantation for neuroinflammation related studies. Through the microprism, we captured microglial/macrophage polarization and migration, as well as blood flow changes after the insult for additional 16 weeks. To our surprise, microglia/macrophage aggregation around the insult site was sustained over the 16-week observation period. This work demonstrates the feasibility of using microprisms for long-term characterizations of inflammatory responses to other injuries including implantable devices at deeper depths than that achievable by conventional two-photon microscopy."
2021 Aug,Advanced healthcare materials,Adv Healthc Mater. 2021 Aug;10(16):e2002150. doi: 10.1002/adhm.202002150. Epub ,"['Woeppel, Kevin M', 'Cui, Xinyan Tracy']","['electrodes, implanted', 'humans', 'microelectrodes', ' nanoparticles', ' neural cell adhesion molecule l1', 'neurons', 'bioactive coatings', 'electrophysiology', 'nanoparticles', 'neural electrodes', 'surface modification']",Nanoparticle and Biomolecule Surface Modification Synergistically Increases Neural Electrode Recording Yield and Minimizes Inflammatory Host Response.,"Due to their ability to interface with neural tissues, neural electrodes are the key tool used for neurophysiological studies, electrochemical detection, brain computer interfacing, and countless neuromodulation therapies and diagnostic procedures. However, the long-term applications of neural electrodes are limited by the inflammatory host tissue response, decreasing detectable electrical signals, and insulating the device from the native environment. Surface modification methods are proposed to limit these detrimental responses but each has their own limitations. Here, a combinatorial approach is presented toward creating a stable interface between the electrode and host tissues. First, a thiolated nanoparticle (TNP) coating is utilized to increase the surface area and roughness. Next, the neural adhesion molecule L1 is immobilized to the nanoparticle modified substrate. In vitro, the combined nanotopographical and bioactive modifications (TNP+L1) elevate the bioactivity of L1, which is maintained for 28 d. In vivo, TNP+L1 modification improves the recording performance of the neural electrode arrays compared to TNP or L1 modification alone. Postmortem histology reveals greater neural cell density around the TNP+L1 coating while eliminating any inflammatory microglial encapsulation after 4 weeks. These results demonstrate that nanotopographical and bioactive modifications synergistically produce a seamless neural tissue interface for chronic neural implants."
2021 Nov 1,Biosensors & bioelectronics,Biosens Bioelectron. 2021 Nov 1;191:113440. doi: 10.1016/j.bios.2021.113440. Epub ,"['Castagnola, Elisa', 'Garg, Raghav', 'Rastogi, Sahil K', 'Cohen-Karni, Tzahi', 'Cui, Xinyan Tracy']","[' biosensing techniques', 'dopamine', 'electrochemical techniques', ' graphite', 'humans', 'microelectrodes', '3d graphene', 'dopamine', 'electrochemical sensing', 'fast scan cyclic voltammetry', 'microelectrode arrays (meas)']",3D fuzzy graphene microelectrode array for dopamine sensing at sub-cellular spatial resolution.,"The development of a high sensitivity real-time sensor for multi-site detection of dopamine (DA) with high spatial and temporal resolution is of fundamental importance to study the complex spatial and temporal pattern of DA dynamics in the brain, thus improving the understanding and treatments of neurological and neuropsychiatric disorders. In response to this need, here we present high surface area out-of-plane grown three-dimensional (3D) fuzzy graphene (3DFG) microelectrode arrays (MEAs) for highly selective, sensitive, and stable DA electrochemical sensing. 3DFG microelectrodes present a remarkable sensitivity to DA (2.12 ± 0.05 nA/nM, with LOD of 364.44 ± 8.65 pM), the highest reported for nanocarbon MEAs using Fast Scan Cyclic Voltammetry (FSCV). The high surface area of 3DFG allows for miniaturization of electrode down to 2 × 2 μm(2), without compromising the electrochemical performance. Moreover, 3DFG MEAs are electrochemically stable under 7.2 million scans of continuous FSCV cycling, present exceptional selectivity over the most common interferents in vitro with minimum fouling by electrochemical byproducts and can discriminate DA and serotonin (5-HT) in response to the injection of their 50:50 mixture. These results highlight the potential of 3DFG MEAs as a promising platform for FSCV based multi-site detection of DA with high sensitivity, selectivity, and spatial resolution."
2021 Jun,Advanced healthcare materials,Adv Healthc Mater. 2021 Jun;10(12):e2100119. doi: 10.1002/adhm.202100119. Epub ,"['Zheng, Xin Sally', 'Tan, Chao', 'Castagnola, Elisa', 'Cui, Xinyan Tracy']","['electric stimulation', 'electrodes, implanted', ' microelectrodes', 'carbon materials', 'chronic neural stimulation', 'conducting polymers', 'metals']",Electrode Materials for Chronic Electrical Microstimulation.,"Electrical microstimulation has enabled partial restoration of vision, hearing, movement, somatosensation, as well as improving organ functions by electrically modulating neural activities. However, chronic microstimulation is faced with numerous challenges. The implantation of an electrode array into the neural tissue triggers an inflammatory response, which can be exacerbated by the delivery of electrical currents. Meanwhile, prolonged stimulation may lead to electrode material degradation., which can be accelerated by the hostile inflammatory environment. Both material degradation and adverse tissue reactions can compromise stimulation performance over time. For stable chronic electrical stimulation, an ideal microelectrode must present 1) high charge injection limit, to efficiently deliver charge without exceeding safety limits for both tissue and electrodes, 2) small size, to gain high spatial selectivity, 3) excellent biocompatibility that ensures tissue health immediately next to the device, and 4) stable in vivo electrochemical properties over the application period. In this review, the challenges in chronic microstimulation are described in detail. To aid material scientists interested in neural stimulation research, the in vitro and in vivo testing methods are introduced for assessing stimulation functionality and longevity and a detailed overview of recent advances in electrode material research and device fabrication for improving chronic microstimulation performance is provided."
2021 Feb 18,Micromachines,Micromachines (Basel). 2021 Feb 18;12(2):208. doi: 10.3390/mi12020208.,"['Tan, Chao', 'Robbins, Elaine M', 'Wu, Bingchen', 'Cui, Xinyan Tracy']","['analytical neurochemistry', 'biosensors', 'brain', 'in vivo', 'neurochemical sensor', 'neurotransmitters']",Recent Advances in In Vivo Neurochemical Monitoring.,"The brain is a complex network that accounts for only 5% of human mass but consumes 20% of our energy. Uncovering the mysteries of the brain's functions in motion, memory, learning, behavior, and mental health remains a hot but challenging topic. Neurochemicals in the brain, such as neurotransmitters, neuromodulators, gliotransmitters, hormones, and metabolism substrates and products, play vital roles in mediating and modulating normal brain function, and their abnormal release or imbalanced concentrations can cause various diseases, such as epilepsy, Alzheimer's disease, and Parkinson's disease. A wide range of techniques have been used to probe the concentrations of neurochemicals under normal, stimulated, diseased, and drug-induced conditions in order to understand the neurochemistry of drug mechanisms and develop diagnostic tools or therapies. Recent advancements in detection methods, device fabrication, and new materials have resulted in the development of neurochemical sensors with improved performance. However, direct in vivo measurements require a robust sensor that is highly sensitive and selective with minimal fouling and reduced inflammatory foreign body responses. Here, we review recent advances in neurochemical sensor development for in vivo studies, with a focus on electrochemical and optical probes. Other alternative methods are also compared. We discuss in detail the in vivo challenges for these methods and provide an outlook for future directions."
2020,Frontiers in bioengineering and biotechnology,Front Bioeng Biotechnol. 2020 Nov 24;8:602216. doi: 10.3389/fbioe.2020.602216. ,"['Castagnola, Elisa', 'Robbins, Elaine M', 'Woeppel, Kevin M', 'McGuier, Moriah', 'Golabchi, Asiyeh', 'Taylor, I Mitch', 'Michael, Adrian C', 'Cui, Xinyan Tracy']","['brain', 'carbon fiber microelectrodes', 'electrochemical impedance spectroscopy', 'fast scan cyclic voltammetry', 'fouling', 'melatonin']",Real-Time Fast Scan Cyclic Voltammetry Detection and Quantification of Exogenously Administered Melatonin in Mice Brain.,"Melatonin (MT) has been recently considered an excellent candidate for the treatment of sleep disorders, neural injuries, and neurological diseases. To better investigate the actions of MT in various brain functions, real-time detection of MT concentrations in specific brain regions is much desired. Previously, we have demonstrated detection of exogenously administered MT in anesthetized mouse brain using square wave voltammetry (SWV). Here, for the first time, we show successful detection of exogenous MT in the brain using fast scan cyclic voltammetry (FSCV) on electrochemically pre-activated carbon fiber microelectrodes (CFEs). In vitro evaluation showed the highest sensitivity (28.1 nA/μM) and lowest detection limit (20.2 ± 4.8 nM) ever reported for MT detection at carbon surface. Additionally, an extensive CFE stability and fouling assessment demonstrated that a prolonged CFE pre-conditioning stabilizes the background, in vitro and in vivo, and provides consistent CFE sensitivity over time even in the presence of a high MT concentration. Finally, the stable in vivo background, with minimized CFE fouling, allows us to achieve a drift-free FSCV detection of exogenous administered MT in mouse brain over a period of 3 min, which is significantly longer than the duration limit (usually < 90 s) for traditional in vivo FSCV acquisition. The MT concentration and dynamics measured by FSCV are in good agreement with SWV, while microdialysis further validated the concentration range. These results demonstrated reliable MT detection using FSCV that has the potential to monitor MT in the brain over long periods of time."
2019 Dec,Biomaterials,Biomaterials. 2019 Dec;225:119519. doi: 10.1016/j.biomaterials.2019.119519. Epub ,"['Golabchi, Asiyeh', 'Wu, Bingchen', 'Cao, Bin', 'Bettinger, Christopher J', 'Cui, Xinyan Tracy']","['adsorption', 'animals', 'cell adhesion drug effects', 'coated materials, biocompatible  pharmacology', 'indoles  pharmacology', 'inflammation  pathology', 'male', 'methacrylates chemistry', 'mice, inbred c57bl', ' neural prostheses', 'polymers  pharmacology', 'surface properties', 'biocompatibility', 'catechol', 'gliosis', 'inflammatory tissue responses', 'neural implants', 'poly sulfobetaine methacrylate', 'polydopamine', 'protein adsorption', 'zwitterionic coating']",Zwitterionic polymer/polydopamine coating reduce acute inflammatory tissue responses to neural implants.,"The inflammatory brain tissue response to implanted neural electrode devices has hindered the longevity of these implants. Zwitterionic polymers have a potent anti-fouling effect that decreases the foreign body response to subcutaneous implants. In this study, we developed a nanoscale anti-fouling coating composed of zwitterionic poly (sulfobetaine methacrylate) (PSB) and polydopamine (PDA) for neural probes. The addition of PDA improved the stability of the coating compared to PSB alone, without compromising the anti-fouling properties of the film. PDA-PSB coating reduced protein adsorption by 89% compared to bare Si samples, while fibroblast adhesion was reduced by 86%. PDA-PSB coated silicon based neural probes were implanted into mouse brain, and the inflammatory tissue responses to the implants were assessed by immunohistochemistry one week after implantation. The PSB-PDA coated implants showed a significantly decreased expression of glial fibrillary acidic protein (GFAP), a marker for reactive astrocytes, within 70 μm from the electrode-tissue interface (p < 0.05). Additionally, the coating reduced the microglia activation as shown in decreased Iba-1 and lectin staining, and improved blood-brain barrier integrity indicated by reduced immunoglobulin (IgG) leakage into the tissue around the probes. These findings demonstrate that anti-fouling zwitterionic coating is effective in suppressing the acute inflammatory brain tissue response to implants, and should be further investigated for its potential to improve chronic performance of neural implants."
2019 Nov,Advanced healthcare materials,Adv Healthc Mater. 2019 Nov;8(21):e1900622. doi: 10.1002/adhm.201900622. Epub ,"['Woeppel, Kevin M', 'Zheng, Xin Sally', 'Schulte, Zachary M', 'Rosi, Nathaniel L', 'Cui, Xinyan Tracy']","['bridged bicyclo compounds, heterocyclic  chemistry', 'drug delivery systems methods', 'microelectrodes', 'nanoparticles  chemistry', 'polymers  chemistry', 'conducting polymers', 'dopants', 'drug delivery systems', 'electrodes', 'nanoparticles']",Nanoparticle Doped PEDOT for Enhanced Electrode Coatings and Drug Delivery.,"In order to address material limitations of biologically interfacing electrodes, modified silica nanoparticles are utilized as dopants for conducting polymers. Silica precursors are selected to form a thiol modified particle (TNP), following which the particles are oxidized to sulfonate modified nanoparticles (SNPs). The selective inclusion of hexadecyl trimethylammonium bromide allows for synthesis of both porous and nonporous SNPs. Nonporous nanoparticle doped polyethylenedioxythiophene (PEDOT) films possess low interfacial impedance, high charge injection (4.8 mC cm(-2) ), and improved stability under stimulation compared to PEDOT/poly(styrenesulfonate). Porous SNP dopants can serve as drug reservoirs and greatly enhance the capability of conducting polymer-based, electrically controlled drug release technology. Using the SNP dopants, drug loading and release is increased up to 16.8 times, in addition to greatly expanding the range of drug candidates to include both cationic and electroactive compounds, all while maintaining their bioactivity. Finally, the PEDOT/SNP composite is capable of precisely modulating neural activity in vivo by timed release of a glutamate receptor antagonist from coated microelectrode sites. Together, this work demonstrates the feasibility and potential of doping conducting polymers with engineered nanoparticles, creating countless options to produce composite materials for enhanced electrical stimulation, neural recording, chemical sensing, and on demand drug delivery."
2019 Oct 15,Analytical chemistry,Anal Chem. 2019 Oct 15;91(20):12917-12927. doi: 10.1021/acs.analchem.9b02904. ,"['Taylor, Ian Mitchell', 'Patel, Nikita Anurag', 'Freedman, Noah Chaim', 'Castagnola, Elisa', 'Cui, Xinyan Tracy']","['animals', 'brain  metabolism', 'bridged bicyclo compounds, heterocyclic  chemistry', 'corpus striatum  metabolism', 'dopamine  analysis', 'electrochemical techniques  methods', 'male', ' microelectrodes', ' nanotubes, carbon', 'polymers  chemistry', 'rats', 'rats, sprague-dawley']","Direct in Vivo Electrochemical Detection of Resting Dopamine Using Poly(3,4-ethylenedioxythiophene)/Carbon Nanotube Functionalized Microelectrodes.","Dopamine (DA) is a monoamine neurotransmitter responsible for the maintenance of a variety of vital life functions. In vivo DA signaling occurs over multiple time scales, from subsecond phasic release due to dopamine neuron firing to tonic release responsible for long-term DA concentration changes over minutes to hours. Due to the complex, multifaceted nature of DA signaling, analytical sensing technology must be capable of recording DA from multiple locations and over multiple time scales. Decades of research has focused on improving in vivo detection capabilities for subsecond phasic DA, but the accurate detection of absolute resting DA levels in real time has proven challenging. We have developed a poly(3,4-ethylenedioxythiophene) (PEDOT)-based nanocomposite coating that exhibits excellent DA sensing capabilities for resting DA. PEDOT/functionalized carbon nanotube (PEDOT/CNT)-coated carbon fiber microelectrodes (CFEs) are capable of directly measuring resting DA using square wave voltammetry (SWV) with high sensitivity and selectivity. Incorporation of a PEDOT/CNT coating significantly increases the sensitivity for the detection of resting DA by a factor of 422. SWV measurements performed at PEDOT/CNT-functionalized CFEs implanted in the rat dorsal striatum reveal the absolute basal DA concentration to be 82 ± 6 nM. Systemic administration of the dopamine transporter inhibitor nomifensine increases resting DA to a maximum 207 ± 16 nM at 28 ± 2 min following injection. PEDOT/CNT was also functionalized onto individual gold electrode sites along silicon microelectrode arrays (MEAs) to produce a multisite DA sensing electrode. MEA implantation allows for the quantification of basal DA from different brain regions with excellent spatial resolution. SWV detection paired with PEDOT/CNT functionalization is highly adaptable and shows great promise for tonic DA detection with high spatial and temporal resolution."
2019 Sep 9,ACS biomaterials science & engineering,ACS Biomater Sci Eng. 2019 Sep 9;5(9):4692-4699. doi: ,"['Lu, Wenjing', 'Du, Fangfang', 'Zhao, Xuewei', 'Shi, Lihong', 'Shuang, Shaomin', 'Cui, Xinyan Tracy', 'Dong, Chuan']","['egfr-overexpressing cancer cells', 'carbon dots', 'inhibiting', 'sulforaphane', 'targeted imaging']",Sulforaphane-Conjugated Carbon Dots: A Versatile Nanosystem for Targeted Imaging and Inhibition of EGFR-Overexpressing Cancer Cells.,"Because of the demand for precision medicine, the investigatation on the application of carbon-dots-based nanosystems in the field of biomedicine is attracting more and more attention. Therefore, we have built a multifunctional nanosystem based on sulforaphane-conjugated carbon dots (SFN-CDs) with thiourea skeleton and applied for EGFR-overexpressing cancer cells targeted imaging and inhibiting. The SFN-CDs are formed by grafting sulforaphane on the amino-rich yellow fluorescent carbon dots, which have excellent optical stability and can be distinguished from normal cells for targeted imaging of cancer cells. The vitro toxicity experiments demonstrated that the SFN-CDs can effectively inhibit EGFR-overexpressing cancer cell proliferation at concentrations below 100 μg mL(-1). All these results validated that SFN-CDs nanoparticles with integration of diagnostic and therapeutic functions can be used as a potential nanodurg in early stage of cancer control. Moreover, this work provides useful insight into targeted nanoparticle design in the biological nanomedicine field."
