time,journal,doi_info,authors,key words,title,abstract
2022,Frontiers in neurology,Front Neurol. 2022 Aug 29;13:937231. doi: 10.3389/fneur.2022.937231. eCollection ,"['de Aratanha, Maria Adelia', 'Balardin, Joana Bisol', 'Cardoso do Amaral, Carolina', 'Lacerda, Shirley S', 'Sowmy, Tiago Abrão Setrak', 'Huppert, Theodore J', 'Thomaz, Rodrigo Barbosa', 'Speciali, Danielli S', 'Machado, Birajara', 'Kozasa, Elisa Harumi']","['cognition', 'dual-task', 'functional neuroimaging', 'gait analysis', 'multiple sclerosis', 'near infrared spectroscopy']",The use of functional near infrared spectroscopy and gait analysis to characterize cognitive and motor processing in early-stage patients with multiple sclerosis.,"BACKGROUND: Dual-task paradigms are a known tool to evaluate possible impairments in the motor and cognitive function in patients with multiple sclerosis (MS). A technique to evaluate the cortical function during movement is functional near-infrared spectroscopy (fNIRS). The evaluation of the MS course or its treatment by associating fNIRS with gait measurements may be flexible and low-cost; however, there are no feasibility studies in the literature using these combined techniques in early-stage patients with MS. OBJECTIVE: To evaluate cortical hemodynamics using fNIRS and gait parameters in patients at early stages of MS and in healthy controls during a dual-task paradigm. METHODS: Participants performed cognitive tasks while walking to simulate daily activities. Cortical activation maps and gait variability were used to evaluate differences between 19 healthy controls and 20 patients with MS. RESULTS AND CONCLUSION: The results suggest an enhanced cortical activation in the motor planning areas already at the early stages of MS when compared to controls. We have also shown that a systematic analysis of the spatiotemporal gait variability parameters indicates differences in the patient population. The association of cortical and gait parameters may reveal possible compensatory mechanisms related to gait during dual tasking at the early stages of the disease."
2022 Jul,Neurophotonics,Neurophotonics. 2022 Jul;9(3):035003. doi: 10.1117/1.NPh.9.3.035003. Epub 2022 ,"['Lanka, Pradyumna', 'Bortfeld, Heather', 'Huppert, Theodore J']","['granger causality', 'functional connectivity', 'functional near-infrared spectroscopy', 'resting-state analysis']",Correction of global physiology in resting-state functional near-infrared spectroscopy.,"Significance: Resting-state functional connectivity (RSFC) analyses of functional near-infrared spectroscopy (fNIRS) data reveal cortical connections and networks across the brain. Motion artifacts and systemic physiology in evoked fNIRS signals present unique analytical challenges, and methods that control for systemic physiological noise have been explored. Whether these same methods require modification when applied to resting-state fNIRS (RS-fNIRS) data remains unclear. Aim: We systematically examined the sensitivity and specificity of several RSFC analysis pipelines to identify the best methods for correcting global systemic physiological signals in RS-fNIRS data. Approach: Using numerically simulated RS-fNIRS data, we compared the rates of true and false positives for several connectivity analysis pipelines. Their performance was scored using receiver operating characteristic analysis. Pipelines included partial correlation and multivariate Granger causality, with and without short-separation measurements, and a modified multivariate causality model that included a non-traditional zeroth-lag cross term. We also examined the effects of pre-whitening and robust statistical estimators on performance. Results: Consistent with previous work on bivariate correlation models, our results demonstrate that robust statistics and pre-whitening are effective methods to correct for motion artifacts and autocorrelation in the fNIRS time series. Moreover, we found that pre-filtering using principal components extracted from short-separation fNIRS channels as part of a partial correlation model was most effective in reducing spurious correlations due to shared systemic physiology when the two signals of interest fluctuated synchronously. However, when there was a temporal lag between the signals, a multivariate Granger causality test incorporating the short-separation channels was better. Since it is unknown if such a lag exists in experimental data, we propose a modified version of Granger causality that includes the non-traditional zeroth-lag term as a compromising solution. Conclusions: A combination of pre-whitening, robust statistical methods, and partial correlation in the processing pipeline to reduce autocorrelation, motion artifacts, and global physiology are suggested for obtaining statistically valid connectivity metrics with RS-fNIRS. Further studies should validate the effectiveness of these methods using human data."
2022 Sep,Cortex; a journal devoted to the study of the nervous system and behavior,Cortex. 2022 Sep;154:62-76. doi: 10.1016/j.cortex.2022.05.009. Epub 2022 May 31.,"['Zhuang, Chu', 'Meidenbauer, Kimberly L', 'Kardan, Omid', 'Stier, Andrew J', 'Choe, Kyoung Whan', 'Cardenas-Iniguez, Carlos', 'Huppert, Theodore J', 'Berman, Marc G']","['brain', ' brain mapping', 'cognition', 'humans', 'memory, short-term', ' spectroscopy, near-infrared', 'functional near-infrared spectroscopy', 'hurst exponent', 'n-back task', 'partial least squares', 'task difficulty']",Scale invariance in fNIRS as a measurement of cognitive load.,"Scale invariant neural dynamics are a relatively new but effective means of measuring changes in brain states as a result of varied cognitive load and task difficulty. This study tests whether scale invariance (as measured by the Hurst exponent, H) can be used with functional near-infrared spectroscopy (fNIRS) to quantify cognitive load, paving the way for scale-invariance to be measured in a variety of real-world settings. We analyzed H extracted from the fNIRS time series while participants completed an N-back working memory task. Consistent with what has been demonstrated in fMRI, the current results showed that scale-invariance analysis significantly differentiated between task and rest periods as calculated from both oxy- (HbO) and deoxy-hemoglobin (HbR) concentration changes. Results from both channel-averaged H and a multivariate partial least squares approach (Task PLS) demonstrated higher H during the 1-back task than the 2-back task. These results were stronger for H derived from HbR than from HbO. This suggests that scale-free brain states are a robust signature of cognitive load and not limited by the specific neuroimaging modality employed. Further, as fNIRS is relatively portable and robust to motion-related artifacts, these preliminary results shed light on the promising future of measuring cognitive load in real life settings."
2022 Jun,Human movement science,Hum Mov Sci. 2022 Jun;83:102950. doi: 10.1016/j.humov.2022.102950. Epub 2022 Apr ,"['Reed, Cody A', 'DuBois, Camryn K', 'Hutchison, Keith A', 'Huppert, Theodore J', 'Monfort, Scott M']","['adult', 'cognition', 'hemoglobins', 'humans', ' postural balance physiology', ' prefrontal cortex physiology']",Influence of serial subtraction tasks on transient characteristics of postural control.,"We sought to better understand the influence of cognitive perturbations on transient aspects of postural control. Twenty healthy, younger adults had their postural control assessed during eyes open quiet stance. Participants completed three different conditions that either had no cognitive perturbation present, an easy cognitive perturbation (i.e., serial subtraction by ones), or a more difficult cognitive perturbation (i.e., serial subtraction by sevens). All trials finished with 60 s of undisturbed eyes open quiet stance, which was the focus of the balance assessment. 95% confidence ellipse area (EA) was calculated for 5-s epochs throughout the trial. The difference in EA from the first epoch after participants started (onset) or stopped (offset) the cognitive task to the last epoch of the trial (i.e., 55-60 s after perturbation) was used to characterize transient postural control behavior. Functional near-infrared spectroscopy was also used to quantify changes in prefrontal cortex activation during the counting tasks to support interpretation of the transient balance findings. There was a significant effect of condition for transient balance characteristics following a cognitive perturbation (P < 0.001), with greater transient increases in postural sway for both difficult (Cohen's d = 0.40, P < 0.001) and easier (Cohen's d = 0.29, P = 0.013) cognitive perturbations relative to no cognitive perturbation. The onset of cognitive tasks was also associated with greater transient increases in postural sway than the offset of the cognitive tasks (Cohen's d = 0.24, P = 0.019). The functional near-infrared spectroscopy data indicated that a significant decrease in deoxygenated hemoglobin was observed for left Brodmann area 46 for both the subtraction by ones (T = -3.97; Benjamini-Hochberg significance value (q) = 0.008) and subtraction by sevens (T = -3.11; q = 0.036) conditions relative to the baseline condition. The subtraction by sevens condition was also associated with a relative increase in deoxygenated hemoglobin for the right Brodmann area 9 (T = 3.36; q = 0.026) compared to the subtraction by ones condition. In conclusion, serial subtraction can elicit transient increases in postural sway, with more difficult tasks and the onset of the cognitive-motor challenge exhibiting magnified effects. Additionally, even the cessation of a cognitive task (i.e., serial subtraction) can be associated with lingering perturbing effects on balance control."
2021,Frontiers in aging neuroscience,Front Aging Neurosci. 2022 Feb 2;13:760663. doi: 10.3389/fnagi.2021.760663. ,"['Kim, Tae', 'Aizenstein, Howard J', 'Snitz, Beth E', 'Cheng, Yu', 'Chang, Yue-Fang', 'Roush, Rebecca E', 'Huppert, Theodore J', 'Cohen, Annie', 'Doman, Jack', 'Becker, James T']","['alzheimer’s disease', 'aging', 'cognitive impairment', 'functional connectivity (fc)', 'white matter fiber tracts', 'white matter hyperintensity (wmh)', 'white matter lesion (wml)']",Tract Specific White Matter Lesion Load Affects White Matter Microstructure and Their Relationships With Functional Connectivity and Cognitive Decline.,White matter hyperintensities (WMHs) are associated with cognitive decline. Assessing the effect of WMH on WM microstructural changes and its relationships with structural and functional connectivity to multiple cognitive domains are helpful to better understand the pathophysiological processes of cognitive impairment. 65 participants (49 normal and 16 M
2022 Jan-Dec,Molecular pain,Mol Pain. 2022 Jan-Dec;18:17448069221074991. doi: 10.1177/17448069221074991.,"['Alter, Benedict J', 'Santosa, Hendrik', 'Nguyen, Quynh H', 'Huppert, Theodore J', 'Wasan, Ajay D']","[' analgesia methods', 'dorsolateral prefrontal cortex', 'humans', 'pain', 'pain measurement methods', 'prefrontal cortex', ' spectroscopy, near-infrared methods', 'offset analgesia', 'descending inhibition', 'endogenous analgesia', 'functional near-infrared spectroscopy', 'heat pain', 'human', 'pain']",Offset analgesia is associated with opposing modulation of medial versus dorsolateral prefrontal cortex activations: A functional near-infrared spectroscopy study.,"Offset analgesia is defined by a dramatic drop in perceived pain intensity with a relatively small decrease in noxious input. Although functional magnetic resonance imaging studies implicate subcortical descending inhibitory circuits during offset analgesia, the role of cortical areas remains unclear. The current study identifies cortical correlates of offset analgesia using functional near infrared spectroscopy (fNIRS). Twenty-four healthy volunteers underwent fNIRS scanning during offset (OS) and control (Con) heat stimuli applied to the forearm. After controlling for non-neural hemodynamic responses in superficial tissues, widespread increases in cortical oxygenated hemoglobin concentration were observed, reflecting cortical activation during heat pain. OS-Con contrasts revealed deactivations in bilateral medial prefrontal cortex (mPFC) and bilateral somatosensory cortex (SSC) associated with offset analgesia. Right dorsolateral prefrontal cortex (dlPFC) showed activation only during OS. These data demonstrate opposing cortical activation patterns during offset analgesia and support a model in which right dlPFC underlies ongoing evaluation of pain intensity change. With predictions of decreasing pain intensity, right dlPFC activation likely inhibits ascending noxious input via subcortical pathways resulting in SSC and mPFC deactivation. This study identifies cortical circuitry underlying offset analgesia and introduces the use of fNIRS to study pain modulation in an outpatient clinical environment."
2022 Mar,Journal of neuroimaging : official journal of the American Society of ,J Neuroimaging. 2022 Mar;32(2):352-362. doi: 10.1111/jon.12949. Epub 2021 Dec 27.,"['Hengenius, James B', 'Bohnen, Nicolaas I', 'Rosso, Andrea', 'Huppert, Theodore J', 'Rosano, Caterina']","['aged', 'aged, 80 and over', ' cerebral small vessel diseases diagnostic imaging', 'cognition', 'dopamine', 'female', 'gray matter', 'humans', 'magnetic resonance imaging methods', 'male', ' white matter', 'cortico-striatal network', 'functional connectivity', 'mild parkinsonian signs', 'white matter hyperintensities']",Cortico-striatal functional connectivity and cerebral small vessel disease: Contribution to mild Parkinsonian signs.,"BACKGROUND AND PURPOSE: Mild Parkinsonian signs (MPS) are common in older adults. We hypothesized that MPS are associated with lower functional connectivity (FC) in dopamine-dependent cortico-striatal networks, and these associations vary with white matter hyperintensity (WMH), a risk factor for MPS. METHODS: We examined resting-state functional MRI in 266 participants (mean age 83; 57% female; 41% African American) with data on MPS (Unified Parkinson's Disease Rating Scale), demographics, cognition, muscle-skeletal, and cardiometabolic health. FC between cortex and striatum was examined separately for sensorimotor, executive, and limbic functional subregions. Logistic regression tested the association of FC in each network with MPS, adjusted for covariates. Interactions of FC by WMH were tested; and analyses were repeated stratified by WMH above/below the median. RESULTS: Compared to those without MPS, those with MPS had lower cortico-striatal FC in the left executive network (adjusted odds ratio [95% confidence interval], p-value: 0.188 [0.043, 0.824], .027). The interaction with WMH was p = .064; left executive FC was inversely associated with MPS for high WMH (0.077 [0.010, 0.599], .014) but not low WMH participants (1.245 [0.128, 12.132], .850). CONCLUSIONS: MPS appear related to lower executive network FC, robust to adjustment for other risk factors, and stronger for those with higher burden of WMH. Future longitudinal studies should examine the interplay between cerebral small vessel disease and connectivity influencing MPS."
2021,Frontiers in global women's health,Front Glob Womens Health. 2021 Sep 23;2:744649. doi: 10.3389/fgwh.2021.744649. ,"['Morgan, Judith K', 'Santosa, Hendrik', 'Fridley, Rachel M', 'Conner, Kaetlyn K', 'Hipwell, Alison E', 'Forbes, Erika E', 'Huppert, Theodore J']","['maternal brain network', 'maternal sensitivity', 'mentalizing', 'near infrared spectroscopy', 'neural connectivity', 'postpartum depression']",Postpartum Depression Is Associated With Altered Neural Connectivity Between Affective and Mentalizing Regions During Mother-Infant Interactions.,"Although there has been growing interest in mood-related neural alterations in women in the initial weeks postpartum, recent work has demonstrated that postpartum depression often lingers for months or years following birth. However, research evaluating the impact of depression on maternal brain function during mother-infant interactions in the late postpartum period is lacking. The current study tested the hypothesis that depressive symptoms at 12-months postpartum are associated with neural alterations in affective and social neural regions, using near-infrared spectroscopy during in vivo mother-infant interactions. Participants were 23 birth mothers of 12-month-old infants (60% boys). While undergoing near-infrared spectroscopy, mothers engaged in an ecologically valid interactive task in which they looked at an age-appropriate book with their infants. Mothers also reported on their depressive symptoms in the past week and were rated on their observed levels of maternal sensitivity during mother-infant play. Greater depressive severity at 12-months postpartum was related to lower connectivity between the right temporoparietal junction and the lateral prefrontal cortex, but greater connectivity between the right temporoparietal junction and anterior medial prefrontal cortex during mother-infant interaction. Given the putative functions of these neural regions within the maternal brain network, our findings suggest that in the context of depression, postpartum mothers' mentalizing about her infants' thoughts and feelings may be related to lower ability to express and regulate her own emotions, but greater ability to engage in emotional bonding with her infant. Future work should explore how connectivity among these regions is associated with longitudinal changes in maternal behavior, especially in the context of changes in mothers' depressive symptoms (e.g., with treatment) over time."
2021,Frontiers in aging neuroscience,Front Aging Neurosci. 2021 May 4;13:637574. doi: 10.3389/fnagi.2021.637574. ,"['Shaaban, C Elizabeth', 'Rosano, Caterina', 'Cohen, Ann D', 'Huppert, Theodore', 'Butters, Meryl A', 'Hengenius, James', 'Parks, W Tony', 'Catov, Janet M']","['arterial spin labeling', 'cerebral blood flow', 'cognitive function', 'hypercapnia', 'hypertensive disorders of pregnancy', 'vascular contributions to cognitive impairment and dementia']",Cognition and Cerebrovascular Reactivity in Midlife Women With History of Preeclampsia and Placental Evidence of Maternal Vascular Malperfusion.,"Background: Preeclampsia is emerging as a sex-specific risk factor for cerebral small vessel disease (SVD) and dementia, but the reason is unknown. We assessed the relationship of maternal vascular malperfusion (MVM), a marker of placental SVD, with cognition and cerebral SVD in women with and without preeclampsia. We hypothesized women with both preeclampsia and MVM would perform worst on information processing speed and executive function. Methods: Women (n = 45; mean 10.5 years post-delivery; mean age: 41 years; 42.2% Black) were classified as preeclampsia-/MVM-, preeclampsia+/MVM-, or preeclampsia+/MVM+. Information processing speed, executive function, and memory were assessed. In a pilot sub-study of cerebrovascular reactivity (CVR; n = 22), cerebral blood flow during room-air breathing and breath-hold induced hypercapnia were obtained via arterial spin labeling MRI. Non-parametric tests and regression models were used to test associations. Results: Between-group cognitive differences were significant for information processing speed (p = 0.02); preeclampsia+/MVM+ had the lowest scores. Cerebral blood flow increased from room-air to breath-hold, globally and in all regions in the three groups, except the preeclampsia+/MVM+ parietal region (p = 0.12). Lower parietal CVR (less change from room-air breathing to breath-holding) was correlated with poorer information processing speed (partial ρ = 0.63, p = 0.005) and executive function (ρ = 0.50, p = 0.03) independent of preeclampsia/MVM status. Conclusion: Compared to women without preeclampsia and MVM, midlife women with both preeclampsia and MVM have worse information processing speed and may have blunted parietal CVR, an area important for information processing speed and executive function. MVM in women with preeclampsia is a promising sex-specific indicator of cerebrovascular integrity in midlife."
2021 Aug,Autism research : official journal of the International Society for Autism ,Autism Res. 2021 Aug;14(8):1585-1596. doi: 10.1002/aur.2513. Epub 2021 Apr 13.,"['Quiñones-Camacho, Laura E', 'Fishburn, Frank A', 'Belardi, Katherine', 'Williams, Diane L', 'Huppert, Theodore J', 'Perlman, Susan B']","['adult', ' autism spectrum disorder', 'brain', 'brain mapping', 'humans', ' mentalization', 'spectroscopy, near-infrared', 'asd', 'tpj', 'neural synchrony', 'social communication impairment', 'social deficits']",Dysfunction in interpersonal neural synchronization as a mechanism for social impairment in autism spectrum disorder.,"Social deficits in autism spectrum disorder (ASD) have been linked to atypical activation of the mentalizing network. This work, however, has been limited by a focus on the brain activity of a single person during computerized social tasks rather than exploring brain activity during in vivo interactions. The current study assessed neural synchronization during a conversation as a mechanism for social impairment in adults with ASD (n = 24) and matched controls (n = 26). Functional near-infrared spectroscopy (fNIRS) data were collected from the prefrontal cortex (PFC) and tempoparietal junction (TPJ). Participants self-reported on their social communication and videos of the interaction were coded for utterances and conversational turns. As expected, controls showed more neural synchrony than participants with ASD in the TPJ. Also as expected, controls showed less social communication impairment than participants with ASD. However, participants with ASD did not have fewer utterances compared with control subjects. Overall, less neural synchrony in the TPJ was associated with higher social impairment and marginally fewer utterances. Our findings advance our understanding of social difficulties in ASD by linking them to decreased neural synchronization of the TPJ. LAY SUMMARY: The coordination of brain responses is important for efficient social interactions. The current study explored the coordination of brain responses in neurotypical adults and adults with ASD to investigate if difficulties in social interactions are related to difficulties coordinating brain responses in ASD. We found that participants with ASD had more difficulties coordinating brain responses during a conversation with an interacting partner. Additionally, we found that the level of coordination in brain responses was linked to problems with social communication."
2021 Jun,NeuroImage,Neuroimage. 2021 Jun;233:117956. doi: 10.1016/j.neuroimage.2021.117956. Epub 2021 ,"['Kim, Tae', 'Kim, Sang-Young', 'Agarwal, Vikas', 'Cohen, Annie', 'Roush, Rebecca', 'Chang, Yue-Fang', 'Cheng, Yu', 'Snitz, Beth', 'Huppert, Theodore J', 'Bagic, Anto', 'Kamboh, M Ilyas', 'Doman, Jack', 'Becker, James T']","['aged', 'aged, 80 and over', 'brain  diagnostic imaging  physiology', 'cerebral ventricles diagnostic imaging physiology', 'cognition  physiology', 'cognitive dysfunction  diagnostic imaging physiopathology', 'female', 'heart rate  physiology', 'humans', 'magnetic resonance imaging methods', 'male', 'middle aged', 'organ size', 'pulsatile flow  physiology', 'amygdala', 'atrophy', 'brain volume', 'cerebral pulsatility', 'cognitive decline', 'hippocampus', 'resting-state functional mri', 'ventricle enlargement', 'volume segmentation']","Cardiac-induced cerebral pulsatility, brain structure, and cognition in middle and older-aged adults.","Changes of cardiac-induced regional pulsatility can be associated with specific regions of brain volumetric changes, and these are related with cognitive alterations. Thus, mapping of cardiac pulsatility over the entire brain can be helpful to assess these relationships. A total of 108 subjects (age: 66.5 ± 8.4 years, 68 females, 52 healthy controls, 11 subjective cognitive decline, 17 impaired without complaints, 19 M"
