time,journal,doi_info,authors,key words,title,abstract
2021 Mar,Psychological review,Psychol Rev. 2021 Mar;128(2):362-395. doi: 10.1037/rev0000264. Epub 2021 Feb 11.,"['Buss, Aaron T', 'Magnotta, Vincent A', 'Penny, Will', 'Schöner, Gregor', 'Huppert, Theodore J', 'Spencer, John P']","['bayes theorem', 'brain  physiology', 'brain mapping', ' cognition', 'humans', 'magnetic resonance imaging', ' memory, short-term', ' models, neurological']",How do neural processes give rise to cognition? Simultaneously predicting brain and behavior with a dynamic model of visual working memory.,"There is consensus that activation within distributed functional brain networks underlies human thought. The impact of this consensus is limited, however, by a gap that exists between data-driven correlational analyses that specify where functional brain activity is localized using functional magnetic resonance imaging (fMRI), and neural process accounts that specify how neural activity unfolds through time to give rise to behavior. Here, we show how an integrative cognitive neuroscience approach may bridge this gap. In an exemplary study of visual working memory, we use multilevel Bayesian statistics to demonstrate that a neural dynamic model simultaneously explains behavioral data and predicts localized patterns of brain activity, outperforming standard analytic approaches to fMRI. The model explains performance on both correct trials and incorrect trials where errors in change detection emerge from neural fluctuations amplified by neural interaction. Critically, predictions of the model run counter to cognitive theories of the origin of errors in change detection. Results reveal neural patterns predicted by the model within regions of the dorsal attention network that have been the focus of much debate. The model-based analysis suggests that key areas in the dorsal attention network such as the intraparietal sulcus play a central role in change detection rather than working memory maintenance, counter to previous interpretations of fMRI studies. More generally, the integrative cognitive neuroscience approach used here establishes a framework for directly testing theories of cognitive and brain function using the combined power of behavioral and fMRI data. (PsycInfo Database Record (c) 2021 APA, all rights reserved)."
2021 Feb 3,Journal of neuroengineering and rehabilitation,J Neuroeng Rehabil. 2021 Feb 3;18(1):24. doi: 10.1186/s12984-020-00803-1.,"['Zuniga, Jorge M', 'Pierce, James E', 'Copeland, Christopher', 'Cortes-Reyes, Claudia', 'Salazar, David', 'Wang, YingYing', 'Arun, K M', 'Huppert, Theodore']","[' artificial limbs', 'child', 'female', 'functional laterality  physiology', 'humans', 'male', 'motor cortex  physiology  physiopathology', 'motor skills  physiology', 'upper extremity deformities, congenital  physiopathology', 'brain activation', 'pediatric', 'prosthesis', 'upper-limb deficiency', 'fnirs']",Brain lateralization in children with upper-limb reduction deficiency.,"BACKGROUND: The purpose of the current study was to determine the influence of upper-limb prostheses on brain activity and gross dexterity in children with congenital unilateral upper-limb reduction deficiencies (ULD) compared to typically developing children (TD). METHODS: Five children with ULD (3 boys, 2 girls, 8.76 ± 3.37 years of age) and five age- and sex-matched TD children (3 boys, 2 girls, 8.96 ± 3.23 years of age) performed a gross manual dexterity task (Box and Block Test) while measuring brain activity (functional near-infrared spectroscopy; fNIRS). RESULTS: There were no significant differences (p = 0.948) in gross dexterity performance between the ULD group with prosthesis (7.23 ± 3.37 blocks per minute) and TD group with the prosthetic simulator (7.63 ± 5.61 blocks per minute). However, there was a significant (p = 0.001) difference in Laterality Index (LI) between the ULD group with prosthesis (LI = - 0.2888 ± 0.0205) and TD group with simulator (LI = 0.0504 ± 0.0296) showing in a significant ipsilateral control for the ULD group. Thus, the major finding of the present investigation was that children with ULD, unlike the control group, showed significant activation in the ipsilateral motor cortex on the non-preferred side using a prosthesis during a gross manual dexterity task. CONCLUSIONS: This ipsilateral response may be a compensation strategy in which the existing cortical representations of the non-affected (preferred) side are been used by the affected (non-preferred) side to operate the prosthesis. This study is the first to report altered lateralization in children with ULD while using a prosthesis. Trial registration The clinical trial (ClinicalTrial.gov ID: NCT04110730 and unique protocol ID: IRB # 614-16-FB) was registered on October 1, 2019 ( https://clinicaltrials.gov/ct2/show/NCT04110730 ) and posted on October 1, 2019. The study start date was January 10, 2020. The first participant was enrolled on January 14, 2020, and the trial is scheduled to be completed by August 23, 2023. The trial was updated January 18, 2020 and is currently recruiting."
2021 Apr 15,NeuroImage,Neuroimage. 2021 Apr 15;230:117795. doi: 10.1016/j.neuroimage.2021.117795. Epub ,"['Meidenbauer, Kimberly L', 'Choe, Kyoung Whan', 'Cardenas-Iniguez, Carlos', 'Huppert, Theodore J', 'Berman, Marc G']","['adolescent', 'adult', 'cognition  physiology', ' data analysis', 'female', 'frontal lobe  metabolism', 'humans', 'least-squares analysis', 'male', 'memory, short-term  physiology', 'photic stimulation methods', 'psychomotor performance  physiology', 'spectroscopy, near-infrared  methods standards', 'young adult', 'cognitive load', 'n-back task', 'neural efficiency', 'partial least squares', 'working memory', 'fnirs']",Load-dependent relationships between frontal fNIRS activity and performance: A data-driven PLS approach.,"Neuroimaging research frequently demonstrates load-dependent activation in prefrontal and parietal cortex during working memory tasks such as the N-back. Most of this work has been conducted in fMRI, but functional near-infrared spectroscopy (fNIRS) is gaining traction as a less invasive and more flexible alternative to measuring cortical hemodynamics. Few fNIRS studies, however, have examined how working memory load-dependent changes in brain hemodynamics relate to performance. The current study employs a newly developed and robust statistical analysis of task-based fNIRS data in a large sample, and demonstrates the utility of data-driven, multivariate analyses to link brain activation and behavior in this modality. Seventy participants completed a standard N-back task with three N-back levels (N = 1, 2, 3) while fNIRS data were collected from frontal and parietal cortex. Overall, participants showed reliably greater fronto-parietal activation for the 2-back versus the 1-back task, suggesting fronto-parietal fNIRS measurements are sensitive to differences in cognitive load. The results for 3-back were much less consistent, potentially due to poor behavioral performance in the 3-back task. To address this, a multivariate analysis (behavioral partial least squares, PLS) was conducted to examine the interaction between fNIRS activation and performance at each N-back level. Results of the PLS analysis demonstrated differences in the relationship between accuracy and change in the deoxyhemoglobin fNIRS signal as a function of N-back level in eight mid-frontal channels. Specifically, greater reductions in deoxyhemoglobin (i.e., more activation) were positively related to performance on the 3-back task, unrelated to accuracy in the 2-back task, and negatively associated with accuracy in the 1-back task. This pattern of results suggests that the metabolic demands correlated with neural activity required for high levels of accuracy vary as a consequence of task difficulty/cognitive load, whereby more automaticity during the 1-back task (less mid-frontal activity) predicted superior performance on this relatively easy task, and successful engagement of this mid-frontal region was required for high accuracy on a more difficult and cognitively demanding 3-back task. In summary, we show that fNIRS activity can track working memory load and can uncover significant associations between brain activity and performance, thus opening the door for this modality to be used in more wide-spread applications."
2021 Jan,Neurophotonics,Neurophotonics. 2021 Jan;8(1):015002. doi: 10.1117/1.NPh.8.1.015002. Epub 2021 ,"['Cao, Jiaming', 'Huppert, Theodore J', 'Grover, Pulkit', 'Kainerstorfer, Jana M']","['diffuse optical tomography', 'electroencephalography', 'functional near-infrared spectroscopy', 'image reconstruction', 'neurovascular coupling']",Enhanced spatiotemporal resolution imaging of neuronal activity using joint electroencephalography and diffuse optical tomography.,"Significance: Electroencephalography (EEG) and functional near-infrared spectroscopy (fNIRS) are both commonly used methodologies for neuronal source reconstruction. While EEG has high temporal resolution (millisecond-scale), its spatial resolution is on the order of centimeters. On the other hand, in comparison to EEG, fNIRS, or diffuse optical tomography (DOT), when used for source reconstruction, can achieve relatively high spatial resolution (millimeter-scale), but its temporal resolution is poor because the hemodynamics that it measures evolve on the order of several seconds. This has important neuroscientific implications: e.g., if two spatially close neuronal sources are activated sequentially with only a small temporal separation, single-modal measurements using either EEG or DOT alone would fail to resolve them correctly. Aim: We attempt to address this issue by performing joint EEG and DOT neuronal source reconstruction. Approach: We propose an algorithm that utilizes DOT reconstruction as the spatial prior of EEG reconstruction, and demonstrate the improvements using simulations based on the ICBM152 brain atlas. Results: We show that neuronal sources can be reconstructed with higher spatiotemporal resolution using our algorithm than using either modality individually. Further, we study how the performance of the proposed algorithm can be affected by the locations of the neuronal sources, and how the performance can be enhanced by improving the placement of EEG electrodes and DOT optodes. Conclusions: We demonstrate using simulations that two sources separated by 2.3-3.3 cm and 50 ms can be recovered accurately using the proposed algorithm by suitably combining EEG and DOT, but not by either in isolation. We also show that the performance can be enhanced by optimizing the electrode and optode placement according to the locations of the neuronal sources."
2020 Jul,Neurophotonics,Neurophotonics. 2020 Jul;7(3):035009. doi: 10.1117/1.NPh.7.3.035009. Epub 2020 ,"['Santosa, Hendrik', 'Zhai, Xuetong', 'Fishburn, Frank', 'Sparto, Patrick J', 'Huppert, Theodore J']","['functional near-infrared spectroscopy', 'noise removal', 'sensitivity–specificity', 'short-separation measurements', 'systemic physiological noise']",Quantitative comparison of correction techniques for removing systemic physiological signal in functional near-infrared spectroscopy studies.,"Significance: Isolating task-evoked brain signals from background physiological noise (e.g., cardiac, respiratory, and blood pressure fluctuations) poses a major challenge for the analysis of functional near-infrared spectroscopy (fNIRS) data. Aim: The performance of several analytic methods to separate background physiological noise from brain activity including spatial and temporal filtering, regression, component analysis, and the use of short-separation (SS) measurements were quantitatively compared. Approach: Using experimentally recorded background signals (breath-hold task), receiver operating characteristics simulations were performed by adding various levels of additive synthetic ""brain"" responses in order to examine the sensitivity and specificity of several previously proposed analytic approaches. Results: We found that the use of SS fNIRS channels as regressors of no-interest within a linear regression model was the best performing approach examined. Furthermore, we found that the addition of all available SS data, including all recorded channels and both hemoglobin species, improved the method performance despite the additional degrees-of-freedom of the models. When SS data were not available, we found that principal component filtering using a separate baseline scan was the best alternative. Conclusions: The use of multiple SS measurements as regressors of no interest implemented in a robust, iteratively prewhitened, general linear model has the best performance of the tested existing methods."
2020 Jul,Neurophotonics,Neurophotonics. 2020 Jul;7(3):035008. doi: 10.1117/1.NPh.7.3.035008. Epub 2020 ,"['Zhai, Xuetong', 'Santosa, Hendrik', 'Huppert, Theodore J']","['functional brain imaging', 'functional near-infrared spectroscopy', 'statistical analysis']",Using anatomically defined regions-of-interest to adjust for head-size and probe alignment in functional near-infrared spectroscopy.,"Significance: Functional near-infrared spectroscopy (fNIRS) uses surface-placed light sources and detectors to record underlying changes in the brain due to fluctuations in hemoglobin levels and oxygenation. Since these measurements are recorded from the surface of the scalp, the mapping from underlying regions-of-interest (ROIs) in the brain space to the fNIRS channel space measurements depends on the registration of the sensors, the anatomy of the head/brain, and the sensitivity of these diffuse measurements through the tissue. However, small displacements in the probe position can change the distribution of recorded brain activity across the fNIRS measurements. Aim: We propose an approach using either individual or atlas-based brain-space anatomical information to define ROI-based statistical hypotheses to test the null involvement of specific regions, which allows us to test the analogous ROI across subjects while adjusting for fNIRS probe placement and sensitivity differences due to head size variations without a localizer task. Approach: We use the optical forward model to project the underlying brain-space ROI into a tapered contrast vector, which defines the relative weighting of the fNIRS channels contributing to the ROI and allows us to test the null hypothesis of no brain activity in this region during a functional task. We demonstrate this method through simulation and compare the sensitivity-specificity of this approach to other conventional methods. Results: We examine the performance of this method in the scenario where head size and probe registration are both an accurately known parameters and where this is subject to unknown experimental errors. This method is compared with the performance of the conventional method using 364 different simulation parameter combinations. Conclusion: The proposed method is always recommended in ROI-based analysis, since it significantly improves the analysis performance without a localizer task, wherever the fNIRS probe registration is known or unknown."
2020 Apr,Journal of neurologic physical therapy : JNPT,J Neurol Phys Ther. 2020 Apr;44(2):156-163. doi: 10.1097/NPT.0000000000000310.,"['Hoppes, Carrie W', 'Huppert, Theodore J', 'Whitney, Susan L', 'Dunlap, Pamela M', 'DiSalvio, Nikki L', 'Alshebber, Kefah M', 'Furman, Joseph M', 'Kwon, Yong H', 'Rosso, Andrea L']","['adult', 'attention  physiology', 'cross-sectional studies', 'female', 'functional neuroimaging', 'gait physiology', 'humans', 'male', 'prefrontal cortex diagnostic imaging  physiopathology', 'spectroscopy, near-infrared', 'vertigo diagnostic imaging  physiopathology', 'walking  physiology']",Changes in Cortical Activation During Dual-Task Walking in Individuals With and Without Visual Vertigo.,"BACKGROUND AND PURPOSE: Persons with vestibular disorders are known to have slower gait speed with greater imbalance and veering during dual-task walking than healthy individuals, but the cerebral mechanisms are unknown. The purpose of this study was to determine whether individuals with visual vertigo (VV) have different cerebral activation during dual-task walking compared with control subjects. METHODS: Fourteen individuals with VV and 14 healthy controls (CON) were included (mean 39 years old, 85% women). A cross-sectional experimental study consisting of 4 combinations of 2 surfaces (even and uneven) and 2 task conditions (single- and dual-task) was performed. Participants walked over an even (level flooring) or uneven (wood prisms underneath carpeting) surface, either quietly or while reciting every other letter of the alphabet. Changes in cerebral activation over the bilateral prefrontal cortices were recorded using functional near-infrared spectroscopy during 4 task conditions relative to quiet standing. Gait speed and cognitive performance were recorded. RESULTS: There were no between-group differences in cognitive performance. Both groups slowed when walking on an uneven surface or performing a dual-task; participants in the VV group walked more slowly than those in the CON group in all conditions. Participants with VV had decreased cerebral activation in the bilateral prefrontal regions in comparison to CON participants in all conditions. DISCUSSION AND CONCLUSIONS: Participants with VV had lower prefrontal cortex activation than CON participants during dual-task walking. Lower cortical activity in those with VV may be due to shifted attention away from the cognitive task to prioritize maintenance of dynamic balance.Video Abstract available for more insights from the authors (see the Video, Supplemental Digital Content 1, available at: http://links.lww.com/JNPT/A303)."
2020 May,Developmental medicine and child neurology,Dev Med Child Neurol. 2020 May;62(5):625-632. doi: 10.1111/dmcn.14458. Epub 2020 ,"['de Campos, Ana Carolina', 'Sukal-Moulton, Theresa', 'Huppert, Theodore', 'Alter, Katharine', 'Damiano, Diane L']","['adolescent', 'adult', 'brain diagnostic imaging  physiopathology', 'cerebral palsy diagnostic imaging  physiopathology', 'child', 'cross-sectional studies', 'female', 'humans', 'male', ' motor activity', 'spectroscopy, near-infrared', 'young adult']",Brain activation patterns underlying upper limb bilateral motor coordination in unilateral cerebral palsy: an fNIRS study.,"AIM: To explore cortical activation during bimanual tasks and functional correlates in unilateral cerebral palsy (CP). METHOD: This cross-sectional study included eight participants with unilateral CP (six females, two males; mean age [SD] 20y 10mo [5y 10mo], 13y 8mo-31y 6mo) in Manual Ability Classification System levels II to III and nine age-matched participants with typical development (seven females, two males; mean age [SD] 17y 8mo [5y 7mo], 9y 4mo-24y 2mo). They performed bimanual symmetric squeezing (BSS) and bimanual asymmetric squeezing (BAS) tasks at 1Hz, and a pouring task with dominant hand (DPour) and a pouring task with non-dominant hand (NDPour) at 0.67Hz, all while a custom array of functional near-infrared spectroscopy (fNIRS) optodes were placed over their sensorimotor area. Mixed-effects were used to contrast groups, tasks, and hemispheres (corrected p-values [q] reported). Analysis of variance and t-tests compared performance measures across groups and tasks. RESULTS: Participants with unilateral CP showed greater activation in both hemispheres during BAS (non-lesioned: q<0.001; lesioned: q<0.001), and in the lesioned hemisphere during BSS (q<0.001), DPour (q=0.02), and NDPour (q=0.02) than those with typical development. The lesioned hemisphere in unilateral CP showed more activity than the non-lesioned one (BSS: q=0.01; BAS: q=0.009; NDPour: q=0.04). During BAS, higher cortical activity correlated with more synchronous arm activation (r=0.79; p=0.02); activity lateralized towards the non-lesioned hemisphere correlated with better Pediatric Evaluation of Disability Inventory computer adaptive test scores (r=0.81; p=0.03). INTERPRETATION: Results suggest abnormally increased sensorimotor cortical activity in unilateral CP, with implications to be investigated. WHAT THIS PAPER ADDS: Cortical activity in manual tasks is described with functional near-infrared spectroscopy in typical and atypical cohorts. Activation levels in unilateral cerebral palsy appear to escalate with task difficulty. Increased brain activity may be associated with poorer selective manual control. Specific patterns of brain activity may be related to impaired bimanual function."
2020 Nov,"Journal of child psychology and psychiatry, and allied disciplines",J Child Psychol Psychiatry. 2020 Nov;61(11):1213-1223. doi: 10.1111/jcpp.13165. ,"['Quiñones-Camacho, Laura E', 'Fishburn, Frank A', 'Camacho, M Catalina', 'Hlutkowsky, Christina O', 'Huppert, Theodore J', 'Wakschlag, Lauren S', 'Perlman, Susan B']","['child, preschool', 'female', ' frustration', 'humans', ' irritable mood', 'male', ' parent-child relations', 'spectroscopy, near-infrared', 'neural synchrony', 'irritability', 'parent-child synchrony', 'prefrontal cortex', 'recovery']",Parent-child neural synchrony: a novel approach to elucidating dyadic correlates of preschool irritability.,"BACKGROUND: Research to date has largely conceptualized irritability in terms of intraindividual differences. However, the role of interpersonal dyadic processes has received little consideration. Nevertheless, difficulties in how parent-child dyads synchronize during interactions may be an important correlate of irritably in early childhood. Innovations in developmentally sensitive neuroimaging methods now enable the use of measures of neural synchrony to quantify synchronous responses in parent-child dyads and can help clarify the neural underpinnings of these difficulties. We introduce the Disruptive Behavior Diagnostic Observation Schedule: Biological Synchrony (DB-DOS:BioSync) as a paradigm for exploring parent-child neural synchrony as a potential biological mechanism for interpersonal difficulties in preschool psychopathology. METHODS: Using functional near-infrared spectroscopy (fNIRS) 4- to 5-year-olds (N = 116) and their mothers completed the DB-DOS:BioSync while assessing neural synchrony during mild frustration and recovery. Child irritability was measured using a latent irritability factor that was calculated from four developmentally sensitive indicators. RESULTS: Both the mild frustration and the recovery contexts resulted in neural synchrony. However, less neural synchrony during the recovery context only was associated with more child irritability. CONCLUSIONS: Our results suggest that recovering after a frustrating period might be particularly challenging for children high in irritability and offer support for the use of the DB-DOS:BioSync task to elucidate interpersonal neural mechanisms of developmental psychopathology."
2019 Dec,Developmental cognitive neuroscience,Dev Cogn Neurosci. 2019 Dec;40:100708. doi: 10.1016/j.dcn.2019.100708. Epub 2019 ,"['Grabell, Adam S', 'Huppert, Theodore J', 'Fishburn, Frank A', 'Li, Yanwei', 'Hlutkowsky, Christina O', 'Jones, Hannah M', 'Wakschlag, Lauren S', 'Perlman, Susan B']","['child', 'child, preschool', 'emotional regulation  physiology', 'emotions  physiology', 'female', 'humans', 'interpersonal relations', 'male', 'prefrontal cortex  physiology', 'deliberate emotion regulation', 'early childhood', 'imaging', 'interpersonal scaffolding', 'prefrontal cortex']",Neural correlates of early deliberate emotion regulation: Young children's responses to interpersonal scaffolding.,"Deliberate emotion regulation, the ability to willfully modulate emotional experiences, is shaped through interpersonal scaffolding and forecasts later functioning in multiple domains. However, nascent deliberate emotion regulation in early childhood is poorly understood due to a paucity of studies that simulate interpersonal scaffolding of this skill and measure its occurrence in multiple modalities. Our goal was to identify neural and behavioral components of early deliberate emotion regulation to identify patterns of competent and deficient responses. A novel probe was developed to assess deliberate emotion regulation in young children. Sixty children (age 4-6 years) were randomly assigned to deliberate emotion regulation or control conditions. Children completed a frustration task while lateral prefrontal cortex (LPFC) activation was recorded via functional near-infrared spectroscopy (fNIRS). Facial expressions were video recorded and children self-rated their emotions. Parents rated their child's temperamental emotion regulation. Deliberate emotion regulation interpersonal scaffolding predicted a significant increase in frustration-related LPFC activation not seen in controls. Better temperamental emotion regulation predicted larger LPFC activation increases post- scaffolding among children who engaged in deliberate emotion regulation interpersonal scaffolding. A capacity to increase LPFC activation in response to interpersonal scaffolding may be a crucial neural correlate of early deliberate emotion regulation."
