time,journal,doi_info,authors,key words,title,abstract
2018 Jan,Neurophotonics,Neurophotonics. 2018 Jan;5(1):011009. doi: 10.1117/1.NPh.5.1.011009. Epub 2017 ,"['Whiteman, Ashley C', 'Santosa, Hendrik', 'Chen, Daniel F', 'Perlman, Susan', 'Huppert, Theodore']","['monte carlo simulation', 'anatomical variability', 'near-infrared spectroscopy', 'radiative transport equation', 'structural anatomy']",Investigation of the sensitivity of functional near-infrared spectroscopy brain imaging to anatomical variations in 5- to 11-year-old children.,"Functional near-infrared spectroscopy (fNIRS) is a noninvasive brain imaging technique that uses scalp-placed light sensors to measure evoked changes in cerebral blood oxygenation. The portability, low overhead cost, and ability to use this technology under a wide range of experimental environments make fNIRS well-suited for studies involving infants and children. However, since fNIRS does not directly provide anatomical or structural information, these measurements may be sensitive to individual or group level differences associated with variations in head size, depth of the brain from the scalp, or other anatomical factors affecting the penetration of light into the head. This information is generally not available in pediatric populations, which are often the target of study for fNIRS. Anatomical magnetic resonance imaging information from 90 school-age children (5 to 11 years old) was used to quantify the expected effect on fNIRS measures of variations in cerebral and extracerebral structure. Monte Carlo simulations of light transport in tissue were used to estimate differential and partial optical pathlengths at 690, 780, 808, 830, and 850 nm and their variations with age, sex, and head size. This work provides look-up tables of these values and general guidance for future investigations using fNIRS sans anatomical information in this child population."
2017 Sep,Gait & posture,Gait Posture. 2017 Sep;57:193-198. doi: 10.1016/j.gaitpost.2017.06.013. Epub 2017 ,"['Rosso, Andrea L', 'Cenciarini, Massimo', 'Sparto, Patrick J', 'Loughlin, Patrick J', 'Furman, Joseph M', 'Huppert, Theodore J']","['adult', 'aged', 'aged, 80 and over', 'aging  physiology', 'attention  physiology', 'brain  diagnostic imaging physiology', 'female', 'humans', 'male', 'multitasking behavior  physiology', ' neuroimaging', 'postural balance  physiology', ' spectroscopy, near-infrared', 'task performance and analysis', 'young adult', 'aging', 'balance', 'dual-task', 'functional near-infrared spectroscopy', 'neuroimaging']",Neuroimaging of an attention demanding dual-task during dynamic postural control.,"Cognitive tasks impact postural control when performed concurrently as dual-tasks. This is presumed to result from capacity limitations in relevant brain regions. We used functional near-infrared spectroscopy (fNIRS) to measure brain activation of the left motor, temporal, and dorsal-lateral prefrontal brain regions of younger (n=6) and older (n=10) adults. Brain activation was measured during an auditory choice reaction task (CRT) and standing on a dynamic posturography platform, both as single-tasks and concurrently as dual-task. Body sway was assessed by median absolute deviation (MAD) of anterior-posterior translation of the center of mass (COM). Brain activation was measured as changes in oxy-hemoglobin by fNIRS. During both single- and dual-task conditions, we found that older adults had greater brain activation relative to younger adults. During dual task performance, the total activation was less than expected from the sum of individual conditions for both age groups, indicating a dual-task interference (reduction in younger adults=53% [p=0.02]; in older adults=53%; [p=0.008]). This reduction was greater for the activation attributable to the postural task (reduction younger adults=75% [p=0.03]; older adults=59% [p=0.005]) compared to the CRT task (reduction younger adults=10%, [p=0.6]; older adults=7.3%, [p=0.5]) in both age groups. Activation reduction was not accompanied by any significant changes in body sway in either group (older adults: single-task MAD=0.94cm, dual-task MAD=1.10cm, p=0.20; younger adults: single-task RMS=0.95cm, dual-task MAD=1.08cm, p=0.14). Our results indicate that neural resources devoted to postural control are reduced under dual-task conditions that engage attention."
2017 May 1,Journal of biomedical optics,J Biomed Opt. 2017 May 1;22(5):55002. doi: 10.1117/1.JBO.22.5.055002.,"['Santosa, Hendrik', 'Aarabi, Ardalan', 'Perlman, Susan B', 'Huppert, Theodore J']","['artifacts', 'brain diagnostic imaging', 'brain mapping', 'humans', 'neuroimaging  methods', ' spectroscopy, near-infrared standards']",Characterization and correction of the false-discovery rates in resting state connectivity using functional near-infrared spectroscopy.,"Functional near-infrared spectroscopy (fNIRS) is a noninvasive neuroimaging technique that uses low levels of red to near-infrared light to measure changes in cerebral blood oxygenation. Spontaneous (resting state) functional connectivity (sFC) has become a critical tool for cognitive neuroscience for understanding task-independent neural networks, revealing pertinent details differentiating healthy from disordered brain function, and discovering fluctuations in the synchronization of interacting individuals during hyperscanning paradigms. Two of the main challenges to sFC-NIRS analysis are (i) the slow temporal structure of both systemic physiology and the response of blood vessels, which introduces false spurious correlations, and (ii) motion-related artifacts that result from movement of the fNIRS sensors on the participants’ head and can introduce non-normal and heavy-tailed noise structures. In this work, we systematically examine the false-discovery rates of several time- and frequency-domain metrics of functional connectivity for characterizing sFC-NIRS. Specifically, we detail the modifications to the statistical models of these methods needed to avoid high levels of false-discovery related to these two sources of noise in fNIRS. We compare these analysis procedures using both simulated and experimental resting-state fNIRS data. Our proposed robust correlation method has better performance in terms of being more reliable to the noise outliers due to the motion artifacts."
2018 Jan,Journal of abnormal child psychology,J Abnorm Child Psychol. 2018 Jan;46(1):137-147. doi: 10.1007/s10802-017-0286-5.,"['Grabell, Adam S', 'Li, Yanwei', 'Barker, Jeff W', 'Wakschlag, Lauren S', 'Huppert, Theodore J', 'Perlman, Susan B']","['child', 'child, preschool', 'female', ' frustration', 'functional neuroimaging  methods', 'humans', 'irritable mood  physiology', 'male', 'prefrontal cortex diagnostic imaging  physiopathology', 'self report', ' self-control', 'spectroscopy, near-infrared  methods', 'early childhood', 'emotion regulation', 'irritability', 'lateral prefrontal cortex']",Evidence of Non-Linear Associations between Frustration-Related Prefrontal Cortex Activation and the Normal:Abnormal Spectrum of Irritability in Young Children.,"Burgeoning interest in early childhood irritability has recently turned toward neuroimaging techniques to better understand normal versus abnormal irritability using dimensional methods. Current accounts largely assume a linear relationship between poor frustration management, an expression of irritability, and its underlying neural circuitry. However, the relationship between these constructs may not be linear (i.e., operate differently at varying points across the irritability spectrum), with implications for how early atypical irritability is identified and treated. Our goal was to examine how the association between frustration-related lateral prefrontal cortex (LPFC) activation and irritability differs across the dimensional spectrum of irritability by testing for non-linear associations. Children (N = 92; ages 3-7) ranging from virtually no irritability to the upper end of the clinical range completed a frustration induction task while we recorded LPFC hemoglobin levels using fNIRS. Children self-rated their emotions during the task and parents rated their child's level of irritability. Whereas a linear model showed no relationship between frustration-related LPFC activation and irritability, a quadratic model revealed frustration-related LPFC activation increased as parent-reported irritability scores increased within the normative range of irritability but decreased with increasing irritability in the severe range, with an apex at the 91st percentile. Complementarily, we found children's self-ratings of emotion during frustration related to concurrent LPFC activation as an inverted U function, such that children who reported mild distress had greater activation than peers reporting no or high distress. Results suggest children with relatively higher irritability who are unimpaired may possess well-developed LPFC support, a mechanism that drops out in the severe end of the irritability dimension. Findings suggest novel avenues for understanding the heterogeneity of early irritability and its clinical sequelae."
2017 Apr,Experimental brain research,Exp Brain Res. 2017 Apr;235(4):1247-1256. doi: 10.1007/s00221-017-4893-8. Epub ,"['Lin, Chia-Cheng', 'Barker, Jeffrey W', 'Sparto, Patrick J', 'Furman, Joseph M', 'Huppert, Theodore J']","['aged', ' aging', 'brain  diagnostic imaging', ' brain mapping methods', 'feedback, sensory  physiology', 'female', 'humans', 'male', 'middle aged', 'oxyhemoglobins metabolism', 'postural balance physiology', ' spectroscopy, near-infrared', 'aging', 'functional near-infrared spectroscopy (fnirs)', 'sensory re-weighting']",Functional near-infrared spectroscopy (fNIRS) brain imaging of multi-sensory integration during computerized dynamic posturography in middle-aged and older adults.,"Studies suggest that aging affects the sensory re-weighting process, but the neuroimaging evidence is minimal. Functional Near-Infrared Spectroscopy (fNIRS) is a novel neuroimaging tool that can detect brain activities during dynamic movement condition. In this study, fNIRS was used to investigate the hemodynamic changes in the frontal-lateral, temporal-parietal, and occipital regions of interest (ROIs) during four sensory integration conditions that manipulated visual and somatosensory feedback in 15 middle-aged and 15 older adults. The results showed that the temporal-parietal ROI was activated more when somatosensory and visual information were absent in both groups, which indicated the sole use of vestibular input for maintaining balance. While both older adults and middle-aged adults had greater activity in most brain ROIs during changes in the sensory conditions, the older adults had greater increases in the occipital ROI and frontal-lateral ROIs. These findings suggest a cortical component to sensory re-weighting that is more distributed and requires greater attention in older adults."
2017 Jan,Neurophotonics,Neurophotonics. 2017 Jan;4(1):015001. doi: 10.1117/1.NPh.4.1.015001. Epub 2017 ,"['Huppert, Theodore', 'Barker, Jeff', 'Schmidt, Benjamin', 'Walls, Shawn', 'Ghuman, Avniel']","['brain', 'functional imaging', 'functional magnetic resonance imaging', 'functional near-infrared spectroscopy', 'magnetoencephalography', 'multimodal']","Comparison of group-level, source localized activity for simultaneous functional near-infrared spectroscopy-magnetoencephalography and simultaneous fNIRS-fMRI during parametric median nerve stimulation.","Functional near-infrared spectroscopy (fNIRS) is a noninvasive neuroimaging technique, which uses light to measure changes in cerebral blood oxygenation through sensors placed on the surface of the scalp. We recorded concurrent fNIRS with magnetoencephalography (MEG) and functional magnetic resonance imaging (fMRI) in order to investigate the group-level correspondence of these measures with source-localized fNIRS estimates. Healthy participants took part in both a concurrent fNIRS-MEG and fNIRS-fMRI neuroimaging session during two somatosensory stimulation tasks, a blocked design median nerve localizer and parametric pulsed-pair median nerve stimulation using interpulse intervals from 100 to 500 ms. We found the spatial correlation for estimated activation patterns from the somatosensory task was [Formula: see text], 0.57, and [Formula: see text] and the amplitude correlation was [Formula: see text], 0.52, and [Formula: see text] for fMRI-MEG, fMRI-fNIRS oxy-hemoglobin, and fMRI-fNIRS deoxy-hemoglobin signals, respectively. Taken together, these results show good correspondence among the fMRI, fNIRS, and MEG with the great majority of the difference across modalities being driven by lower sensitivity for deeper brain sources in MEG and fNIRS. These results provide an important validation of source-localized fNIRS in the context of concurrent multimodal imaging for future studies of the relationship between physiological effects in the human brain."
2017 Oct,Aging clinical and experimental research,Aging Clin Exp Res. 2017 Oct;29(5):1021-1030. doi: 10.1007/s40520-016-0693-4. ,"['Alqahtani, Bader A', 'Ferchak, Mary Ann', 'Huppert, Theodore J', 'Sejdic, Ervin', 'Perera, Subashan', 'Greenspan, Susan L', 'Sparto, Patrick J']","['accelerometry  methods', 'accidental falls', 'aged', 'aged, 80 and over', 'aging  physiology', 'feasibility studies', 'female', 'frailty diagnosis', 'humans', 'long-term care', 'lower extremity physiology', 'male', 'muscle strength  physiology', 'postural balance  physiology', 'reproducibility of results', 'self report', 'walking speed physiology', 'accelerometer', 'long-term care', 'muscle strength', 'residential care communities', 'standing balance']",Standing balance and strength measurements in older adults living in residential care communities.,"Research on balance and mobility in older adults has been conducted primarily in lab-based settings in individuals who live in the community. Although they are at greater risk of falls, residents of long-term care facilities, specifically residential care communities (RCCs), have been investigated much less frequently. We sought to determine the feasibility of using portable technology-based measures of balance and muscle strength (i.e., an accelerometer and a load cell) that can be used in any RCC facility. Twenty-nine subjects (age 87 ± 6 years) living in RCCs participated. An accelerometer placed on the back of the subjects measured body sway during different standing conditions. Sway in antero-posterior and mediolateral directions was calculated. Lower extremity strength was measured with a portable load cell and the within-visit reliability was determined. Assessments of grip strength, gait speed, frailty, and comorbidity were also examined. A significant increase in postural sway in both the AP and ML directions occurred as the balance conditions became more difficult due to alteration of sensory feedback (p < 0.001) or reducing the base of support (p < 0.001). There was an association between increased sway and increased frailty, more comorbidities and slower gait speed. All strength measurements were highly reliable (ICC = 0.93-0.99). An increase in lower extremity strength was associated with increased grip strength and gait speed. The portable instruments provide inexpensive ways for measuring balance and strength in the understudied RCC population, but additional studies are needed to examine their relationship with functional outcomes."
2017 Feb 15,NeuroImage,Neuroimage. 2017 Feb 15;147:204-218. doi: 10.1016/j.neuroimage.2016.12.007. Epub ,"['Wijeakumar, Sobanawartiny', 'Huppert, Theodore J', 'Magnotta, Vincent A', 'Buss, Aaron T', 'Spencer, John P']","['adult', 'brain diagnostic imaging', 'brain mapping methods', 'computer simulation', 'female', 'humans', 'image processing, computer-assisted  methods', 'magnetic resonance imaging  methods', 'male', 'memory, short-term  physiology', 'monte carlo method', 'multimodal imaging', 'neuroimaging  methods', 'psychomotor performance physiology', 'reproducibility of results', 'spectroscopy, near-infrared  methods', 'visual perception physiology', 'young adult', 'functional magnetic resonance imaging', 'functional near-infrared spectroscopy', 'image reconstruction', 'visual working memory', 'working memory load']",Validating an image-based fNIRS approach with fMRI and a working memory task.,"In the current study, we extend a previous methodological pipeline by adding a novel image reconstruction approach to move functional near-infrared (fNIRS) signals from channel-space on the surface of the head to voxel-space within the brain volume. We validate this methodology by comparing voxel-wise fNIRS results to functional magnetic resonance imaging (fMRI) results from a visual working memory (VWM) task using two approaches. In the first approach, significant voxel-wise correlations were observed between fNIRS and fMRI measures for all experimental conditions across brain regions in the fronto-parieto-temporal cortices. In the second approach, we conducted separate multi-factorial ANOVAs on fNIRS and fMRI measures and then examined the correspondence between main and interaction effects within common regions of interest. Both fMRI and fNIRS showed similar trends in activation within the VWM network when the number of items held in working memory increases. These results validate the image-based fNIRS approach."
2017 Feb 15,Behavioural brain research,Behav Brain Res. 2017 Feb 15;319:87-95. doi: 10.1016/j.bbr.2016.11.021. Epub 2016 ,"['Karim, Helmet T', 'Huppert, Theodore J', 'Erickson, Kirk I', 'Wollam, Mariegold E', 'Sparto, Patrick J', 'Sejdić, Ervin', 'VanSwearingen, Jessie M']","['adult', 'brain diagnostic imaging  physiology', ' brain mapping', 'female', 'functional laterality', 'healthy volunteers', 'humans', 'imaging, three-dimensional', 'learning  physiology', 'linear models', 'magnetic resonance imaging', 'male', 'motor skills  physiology', 'neural pathways diagnostic imaging physiology', 'oxygen blood', 'young adult', 'functional connectivity', 'motor learning', 'motor skill', 'gppi']",Motor sequence learning-induced neural efficiency in functional brain connectivity.,"Previous studies have shown the functional neural circuitry differences before and after an explicitly learned motor sequence task, but have not assessed these changes during the process of motor skill learning. Functional magnetic resonance imaging activity was measured while participants (n=13) were asked to tap their fingers to visually presented sequences in blocks that were either the same sequence repeated (learning block) or random sequences (control block). Motor learning was associated with a decrease in brain activity during learning compared to control. Lower brain activation was noted in the posterior parietal association area and bilateral thalamus during the later periods of learning (not during the control). Compared to the control condition, we found the task-related motor learning was associated with decreased connectivity between the putamen and left inferior frontal gyrus and left middle cingulate brain regions. Motor learning was associated with changes in network activity, spatial extent, and connectivity."
2017 Jun,Developmental cognitive neuroscience,Dev Cogn Neurosci. 2017 Jun;25:138-144. doi: 10.1016/j.dcn.2016.07.002. Epub 2016 ,"['Li, Yanwei', 'Grabell, Adam S', 'Wakschlag, Lauren S', 'Huppert, Theodore J', 'Perlman, Susan B']","['child, preschool', 'cognition  physiology', 'female', 'humans', 'irritable mood  physiology', 'male', 'spectroscopy, near-infrared  methods', 'cognitive flexibility', 'early childhood', 'irritability', 'neurodevelopment', 'fnirs']",The neural substrates of cognitive flexibility are related to individual differences in preschool irritability: A fNIRS investigation.,"Preschool (age 3-5) is a phase of rapid development in both cognition and emotion, making this a period in which the neurodevelopment of each domain is particularly sensitive to that of the other. During this period, children rapidly learn how to flexibly shift their attention between competing demands and, at the same time, acquire critical emotion regulation skills to respond to negative affective challenges. The integration of cognitive flexibility and individual differences in irritability may be an important developmental process of early childhood maturation. However, at present it is unclear if they share common neural substrates in early childhood. Our main goal was to examine the neural correlates of cognitive flexibility in preschool children and test for associations with irritability. Forty-six preschool aged children completed a novel, child-appropriate, Stroop task while dorsolateral prefrontal cortex (DLPFC) activation was recorded using functional Near Infrared Spectroscopy (fNIRS). Parents rated their child's irritability. Results indicated that left DLPFC activation was associated with cognitive flexibility and positively correlated with irritability. Right DLPFC activation was also positively correlated with irritability. Results suggest the entwined nature of cognitive and emotional neurodevelopment during a developmental period of rapid and mutual acceleration."
2016 Apr,Neurophotonics,Neurophotonics. 2016 Apr;3(2):025004. doi: 10.1117/1.NPh.3.2.025004. Epub 2016 ,"['Aarabi, Ardalan', 'Huppert, Theodore J']","['near-infrared spectroscopy', 'oxygenated deoxygenated hemoglobin', 'physiological noise', 'resting state', 'signal decomposition', 'single-channel independent component analysis']",Characterization of the relative contributions from systemic physiological noise to whole-brain resting-state functional near-infrared spectroscopy data using single-channel independent component analysis.,"Functional near-infrared spectroscopy (fNIRS) is a noninvasive neuroimaging technique used to measure changes in oxygenated hemoglobin (oxy-Hb) and deoxygenated hemoglobin (deoxy-Hb) in the brain. In this study, we present a decomposition approach based on single-channel independent component analysis (scICA) to investigate the contribution of physiological noise to fNIRS signals during rest. Single-channel ICA is an underdetermined decomposition method, which separates a single time series into components containing nonredundant spectral information. Using scICA, fNIRS signals from a total of 17 subjects were decomposed into the constituent physiological components. The percentage contribution of the classes of physiology to the fNIRS signals including low-frequency (LF) fluctuations, respiration, and cardiac oscillations was estimated using spectral domain classification methods. Our results show that LF oscillations accounted for 40% to 55% of total power of both the oxy-Hb and deoxy-Hb signals. Respiration and its harmonics accounted for 10% to 30% of the power, and cardiac pulsations and cardio-respiratory components accounted for 10% to 30%. We describe this scICA method for decomposing fNIRS signals, which unlike other approaches to spatial covariance reduction is applicable to both single- or multiple-channel fNIRS signals and discuss how this approach allows functionally distinct sources of noise with disjoint spectral support to be separated from obscuring systemic physiology."
2016 Mar 1,Biomedical optics express,Biomed Opt Express. 2016 Feb 23;7(3):979-1002. doi: 10.1364/BOE.7.000979. ,"['Harrivel, Angela R', 'Weissman, Daniel H', 'Noll, Douglas C', 'Huppert, Theodore', 'Peltier, Scott J']","['(300.0300) spectroscopy', '(300.6340) spectroscopy, infrared']",Dynamic filtering improves attentional state prediction with fNIRS.,"Brain activity can predict a person's level of engagement in an attentional task. However, estimates of brain activity are often confounded by measurement artifacts and systemic physiological noise. The optimal method for filtering this noise - thereby increasing such state prediction accuracy - remains unclear. To investigate this, we asked study participants to perform an attentional task while we monitored their brain activity with functional near infrared spectroscopy (fNIRS). We observed higher state prediction accuracy when noise in the fNIRS hemoglobin [Hb] signals was filtered with a non-stationary (adaptive) model as compared to static regression (84% ± 6% versus 72% ± 15%)."
