time,journal,doi_info,authors,key words,title,abstract
2016,Journal of pathology informatics,J Pathol Inform. 2016 Nov 29;7:47. doi: 10.4103/2153-3539.194839. eCollection ,"['Spagnolo, Daniel M', 'Gyanchandani, Rekha', 'Al-Kofahi, Yousef', 'Stern, Andrew M', 'Lezon, Timothy R', 'Gough, Albert', 'Meyer, Dan E', 'Ginty, Fiona', 'Sarachan, Brion', 'Fine, Jeffrey', 'Lee, Adrian V', 'Taylor, D Lansing', 'Chennubhotla, S Chakra']","['computational pathology', 'multiplexed immunofluorescence', 'pointwise mutual information', 'tumor heterogeneity', 'tumor microenvironment']",Pointwise mutual information quantifies intratumor heterogeneity in tissue sections labeled with multiple fluorescent biomarkers.,"BACKGROUND: Measures of spatial intratumor heterogeneity are potentially important diagnostic biomarkers for cancer progression, proliferation, and response to therapy. Spatial relationships among cells including cancer and stromal cells in the tumor microenvironment (TME) are key contributors to heterogeneity. METHODS: We demonstrate how to quantify spatial heterogeneity from immunofluorescence pathology samples, using a set of 3 basic breast cancer biomarkers as a test case. We learn a set of dominant biomarker intensity patterns and map the spatial distribution of the biomarker patterns with a network. We then describe the pairwise association statistics for each pattern within the network using pointwise mutual information (PMI) and visually represent heterogeneity with a two-dimensional map. RESULTS: We found a salient set of 8 biomarker patterns to describe cellular phenotypes from a tissue microarray cohort containing 4 different breast cancer subtypes. After computing PMI for each pair of biomarker patterns in each patient and tumor replicate, we visualize the interactions that contribute to the resulting association statistics. Then, we demonstrate the potential for using PMI as a diagnostic biomarker, by comparing PMI maps and heterogeneity scores from patients across the 4 different cancer subtypes. Estrogen receptor positive invasive lobular carcinoma patient, AL13-6, exhibited the highest heterogeneity score among those tested, while estrogen receptor negative invasive ductal carcinoma patient, AL13-14, exhibited the lowest heterogeneity score. CONCLUSIONS: This paper presents an approach for describing intratumor heterogeneity, in a quantitative fashion (via PMI), which departs from the purely qualitative approaches currently used in the clinic. PMI is generalizable to highly multiplexed/hyperplexed immunofluorescence images, as well as spatial data from complementary in situ methods including FISSEQ and CyTOF, sampling many different components within the TME. We hypothesize that PMI will uncover key spatial interactions in the TME that contribute to disease proliferation and progression."
2017 Feb,Clinics in liver disease,Clin Liver Dis. 2017 Feb;21(1):197-214. doi: 10.1016/j.cld.2016.08.013.,"['Vernetti, Lawrence A', 'Vogt, Andreas', 'Gough, Albert', 'Taylor, D Lansing']","['animals', 'chemical and drug induced liver injury  prevention & control', ' drug design', 'drug discovery', 'drug evaluation, preclinical  methods', 'evolution, chemical', 'humans', 'liver  drug effects', 'mammals', 'models, animal', 'predictive value of tests', 'risk assessment', 'drug discovery', 'drug-induced liver injury', 'human liver models', 'in\xa0vitro hepatotoxicity', 'liver toxicology', 'microphysiology liver', 'quantitative system pharmacology']",Evolution of Experimental Models of the Liver to Predict Human Drug Hepatotoxicity and Efficacy.,"In this article, we review the past applications of in vitro models in identifying human hepatotoxins and then focus on the use of multiscale experimental models in drug development, including the use of zebrafish and human cell-based, 3-dimensional, microfluidic systems of liver functions as key components in applying Quantitative Systems Pharmacology (QSP). We have implemented QSP as a platform to improve the rate of success in the process of drug discovery and development of therapeutics."
2016 Sep,"Experimental biology and medicine (Maywood, N.J.)",Exp Biol Med (Maywood). 2016 Sep;241(15):1639-52. doi: 10.1177/1535370216658144. ,"['Clark, Amanda M', 'Ma, Bo', 'Taylor, D Lansing', 'Griffith, Linda', 'Wells, Alan']","['biomimetics', 'hepatic stellate cells pathology', 'humans', 'kupffer cells pathology', 'liver pathology', 'neoplasm metastasis pathology', 'tumor microenvironment  physiology', 'liver metastasis', 'hepatic niche', 'metastatic models', 'microphysiological', 'tumor microenvironment']",Liver metastases: Microenvironments and ex-vivo models.,"The liver is a highly metastasis-permissive organ, tumor seeding of which usually portends mortality. Its unique and diverse architectural and cellular composition enable the liver to undertake numerous specialized functions, however, this distinctive biology, notably its hemodynamic features and unique microenvironment, renders the liver intrinsically hospitable to disseminated tumor cells. The particular focus for this perspective is the bidirectional interactions between the disseminated tumor cells and the unique resident cell populations of the liver; notably, parenchymal hepatocytes and non-parenchymal liver sinusoidal endothelial, Kupffer, and hepatic stellate cells. Understanding the early steps in the metastatic seeding, including the decision to undergo dormancy versus outgrowth, has been difficult to study in 2D culture systems and animals due to numerous limitations. In response, tissue-engineered biomimetic systems have emerged. At the cutting-edge of these developments are ex vivo 'microphysiological systems' (MPS) which are cellular constructs designed to faithfully recapitulate the structure and function of a human organ or organ regions on a milli- to micro-scale level and can be made all human to maintain species-specific interactions. Hepatic MPSs are particularly attractive for studying metastases as in addition to the liver being a main site of metastatic seeding, it is also the principal site of drug metabolism and therapy-limiting toxicities. Thus, using these hepatic MPSs will enable not only an enhanced understanding of the fundamental aspects of metastasis but also allow for therapeutic agents to be fully studied for efficacy while also monitoring pharmacologic aspects and predicting toxicities. The review discusses some of the hepatic MPS models currently available and although only one MPS has been validated to relevantly modeling metastasis, it is anticipated that the adaptation of the other hepatic models to include tumors will not be long in coming."
2016 Sep,Molecular & cellular proteomics : MCP,Mol Cell Proteomics. 2016 Sep;15(9):3045-57. doi: 10.1074/mcp.M115.057729. Epub ,"['Erdem, Cemal', 'Nagle, Alison M', 'Casa, Angelo J', 'Litzenburger, Beate C', 'Wang, Yu-Fen', 'Taylor, D Lansing', 'Lee, Adrian V', 'Lezon, Timothy R']","['breast neoplasms  metabolism', 'cell line, tumor', 'female', 'gene expression regulation, neoplastic drug effects', 'gene regulatory networks drug effects', 'humans', 'insulin  pharmacology', 'insulin-like growth factor i  pharmacology', 'mcf-7 cells', 'proteomics  methods', 'regression analysis', 'signal transduction drug effects']",Proteomic Screening and Lasso Regression Reveal Differential Signaling in Insulin and Insulin-like Growth Factor I (IGF1) Pathways.,"Insulin and insulin-like growth factor I (IGF1) influence cancer risk and progression through poorly understood mechanisms. To better understand the roles of insulin and IGF1 signaling in breast cancer, we combined proteomic screening with computational network inference to uncover differences in IGF1 and insulin induced signaling. Using reverse phase protein array, we measured the levels of 134 proteins in 21 breast cancer cell lines stimulated with IGF1 or insulin for up to 48 h. We then constructed directed protein expression networks using three separate methods: (i) lasso regression, (ii) conventional matrix inversion, and (iii) entropy maximization. These networks, named here as the time translation models, were analyzed and the inferred interactions were ranked by differential magnitude to identify pathway differences. The two top candidates, chosen for experimental validation, were shown to regulate IGF1/insulin induced phosphorylation events. First, acetyl-CoA carboxylase (ACC) knock-down was shown to increase the level of mitogen-activated protein kinase (MAPK) phosphorylation. Second, stable knock-down of E-Cadherin increased the phospho-Akt protein levels. Both of the knock-down perturbations incurred phosphorylation responses stronger in IGF1 stimulated cells compared with insulin. Overall, the time-translation modeling coupled to wet-lab experiments has proven to be powerful in inferring differential interactions downstream of IGF1 and insulin signaling, in vitro."
2016 Jun 1,Applied in vitro toxicology,Appl In Vitro Toxicol. 2016 Jun 1;2(2):103-117. doi: 10.1089/aivt.2016.0011.,"['Gough, Albert', 'Vernetti, Lawrence', 'Bergenthal, Luke', 'Shun, Tong Ying', 'Taylor, D Lansing']","['computational toxicology', 'high throughput', 'in vitro methods', 'liver', 'multi-organ models']",The Microphysiology Systems Database for Analyzing and Modeling Compound Interactions with Human and Animal Organ Models.,"Microfluidic human organ models, microphysiology systems (MPS), are currently being developed as predictive models of drug safety and efficacy in humans. To design and validate MPS as predictive of human safety liabilities requires safety data for a reference set of compounds, combined with in vitro data from the human organ models. To address this need, we have developed an internet database, the MPS database (MPS-Db), as a powerful platform for experimental design, data management, and analysis, and to combine experimental data with reference data, to enable computational modeling. The present study demonstrates the capability of the MPS-Db in early safety testing using a human liver MPS to relate the effects of tolcapone and entacapone in the in vitro model to human in vivo effects. These two compounds were chosen to be evaluated as a representative pair of marketed drugs because they are structurally similar, have the same target, and were found safe or had an acceptable risk in preclinical and clinical trials, yet tolcapone induced unacceptable levels of hepatotoxicity while entacapone was found to be safe. Results demonstrate the utility of the MPS-Db as an essential resource for relating in vitro organ model data to the multiple biochemical, preclinical, and clinical data sources on in vivo drug effects."
2016 Jul,Journal of biomolecular screening,J Biomol Screen. 2016 Jul;21(6):521-34. doi: 10.1177/1087057116635818. Epub 2016 ,"['Stern, Andrew M', 'Schurdak, Mark E', 'Bahar, Ivet', 'Berg, Jeremy M', 'Taylor, D Lansing']","['disease progression', ' drug design', ' drug discovery', 'drug industry trends', 'humans', ' models, biological', ' precision medicine', 'drug discovery', 'novel therapeutic strategies', 'personalized medicine', 'quantitative systems pharmacology']",A Perspective on Implementing a Quantitative Systems Pharmacology Platform for Drug Discovery and the Advancement of Personalized Medicine.,"Drug candidates exhibiting well-defined pharmacokinetic and pharmacodynamic profiles that are otherwise safe often fail to demonstrate proof-of-concept in phase II and III trials. Innovation in drug discovery and development has been identified as a critical need for improving the efficiency of drug discovery, especially through collaborations between academia, government agencies, and industry. To address the innovation challenge, we describe a comprehensive, unbiased, integrated, and iterative quantitative systems pharmacology (QSP)-driven drug discovery and development strategy and platform that we have implemented at the University of Pittsburgh Drug Discovery Institute. Intrinsic to QSP is its integrated use of multiscale experimental and computational methods to identify mechanisms of disease progression and to test predicted therapeutic strategies likely to achieve clinical validation for appropriate subpopulations of patients. The QSP platform can address biological heterogeneity and anticipate the evolution of resistance mechanisms, which are major challenges for drug development. The implementation of this platform is dedicated to gaining an understanding of mechanism(s) of disease progression to enable the identification of novel therapeutic strategies as well as repurposing drugs. The QSP platform will help promote the paradigm shift from reactive population-based medicine to proactive personalized medicine by focusing on the patient as the starting and the end point."
2015,Journal of pathology informatics,J Pathol Inform. 2015 Aug 31;6:48. doi: 10.4103/2153-3539.163987. eCollection ,"['Prichard, Jeffrey W', 'Davison, Jon M', 'Campbell, Bruce B', 'Repa, Kathleen A', 'Reese, Lia M', 'Nguyen, Xuan M', 'Li, Jinhong', 'Foxwell, Tyler', 'Taylor, D Lansing', 'Critchley-Thorne, Rebecca J']","[""barrett's esophagus"", 'tissuecypher™', 'biomarkers', 'computer vision', 'digital pathology', 'high-grade dysplasia', 'multiplexed immunofluorescence', 'quantitative image analysis', 'reactive atypia', 'stromal cells']",TissueCypher(™): A systems biology approach to anatomic pathology.,"BACKGROUND: Current histologic methods for diagnosis are limited by intra- and inter-observer variability. Immunohistochemistry (IHC) methods are frequently used to assess biomarkers to aid diagnoses, however, IHC staining is variable and nonlinear and the manual interpretation is subjective. Furthermore, the biomarkers assessed clinically are typically biomarkers of epithelial cell processes. Tumors and premalignant tissues are not composed only of epithelial cells but are interacting systems of multiple cell types, including various stromal cell types that are involved in cancer development. The complex network of the tissue system highlights the need for a systems biology approach to anatomic pathology, in which quantification of system processes is combined with informatics tools to produce actionable scores to aid clinical decision-making. AIMS: Here, we describe a quantitative, multiplexed biomarker imaging approach termed TissueCypher™ that applies systems biology to anatomic pathology. Applications of TissueCypher™ in understanding the tissue system of Barrett's esophagus (BE) and the potential use as an adjunctive tool in the diagnosis of BE are described. PATIENTS AND METHODS: The TissueCypher™ Image Analysis Platform was used to assess 14 epithelial and stromal biomarkers with known diagnostic significance in BE in a set of BE biopsies with nondysplastic BE with reactive atypia (RA, n = 22) and Barrett's with high-grade dysplasia (HGD, n = 17). Biomarker and morphology features were extracted and evaluated in the confirmed BE HGD cases versus the nondysplastic BE cases with RA. RESULTS: Multiple image analysis features derived from epithelial and stromal biomarkers, including immune biomarkers and morphology, showed significant differences between HGD and RA. CONCLUSIONS: The assessment of epithelial cell abnormalities combined with an assessment of cellular changes in the lamina propria may serve as an adjunct to conventional pathology in the assessment of BE."
2016 Jan,"Experimental biology and medicine (Maywood, N.J.)",Exp Biol Med (Maywood). 2016 Jan;241(1):101-14. doi: 10.1177/1535370215592121. ,"['Vernetti, Lawrence A', 'Senutovitch, Nina', 'Boltz, Robert', 'DeBiasio, Richard', 'Shun, Tong Ying', 'Gough, Albert', 'Taylor, D Lansing']","[' biomarkers, pharmacological', 'biosensing techniques methods', 'cell survival', 'drug evaluation, preclinical  methods', 'humans', 'liver  drug effects  physiology', ' liver, artificial', 'luminescent proteins analysis', 'microfluidics  methods', 'organ culture techniques  methods', 'time factors', 'in\xa0vitro liver model', 'hepatotoxicity', 'high content analysis', 'liver disease models', 'microfluidics', 'microphysiology systems']","A human liver microphysiology platform for investigating physiology, drug safety, and disease models.","This paper describes the development and characterization of a microphysiology platform for drug safety and efficacy in liver models of disease that includes a human, 3D, microfluidic, four-cell, sequentially layered, self-assembly liver model (SQL-SAL); fluorescent protein biosensors for mechanistic readouts; as well as a microphysiology system database (MPS-Db) to manage, analyze, and model data. The goal of our approach is to create the simplest design in terms of cells, matrix materials, and microfluidic device parameters that will support a physiologically relevant liver model that is robust and reproducible for at least 28 days for stand-alone liver studies and microfluidic integration with other organs-on-chips. The current SQL-SAL uses primary human hepatocytes along with human endothelial (EA.hy926), immune (U937) and stellate (LX-2) cells in physiological ratios and is viable for at least 28 days under continuous flow. Approximately, 20% of primary hepatocytes and/or stellate cells contain fluorescent protein biosensors (called sentinel cells) to measure apoptosis, reactive oxygen species (ROS) and/or cell location by high content analysis (HCA). In addition, drugs, drug metabolites, albumin, urea and lactate dehydrogenase (LDH) are monitored in the efflux media. Exposure to 180 μM troglitazone or 210 μM nimesulide produced acute toxicity within 2-4 days, whereas 28 μM troglitazone produced a gradual and much delayed toxic response over 21 days, concordant with known mechanisms of toxicity, while 600 µM caffeine had no effect. Immune-mediated toxicity was demonstrated with trovafloxacin with lipopolysaccharide (LPS), but not levofloxacin with LPS. The SQL-SAL exhibited early fibrotic activation in response to 30 nM methotrexate, indicated by increased stellate cell migration, expression of alpha-smooth muscle actin and collagen, type 1, alpha 2. Data collected from the in vitro model can be integrated into a database with access to related chemical, bioactivity, preclinical and clinical information uploaded from external databases for constructing predictive models."
2015 Jun,"Experimental biology and medicine (Maywood, N.J.)",Exp Biol Med (Maywood). 2015 Jun;240(6):795-808. doi: 10.1177/1535370215584934. ,"['Senutovitch, Nina', 'Vernetti, Lawrence', 'Boltz, Robert', 'DeBiasio, Richard', 'Gough, Albert', 'Taylor, D Lansing']","['animals', 'biosensing techniques  methods', 'humans', ' imaging, three-dimensional', 'luminescent proteins  chemistry', 'molecular imaging  methods', 'microphysiology systems', 'fluorescence microscopy', 'fluorescent probes', 'fluorescent protein biosensors', 'fluorescent proteins', 'high-content screening']",Fluorescent protein biosensors applied to microphysiological systems.,"This mini-review discusses the evolution of fluorescence as a tool to study living cells and tissues in vitro and the present role of fluorescent protein biosensors (FPBs) in microphysiological systems (MPSs). FPBs allow the measurement of temporal and spatial dynamics of targeted cellular events involved in normal and perturbed cellular assay systems and MPSs in real time. FPBs evolved from fluorescent analog cytochemistry (FAC) that permitted the measurement of the dynamics of purified proteins covalently labeled with environmentally insensitive fluorescent dyes and then incorporated into living cells, as well as a large list of diffusible fluorescent probes engineered to measure environmental changes in living cells. In parallel, a wide range of fluorescence microscopy methods were developed to measure the chemical and molecular activities of the labeled cells, including ratio imaging, fluorescence lifetime, total internal reflection, 3D imaging, including super-resolution, as well as high-content screening. FPBs evolved from FAC by combining environmentally sensitive fluorescent dyes with proteins in order to monitor specific physiological events such as post-translational modifications, production of metabolites, changes in various ion concentrations, and the dynamic interaction of proteins with defined macromolecules in time and space within cells. Original FPBs involved the engineering of fluorescent dyes to sense specific activities when covalently attached to particular domains of the targeted protein. The subsequent development of fluorescent proteins (FPs), such as the green fluorescent protein, dramatically accelerated the adoption of studying living cells, since the genetic ""labeling"" of proteins became a relatively simple method that permitted the analysis of temporal-spatial dynamics of a wide range of proteins. Investigators subsequently engineered the fluorescence properties of the FPs for environmental sensitivity that, when combined with targeted proteins/peptides, created a new generation of FPBs. Examples of FPBs that are useful in MPS are presented, including the design, testing, and application in a liver MPS."
2015 Jan 1,"Bioinformatics (Oxford, England)",Bioinformatics. 2015 Jan 1;31(1):131-3. doi: 10.1093/bioinformatics/btu599. Epub ,"['Cobanoglu, Murat Can', 'Oltvai, Zoltán N', 'Taylor, D Lansing', 'Bahar, Ivet']","[' databases, pharmaceutical', ' databases, protein', ' drug discovery', 'drug repositioning', 'humans', ' internet', ' software']",BalestraWeb: efficient online evaluation of drug-target interactions.,"SUMMARY: BalestraWeb is an online server that allows users to instantly make predictions about the potential occurrence of interactions between any given drug-target pair, or predict the most likely interaction partners of any drug or target listed in the DrugBank. It also permits users to identify most similar drugs or most similar targets based on their interaction patterns. Outputs help to develop hypotheses about drug repurposing as well as potential side effects. AVAILABILITY AND IMPLEMENTATION: BalestraWeb is accessible at http://balestra.csb.pitt.edu/. The tool is built using a probabilistic matrix factorization method and DrugBank v3, and the latent variable models are trained using the GraphLab collaborative filtering toolkit. The server is implemented using Python, Flask, NumPy and SciPy."
2014,PloS one,PLoS One. 2014 Jul 18;9(7):e102678. doi: 10.1371/journal.pone.0102678. ,"['Gough, Albert H', 'Chen, Ning', 'Shun, Tong Ying', 'Lezon, Timothy R', 'Boltz, Robert C', 'Reese, Celeste E', 'Wagner, Jacob', 'Vernetti, Lawrence A', 'Grandis, Jennifer R', 'Lee, Adrian V', 'Stern, Andrew M', 'Schurdak, Mark E', 'Taylor, D Lansing']","['cell line, tumor', 'drug discovery  methods', 'humans', 'mcf-7 cells', 'stat3 transcription factor metabolism']",Identifying and quantifying heterogeneity in high content analysis: application of heterogeneity indices to drug discovery.,"One of the greatest challenges in biomedical research, drug discovery and diagnostics is understanding how seemingly identical cells can respond differently to perturbagens including drugs for disease treatment. Although heterogeneity has become an accepted characteristic of a population of cells, in drug discovery it is not routinely evaluated or reported. The standard practice for cell-based, high content assays has been to assume a normal distribution and to report a well-to-well average value with a standard deviation. To address this important issue we sought to define a method that could be readily implemented to identify, quantify and characterize heterogeneity in cellular and small organism assays to guide decisions during drug discovery and experimental cell/tissue profiling. Our study revealed that heterogeneity can be effectively identified and quantified with three indices that indicate diversity, non-normality and percent outliers. The indices were evaluated using the induction and inhibition of STAT3 activation in five cell lines where the systems response including sample preparation and instrument performance were well characterized and controlled. These heterogeneity indices provide a standardized method that can easily be integrated into small and large scale screening or profiling projects to guide interpretation of the biology, as well as the development of therapeutics and diagnostics. Understanding the heterogeneity in the response to perturbagens will become a critical factor in designing strategies for the development of therapeutics including targeted polypharmacology."
