time,journal,doi_info,authors,key words,title,abstract
2020 Nov 15,Journal of neurotrauma,J Neurotrauma. 2020 Nov 15;37(22):2353-2371. doi: 10.1089/neu.2018.6203. Epub ,"['Kochanek, Patrick M', 'Jackson, Travis C', 'Jha, Ruchira M', 'Clark, Robert S B', 'Okonkwo, David O', 'Bayır, Hülya', 'Poloyac, Samuel M', 'Wagner, Amy K', 'Empey, Philip E', 'Conley, Yvette P', 'Bell, Michael J', 'Kline, Anthony E', 'Bondi, Corina O', 'Simon, Dennis W', 'Carlson, Shaun W', 'Puccio, Ava M', 'Horvat, Christopher M', 'Au, Alicia K', 'Elmer, Jonathan', 'Treble-Barna, Amery', 'Ikonomovic, Milos D', 'Shutter, Lori A', 'Taylor, D Lansing', 'Stern, Andrew M', 'Graham, Steven H', 'Kagan, Valerian E', 'Jackson, Edwin K', 'Wisniewski, Stephen R', 'Dixon, C Edward']","['animals', 'brain injuries, traumatic  drug therapy', 'humans', 'neuroprotective agents pharmacology', ' translational research, biomedical', 'clinical trial design', 'combination therapy', 'consortium', 'neuroprotection', 'pharmacodynamics response biomarker', 'phenotyping', 'quantitative systems pharmacology', 'rehabilitation', 'target engagement', 'traumatic brain injury (tbi)']",Paths to Successful Translation of New Therapies for Severe Traumatic Brain Injury in the Golden Age of Traumatic Brain Injury Research: A Pittsburgh Vision.,"New neuroprotective therapies for severe traumatic brain injury (TBI) have not translated from pre-clinical to clinical success. Numerous explanations have been suggested in both the pre-clinical and clinical arenas. Coverage of TBI in the lay press has reinvigorated interest, creating a golden age of TBI research with innovative strategies to circumvent roadblocks. We discuss the need for more robust therapies. We present concepts for traditional and novel approaches to defining therapeutic targets. We review lessons learned from the ongoing work of the pre-clinical drug and biomarker screening consortium Operation Brain Trauma Therapy and suggest ways to further enhance pre-clinical consortia. Biomarkers have emerged that empower choice and assessment of target engagement by candidate therapies. Drug combinations may be needed, and it may require moving beyond conventional drug therapies. Precision medicine may also link the right therapy to the right patient, including new approaches to TBI classification beyond the Glasgow Coma Scale or anatomical phenotyping-incorporating new genetic and physiologic approaches. Therapeutic breakthroughs may also come from alternative approaches in clinical investigation (comparative effectiveness, adaptive trial design, use of the electronic medical record, and big data). The full continuum of care must also be represented in translational studies, given the important clinical role of pre-hospital events, extracerebral insults in the intensive care unit, and rehabilitation. TBI research from concussion to coma can cross-pollinate and further advancement of new therapies. Misconceptions can stifle/misdirect TBI research and deserve special attention. Finally, we synthesize an approach to deliver therapeutic breakthroughs in this golden age of TBI research."
2018 Aug 21,Lab on a chip,Lab Chip. 2018 Aug 21;18(17):2614-2631. doi: 10.1039/c8lc00418h.,"['Li, Xiang', 'George, Subin M', 'Vernetti, Lawrence', 'Gough, Albert H', 'Taylor, D Lansing']","['acinar cells  cytology drug effects', ' glass', 'humans', ' lab-on-a-chip devices', 'liver  cytology', ' neovascularization, physiologic drug effects', 'reactive oxygen species metabolism', 'tissue array analysis  instrumentation']","A glass-based, continuously zonated and vascularized human liver acinus microphysiological system (vLAMPS) designed for experimental modeling of diseases and ADME/TOX.","The vLAMPS is a human, biomimetic liver MPS, in which the ECM and cell seeding of the intermediate layer prior to assembly, simplifies construction of the model and makes the platform user-friendly. This primarily glass microfluidic device is optimal for real-time imaging, while minimizing the binding of hydrophobic drugs/biologics to the materials that constitute the device. The assembly of the three layered device with primary human hepatocytes and liver sinusoidal endothelial cells (LSECs), and human cell lines for stellate and Kupffer cells, creates a vascular channel separated from the hepatic channel (chamber) by a porous membrane that allows communication between channels, recapitulating the 3D structure of the liver acinus. The vascular channel can be used to deliver drugs, immune cells, as well as various circulating cells and other factors to a stand-alone liver MPS and/or to couple the liver MPS to other organ MPS. We have successfully created continuous oxygen zonation by controlling the flow rates of media in the distinct vascular and hepatic channels and validated the computational modeling of zonation with oxygen sensitive and insensitive beads. This allows the direct investigation of the role of zonation in physiology, toxicology and disease progression. The vascular channel is lined with human LSECs, recapitulating partial immunologic functions within the liver sinusoid, including the activation of LSECs, promoting the binding of polymorphonuclear leukocytes (PMNs) followed by transmigration into the hepatic chamber. The vLAMPS is a valuable platform to investigate the functions of the healthy and diseased human liver using all primary human cell types and/or iPSC-derived cells."
2018,"Methods in molecular biology (Clifton, N.J.)",Methods Mol Biol. 2018;1787:207-222. doi: 10.1007/978-1-4939-7847-2_16.,"['Schurdak, Mark E', 'Pei, Fen', 'Lezon, Timothy R', 'Carlisle, Diane', 'Friedlander, Robert', 'Taylor, D Lansing', 'Stern, Andrew M']","['biomarkers', 'databases, factual', 'genetic association studies  methods', 'humans', 'huntington disease diagnosis drug therapy etiology metabolism', ' phenotype', 'precision medicine methods', 'systems biology  methods', 'technology, pharmaceutical  methods', 'web browser', 'chemogenomics', 'heterogeneity', 'huntington’s disease', 'phi', 'pittsburgh heterogeneity index', 'precision medicine', 'qsp', 'quantitative systems pharmacology']",A Quantitative Systems Pharmacology Approach to Infer Pathways Involved in Complex Disease Phenotypes.,"Designing effective therapeutic strategies for complex diseases such as cancer and neurodegeneration that involve tissue context-specific interactions among multiple gene products presents a major challenge for precision medicine. Safe and selective pharmacological modulation of individual molecular entities associated with a disease often fails to provide efficacy in the clinic. Thus, development of optimized therapeutic strategies for individual patients with complex diseases requires a more comprehensive, systems-level understanding of disease progression. Quantitative systems pharmacology (QSP) is an approach to drug discovery that integrates computational and experimental methods to understand the molecular pathogenesis of a disease at the systems level more completely. Described here is the chemogenomic component of QSP for the inference of biological pathways involved in the modulation of the disease phenotype. The approach involves testing sets of compounds of diverse mechanisms of action in a disease-relevant phenotypic assay, and using the mechanistic information known for the active compounds, to infer pathways and networks associated with the phenotype. The example used here is for monogenic Huntington's disease (HD), which due to the pleiotropic nature of the mutant phenotype has a complex pathogenesis. The overall approach, however, is applicable to any complex disease."
2018 May,Clinical and translational science,Clin Transl Sci. 2018 May;11(3):267-276. doi: 10.1111/cts.12536. Epub 2018 Mar 2.,"['Keating, Susan M', 'Taylor, D Lansing', 'Plant, Anne L', 'Litwack, E David', 'Kuhn, Peter', 'Greenspan, Emily J', 'Hartshorn, Christopher M', 'Sigman, Caroline C', 'Kelloff, Gary J', 'Chang, David D', 'Friberg, Gregory', 'Lee, Jerry S H', 'Kuida, Keisuke']","['biopsy methods standards', 'health plan implementation  methods organization & administration', 'humans', 'national institutes of health (u.s.) organization & administration', 'neoplasms  diagnosis pathology', 'prognosis', 'single-cell analysis  methods standards', 'translational research, biomedical  methods', 'united states', 'validation studies as topic']",Opportunities and Challenges in Implementation of Multiparameter Single Cell Analysis Platforms for Clinical Translation.,"The high-content interrogation of single cells with platforms optimized for the multiparameter characterization of cells in liquid and solid biopsy samples can enable characterization of heterogeneous populations of cells ex vivo. Doing so will advance the diagnosis, prognosis, and treatment of cancer and other diseases. However, it is important to understand the unique issues in resolving heterogeneity and variability at the single cell level before navigating the validation and regulatory requirements in order for these technologies to impact patient care. Since 2013, leading experts representing industry, academia, and government have been brought together as part of the Foundation for the National Institutes of Health (FNIH) Biomarkers Consortium to foster the potential of high-content data integration for clinical translation."
2018,"Methods in molecular biology (Clifton, N.J.)",Methods Mol Biol. 2018;1745:25-46. doi: 10.1007/978-1-4939-7680-5_2.,"['Gough, Albert', 'Shun, Tong Ying', 'Taylor, D Lansing', 'Schurdak, Mark']","[' biological assay', 'computational biology methods', 'data interpretation, statistical', 'drug discovery methods standards', ' high-throughput screening assays', 'humans', 'quality control', 'reproducibility of results', 'systems biology  methods standards', 'cellular heterogeneity', 'drug discovery', 'high-content screening', 'phenotypic profiling', 'systems biology']",Integrating Analysis of Cellular Heterogeneity in High-Content Dose-Response Studies.,"Heterogeneity is a complex property of cellular systems and therefore presents challenges to the reliable identification and characterization. Large-scale biology projects may span many months, requiring a systematic approach to quality control to track reproducibility and correct for instrumental variation and assay drift that could mask biological heterogeneity and preclude comparisons of heterogeneity between runs or even between plates. However, presently there is no standard approach to the tracking and analysis of heterogeneity. Previously, we demonstrated the use of the Kolmogorov-Smirnov statistic as a metric for monitoring the reproducibility of heterogeneity in a screen and described the use of three heterogeneity indices as a means to characterize, filter, and browse cellular heterogeneity in big data sets (Gough et al., Methods 96:12-26, 2016). In this chapter, we present a detailed method for integrating the analysis of cellular heterogeneity in assay development, validation, screening, and post screen. Importantly, we provide a detailed method for quality control, to normalize cellular data, track heterogeneity over time, and analyze heterogeneity in big data sets, along with software tools to assist in that process. The example screen for this method is from an HCS project, but the approach applies equally to other experimental methods that measure populations of cells."
2018 Feb 1,Experimental cell research,Exp Cell Res. 2018 Feb 1;363(1):15-25. doi: 10.1016/j.yexcr.2017.12.023. Epub ,"['Beckwitt, Colin H', 'Clark, Amanda M', 'Wheeler, Sarah', 'Taylor, D Lansing', 'Stolz, Donna B', 'Griffith, Linda', 'Wells, Alan']","['animals', 'hepatocytes  cytology', 'humans', ' lab-on-a-chip devices', 'liver  cytology', ' microfluidics', 'models, biological', ' tissue engineering', '3d culture systems', 'microphysiologic systems', 'organoids']",Liver 'organ on a chip'.,"The liver plays critical roles in both homeostasis and pathology. It is the major site of drug metabolism in the body and, as such, a common target for drug-induced toxicity and is susceptible to a wide range of diseases. In contrast to other solid organs, the liver possesses the unique ability to regenerate. The physiological importance and plasticity of this organ make it a crucial system of study to better understand human physiology, disease, and response to exogenous compounds. These aspects have impelled many to develop liver tissue systems for study in isolation outside the body. Herein, we discuss these biologically engineered organoids and microphysiological systems. These aspects have impelled many to develop liver tissue systems for study in isolation outside the body. Herein, we discuss these biologically engineered organoids and microphysiological systems."
2017 Dec 19,Scientific reports,Sci Rep. 2017 Dec 19;7(1):17803. doi: 10.1038/s41598-017-17378-y.,"['Pei, Fen', 'Li, Hongchun', 'Henderson, Mark J', 'Titus, Steven A', 'Jadhav, Ajit', 'Simeonov, Anton', 'Cobanoglu, Murat Can', 'Mousavi, Seyed H', 'Shun, Tongying', 'McDermott, Lee', 'Iyer, Prema', 'Fioravanti, Michael', 'Carlisle, Diane', 'Friedlander, Robert M', 'Bahar, Ivet', 'Taylor, D Lansing', 'Lezon, Timothy R', 'Stern, Andrew M', 'Schurdak, Mark E']","['animals', 'cyclic amp-dependent protein kinases metabolism', 'disease models, animal', 'drug combinations', 'huntingtin protein metabolism', 'huntington disease  drug therapy  metabolism', 'mice', 'mutation drug effects', 'neurons  drug effects  metabolism', 'phenotype', 'protective agents  pharmacology', 'signal transduction drug effects', 'small molecule libraries pharmacology']",Connecting Neuronal Cell Protective Pathways and Drug Combinations in a Huntington's Disease Model through the Application of Quantitative Systems Pharmacology.,"Quantitative Systems Pharmacology (QSP) is a drug discovery approach that integrates computational and experimental methods in an iterative way to gain a comprehensive, unbiased understanding of disease processes to inform effective therapeutic strategies. We report the implementation of QSP to Huntington's Disease, with the application of a chemogenomics platform to identify strategies to protect neuronal cells from mutant huntingtin induced death. Using the STHdh (Q111) cell model, we investigated the protective effects of small molecule probes having diverse canonical modes-of-action to infer pathways of neuronal cell protection connected to drug mechanism. Several mechanistically diverse protective probes were identified, most of which showed less than 50% efficacy. Specific combinations of these probes were synergistic in enhancing efficacy. Computational analysis of these probes revealed a convergence of pathways indicating activation of PKA. Analysis of phospho-PKA levels showed lower cytoplasmic levels in STHdh (Q111) cells compared to wild type STHdh (Q7) cells, and these levels were increased by several of the protective compounds. Pharmacological inhibition of PKA activity reduced protection supporting the hypothesis that protection may be working, in part, through activation of the PKA network. The systems-level studies described here can be broadly applied to any discovery strategy involving small molecule modulation of disease phenotype."
2017 Nov 1,Cancer research,Cancer Res. 2017 Nov 1;77(21):e71-e74. doi: 10.1158/0008-5472.CAN-17-0676.,"['Spagnolo, Daniel M', 'Al-Kofahi, Yousef', 'Zhu, Peihong', 'Lezon, Timothy R', 'Gough, Albert', 'Stern, Andrew M', 'Lee, Adrian V', 'Ginty, Fiona', 'Sarachan, Brion', 'Taylor, D Lansing', 'Chennubhotla, S Chakra']","['algorithms', ' genetic heterogeneity', 'humans', 'image processing, computer-assisted methods', 'neoplasms  genetics pathology', 'optical imaging methods  statistics & numerical data', ' software', 'tissue array analysis statistics & numerical data']",Platform for Quantitative Evaluation of Spatial Intratumoral Heterogeneity in Multiplexed Fluorescence Images.,"We introduce THRIVE (Tumor Heterogeneity Research Interactive Visualization Environment), an open-source tool developed to assist cancer researchers in interactive hypothesis testing. The focus of this tool is to quantify spatial intratumoral heterogeneity (ITH), and the interactions between different cell phenotypes and noncellular constituents. Specifically, we foresee applications in phenotyping cells within tumor microenvironments, recognizing tumor boundaries, identifying degrees of immune infiltration and epithelial/stromal separation, and identification of heterotypic signaling networks underlying microdomains. The THRIVE platform provides an integrated workflow for analyzing whole-slide immunofluorescence images and tissue microarrays, including algorithms for segmentation, quantification, and heterogeneity analysis. THRIVE promotes flexible deployment, a maintainable code base using open-source libraries, and an extensible framework for customizing algorithms with ease. THRIVE was designed with highly multiplexed immunofluorescence images in mind, and, by providing a platform to efficiently analyze high-dimensional immunofluorescence signals, we hope to advance these data toward mainstream adoption in cancer research. Cancer Res; 77(21); e71-74. ©2017 AACR."
2017 Oct,"Experimental biology and medicine (Maywood, N.J.)",Exp Biol Med (Maywood). 2017 Oct;242(16):1617-1632. doi: ,"['Lee-Montiel, Felipe T', 'George, Subin M', 'Gough, Albert H', 'Sharma, Anup D', 'Wu, Juanfang', 'DeBiasio, Richard', 'Vernetti, Lawrence A', 'Taylor, D Lansing']","['acetaminophen toxicity', 'cell line', 'fatty liver pathology', 'glucose metabolism', 'glycolysis physiology', 'hepatocytes  metabolism', 'humans', 'interleukin-6 metabolism', 'lab-on-a-chip devices', 'lipopolysaccharides', 'liver  metabolism', 'macrophages cytology', 'microchip analytical procedures  methods', 'microfluidics  methods', 'monocytes cytology', 'oxidative phosphorylation', 'oxygen  metabolism', 'oxygen consumption  physiology', 'tumor necrosis factor-alpha metabolism', 'u937 cells', 'liver', 'microphysiology systems', 'oxygen', 'zonation']",Control of oxygen tension recapitulates zone-specific functions in human liver microphysiology systems.,"This article describes our next generation human Liver Acinus MicroPhysiology System (LAMPS). The key demonstration of this study was that Zone 1 and Zone 3 microenvironments can be established by controlling the oxygen tension in individual devices over the range of ca. 3 to 13%. The oxygen tension was computationally modeled using input on the microfluidic device dimensions, numbers of cells, oxygen consumption rates of hepatocytes, the diffusion coefficients of oxygen in different materials and the flow rate of media in the MicroPhysiology System (MPS). In addition, the oxygen tension was measured using a ratiometric imaging method with the oxygen sensitive dye, Tris(2,2'-bipyridyl) dichlororuthenium(II) hexahydrate (RTDP) and the oxygen insensitive dye, Alexa 488. The Zone 1 biased functions of oxidative phosphorylation, albumin and urea secretion and Zone 3 biased functions of glycolysis, α1AT secretion, Cyp2E1 expression and acetaminophen toxicity were demonstrated in the respective Zone 1 and Zone 3 MicroPhysiology System. Further improvements in the Liver Acinus MicroPhysiology System included improved performance of selected nonparenchymal cells, the inclusion of a porcine liver extracellular matrix to model the Space of Disse, as well as an improved media to support both hepatocytes and non-parenchymal cells. In its current form, the Liver Acinus MicroPhysiology System is most amenable to low to medium throughput, acute through chronic studies, including liver disease models, prioritizing compounds for preclinical studies, optimizing chemistry in structure activity relationship (SAR) projects, as well as in rising dose studies for initial dose ranging. Impact statement Oxygen zonation is a critical aspect of liver functions. A human microphysiology system is needed to investigate the impact of zonation on a wide range of liver functions that can be experimentally manipulated. Because oxygen zonation has such diverse physiological effects in the liver, we developed and present a method for computationally modeling and measuring oxygen that can easily be implemented in all MPS models. We have applied this method in a liver MPS in which we are then able to control oxygenation in separate devices and demonstrate that zonation-dependent hepatocyte functions in the MPS recapitulate what is known about in vivo liver physiology. We believe that this advance allows a deep experimental investigation on the role of zonation in liver metabolism and disease. In addition, modeling and measuring oxygen tension will be required as investigators migrate from PDMS to plastic and glass devices."
2017 Mar,SLAS discovery : advancing life sciences R & D,SLAS Discov. 2017 Mar;22(3):213-237. doi: 10.1177/2472555216682725. Epub 2017 Jan ,"['Gough, Albert', 'Stern, Andrew M', 'Maier, John', 'Lezon, Timothy', 'Shun, Tong-Ying', 'Chennubhotla, Chakra', 'Schurdak, Mark E', 'Haney, Steven A', 'Taylor, D Lansing']","['decision making', 'decision support techniques', 'drug discovery methods', 'flow cytometry methods standards', ' genetic heterogeneity', 'histocytochemistry methods standards', 'humans', 'imaging, three-dimensional methods standards', ' machine learning', 'neoplasms  drug therapy genetics pathology', 'precision medicine  methods', 'reference values', 'single-cell analysis methods standards', 'systems biology  methods statistics & numerical data', 'cellular models', 'computational pathology', 'drug discovery', 'flow cytometry', 'heterogeneity', 'high-content screening', 'organs-on-chips', 'precision medicine', 'quantitative systems pharmacology', 'systems biology']",Biologically Relevant Heterogeneity: Metrics and Practical Insights.,"Heterogeneity is a fundamental property of biological systems at all scales that must be addressed in a wide range of biomedical applications, including basic biomedical research, drug discovery, diagnostics, and the implementation of precision medicine. There are a number of published approaches to characterizing heterogeneity in cells in vitro and in tissue sections. However, there are no generally accepted approaches for the detection and quantitation of heterogeneity that can be applied in a relatively high-throughput workflow. This review and perspective emphasizes the experimental methods that capture multiplexed cell-level data, as well as the need for standard metrics of the spatial, temporal, and population components of heterogeneity. A recommendation is made for the adoption of a set of three heterogeneity indices that can be implemented in any high-throughput workflow to optimize the decision-making process. In addition, a pairwise mutual information method is suggested as an approach to characterizing the spatial features of heterogeneity, especially in tissue-based imaging. Furthermore, metrics for temporal heterogeneity are in the early stages of development. Example studies indicate that the analysis of functional phenotypic heterogeneity can be exploited to guide decisions in the interpretation of biomedical experiments, drug discovery, diagnostics, and the design of optimal therapeutic strategies for individual patients."
2017 Feb 8,Scientific reports,Sci Rep. 2017 Feb 8;7:42296. doi: 10.1038/srep42296.,"['Vernetti, Lawrence', 'Gough, Albert', 'Baetz, Nicholas', 'Blutt, Sarah', 'Broughman, James R', 'Brown, Jacquelyn A', 'Foulke-Abel, Jennifer', 'Hasan, Nesrin', 'In, Julie', 'Kelly, Edward', 'Kovbasnjuk, Olga', 'Repper, Jonathan', 'Senutovitch, Nina', 'Stabb, Janet', 'Yeung, Catherine', 'Zachos, Nick C', 'Donowitz, Mark', 'Estes, Mary', 'Himmelfarb, Jonathan', 'Truskey, George', 'Wikswo, John P', 'Taylor, D Lansing']","['biological transport drug effects', 'blood-brain barrier  physiology', 'cholecalciferol metabolism', 'humans', 'intestines  physiology', 'kidney tubules, proximal  physiology', 'liver  physiology', 'metabolome', 'methylamines metabolism', 'muscle, skeletal  physiology', 'organ specificity', 'terfenadine pharmacology']","Functional Coupling of Human Microphysiology Systems: Intestine, Liver, Kidney Proximal Tubule, Blood-Brain Barrier and Skeletal Muscle.","Organ interactions resulting from drug, metabolite or xenobiotic transport between organs are key components of human metabolism that impact therapeutic action and toxic side effects. Preclinical animal testing often fails to predict adverse outcomes arising from sequential, multi-organ metabolism of drugs and xenobiotics. Human microphysiological systems (MPS) can model these interactions and are predicted to dramatically improve the efficiency of the drug development process. In this study, five human MPS models were evaluated for functional coupling, defined as the determination of organ interactions via an in vivo-like sequential, organ-to-organ transfer of media. MPS models representing the major absorption, metabolism and clearance organs (the jejunum, liver and kidney) were evaluated, along with skeletal muscle and neurovascular models. Three compounds were evaluated for organ-specific processing: terfenadine for pharmacokinetics (PK) and toxicity; trimethylamine (TMA) as a potentially toxic microbiome metabolite; and vitamin D3. We show that the organ-specific processing of these compounds was consistent with clinical data, and discovered that trimethylamine-N-oxide (TMAO) crosses the blood-brain barrier. These studies demonstrate the potential of human MPS for multi-organ toxicity and absorption, distribution, metabolism and excretion (ADME), provide guidance for physically coupling MPS, and offer an approach to coupling MPS with distinct media and perfusion requirements."
