time,journal,doi_info,authors,key words,title,abstract
2023 Dec 29,Journal of neural engineering,J Neural Eng. 2023 Dec 29;20(6). doi: 10.1088/1741-2552/ad17f2.,"['Ivanov, Nicolas', 'Lio, Aaron', 'Chau, Tom']","['adolescent', 'humans', ' brain-computer interfaces', 'markov chains', 'electroencephalography methods', 'imagery, psychotherapy', 'movement', 'brain', 'eeg', 'markov chain', 'brain–computer interface', 'mental imagery', 'unsupervised learning', 'user assessment']",Towards user-centric BCI design: Markov chain-based user assessment for mental imagery EEG-BCIs.,
2023,Frontiers in computational neuroscience,Front Comput Neurosci. 2023 Nov 17;17:1286681. doi: 10.3389/fncom.2023.1286681. ,"['Ivanov, Nicolas', 'Chau, Tom']","['riemannian geometry', 'brain-computer interface (bci)', 'electroencephalography (eeg)', 'simulation', 'user evaluation', 'user training']",Corrigendum: Riemannian geometry-based metrics to measure and reinforce user performance changes during brain-computer interface user training.,[This corrects the article DOI: 10.3389/fncom.2023.1108889.].
2023 Sep,International journal of neural systems,Int J Neural Syst. 2023 Sep;33(9):2350048. doi: 10.1142/S012906572350048X. Epub ,"['Moon, Jae', 'Chau, Tom']","['humans', 'speech', 'electroencephalography methods', 'vocabulary', 'auditory perception', ' speech perception', ' brain-computer interfaces', 'brain–computer interface', 'covert speech', 'machine learning', 'neural oscillations', 'speech perception']",Online Ternary Classification of Covert Speech by Leveraging the Passive Perception of Speech.,Brain-computer interfaces (B
2023,Frontiers in human neuroscience,Front Hum Neurosci. 2023 May 16;17:1201623. doi: 10.3389/fnhum.2023.1201623. ,"['Kirton, Adam', 'Kinney-Lang, Eli', 'Norton, James', 'Chau, Tom']","['assistive technological devices', 'brain-computer interface', 'communication', 'pediatrics', 'severe disabilities']",Editorial: BCIs: research and development in children.,
2023 Jul,The European journal of neuroscience,Eur J Neurosci. 2023 Jul;58(1):2367-2383. doi: 10.1111/ejn.16036. Epub 2023 May ,"['Kang, Kyurim', 'Orlandi, Silvia', 'Leung, Jason', 'Akter, Masuma', 'Lorenzen, Nicole', 'Chau, Tom', 'Thaut, Michael H']","['humans', ' music', ' autism spectrum disorder therapy', ' disabled children', ' cerebral palsy', 'diencephalon', 'parents psychology', 'children with disabilities', 'electroencephalography (eeg)', 'hyperscanning', 'interbrain synchronization', 'music therapy']","Electroencephalographic interbrain synchronization in children with disabilities, their parents, and neurologic music therapists.","As with typically developing children, children with cerebral palsy and autism spectrum disorder develop important socio-emotional rapport with their parents and healthcare providers. However, the neural mechanisms underlying these relationships have been less studied. By simultaneously measuring the brain activity of multiple individuals, interbrain synchronization could serve as a neurophysiological marker of social-emotional responses. Music evokes emotional and physiological responses and enhances social cohesion. These characteristics of music have fostered its deployment as a therapeutic medium in clinical settings. Therefore, this study investigated two aspects of interbrain synchronization, namely, its phase and directionality, in child-parent (CP) and child-therapist (CT) dyads during music and storytelling sessions (as a comparison). A total of 17 participants (seven cerebral palsy or autism spectrum disorder children [aged 12-18 years], their parents, and three neurologic music therapists) completed this study, comprising seven CP and seven CT dyads. Each music therapist worked with two or three children. We found that session type, dyadic relationship, frequency band, and brain region were significantly related to the degree of interbrain synchronization and its directionality. Particularly, music sessions and CP dyads were associated with higher interbrain synchronization and stronger directionality. Delta (.5-4 Hz) range showed the highest phase locking value in both CP and CT dyads in frontal brain regions. It appears that synchronization is directed predominantly from parent to child, that is, parents and music therapists' brain activity tended to influence a child's. Our findings encourage further research into neural synchrony in children with disabilities, especially in musical contexts, and its implications for social and emotional development."
2023,Frontiers in computational neuroscience,Front Comput Neurosci. 2023 Feb 13;17:1108889. doi: 10.3389/fncom.2023.1108889. ,"['Ivanov, Nicolas', 'Chau, Tom']","['riemannian geometry', 'brain-computer interface (bci)', 'electroencephalography (eeg)', 'simulation', 'user evaluation', 'user training']",Riemannian geometry-based metrics to measure and reinforce user performance changes during brain-computer interface user training.,Despite growing interest and research into brain-computer interfaces (B
2022,Frontiers in human neuroscience,Front Hum Neurosci. 2022 Sep 23;16:938708. doi: 10.3389/fnhum.2022.938708. ,"['Floreani, Erica D', 'Orlandi, Silvia', 'Chau, Tom']","['affective state', 'alternative and augmentative communication', 'brain-computer interface', 'functional near-infrared spectroscopy', 'neurofeedback', 'pediatric']",A pediatric near-infrared spectroscopy brain-computer interface based on the detection of emotional valence.,Brain-computer interfaces (B
2022,Frontiers in computational neuroscience,Front Comput Neurosci. 2022 Jun 16;16:875282. doi: 10.3389/fncom.2022.875282. ,"['Nazneen, Tahnia', 'Islam, Iffath Binta', 'Sajal, Md Sakibur Rahman', 'Jamal, Wasifa', 'Amin, M Ashraful', 'Vaidyanathan, Ravi', 'Chau, Tom', 'Mamun, Khondaker A']","['behavioral cognition', 'brain dynamics', 'brain-to-brain synchrony', 'interbrain synchrony', 'neuroscience', 'psychology', 'synchrony measure']",Recent Trends in Non-invasive Neural Recording Based Brain-to-Brain Synchrony Analysis on Multidisciplinary Human Interactions for Understanding Brain Dynamics: A Systematic Review.,The study of brain-to-brain synchrony has a burgeoning application in the brain-computer interface (B
2022 Aug,Developmental neurorehabilitation,Dev Neurorehabil. 2022 Aug;25(6):426-432. doi: 10.1080/17518423.2022.2051628. ,"['Kang, Kyurim', 'Orlandi, Silvia', 'Lorenzen, Nicole', 'Chau, Tom', 'Thaut, Michael H']","['adolescent', 'brain', ' cerebral palsy', 'diencephalon', 'electroencephalography', 'female', 'humans', ' music', 'parents', 'music', 'electroencephalography (eeg)', 'empathy and social interaction', 'hyperscanning', 'interbrain synchronization', 'non-speaking cerebral palsy (cp)']","Does music induce interbrain synchronization between a non-speaking youth with cerebral palsy (CP), a parent, and a neurologic music therapist? A brief report.","Shared emotional experiences during musical activities among musicians can be coupled with brainwave synchronization. For non-speaking individuals with CP, verbal communication may be limited in expressing mutual empathy. Therefore, this case study explored interbrain synchronization among a non-speaking CP (female, 18 yrs), her parent, and a music therapist by measuring their brainwaves simultaneously during four music and four storytelling sessions. In only the youth-parent dyad, we observed a significantly higher level of interbrain synchronization during music rather than story-telling condition. However, in both the youth-parent and youth-therapist dyad, regardless of condition type, significant interbrain synchronization emerged in frontal and temporal lobes in the low-frequency bands, which are associated with socio-emotional responses. Although interbrain synchronization may have been induced by multiple factors (e.g., external stimuli, shared empathetic experiences, and internal physiological rhythms), the music activity setting deserves further study as a potential facilitator of neurophysiological synchrony between youth with CP and caregivers/healthcare providers."
2022 Apr 15,Brain research,Brain Res. 2022 Apr 15;1781:147778. doi: 10.1016/j.brainres.2022.147778. Epub ,"['Moon, Jae', 'Orlandi, Silvia', 'Chau, Tom']","[' brain-computer interfaces', 'electroencephalography', 'humans', 'speech', ' speech perception', 'wavelet analysis', 'brain-computer interface', 'covert speech', 'eeg', 'neural oscillation', 'phase-amplitude coupling', 'speech perception']",A comparison and classification of oscillatory characteristics in speech perception and covert speech.,"Covert speech, the mental imagery of speaking, has been studied increasingly to understand and decode thoughts in the context of brain-computer interfaces. In studies of speech comprehension, neural oscillations are thought to play a key role in the temporal encoding of speech. However, little is known about the role of oscillations in covert speech. In this study, we investigated the oscillatory involvements in covert speech and speech perception. Data were collected from 10 participants with 64 channel EEG. Participants heard the words, 'blue' and 'orange', and subsequently mentally rehearsed them. First, continuous wavelet transform was performed on epoched signals and subsequently two-tailed t-tests between two classes (tasks) were conducted to determine statistical differences in frequency and time (t-CWT). In the current experiment, a task comprised speech perception or covert rehearsal of a word while a condition was the discrimination between tasks. Features were extracted using t-CWT and subsequently classified using a support vector machine. θ and γ phase amplitude coupling (PAC) was also assessed within tasks and across conditions between perception and covert activities (i.e. cross-task). All binary classifications accuracies (80-90%) significantly exceeded chance level, supporting the use of t-CWT in determining relative oscillatory involvements. While the perception condition dynamically invoked all frequencies with more prominent θ and α activity, the covert condition favoured higher frequencies with significantly higher γ activity than perception. Moreover, the perception condition produced significant θ-γ PAC, possibly corroborating a reported linkage between syllabic and phonemic sampling. Although this coupling was found to be suppressed in the covert condition, we found significant cross-task coupling between perception θ and covert speech γ. Covert speech processing appears to be largely associated with higher frequencies of EEG. Importantly, the significant cross-task coupling between speech perception and covert speech, in the absence of within-task covert speech PAC, seems to support the notion that the γ- and θ-bands reflect, respectively, shared and unique encoding processes across tasks."
2021,PloS one,PLoS One. 2021 Sep 3;16(9):e0257029. doi: 10.1371/journal.pone.0257029. ,"['Schudlo, Larissa C', 'Anagnostou, Evdokia', 'Chau, Tom', 'Doyle-Thomas, Krissy']","['adolescent', 'autism spectrum disorder diagnosis  diagnostic imaging', 'brain diagnostic imaging', 'child', 'cold temperature', 'humans', 'pain physiopathology', 'sensation  physiology', ' spectroscopy, near-infrared', 'time factors']",Investigating sensory response to physical discomfort in children with autism spectrum disorder using near-infrared spectroscopy.,"Self-reporting of pain can be difficult in populations with communication challenges or atypical sensory processing, such as children with autism spectrum disorder (ASD). Consequently, pain can go untreated. An objective method to identify discomfort would be valuable to individuals unable to express or recognize their own bodily distress. Near-infrared spectroscopy (NIRS) is a brain-imaging modality that is suited for this application. We evaluated the potential of detecting a cortical response to discomfort in the ASD population using NIRS. Using a continuous-wave spectrometer, prefrontal and parietal measures were collected from 15 males with ASD and 7 typically developing (TD) males 10-15 years of age. Participants were exposed to a noxious cold stimulus by immersing their hands in cold water and tepid water as a baseline task. Across all participants, the magnitude and timing of the cold and tepid water-induced brain responses were significantly different (p < 0.001). The effect of the task on the brain response depended on the study group (group x task: p < 0.001), with the ASD group exhibiting a blunted response to the cold stimulus. Findings suggest that NIRS may serve as a tool for objective pain assessment and atypical sensory processing."
2021,Frontiers in human neuroscience,Front Hum Neurosci. 2021 Jul 14;15:643294. doi: 10.3389/fnhum.2021.643294. ,"['Orlandi, Silvia', 'House, Sarah C', 'Karlsson, Petra', 'Saab, Rami', 'Chau, Tom']","['assistive technology', 'brain-computer interface', 'children', 'communication', 'environmental control', 'severe disability', 'youth']",Brain-Computer Interfaces for Children With Complex Communication Needs and Limited Mobility: A Systematic Review.,Brain-computer interfaces (B
2021,Frontiers in neuroscience,Front Neurosci. 2021 Apr 30;15:531915. doi: 10.3389/fnins.2021.531915. ,"['Samadani, Ali', 'Kim, Song', 'Moon, Jae', 'Kang, Kyurim', 'Chau, Tom']","['eeg', 'child-parent dyad', 'children with severe physical disabilities', 'granger influence', 'interbrain synchrony', 'music therapy', 'neural synchrony', 'spectral coherence']",Neurophysiological Synchrony Between Children With Severe Physical Disabilities and Their Parents During Music Therapy.,"Although physiological synchronization has been associated with the level of empathy in emotionally meaningful relationships, little is known about the interbrain synchrony between non-speaking children with severe disabilities and their familial caregivers. In a repeated measures observational study, we ascertained the degree of interbrain synchrony during music therapy in 10 child-parent dyads, where the children were non-speaking and living with severe motor impairments. Interbrain synchrony was quantified via measurements of spectral coherence and Granger causality between child and parent electroencephalographic (EEG) signals collected during ten 15-min music therapy sessions per dyad, where parents were present as non-participating, covert observers. Using cluster-based permutation tests, we found significant child-parent interbrain synchrony, manifesting most prominently across dyads in frontal brain regions within β and low γ frequencies. Specifically, significant dyadic coherence was observed contra-laterally, between child frontal right and parental frontal left regions at β and lower γ bands in empathy-related brain areas. Furthermore, significant Granger influences were detected bidirectionally (from child to parent and vice versa) in the same frequency bands. In all dyads, significant increases in session-specific coherence and Granger influences were observed over the time course of a music therapy session. The observed interbrain synchrony suggests a cognitive-emotional coupling during music therapy between child and parent that is responsive to change. These findings encourage further study of the socio-empathic capacity and interpersonal relationships formed between caregivers and non-speaking children with severe physical impairments."
2021 Jun,Developmental medicine and child neurology,Dev Med Child Neurol. 2021 Jun;63(6):637-648. doi: 10.1111/dmcn.14800. Epub 2021 ,"['Raghuram, Kamini', 'Orlandi, Silvia', 'Church, Paige', 'Chau, Tom', 'Uleryk, Elizabeth', 'Pechlivanoglou, Petros', 'Shah, Vibhuti']","['humans', 'infant', 'motor disorders  diagnosis physiopathology', 'movement  physiology', 'sensitivity and specificity']",Automated movement recognition to predict motor impairment in high-risk infants: a systematic review of diagnostic test accuracy and meta-analysis.,"AIM: To assess the sensitivity and specificity of automated movement recognition in predicting motor impairment in high-risk infants. METHOD: We searched MEDLINE, Embase, PsycINFO,"
2020,Frontiers in human neuroscience,Front Hum Neurosci. 2020 Dec 3;14:593883. doi: 10.3389/fnhum.2020.593883. ,"['Kinney-Lang, Eli', 'Kelly, Dion', 'Floreani, Erica D', 'Jadavji, Zeanna', 'Rowley, Danette', 'Zewdie, Ephrem Takele', 'Anaraki, Javad R', 'Bahari, Hosein', 'Beckers, Kim', 'Castelane, Karen', 'Crawford, Lindsey', 'House, Sarah', 'Rauh, Chelsea A', 'Michaud, Amber', 'Mussi, Matheus', 'Silver, Jessica', 'Tuck, Corinne', 'Adams, Kim', 'Andersen, John', 'Chau, Tom', 'Kirton, Adam']","['brain-computer interface', 'brain-machine interface', 'cerebral palsy', 'clinical neuroscience', 'developmental neuroscience', 'neurology', 'pediatrics']",Advancing Brain-Computer Interface Applications for Severely Disabled Children Through a Multidisciplinary National Network: Summary of the Inaugural Pediatric BCI Canada Meeting.,
2021 Apr,Developmental neurorehabilitation,Dev Neurorehabil. 2021 Apr;24(3):187-198. doi: 10.1080/17518423.2020.1825539. ,"['Urban, Karolina', 'Schudlo, Larissa', 'Keightley, Michelle', 'Alain, Sam', 'Reed, Nick', 'Chau, Tom']","['adolescent', 'brain diagnostic imaging  physiopathology', 'brain concussion diagnostic imaging  physiopathology', 'cognition', 'female', 'humans', 'male', 'spectroscopy, near-infrared', ' task performance and analysis', 'young adult']",Altered Brain Activation in Youth following Concussion: Using a Dual-task Paradigm.,"A concussion is known as a functional injury affecting brain communication, integration, and processing. There is a need to objectively measure how concussions disrupt brain activation while completing ecologically relevant tasks.The objective of this study was to compare brain activation patterns between concussion and comparison groups (non-concussed youth) during a cognitive-motor single and dual-task paradigm utilizing functional near-infrared spectroscopy (fNIRS) in regions of the frontal-parietal attention network and compared to task performance.Youth with concussion generally exhibited hyperactivation and recruitment of additional brain regions in the dorsal lateral prefrontal (DLPFC), superior (SPC) and inferior parietal cortices (IPC), which are associated with processing, information integration, and response selection. Additionally, hyper- or hypo-activation patterns were associated with slower processing speed on the cognitive task. Our findings corroborate the growing literature suggesting that neural recovery may be delayed compared to the restoration of behavioral performance post-concussion.Concussion, near-infrared spectroscopy, dual-task paradigm, cognitive, motor, brain activation."
2020 Sep 21,Brain informatics,Brain Inform. 2020 Sep 21;7(1):10. doi: 10.1186/s40708-020-00109-x.,"['Rawnaque, Ferdousi Sabera', 'Rahman, Khandoker Mahmudur', 'Anwar, Syed Ferhat', 'Vaidyanathan, Ravi', 'Chau, Tom', 'Sarker, Farhana', 'Mamun, Khondaker Abdullah Al']","['brain computer interface', 'machine learning algorithm', 'marketing', 'neural recording', 'neuromarketing']",Technological advancements and opportunities in Neuromarketing: a systematic review.,"Neuromarketing has become an academic and commercial area of interest, as the advancements in neural recording techniques and interpreting algorithms have made it an effective tool for recognizing the unspoken response of consumers to the marketing stimuli. This article presents the very first systematic review of the technological advancements in Neuromarketing field over the last 5 years. For this purpose, authors have selected and reviewed a total of 57 relevant literatures from valid databases which directly contribute to the Neuromarketing field with basic or empirical research findings. This review finds consumer goods as the prevalent marketing stimuli used in both product and promotion forms in these selected literatures. A trend of analyzing frontal and prefrontal alpha band signals is observed among the consumer emotion recognition-based experiments, which corresponds to frontal alpha asymmetry theory. The use of electroencephalogram (EEG) is found favorable by many researchers over functional magnetic resonance imaging (fMRI) in video advertisement-based Neuromarketing experiments, apparently due to its low cost and high time resolution advantages. Physiological response measuring techniques such as eye tracking, skin conductance recording, heart rate monitoring, and facial mapping have also been found in these empirical studies exclusively or in parallel with brain recordings. Alongside traditional filtering methods, independent component analysis (ICA) was found most commonly in artifact removal from neural signal. In consumer response prediction and classification, Artificial Neural Network (ANN), Support Vector Machine (SVM) and Linear Discriminant Analysis (LDA) have performed with the highest average accuracy among other machine learning algorithms used in these literatures. The authors hope, this review will assist the future researchers with vital information in the field of Neuromarketing for making novel contributions."
2020 Jun,International journal of neural systems,Int J Neural Syst. 2020 Jun;30(6):2050026. doi: 10.1142/S0129065720500264.,"['Stojic, Filip', 'Chau, Tom']","['adult', 'alpha rhythm physiology', ' brain-computer interfaces', ' electroencephalography', 'feedback, sensory  physiology', 'humans', 'imagination  physiology', ' intention', 'pattern recognition, visual  physiology', 'space perception  physiology', 'visual cortex  physiology', 'bci', 'electroencephalography', 'imagery', 'online', 'visuospatial']",Nonspecific Visuospatial Imagery as a Novel Mental Task for Online EEG-Based BCI Control.,
2020 Jan 27,Behavioural brain research,Behav Brain Res. 2020 Jan 27;378:112240. doi: 10.1016/j.bbr.2019.112240. Epub ,"['Emami, Zahra', 'Chau, Tom']","['adult', 'alpha rhythm  physiology', 'attention  physiology', ' brain-computer interfaces', 'female', 'fingers physiology', 'humans', 'imagination  physiology', 'male', 'memory, short-term  physiology', 'motor activity  physiology', 'parietal lobe  physiology', 'pattern recognition, visual  physiology', 'theta rhythm  physiology', 'young adult', 'brain-computer interface', 'cognitive load', 'distractor', 'electroencephalography', 'motor imagery', 'theta alpha']",The effects of visual distractors on cognitive load in a motor imagery brain-computer interface.,A brain-computer interface (B
2019 Nov 11,Journal of neural engineering,J Neural Eng. 2019 Nov 11;16(6):066042. doi: 10.1088/1741-2552/ab4943.,"['Yousefi, Rozhin', 'Rezazadeh Sereshkeh, Alborz', 'Chau, Tom']","['adult', 'brain  physiology', ' brain-computer interfaces', 'electroencephalography methods', 'event-related potentials, p300  physiology', 'female', 'humans', 'male', ' mathematical concepts', 'mental processes  physiology', 'spatial processing  physiology']",Development of a robust asynchronous brain-switch using ErrP-based error correction.,OBJECTIVE: The ultimate goal of many brain-computer interface (B
2019 Oct,Journal of perinatology : official journal of the California Perinatal ,J Perinatol. 2019 Oct;39(10):1362-1369. doi: 10.1038/s41372-019-0464-0. Epub 2019 ,"['Raghuram, Kamini', 'Orlandi, Silvia', 'Shah, Vibhuti', 'Chau, Tom', 'Luther, Maureen', 'Banihani, Rudaina', 'Church, Paige']","['cerebral palsy diagnosis', 'female', 'humans', 'infant, low birth weight physiology', 'infant, newborn', 'infant, premature  physiology', 'logistic models', 'male', 'motor activity', 'motor disorders  diagnosis', 'neurologic examination', 'prognosis', 'roc curve', 'retrospective studies', 'sensitivity and specificity', 'video recording']",Automated movement analysis to predict motor impairment in preterm infants: a retrospective study.,"OBJECTIVE: To apply automated movement analysis to the general movements assessment (GMA) to build a predictive model for motor impairment (MI). STUDY DESIGN: A retrospective cohort study including infants ≤30(6/7) weeks GA or BW ≤1500 g seen at 3-5 months was conducted. Automated video analysis was used to develop a multivariable model to identify MI, defined as Bayley motor composite score <85 or cerebral palsy (CP). RESULTS: One hundred and fifty two videos were analyzed. Median GA and BW were 27(5/7) weeks and 955 g, respectively. MI and CP rates were 22% (N = 33) and 14% (N = 22). Minimum, mean, and mean vertical velocity of the infant's silhouette correlated significantly with MI. Sensitivity, specificity, positive and negative predictive values, and accuracy of automated GMA were 79%, 63%, 37%, 91%, and 66%, respectively. C-statistic indicated good fit (C = 0.77). CONCLUSIONS: Automated movement analysis predicts MI in preterm infants. Further refinement of this technology is required for clinical application."
2019 Feb,Journal of neural engineering,J Neural Eng. 2019 Feb;16(1):016005. doi: 10.1088/1741-2552/aae4b9. Epub 2018 Sep ,"['Rezazadeh Sereshkeh, Alborz', 'Yousefi, Rozhin', 'Wong, Andrew T', 'Chau, Tom']","['adult', 'cerebral cortex  physiology', 'female', 'humans', 'imagination  physiology', 'male', 'photic stimulation methods', 'random allocation', 'spectroscopy, near-infrared classification methods', 'speech  physiology', 'young adult']",Online classification of imagined speech using functional near-infrared spectroscopy signals.,OBJECTIVE: Most brain-computer interfaces (B
