time,journal,doi_info,authors,key words,title,abstract
2019 Jul,Disability and rehabilitation. Assistive technology,Disabil Rehabil Assist Technol. 2019 Jul;14(5):434-444. doi: ,"['Fleury, Amanda', 'Wu, Gloria', 'Chau, Tom']","['adolescent', ' communication aids for disabled', 'disabled children  rehabilitation', 'equipment design', 'female', 'humans', 'surveys and questionnaires', ' textiles', ' wearable electronic devices', 'speech generating device (sgd)', 'assistive technology', 'augmentative and alternative communication (aac)', 'electronic textile', 'fabric-based switch', 'wearable technology']",A wearable fabric-based speech-generating device: system design and case demonstration.,"Purpose: Existing speech generating devices (SGD) often require caregiver intervention for setup and positioning, and thus limit opportunities for spontaneous social interaction. The advent of conductive fabrics presents an opportunity to render SGDs wearable, thus persistently available. Our goal was to design and test a wearable SGD incorporating resistive textile-based switches for a nonverbal pediatric participant with vision impairment. Materials and methods: Quad-key fabric keypads were designed using two conductive fabrics in combination with felt and mesh insulators. The keypad with the most repeatable low force activations and the least cross-talk among keys was chosen for implementation in a wrist-worn, four-message textile SGD. The fabric-based SGD was used by a nonverbal pediatric participant for two one-week analysis periods, alternating with the user's current device for usage reference. Data were derived from usage logs, parent questionnaires and an end-of-study participant interview. Results: The best performing keypad consisted of two layers of woven conductive fabrics and one layer of insulating felt with 10 mm apertures. Communicative interactions were higher with the fabric-based SGD, particularly at school. Unprompted initiation of communication was observed only with the fabric-based SGD. The persistent availability of the textile solution, along with esthetic appeal likely contributed to its utilization. While the participant preferred the fabric-based SGD, the parent opted for the iPod alternative, citing enhanced message intelligibility. Conclusions: Fabric-based SGDs are a new alternative to conventional SGD designs using rigid electronics. As such, tactile differentiability of keys, device wearability and esthetic personalization may be promising advantages for pediatric users. Implications for rehabilitation Fabric-based switches may be a promising alternative to conventional electro-mechanical switches for the control of speech-generating devices, offering functional (e.g., comfort and tactile differentiability), expressive (e.g., non-stigmatizing textile integration) and esthetic (e.g., colors and textures) appeal. The material combination of two layers of woven conductive material and one insulating layer of felt with 10 mm diameter apertures seems to provide a fabric-based keypad suitable for pediatric use, requiring low-force activation and minimal cross-talk among buttons. Fabric-based devices offer advantages of tactile differentiability and thus may be particularly suited to individuals with vision impairments. Wearable textile SGDs can be persistently available and may thus increase opportunities for communication."
2018 Sep,NeuroImage,Neuroimage. 2018 Sep;178:119-128. doi: 10.1016/j.neuroimage.2018.05.031. Epub ,"['Proulx, Nicole', 'Samadani, Ali-Akbar', 'Chau, Tom']","['adult', 'electroencephalography  methods', 'evoked potentials  physiology', 'female', 'functional neuroimaging  methods', 'humans', 'male', 'prefrontal cortex diagnostic imaging  physiology', 'spectroscopy, near-infrared  methods', 'visual perception  physiology', 'young adult', 'electroencephalography (eeg)', 'event-related potential', 'fast optical signal', 'near-infrared spectroscopy (nirs)', 'prefrontal cortex', 'visual oddball paradigm']",Quantifying fast optical signal and event-related potential relationships during a visual oddball task.,"Event-related potentials (ERPs) have previously been used to confirm the existence of the fast optical signal (FOS) but validation methods have mainly been limited to exploring the temporal correspondence of FOS peaks to those of ERPs. The purpose of this study was to systematically quantify the relationship between FOS and ERP responses to a visual oddball task in both time and frequency domains. Near-infrared spectroscopy (NIRS) and electroencephalography (EEG) sensors were co-located over the prefrontal cortex while participants performed a visual oddball task. Fifteen participants completed 2 data collection sessions each, where they were instructed to keep a mental count of oddball images. The oddball condition produced a positive ERP at 200 ms followed by a negativity 300-500 ms after image onset in the frontal electrodes. In contrast to previous FOS studies, a FOS response was identified only in DC intensity signals and not in phase delay signals. A decrease in DC intensity was found 150-250 ms after oddball image onset with a 400-trial average in 10 of 15 participants. The latency of the positive 200 ms ERP and the FOS DC intensity decrease were significantly correlated for only 6 (out of 15) participants due to the low signal-to-noise ratio of the FOS response. Coherence values between the FOS and ERP oddball responses were found to be significant in the 3-5 Hz frequency band for 10 participants. A significant Granger causal influence of the ERP on the FOS oddball response was uncovered in the 2-6 Hz frequency band for 7 participants. Collectively, our findings suggest that, for a majority of participants, the ERP and the DC intensity signal of the FOS are spectrally coherent, specifically in narrow frequency bands previously associated with event-related oscillations in the prefrontal cortex. However, these electro-optical relationships were only found in a subset of participants. Further research on enhancing the quality of the event-related FOS signal is required before it can be practically exploited in applications such as brain-computer interfacing."
2018 Aug,Journal of electromyography and kinesiology : official journal of the ,J Electromyogr Kinesiol. 2018 Aug;41:34-40. doi: 10.1016/j.jelekin.2018.04.001. ,"['Plewa, Katherine', 'Samadani, Ali', 'Orlandi, Silvia', 'Chau, Tom']","['adult', 'algorithms', 'electromyography  methods', 'female', 'gait', 'humans', 'lower extremity physiology', 'male', 'muscle, skeletal physiology']",A novel approach to automatically quantify the level of coincident activity between EMG and MMG signals.,"Although previous studies have highlighted both similarities and differences between the timing of electromyography (EMG) and mechanomyography (MMG) activities of muscles, there is no method to systematically quantify the temporal alignment between corresponding EMG and MMG signals. We proposed a novel method to determine the level of coincident activity in quasi-periodic MMG and EMG signals. The method optimizes 3 muscle-specific parameters: amplitude threshold, window size and minimum percent of EMG and MMG overlap using a particle swarm optimization algorithm to maximize the agreement (balanced accuracy) between electrical and mechanical muscle activity. The method was applied to bilaterally recorded EMG and MMG signals from 4 lower limb muscles per side of 25 pediatric participants during self-paced gait. Mean balanced accuracy exceeded 75% for all muscles except the lateral gastrocnemius, where EMG and MMG misalignment was notable (56% balanced accuracy). The proposed method can be applied to the criterion-driven comparison of simultaneously recorded myographic signals from two different measurement modalities during a motor task."
2018 Jun,Clinical neurophysiology : official journal of the International Federation of ,Clin Neurophysiol. 2018 Jun;129(6):1268-1275. doi: 10.1016/j.clinph.2018.03.015. ,"['Emami, Zahra', 'Chau, Tom']","['adult', 'attention  physiology', 'beta rhythm  physiology', 'brain  physiology', 'brain-computer interfaces', 'electroencephalography', 'female', 'humans', 'imagination  physiology', 'male', 'movement  physiology', 'neurofeedback', 'psychomotor performance physiology', 'young adult', 'beta rhythm', 'brain-computer interface', 'distractor', 'electroencephalography', 'motor imagery', 'mu rhythm']",Investigating the effects of visual distractors on the performance of a motor imagery brain-computer interface.,OBJECTIVES: Brain-computer interfaces (B
2018 May,International journal of neural systems,Int J Neural Syst. 2018 May;28(4):1750052. doi: 10.1142/S0129065717500526. Epub ,"['Schudlo, Larissa C', 'Chau, Tom']","['attention physiology', 'brain physiology', ' brain-computer interfaces', 'computer simulation', 'humans', 'memory, short-term physiology', 'rest', ' spectroscopy, near-infrared', 'speech physiology', 'stroop test', 'visual perception physiology', 'near-infrared spectroscopy', 'attention', 'brain-computer interface', 'feedback', 'ternary classification', 'working memory']","Development of a Ternary Near-Infrared Spectroscopy Brain-Computer Interface: Online Classification of Verbal Fluency Task, Stroop Task and Rest.",The majority of proposed NIRS-B
2017 Dec,International journal of neural systems,Int J Neural Syst. 2017 Dec;27(8):1750033. doi: 10.1142/S0129065717500332. Epub ,"['Sereshkeh, Alborz Rezazadeh', 'Trott, Robert', 'Bricout, Aurélien', 'Chau, Tom']","['adult', 'brain  physiology', ' brain-computer interfaces', 'electroencephalography  methods', 'female', 'humans', ' language', 'male', 'support vector machine', 'thinking  physiology', 'time factors', 'wavelet analysis', 'young adult', 'brain–computer interface', 'eeg', 'covert speech, support vector machine, autoregressive model', 'wavelet transform']",Online EEG Classification of Covert Speech for Brain-Computer Interfacing.,Brain-computer interfaces (B
2018 Aug,Disability and rehabilitation. Assistive technology,Disabil Rehabil Assist Technol. 2018 Aug;13(6):581-591. doi: ,"['Schudlo, Larissa C', 'Chau, Tom']","['adult', ' brain-computer interfaces', ' communication aids for disabled', 'congenital abnormalities  rehabilitation', 'disabled persons  rehabilitation', 'equipment design', 'humans', ' infrared rays', 'male', 'psychomotor performance', 'severity of illness index', 'communication; brain–computer interface; near-infrared spectroscopy; congenital']",Development and testing an online near-infrared spectroscopy brain-computer interface tailored to an individual with severe congenital motor impairments.,"PURPOSE: For non-verbal individuals, brain-computer interfaces (B"
2017 Oct,Journal of electromyography and kinesiology : official journal of the ,J Electromyogr Kinesiol. 2017 Oct;36:73-80. doi: 10.1016/j.jelekin.2017.07.002. ,"['Plewa, Katherine', 'Samadani, Ali', 'Chau, Tom']","['accelerometry methods standards', 'adolescent', 'biomechanical phenomena physiology', 'child', 'electromyography  methods standards', 'female', 'gait  physiology', 'humans', 'male', 'muscle contraction  physiology', 'muscle, skeletal  physiology', 'myography methods standards', 'quadriceps muscle physiology', 'electromyography', 'gait', 'mechanomyography', 'muscular activity', 'pediatrics']",Comparing electro- and mechano-myographic muscle activation patterns in self-paced pediatric gait.,"Electromyography (EMG) is the standard modality for measuring muscle activity. However, the convenience and availability of low-cost accelerometer-based wearables makes mechanomyography (MMG) an increasingly attractive alternative modality for clinical applications. Literature to date has demonstrated a strong association between EMG and MMG temporal alignment in isometric and isokinetic contractions. However, the EMG-MMG relationship has not been studied in gait. In this study, the concurrence of EMG- and MMG-detected contractions in the tibialis anterior, lateral gastrocnemius, vastus lateralis, and biceps femoris muscles were investigated in children during self-paced gait. Furthermore, the distribution of signal power over the gait cycle was statistically compared between EMG-MMG modalities. With EMG as the reference, muscular contractions were detected based on MMG with balanced accuracies between 88 and 94% for all muscles except the gastrocnemius. MMG signal power differed from that of EMG during certain phases of the gait cycle in all muscles except the biceps femoris. These timing and power distribution differences between the two modalities may in part be related to muscle fascicle length changes that are unique to muscle motion during gait. Our findings suggest that the relationship between EMG and MMG appears to be more complex during gait than in isometric and isokinetic contractions."
2017 May 15,Journal of health organization and management,J Health Organ Manag. 2017 May 15;31(3):302-316. doi: 10.1108/JHOM-11-2016-0225.,"['King, Gillian', 'Parker, Kathryn', 'Peacocke, Sean', 'Curran, C J', 'McPherson, Amy C', 'Chau, Tom', 'Widgett, Elaine', 'Fehlings, Darcy', 'Milo-Manson, Golda']","['child', ' cooperative behavior', 'humans', ' leadership', ' rehabilitation centers', 'academic health science centre (ahsc)', 'evidence-informed decision making']",Centres for Leadership: a strategy for academic integration.,"Purpose The purpose of this paper is to describe how an Academic Health Science Centre, providing pediatric rehabilitation services, research, and education, developed a Centres for Leadership (CfL) initiative to integrate its academic functions and embrace the goal of being a learning organization. Design/methodology/approach Historical documents, tracked output information, and staff members' insights were used to describe the ten-year evolution of the initiative, its benefits, and transformational learnings for the organization. Findings The evolutions concerned development of a series of CfLs, and changes over time in leadership and management structure, as well as in operations and targeted activities. Benefits included enhanced clinician engagement in research, practice-based research, and impacts on clinical practice. Transformational learnings concerned the importance of supporting stakeholder engagement, fostering a spirit of inquiry, and fostering leaderful practice. These learnings contributed to three related emergent outcomes reflecting ""way stations"" on the journey to enhanced evidence-informed decision making and clinical excellence: enhancements in authentic partnerships, greater innovation capacity, and greater understanding and actualization of leadership values. Practical implications Practical information is provided for other organizations interested in understanding how this initiative evolved, its tangible value, and its wider benefits for organizational collaboration, innovation, and leadership values. Challenges encountered and main messages for other organizations are also considered. Originality/value A strategy map is used to present the structures, processes, and outcomes arising from the initiative, with the goal of informing the operations of other organizations desiring to be learning organizations."
2018 Apr,Disability and rehabilitation,Disabil Rehabil. 2018 Apr;40(7):859-863. doi: 10.1080/09638288.2016.1276973. Epub ,"['Anderson, James', 'Williams, Laura', 'Karmali, Amir', 'Beesley, Lori', 'Tanel, Nadia', 'Doyle-Thomas, Krissy', 'Sheps, Gideon', 'Chau, Tom']","['academic medical centers', 'canada', ' family', 'humans', ' patient participation', ' patient-centered care', 'rehabilitation centers', 'rehabilitation research  organization & administration', 'patient engagement', 'knowledge translation', 'participatory research', 'patient involvement']",Client and family engagement in rehabilitation research: a framework for health care organizations.,"PURPOSE: To describe the development and implementation of an organizational framework for client and family-centered research. METHOD: Case report. RESULTS: While patient-centered care is now well established, patient-centered research remains underdeveloped. This is particularly true at the organizational level (e.g., hospital based research institutes). In this paper we describe the development of an organizational framework for client and family centered research at Holland Bloorview Kids Rehabilitation Hospital in Toronto, Canada. CONCLUSION: It is our hope that, by sharing our framework other research institutions can learn from our experience and develop their own research patient/client/family engagement programs. Implications for rehabilitation Family engagement in rehabilitation research •Rehabilitation research is crucial to the development and improvement of rehabilitative care. •The relevance, appropriateness, and accountability of research to patients, clients and families could be improved. •Engaging clients and families as partners in all aspects of the research process is one way to address this problem. •In this paper, we describe a framework for engaging clients and families in research at the organizational level."
2016 Dec,Journal of neural engineering,J Neural Eng. 2016 Dec;13(6):066012. doi: 10.1088/1741-2560/13/6/066012. Epub ,"['Zeid, Elias Abou', 'Sereshkeh, Alborz Rezazadeh', 'Chau, Tom']","['adult', 'algorithms', 'benchmarking', ' brain-computer interfaces', 'contingent negative variation  physiology', 'electroencephalography methods', 'functional laterality  physiology', 'humans', 'male', 'movement  physiology', 'reproducibility of results', 'somatosensory cortex physiology']",A pipeline of spatio-temporal filtering for predicting the laterality of self-initiated fine movements from single trial readiness potentials.,"OBJECTIVE: In recent years, the readiness potential (RP), a type of pre-movement neural activity, has been investigated for asynchronous electroencephalogram (EEG)-based brain-computer interfaces (B"
2016 Jul,Physical review. E,Phys Rev E. 2016 Jul;94(1-1):012220. doi: 10.1103/PhysRevE.94.012220. Epub 2016 ,"['Saghir, Hamidreza', 'Chau, Tom', 'Kushki, Azadeh']",[],Clustering of time-evolving scaling dynamics in a complex signal.,"Complex time series are widespread in physics and physiology. Multifractal analysis provides a tool to study the scaling dynamics of such time series. However, the temporal evolution of scaling dynamics has been ignored by traditional tools such as the multifractal spectrum. We present scaling maps that add the time dimension to the study of scaling dynamics. This is particularly important in cases in which the dynamics of the underlying processes change in time or in applications that necessitate real-time detection of scaling dynamics. In addition, we present a methodology for automatic clustering of existing scaling regimes in a signal. We demonstrate the methodology on time-evolving correlated and uncorrelated noise and the output of a physiological control system (i.e., cardiac interbeat intervals) in healthy and pathological states."
2016 Apr,Journal of neural engineering,J Neural Eng. 2016 Apr;13(2):026008. doi: 10.1088/1741-2560/13/2/026008. Epub ,"['Zeyl, Timothy', 'Yin, Erwei', 'Keightley, Michelle', 'Chau, Tom']","['adult', ' brain-computer interfaces standards', 'electroencephalography  methods standards', 'event-related potentials, p300  physiology', 'female', 'humans', 'male', 'photic stimulation  methods', 'time factors', ' uncertainty', 'young adult']",Partially supervised P300 speller adaptation for eventual stimulus timing optimization: target confidence is superior to error-related potential score as an uncertain label.,OBJECTIVE: Error-related potentials (ErrPs) have the potential to guide classifier adaptation in B
2016 Mar 15,Journal of neuroscience methods,J Neurosci Methods. 2016 Mar 15;262:77-84. doi: 10.1016/j.jneumeth.2016.01.014. ,"['Myrden, Andrew', 'Chau, Tom']","[' algorithms', 'brain waves  physiology', 'cerebral cortex  physiology', ' cluster analysis', 'electroencephalography  classification  methods', 'humans', 'spectrum analysis', 'brain–computer interface', 'electroencephalography', 'feature extraction', 'feature selection']",Feature clustering for robust frequency-domain classification of EEG activity.,"BACKGROUND: The analysis of electroencephalograms is often performed in the frequency-domain. These analyses typically involve the computation of spectral power either over pre-defined frequency bands (e.g. theta, delta, alpha, and beta bands) or over a large number of narrow frequency ranges. However, the former technique ignores variability in these frequency bands over time and between participants while the latter ignores the significant redundancy between these powers. NEW METHOD: This paper details an unsupervised feature extraction method for EEG data that uses a clustering of features to agglomerate narrow-band spectral powers based on their similarities. This method computes a set of analogues to the traditional frequency bands that are data-driven and participant-specific. A fast correlation-based filter was used to identify which of these agglomerated features were most useful for each investigated classification problem. RESULTS: The new feature clustering algorithm was used to detect changes in three mental states and to detect the performance of three mental tasks. Balanced classification accuracies approaching or exceeding 70% were attained for all classification problems. COMPARISON TO EXISTING METHODS: Classification accuracies attained by this algorithm were compared to those attained by two frequency-domain algorithms that did not employ clustering--a wide-band algorithm based on the spectral power within the theta, delta, alpha, and beta bands and a narrow-band algorithm based on the spectral power within 1-Hz ranges. Overall, the feature clustering algorithm was statistically superior to both alternative algorithms. CONCLUSIONS: The new feature clustering algorithm provides a promising alternative to conventional frequency-domain EEG analysis."
2016 Jun,Neuroscience research,Neurosci Res. 2016 Jun;107:47-56. doi: 10.1016/j.neures.2015.12.013. Epub 2016 ,"['Goyal, Anuja', 'Samadani, Ali-Akbar', 'Guerguerian, Anne-Marie', 'Chau, Tom']","['adult', ' brain-computer interfaces', ' cognition', 'female', 'humans', 'imagination', 'male', 'middle cerebral artery physiology', 'online systems', 'photic stimulation', ' ultrasonography, doppler, transcranial', 'verbal behavior', 'young adult', 'brain computer interface', 'lateralization', 'motor imagery task', 'online', 'spatial task', 'transcranial doppler ultrasound']",An online three-class Transcranial Doppler ultrasound brain computer interface.,Brain computer interfaces (B
2016 Feb,International journal of neural systems,Int J Neural Syst. 2016 Feb;26(1):1650001. doi: 10.1142/S0129065716500015. Epub ,"['Yin, Erwei', 'Zeyl, Timothy', 'Saab, Rami', 'Hu, Dewen', 'Zhou, Zongtan', 'Chau, Tom']","['acoustic stimulation  methods', 'adult', ' brain-computer interfaces', ' event-related potentials, p300', 'female', 'humans', 'male', 'physical stimulation  methods', 'saccades', 'young adult', 'brain–computer interface', 'p300 event-related potentials', 'auditory', 'bimodal stimuli', 'tactile']",An Auditory-Tactile Visual Saccade-Independent P300 Brain-Computer Interface.,Most P300 event-related potential (ERP)-based brain-computer interface (B
2015,Frontiers in human neuroscience,Front Hum Neurosci. 2015 Sep 30;9:536. doi: 10.3389/fnhum.2015.00536. eCollection ,"['Weyand, Sabine', 'Chau, Tom']","['brain–computer interface', 'correlation analysis', 'multi-class', 'near-infrared spectroscopy', 'personalized tasks']",Correlates of Near-Infrared Spectroscopy Brain-Computer Interface Accuracy in a Multi-Class Personalization Framework.,Brain-computer interfaces (B
2017 Feb,Developmental neurorehabilitation,Dev Neurorehabil. 2017 Feb;20(2):99-107. doi: 10.3109/17518423.2015.1087436. Epub ,"['Weyand, Sabine', 'Chau, Tom']","[' brain-computer interfaces', 'humans', 'male', ' mental processes', 'motor disorders psychology  rehabilitation', 'neurological rehabilitation instrumentation  methods', ' nonverbal communication', 'spectroscopy, near-infrared', 'young adult', 'brain–computer interface', 'client case study', 'near-infrared spectroscopy', 'personalized mental tasks']",Challenges of implementing a personalized mental task near-infrared spectroscopy brain-computer interface for a non-verbal young adult with motor impairments.,PURPOSE: Near-infrared spectroscopy brain-computer interfaces (NIRS-B
2015 Dec,Journal of neural engineering,J Neural Eng. 2015 Dec;12(6):066008. doi: 10.1088/1741-2560/12/6/066008. Epub ,"['C Schudlo, Larissa', 'Chau, Tom']","['adult', ' brain-computer interfaces', 'female', 'humans', 'male', 'parietal lobe physiology', 'prefrontal cortex physiology', 'psychomotor performance  physiology', 'reaction time physiology', 'rest  physiology', 'spectroscopy, near-infrared  methods', 'speech  physiology', ' stroop test', 'young adult']","Towards a ternary NIRS-BCI: single-trial classification of verbal fluency task, Stroop task and unconstrained rest.",
