time,journal,doi_info,authors,key words,title,abstract
2016 Apr,Autism research : official journal of the International Society for Autism ,Autism Res. 2016 Apr;9(4):491-501. doi: 10.1002/aur.1528. Epub 2015 Sep 21.,"['Chiu, Tabitha A', 'Anagnostou, Evdokia', 'Brian, Jessica', 'Chau, Tom', 'Kushki, Azadeh']","['anxiety disorders  complications  psychology', 'arousal  physiology', 'attention physiology', 'autism spectrum disorder  complications  psychology', 'autonomic nervous system  physiology', 'child', 'electrocardiography', 'female', 'heart rate physiology', 'humans', 'male', 'sensitivity and specificity', 'social behavior', 'anxiety', 'arousal', 'autism spectrum disorders', 'autonomic nervous system', 'cardiac activity', 'physiology', 'psychophysiology']",Specificity of autonomic arousal to anxiety in children with autism spectrum disorder.,"Anxiety is one of the most concerning comorbidities in autism spectrum disorder (ASD) due to its high prevalence, negative impact on physical and psychological well-being, and interaction with core deficits of ASD. Current assessment and treatment of anxiety, which rely on the observation of behavior and self-reports, are often ineffective as ASD is associated with deficits in communication and diminished introspective ability. In this light, autonomic nervous system (ANS) activity has been suggested as a marker of physiological arousal associated with anxiety. However, physiological arousal measured by ANS indices also occurs with other cognitive and emotional processes, and it is unclear whether anxiety-related arousal can be differentiated from that related to other cognitive processes. To address this gap, we investigated the use of linear and nonlinear classification techniques for differentiating anxiety-related arousal from arousal due to three cognitive processes (attention, inhibitory control, and social cognition) and physical activity based on electrocardiography signal features. Our results indicate that over 80% classification accuracy can be achieved, suggesting that ANS response can be used as a specific marker of anxiety-related arousal in a subgroup of children with ASD who demonstrate an increase in heart rate in response to anxiogenic stimuli."
2015 Oct 30,Journal of neuroscience methods,J Neurosci Methods. 2015 Oct 30;254:36-45. doi: 10.1016/j.jneumeth.2015.07.007. ,"['Weyand, Sabine', 'Takehara-Nishiuchi, Kaori', 'Chau, Tom']","['adolescent', 'adult', 'brain  physiology', ' brain-computer interfaces', 'female', 'humans', 'male', 'mental processes  physiology', 'neurofeedback physiology', ' neuropsychological tests', 'spectroscopy, near-infrared  methods', 'time factors', 'young adult', 'accuracy', 'brain–computer interface', 'ease-of-use', 'near-infrared spectroscopy', 'personalized mental tasks', 'prescribed mental tasks']",Exploring methodological frameworks for a mental task-based near-infrared spectroscopy brain-computer interface.,BACKGROUND: Near-infrared spectroscopy (NIRS) brain-computer interfaces (B
2016 Feb,Disability and rehabilitation. Assistive technology,Disabil Rehabil Assist Technol. 2016 Feb;11(2):166-175. doi: ,"['Mumford, Leslie', 'Chau, Tom']","['assistive technology', 'assistive technology assessment', 'assistive technology prescription']",Application of an access technology delivery protocol to two children with cerebral palsy.,"PURPOSE: This study further delineates the merits and limitations of the Access Technology Delivery Protocol (ATDP) through its application to two children with severe disabilities. METHOD: We conducted mixed methods case studies to demonstrate the ATDP with two children with no reliable means of access to an external device. Evaluations of response efficiency, satisfaction, goal attainment, technology use and participation were made after 8 and 16 weeks of training with custom access technologies. RESULTS: After 16 weeks, one child's switch offered improved response efficiency, high teacher satisfaction and increased participation. The other child's switch resulted in improved satisfaction and switch effectiveness but lower overall efficiency. The latter child was no longer using his switch by the end of the study. CONCLUSIONS: These contrasting findings indicate that changes to any contextual factors that may impact the user's switch performance should mandate a reassessment of the access pathway. Secondly, it is important to ensure that individuals who will be responsible for switch training be identified at the outset and engaged throughout the ATDP. Finally, the ATDP should continue to be tested with individuals with severe disabilities to build an evidence base for the delivery of response efficient access solutions. Implications for Rehabilitation A data-driven, comprehensive access technology delivery protocol for children with complex communication needs could help to mitigate technology abandonment. Successful adoption of an access technology requires personalized design, training of the technology user, the teaching staff, the caregivers and other communication partners, and integration with functional activities."
2015 Nov,Neuroscience research,Neurosci Res. 2015 Nov;100:29-38. doi: 10.1016/j.neures.2015.06.007. Epub 2015 ,"['Faulkner, Hayley G', 'Myrden, Andrew', 'Li, Michael', 'Mamun, Khondaker', 'Chau, Tom']","['adult', ' brain-computer interfaces', 'cerebral cortex  blood supply  physiology', 'cognition  physiology', 'decision making  physiology', 'female', 'humans', 'male', 'pattern recognition, automated', 'signal processing, computer-assisted', ' ultrasonography, doppler, transcranial', 'young adult', 'brain–computer interface', 'functional transcranial doppler', 'verbal fluency task']",Sequential hypothesis testing for automatic detection of task-related changes in cerebral perfusion in a brain-computer interface.,"Evidence suggests that the cerebral blood flow patterns accompanying cognitive activity are retained in many locked-in patients. These patterns can be monitored using transcranial Doppler ultrasound (TCD), a medical imaging technique that measures bilateral cerebral blood flow velocities. Recently, TCD has been proposed as an alternative imaging modality for brain-computer interfaces (B"
2015 Apr,Neurophotonics,Neurophotonics. 2015 Apr;2(2):025001. doi: 10.1117/1.NPh.2.2.025001. Epub 2015 ,"['Weyand, Sabine', 'Schudlo, Larissa', 'Takehara-Nishiuchi, Kaori', 'Chau, Tom']","['brain-computer interface', 'ease-of-use', 'near-infrared spectroscopy', 'personalized mental tasks', 'user selected mental tasks', 'user-centered']",Usability and performance-informed selection of personalized mental tasks for an online near-infrared spectroscopy brain-computer interface.,Brain-computer interfaces (B
2015,Frontiers in human neuroscience,Front Hum Neurosci. 2015 Jun 2;9:308. doi: 10.3389/fnhum.2015.00308. eCollection ,"['Myrden, Andrew', 'Chau, Tom']","['eeg', 'attention', 'brain-computer interface', 'fatigue', 'frustration', 'user mental state']",Effects of user mental state on EEG-BCI performance.,
2015 Jul,Medical engineering & physics,Med Eng Phys. 2015 Jul;37(7):665-73. doi: 10.1016/j.medengphy.2015.04.007. Epub ,"['Mamun, Khondaker A', 'Steele, Catriona M', 'Chau, Tom']","['accelerometry  instrumentation  methods', 'adolescent', 'adult', 'aged', 'deglutition  physiology', 'deglutition disorders classification physiopathology', 'entropy', 'female', 'humans', 'information theory', 'male', 'middle aged', 'respiration', 'wavelet analysis', 'young adult', 'accelerometry', 'dysphagia', 'swallowing']",Swallowing accelerometry signal feature variations with sensor displacement.,"Dual-axis accelerometry has recently shown promise as a non-invasive method for detecting swallowing impairment using signal processing and pattern classification algorithms. However, it is unknown whether variations in sensor placement alter signal characteristics, threatening the accuracy of signal processing classifiers for aspiration detection. To address this question, water swallows were recorded in 14 healthy adults using a dual-axis accelerometer in 13 different positions (baseline, and 2, 4, 6 and 8 mm above, below and to the right of baseline). The baseline position was midline, immediately below the thyroid cartilage during quiet breathing. After segmentation and pre-processing, signal features were extracted in multiple domains (time, frequency, time-frequency). The effect of sensor position on signal feature distributions was examined with non-parametric statistical analysis. The analysis showed that the sensor could be displaced by as much as 4 mm inferior and lateral to the baseline position and by up to 6 mm above the baseline location without significantly altering time-frequency features. In other words, when considering the baseline position as the origin, the admissible region for sensor placement spans 10 mm in the superior-inferior axis and 8 mm in the medial-lateral direction. Results of this study suggest that time-frequency representations of accelerometry signals are most robust to sensor placement variations around the baseline position. The implication of this finding is that a swallowing accelerometry classifier based on time-frequency features can likely tolerate small variations in sensor location without degradation in classification performance."
2015 Sep 1,Behavioural brain research,Behav Brain Res. 2015 Sep 1;290:131-42. doi: 10.1016/j.bbr.2015.04.053. Epub 2015 ,"['Schudlo, Larissa C', 'Chau, Tom']","['adult', 'attention  physiology', 'brain-computer interfaces', 'functional neuroimaging  methods', 'humans', 'memory, short-term  physiology', 'parietal lobe  physiology', 'prefrontal cortex  physiology', ' signal processing, computer-assisted', 'spectroscopy, near-infrared  methods', 'young adult', 'attention', 'brain–computer interface', 'near-infrared spectroscopy', 'parietal cortex', 'prefrontal cortex', 'working memory']",Single-trial classification of near-infrared spectroscopy signals arising from multiple cortical regions.,Near-infrared spectroscopy (NIRS) brain-computer interface (B
2015 Jun,International journal of neural systems,Int J Neural Syst. 2015 Jun;25(4):1550014. doi: 10.1142/S0129065715500148. Epub ,"['Abou Zeid, Elias', 'Chau, Tom']","['adult', 'artifacts', 'contingent negative variation physiology', ' electrodes', ' electroencephalography', 'evoked potentials, motor  physiology', 'female', 'humans', ' intention', 'male', 'motor cortex  physiology', 'movement  physiology', 'signal processing, computer-assisted', 'eeg', 'human machine interface', 'readiness potential', 'self-initiated voluntary movements']",Electrode fusion for the prediction of self-initiated fine movements from single-trial readiness potentials.,"Current human-machine interfaces (HMIs) for users with severe disabilities often have difficulty distinguishing between intentional and inadvertent activations. Pre-movement neuro-cortical activity may aid in this elusive discrimination task but has not been exploited in HMIs. This work investigates the utility of the readiness potential (RP), a slow negative cortical potential preceding voluntary movement, for detecting the intention of self-initiated fine movements prior to their motoric realization. We recorded electroencephalography from the frontal, central, parietal and occipital lobes of 10 participants using a self-initiated switch activation protocol. Eye movement artifacts were removed by regression and the RP was detected on a single-trial basis, in a narrow frequency range (0.1-1 Hz). Common average reference was applied prior to windowed-averaging for feature extraction. Electrodes were selected according to a separability measure based on Fisher projection. Our findings demonstrate that feature fusion from an optimal number of electrodes achieves a statistically significant lower classification error than the best single classifier. Finally, voluntary fine movement intention was detected on a single-trial basis at above-chance levels approximately 396 ms before physical switch activation. These findings encourage the development of rapid-response, intention-aware HMIs for individuals with severe disabilities who struggle with executing voluntary fine motor movements."
2015,PloS one,PLoS One. 2015 Apr 2;10(4):e0122148. doi: 10.1371/journal.pone.0122148. ,"['Moghimi, Saba', 'Schudlo, Larissa', 'Chau, Tom', 'Guerguerian, Anne-Marie']","['adult', 'auditory perception', ' emotions', 'female', ' hemodynamics', 'humans', 'male', 'music  psychology', 'prefrontal cortex  blood supply physiology', 'spectroscopy, near-infrared', 'young adult']","Variability in prefrontal hemodynamic response during exposure to repeated self-selected music excerpts, a near-infrared spectroscopy study.","Music-induced brain activity modulations in areas involved in emotion regulation may be useful in achieving therapeutic outcomes. Clinical applications of music may involve prolonged or repeated exposures to music. However, the variability of the observed brain activity patterns in repeated exposures to music is not well understood. We hypothesized that multiple exposures to the same music would elicit more consistent activity patterns than exposure to different music. In this study, the temporal and spatial variability of cerebral prefrontal hemodynamic response was investigated across multiple exposures to self-selected musical excerpts in 10 healthy adults. The hemodynamic changes were measured using prefrontal cortex near infrared spectroscopy and represented by instantaneous phase values. Based on spatial and temporal characteristics of these observed hemodynamic changes, we defined a consistency index to represent variability across these domains. The consistency index across repeated exposures to the same piece of music was compared to the consistency index corresponding to prefrontal activity from randomly matched non-identical musical excerpts. Consistency indexes were significantly different for identical versus non-identical musical excerpts when comparing a subset of repetitions. When all four exposures were compared, no significant difference was observed between the consistency indexes of randomly matched non-identical musical excerpts and the consistency index corresponding to repetitions of the same musical excerpts. This observation suggests the existence of only partial consistency between repeated exposures to the same musical excerpt, which may stem from the role of the prefrontal cortex in regulating other cognitive and emotional processes."
2014,Annual International Conference of the IEEE Engineering in Medicine and Biology ,Annu Int Conf IEEE Eng Med Biol Soc. 2014;2014:1996-9. doi: ,"['Schudlo, Larissa C', 'Weyand, Sabine', 'Chau, Tom']","['brain physiopathology', ' brain-computer interfaces', 'humans', 'research  trends', 'spectroscopy, near-infrared  trends', 'task performance and analysis']",A review of past and future near-infrared spectroscopy brain computer interface research at the PRISM lab.,Single-trial classification of near-infrared spectroscopy (NIRS) signals for brain-computer interface (B
2014 Aug,Journal of child neurology,J Child Neurol. 2014 Aug;29(8):1108-18. doi: 10.1177/0883073814534320. Epub 2014 ,"['Myrden, Andrew', 'Schudlo, Larissa', 'Weyand, Sabine', 'Zeyl, Timothy', 'Chau, Tom']","['adolescent', 'cerebral palsy  complications', 'child', 'child, preschool', 'communication aids for disabled  statistics & numerical data  trends', 'communication disorders  etiology  rehabilitation', 'databases, bibliographic statistics & numerical data', 'humans', 'retrospective studies', 'technology instrumentation', 'access technology', 'cerebral palsy', 'children', 'communication']",Trends in communicative access solutions for children with cerebral palsy.,"Access solutions may facilitate communication in children with limited functional speech and motor control. This study reviews current trends in access solution development for children with cerebral palsy, with particular emphasis on the access technology that harnesses a control signal from the user (eg, movement or physiological change) and the output device (eg, augmentative and alternative communication system) whose behavior is modulated by the user's control signal. Access technologies have advanced from simple mechanical switches to machine vision (eg, eye-gaze trackers), inertial sensing, and emerging physiological interfaces that require minimal physical effort. Similarly, output devices have evolved from bulky, dedicated hardware with limited configurability, to platform-agnostic, highly personalized mobile applications. Emerging case studies encourage the consideration of access technology for all nonverbal children with cerebral palsy with at least nascent contingency awareness. However, establishing robust evidence of the effectiveness of the aforementioned advances will require more expansive studies."
2014,Frontiers in human neuroscience,Front Hum Neurosci. 2014 Apr 22;8:199. doi: 10.3389/fnhum.2014.00199. eCollection ,"['Lu, Jie', 'Mamun, Khondaker A', 'Chau, Tom']","['bci', 'tcd', 'communication', 'hemodynamic response', 'lateralization', 'middle cerebral artery']",Online transcranial Doppler ultrasonographic control of an onscreen keyboard.,Brain-computer interface (B
2014 Aug,Pediatric exercise science,Pediatr Exerc Sci. 2014 Aug;26(3):242-9. doi: 10.1123/pes.2013-0117. Epub 2014 ,"['Ellis, Denine', 'Sejdic, Ervin', 'Zabjek, Karl', 'Chau, Tom']","['adolescent', 'child', 'energy metabolism  physiology', 'exercise test', 'female', 'gait  physiology', 'humans', 'linear models', 'male', 'motor activity  physiology', 'surveys and questionnaires', 'time factors']","A pediatric correlational study of stride interval dynamics, energy expenditure and activity level.","The strength of time-dependent correlations known as stride interval (SI) dynamics has been proposed as an indicator of neurologically healthy gait. Most recently, it has been hypothesized that these dynamics may be necessary for gait efficiency although the supporting evidence to date is scant. The current study examines over-ground SI dynamics, and their relationship with the cost of walking and physical activity levels in neurologically healthy children aged nine to 15 years. Twenty participants completed a single experimental session consisting of three phases: 10 min resting, 15 min walking and 10 min recovery. The scaling exponent (α) was used to characterize SI dynamics while net energy cost was measured using a portable metabolic cart, and physical activity levels were determined based on a 7-day recall questionnaire. No significant linear relationships were found between a and the net energy cost measures (r < .07; p > .25) or between α and physical activity levels (r = .01, p = .62). However, there was a marked reduction in the variance of α as activity levels increased. Over-ground stride dynamics do not appear to directly reflect energy conservation of gait in neurologically healthy youth. However, the reduction in the variance of α with increasing physical activity suggests a potential exercise-moderated convergence toward a level of stride interval persistence for able-bodied youth reported in the literature. This latter finding warrants further investigation."
2014 Mar 8,Journal of neuroengineering and rehabilitation,J Neuroeng Rehabil. 2014 Mar 8;11:34. doi: 10.1186/1743-0003-11-34.,"['Leung, Brian', 'Chau, Tom']","['autonomic nervous system  physiology', 'cerebral palsy complications  rehabilitation', 'child', 'humans', 'male', 'quadriplegia etiology rehabilitation', 'treatment outcome', ' user-computer interface']",Autonomic responses to correct outcomes and interaction errors during single-switch scanning among children with severe spastic quadriplegic cerebral palsy.,"BACKGROUND: The combination of single-switch access technology and scanning is the most promising means of augmentative and alternative communication for many children with severe physical disabilities. However, the physical impairment of the child and the technology's limited ability to interpret the child's intentions often lead to false positives and negatives (corresponding to accidental and missed selections, respectively) occurring at rates that frustrate the user and preclude functional communication. Multiple psychophysiological studies have associated cardiac deceleration and increased phasic electrodermal activity with self-realization of errors among able-bodied individuals. Thus, physiological measurements have potential utility at enhancing single-switch access, provided that such prototypical autonomic responses exist in persons with profound disabilities. METHODS: The present case series investigated the autonomic responses of three pediatric single-switch users with severe spastic quadriplegic cerebral palsy, in the context of a single-switch letter matching activity. Each participant exhibited distinct autonomic responses to activity engagement. RESULTS: Our analysis confirmed the presence of the autonomic response pattern of cardiac deceleration and increased phasic electrodermal activity following true positives, false positives and false negatives errors, but not subsequent to true negative outcomes. CONCLUSIONS: These findings suggest that there may be merit in complementing single-switch input with autonomic measurements to improve augmentative and alternative communications for pediatric access technology users."
2014 Feb,Journal of neural engineering,J Neural Eng. 2014 Feb;11(1):016003. doi: 10.1088/1741-2560/11/1/016003. Epub ,"['Schudlo, Larissa C', 'Chau, Tom']","['adult', 'algorithms', 'artifacts', 'brain mapping  methods', 'brain-computer interfaces', 'feedback, psychological', 'hemoglobins metabolism', 'humans', 'male', 'mathematics', 'mental processes  physiology', 'prefrontal cortex  physiology', 'psychomotor performance physiology', 'reading', 'rest  physiology', 'spectroscopy, near-infrared  methods']",Dynamic topographical pattern classification of multichannel prefrontal NIRS signals: II. Online differentiation of mental arithmetic and rest.,OBJECTIVE: Near-infrared spectroscopy (NIRS) has recently gained attention as a modality for brain-computer interfaces (B
2014 Aug,Developmental neurorehabilitation,Dev Neurorehabil. 2014 Aug;17(4):232-42. doi: 10.3109/17518423.2013.776125. Epub ,"['Mumford, Leslie', 'Lam, Rachel', 'Wright, Virginia', 'Chau, Tom']","['algorithms', 'child', 'communication', 'communication aids for disabled', 'developmental disabilities  rehabilitation', 'disabled persons', 'equipment design', 'humans', 'male', 'muscle hypotonia  rehabilitation', 'occupational therapy', 'pattern recognition, automated', ' self-help devices', 'signal processing, computer-assisted', 'surveys and questionnaires', 'access technology', 'assessment', 'assistive technology', 'communication', 'provision', 'service delivery']",An access technology delivery protocol for children with severe and multiple disabilities: a case demonstration.,"OBJECTIVE: This study applied response efficiency theory to create the Access Technology Delivery Protocol (ATDP), a child and family-centred collaborative approach to the implementation of access technologies. METHODS: We conducted a descriptive, mixed methods case study to demonstrate the ATDP method with a 12-year-old boy with no reliable means of access to an external device. Evaluations of response efficiency, satisfaction, goal attainment, technology use and participation were made after 8 and 16 weeks of training with a custom smile-based access technology. RESULTS: At the 16 week mark, the new access technology offered better response quality; teacher satisfaction was high; average technology usage was 3-4 times per week for up to 1 h each time; switch sensitivity and specificity reached 78% and 64%, respectively, and participation scores increased by 38%. CONCLUSION: This case supports further development and testing of the ATDP with additional children with multiple or severe disabilities."
