time,journal,doi_info,authors,key words,title,abstract
2017 Nov,The journal of spinal cord medicine,J Spinal Cord Med. 2017 Nov;40(6):813-869. doi: 10.1080/10790268.2017.1369666.,"['Shojaei, Mir Hatef', 'Alavinia, Mohammad', 'Craven, B Catharine', 'Cheng, Christiana L', 'Plashkes, Tova', 'Shen, Tian', 'Fallah, Nader', 'Humphreys, Suzanne', ""O'Connell, Colleen"", 'Linassi, Angelo Gary', 'Ho, Chester', 'Short, Christine', 'Ethans, Karen', 'Charbonneau, Rebecca', 'Paquet, Jerome', 'Noonan, Vanessa K', 'Furlan, Julio C', 'Fehlings, Michael G', 'Craven, B Catharine', 'Likitlersuang, Jirapat', 'Sumitro, Elizabeth', 'Kalsi-Ryan, Sukhvinder', 'Zariffa, José', 'Wolfe, Dalton', 'Cornell, Stephanie', 'Gagliardi, Julie', 'Marrocco, Stephanie', 'Rivers, Carly S', 'Fallah, Nader Nader', 'Noonan, Vanessa K', 'Whitehurst, David', 'Schwartz, Carolyn', 'Finkelstein, Joel', 'Craven, B Catharine', 'Ethans, Karen', ""O'Connell, Colleen"", 'Truchon, Catherine', 'Ho, Chester', 'Linassi, A Gary', 'Short, Christine', 'Tsai, Eve', 'Drew, Brian', 'Ahn, Henry', 'Dvorak, Marcel F', 'Paquet, Jérôme', 'Fehlings, Michael G', 'Noreau, Luc', 'Lenz, Katie', 'Bailey, K Alysse', 'Allison, David', 'Ditor, David', 'Baron, Justine', 'Tomasone, Jennifer', 'Curran, Dorothyann', 'Miller, Toba', 'Grimshaw, Jeremy', 'Moineau, Bastien', 'Alizadeh-Meghrazi, Milad', 'Stefan, Gabriel', 'Masani, Kei', 'Popovic, Milos R', 'Sumitro, Elizabeth', 'Likitlersuang, Jirapat', 'Kalsi-Ryan, Sukhvinder', 'Zariffa, José', 'Garcia-Garcia, Martha G', 'Marquez-Chin, Cesar', 'Popovic, Milos R', 'Furlan, Julio C', 'Gulasingam, Sivakumar', 'Craven, B Catharine', 'Furlan, Julio C', 'Gulasingam, Sivakumar', 'Craven, B Catharine', 'Khan, Alia', 'Pujol, Clara', 'Laylor, Mark', 'Unic, Nikola', 'Pakosh, Maureen', 'Musselman, Kristin', 'Brisbois, Louise M', 'Catharine Craven, B', 'Verrier, Mary C', 'Jones, Maryleen K', ""O'Shea, Roberta"", 'Valika, Sakina', 'Holtz, Kaila', 'Szefer, Elena', 'Noonan, Vanessa', 'Kwon, Brian', 'Mills, Patricia', 'Morin, Cynthia', 'Harris, Anne', 'Cheng, Christiana', 'Aspinall, Arlene', 'Plashkes, Tova', 'Noonan, Vanessa K', 'Chan, Katherine', 'Verrier, Mary C', 'Craven, B Catharine', 'Alappat, Chris', 'Flett, Heather M', 'Furlan, Julio C', 'Musselman, Kristin E', 'Milligan, James', 'Hillier, Loretta M', 'Bauman, Craig', 'Donaldson, Lindsay', 'Lee, Joseph', 'Milligan, James', 'Lee, Joseph', 'Hillier, Loretta M', 'Slonim, Karen', 'Wolfe, Dalton', 'Sleeth, Lindsay', 'Jeske, Samantha', 'Kras-Dupuis, Anna', 'Marrocco, Stephanie', 'McRae, Samantha', 'Flett, Heather', 'Mokry, Jennifer', 'Zee, Joanne', 'Bayley, Mark', 'Lemay, Jean-Francois', 'Roy, Audrey', 'Gagnon, H Dany', 'Jones, Maryleen K', ""O'Shea, Roberta"", 'Theiss, Renee', 'Flett, Heather', 'Guy, Kristina', 'Johnston, Gillian', 'Kokotow, Melanie', 'Mills, Sandra', 'Mokry, Jennifer', 'Bain, Patricia', 'Scovil, Carol', 'Houghton, Pamela', 'Lala, Deena', 'Orr, Lyndsay', 'Holyoke, Paul', 'Wolfe, Dalton', 'Orr, Lyndsay', 'Brooke, Jillian', 'Holyoke, Paul', 'Lala, Deena', 'Houghton, Pamela', 'Martin Ginis, Kathleen A', 'Shaw, Robert B', 'Stork, Matthew J', 'McBride, Christopher B', 'Furlan, Julio C', 'Craven, B Catharine', 'Giangregorio, Lora', 'Hitzig, Sander', 'Kapadia, Naaz', 'Popovic, Milos R', 'Zivanovic, Vera', 'Valiante, Taufik', 'Popovic, Milos R', 'Patsakos, Eleni', 'Brisbois, Louise', 'Farahani, Farnoosh', 'Kaiser, Anita', 'Craven, B Catharine', 'Patsakos, Eleni', 'Kaiser, Anita', 'Brisbois, Louise', 'Farahani, Farnoosh', 'Craven, B Catharine', 'Mortenson, Ben', 'MacGillivray, Megan', 'Mahsa, Sadeghi', 'Adams, Jared', 'Sawatzky, Bonita', 'Mills, Patricia', 'Arbour-Nicitopoulos, Kelly', 'Bassett-Gunter, Rebecca', 'Leo, Jennifer', 'Sharma, Ritu', 'Latimer-Cheung, Amy', 'Olds, Timothy', 'Martin Ginis, Kathleen', 'Graco, Marnie', 'Cross, Susan', 'Thiyagarajan, Chinnaya', 'Shafazand, Shirin', 'Ayas, Najib', 'Schembri, Rachel', 'Booker, Lauren', 'Nicholls, Carmel', 'Burns, Patricia', 'Nash, Mark', 'Green, Sally', 'Berlowitz, David J', 'Taran, Samantha', 'Rocchi, Meredith', 'Martin Ginis, Kathleen A', 'Sweet, Shane N', 'Caron, Jeffrey G', 'Sweet, Shane N', 'Rocchi, Meredith A', 'Zelaya, Walter', 'Sweet, Shane N', 'Bergquist, Austin J', 'Del Castillo-Valenzuela, Mikael F', 'Popovic, Milos R', 'Masani, Kei', 'Ethans, Karen', 'Casey, Alan', 'Namaka, Micheal', 'Krassiokov-Enns, Dimitri', 'Marquez-Chin, Cesar', 'Marquis, Aaron', 'Desai, Naaz', 'Zivanovic, Vera', 'Hebert, Debbie', 'Popovic, Milos R', 'Furlan, Julio C', 'Craven, B Catharine', 'McLeod, Jonathan', 'Hicks, Audrey', 'Gauthier, Cindy', 'Arel, Jasmine', 'Brosseau, Rachel', 'Hicks, Audrey L', 'Gagnon, Dany H', 'Nejatbakhsh, Nasrin', 'Kaiser, Anita', 'Hitzig, Sander L', 'Cappe, Shauna', 'McGillivray, Colleen', 'Singh, Hardeep', 'Sam, Jaya', 'Flett, Heather', 'Craven, B Catharine', 'Verrier, Mary', 'Musselman, Kristin', 'Koh, Ryan G L', 'Garai, Purbasha', 'Zariffa, José', 'Unger, Janelle', 'Oates, Alison R', 'Arora, Tarun', 'Musselman, Kristin', 'Moshe, Bondi', 'Anthony, Burns', 'Gulasingam, Sivakumar', 'Craven, B Catharine', 'Michalovic, Emilie', 'Gainforth, Heather L', 'Baron, Justine', 'Graham, Ian D', 'Sweet, Shane N', 'Chan, Brian', 'Craven, B Catharine', 'Wodchis, Walter', 'Cadarette, Suzanne', 'Krahn, Murray', 'Mittmann, Nicole', 'Chemtob, Keryn', 'Rocchi, Meredith A', 'Arbour-Nicitopoulos, Kelly', 'Kairy, Dahlia', 'Sweet, Shane N', 'Sabetian, Parisa', 'Koh, Ryan G L', 'Zariffa, José', 'Yoo, Paul', 'Iwasa, Stephanie N', 'Babona-Pilipos, Robart', 'Schneider, Patrick', 'Velayudhan, Prashanth', 'Ahmed, Umalkhair', 'Popovic, Milos R', 'Morshead, Cindi M', 'Yoo, Jaeeun', 'Shinya, Masahiro', 'Milosevic, Matija', 'Masani, Kei', 'Gabison, Sharon', 'Mathur, Sunita', 'Nussbaum, Ethne', 'Popovic, Milos', 'Verrier, Mary C', 'Musselman, Kristin', 'Lemay, Jean-François', 'McCullum, Shane', 'Guy, Kristina', 'Walden, Kristen', 'Zariffa, Jose', 'Kalsi-Ryan, Sukhvinder', 'Alizadeh-Meghrazi, Milad', 'Lee, Joseph', 'Milligan, James', 'Smith, Matt', 'Athanasopoulos, Peter', 'Jeji, Tara', 'Howcroft, Jennifer', 'Howcroft, Jeremy', 'Townson, Andrea', 'Willms, Rhonda', 'Plashkes, Tova', 'Mills, Sandra', 'Flett, Heather', 'Scovil, Carol', 'Mazzella, Filomena', 'Morris, Helen', 'Ventre, Anellina', 'Loh, Eldon', 'Guy, Stacey', 'Kramer, John', 'Jeji, Tara', 'Xia, Nancy', 'Mehta, Swati', 'Martin Ginis, Kathleen A', 'McBride, Christopher B', 'Shaw, Robert B', 'West, Christopher', 'Ethans, Karen', ""O'Connell, Colleen"", 'Charlifue, Susan', 'Gagnon, Dany H', 'Escalona Castillo, Manuel Jose', 'Vermette, Martin', 'Carvalho, Lívia Pinheiro', 'Karelis, Antony', 'Kairy, Dahlia', 'Aubertin-Leheudre, Mylène', 'Duclos, Cyril', 'Houghton, Pamela E', 'Orr, Lyndsay', 'Holyoke, Paul', 'Kras-Dupuis, Anna', 'Wolfe, Dalton', 'Munro, Barry', 'Sweeny, Michelle', 'Craven, B Catharine', 'Flett, Heather', 'Hitzig, Sander', 'Farahani, Farnoosh', 'Alavinia, S Mohammad', 'Omidvar, Maryam', 'Bayley, Mark', 'Sweet, Shane N', 'Gassaway, Julie', 'Shaw, Rob', 'Hong, Minna', 'Everhart-Skeels, Sarah', 'Houlihan, Bethlyn', 'Burns, Anthony', 'Bilsky, Gerald', 'Lanig, Indira', 'Graco, Marnie', 'Cross, Susan', 'Thiyagarajan, Chinnaya', 'Shafazand, Shirin', 'Ayas, Najib', 'Schembri, Rachel', 'Booker, Lauren', 'Nicholls, Carmel', 'Burns, Patricia', 'Nash, Mark', 'Green, Sally', 'Berlowitz, David', 'Furlan, Julio C', 'Kalsi-Ryan, Sukhvinder']",[],"Abstracts and Workshops 7th National Spinal Cord Injury Conference November 9 - 11, 2017 Fallsview Casino Resort Niagara Falls, Ontario, Canada.","Canada.FAU - Short, ChristineAU - Short CAD - d Dalhousie University , Halifax , NS , Canada.FAU - Ethans, KarenAU - Ethans KAD - g University of Manitoba , Winnipeg , MB , Canada.FAU - Charbonneau, RebeccaAU - Charbonneau RAD - h University of Alberta , Edmonton , AB , Canada.FAU - Paquet, JeromeAU - Paquet JAD - i Universite Laval, Quebe c City , QC , Canada.FAU - Noonan, Vanessa KAU - Noonan VKAD - c Rick Hansen Institute , Vancouver , BC , Canada.AD - j RHS"
2017 Oct 17,Neurology,Neurology. 2017 Oct 17;89(16):1660-1667. doi: 10.1212/WNL.0000000000004519. Epub ,"['Squair, Jordan W', 'Bélanger, Lise M', 'Tsang, Angela', 'Ritchie, Leanna', 'Mac-Thiong, Jean-Marc', 'Parent, Stefan', 'Christie, Sean', 'Bailey, Christopher', 'Dhall, Sanjay', 'Street, John', 'Ailon, Tamir', 'Paquette, Scott', 'Dea, Nicolas', 'Fisher, Charles G', 'Dvorak, Marcel F', 'West, Christopher R', 'Kwon, Brian K']","['acute disease', 'blood pressure physiology', 'catheterization  methods', 'cerebrospinal fluid pressure  physiology', 'female', 'follow-up studies', 'humans', 'male', 'middle aged', 'neurologic examination', 'perfusion', 'prospective studies', 'recovery of function  physiology', 'spinal cord injuries  surgery']",Spinal cord perfusion pressure predicts neurologic recovery in acute spinal cord injury.,"OBJECTIVE: To determine whether spinal cord perfusion pressure (SCPP) as measured with a lumbar intrathecal catheter is a more predictive measure of neurologic outcome than the conventionally measured mean arterial pressure (MAP). METHODS: A total of 92 individuals with acute spinal cord injury were enrolled in this multicenter prospective observational clinical trial. MAP and CSF pressure (CSFP) were monitored during the first week postinjury. Neurologic impairment was assessed at baseline and at 6 months postinjury. We used logistic regression, systematic iterations of relative risk, and Cox proportional hazard models to examine hemodynamic patterns commensurate with neurologic outcome. RESULTS: We found that SCPP (odds ratio 1.039, p = 0.002) is independently associated with positive neurologic recovery. The relative risk for not recovering neurologic function continually increased as individuals were exposed to SCPP below 50 mm Hg. Individuals who improved in neurologic grade dropped below SCPP of 50 mm Hg fewer times than those who did not improve (p = 0.012). This effect was not observed for MAP or CSFP. Those who were exposed to SCPP below 50 mm Hg were less likely to improve from their baseline neurologic impairment grade (p = 0.0056). CONCLUSIONS: We demonstrate that maintaining SCPP above 50 mm Hg is a strong predictor of improved neurologic recovery following spinal cord injury. This suggests that SCPP (the difference between MAP and CSFP) can provide useful information to guide the hemodynamic management of patients with acute spinal cord injury."
2017 Dec 15,Journal of neurotrauma,J Neurotrauma. 2017 Dec 15;34(24):3336-3350. doi: 10.1089/neu.2017.5034. Epub ,"['Streijger, Femke', 'So, Kitty', 'Manouchehri, Neda', 'Tigchelaar, Seth', 'Lee, Jae H T', 'Okon, Elena B', 'Shortt, Katelyn', 'Kim, So-Eun', 'McInnes, Kurt', 'Cripton, Peter', 'Kwon, Brian K']","['animals', 'disease models, animal', 'female', 'hemodynamics physiology', 'ischemia etiology', 'regional blood flow physiology', 'spinal cord injuries  physiopathology', 'swine', 'swine, miniature', 'l p ratio', 'blood flow', 'microdialysis', 'oxygenation', 'porcine model', 'pressure', 'spinal cord injury']","Changes in Pressure, Hemodynamics, and Metabolism within the Spinal Cord during the First 7 Days after Injury Using a Porcine Model.",Traumatic spinal cord injury (S
2017 Sep,Journal of orthopaedic trauma,J Orthop Trauma. 2017 Sep;31 Suppl 4:S38-S43. doi: 10.1097/BOT.0000000000000946.,"['Kato, So', 'Murray, Jean-Christophe', 'Kwon, Brian K', 'Schroeder, Gregory D', 'Vaccaro, Alexander R', 'Fehlings, Michael G']","['accidental falls', 'decompression, surgical  methods', 'female', 'fracture healing physiology', 'fractures, compression diagnostic imaging  surgery', 'humans', 'injury severity score', 'lumbar vertebrae injuries', 'magnetic resonance imaging methods', 'middle aged', 'paralysis  prevention & control', 'prognosis', 'risk assessment', 'spinal fractures  diagnostic imaging  surgery', 'thoracic vertebrae injuries', 'time factors', 'time-to-treatment', 'tomography, x-ray computed methods']",Does Surgical Intervention or Timing of Surgery Have an Effect on Neurological Recovery in the Setting of a Thoracolumbar Burst Fracture?,"Traumatic thoracolumbar burst fractures are one of the most common forms of spinal trauma with the majority occurring at the junctional area where mechanical load is maximal (AOSpine Thoracolumbar Spine Injury Classification System Subtype A3 or A4). Burst fractures entail the involvement of the middle column, and therefore, they are typically associated with bone fragment in the spinal canal, which may cause compression of the spinal cord, conus medullaris, cauda equina, or a combination of these. Fortunately, approximately half of the patients with thoracolumbar burst fractures are neurologically intact due to the wide canal diameter. Recent evidences have revealed that functional outcomes in the long term may be equivalent between operative and nonoperative management for neurologically intact thoracolumbar burst fractures. Nevertheless, consensus has not been met regarding the optimal treatment strategy for those with neurological deficits. The present review article summarizes the contemporary evidences to discuss the role of nonoperative management in the presence of neurological deficits and the optimal timing of decompression surgery for neurological recovery. In summary, although operative management is generally recommended for thoracolumbar fracture with significant neurological deficits, the evidence is weak, and nonoperative management can also be an option for those with solitary radicular symptoms. With regards to timing of operative management, high-quality studies comparing early and delayed intervention are lacking. Extrapolating from the evidence in cervical spine injury leads to an assumption that early intervention would also be beneficial for neurological recovery, but further studies are warranted to answer these questions."
2017 Oct 15,Journal of neurotrauma,J Neurotrauma. 2017 Oct 15;34(20):2892-2900. doi: 10.1089/neu.2016.4934. Epub ,"['White, Barry A B', 'Dea, Nicolas', 'Street, John T', 'Cheng, Christiana L', 'Rivers, Carly S', 'Attabib, Najmedden', 'Kwon, Brian K', 'Fisher, Charles G', 'Dvorak, Marcel F']","['adult', 'canada', 'case-control studies', 'cost of illness', 'female', 'humans', 'male', 'middle aged', 'pressure ulcer economics  etiology', 'spinal cord injuries  complications  economics', 'urinary tract infections economics  etiology', 'economic burden', 'pressure ulcers', 'secondary complications', 'spinal cord injury', 'urinary tract infections']",The Economic Burden of Urinary Tract Infection and Pressure Ulceration in Acute Traumatic Spinal Cord Injury Admissions: Evidence for Comparative Economics and Decision Analytics from a Matched Case-Control Study.,Secondary complications of spinal cord injury (S
2017 Oct 15,Journal of neurotrauma,J Neurotrauma. 2017 Oct 15;34(20):2924-2933. doi: 10.1089/neu.2016.4937. Epub ,"['Dvorak, Marcel F', 'Cheng, Christiana L', 'Fallah, Nader', 'Santos, Argelio', 'Atkins, Derek', 'Humphreys, Suzanne', 'Rivers, Carly S', 'White, Barry A B', 'Ho, Chester', 'Ahn, Henry', 'Kwon, Brian K', 'Christie, Sean', 'Noonan, Vanessa K']","['continuity of patient care standards', 'humans', 'neurology  standards', 'outcome assessment, health care standards', ' registries', ' spinal cord injuries', 'clinical registry', 'data quality', 'healthcare system', 'knowledge gaps', 'spinal cord injury']",Spinal Cord Injury Clinical Registries: Improving Care across the SCI Care Continuum by Identifying Knowledge Gaps.,
2018 Feb,The spine journal : official journal of the North American Spine Society,Spine J. 2018 Feb;18(2):245-254. doi: 10.1016/j.spinee.2017.07.003. Epub 2017 Jul ,"['Charest-Morin, Raphaële', 'Street, John', 'Zhang, Honglin', 'Roughead, Taren', 'Ailon, Tamir', 'Boyd, Michael', 'Dvorak, Marcel', 'Kwon, Brian', 'Paquette, Scott', 'Dea, Nicolas', 'Fisher, Charles G', 'Flexman, Alana M']","['aged', 'aged, 80 and over', 'elective surgical procedures  adverse effects', 'female', 'frail elderly', 'frailty  complications', 'humans', 'incidence', 'lumbar vertebrae  surgery', 'male', 'neurosurgical procedures  adverse effects', 'orthopedic procedures  adverse effects', 'postoperative complications  epidemiology etiology', 'reproducibility of results', 'risk factors', 'sarcopenia  complications', 'spinal diseases complications  surgery', 'adverse event', 'complication', 'frailty', 'modified frailty index', 'sarcopenia', 'spine', 'total psoas muscle area']",Frailty and sarcopenia do not predict adverse events in an elderly population undergoing non-complex primary elective surgery for degenerative conditions of the lumbar spine.,"BACKGROUND CONTEXT: Sarcopenia measured by normalized total psoas area (NTPA) has been shown to predict mortality and adverse events (AEs) in numerous surgical populations. The relationship between sarcopenia and postoperative outcomes after surgery for degenerative spine disease (DSD) has not been investigated. PURPOSE: This study aimed to determine the relationships between sarcopenia, frailty, and postoperative AEs in the elderly DSD population. Secondary objectives were to describe the distribution and predictors of NTPA and to determine the relationship between sarcopenia, frailty, and length of stay, discharge to a facility, and in-hospital mortality. STUDY DESIGN: This is an ambispective study from a quaternary care academic center. PATIENT SAMPLE: A total of 102 patients over 65 years old who underwent elective thoracolumbar surgery for DSD between 2009 and 2013 were included in this study. OUTCOME MEASURES: The primary outcome was a composite of perioperative AEs; the secondary outcomes were length of stay, discharge disposition, and in-hospital mortality. METHODS: Total psoas area (TPA) at mid-L3 level on preoperative computed tomography scan adjusted for height (NTPA) defined sarcopenia. The modified frailty index (mFI) of 11 clinical variables defined frailty. The distribution and predictors of sarcopenia (NTPA) were determined. The association of NTPA with AEs, length of stay, discharge disposition to care facility, and mortality was analyzed, including adjusting for known and suspected confounders using multivariate regression. RESULTS: Median Spine Surgical Invasiveness Index was 8 (interquartile range 2-10), and mean NTPA was 674 mm(2)/m(2) (293.21-1636.25). Using the mFI, 20.6% were pre-frail and 19.6% were frail. Inter- and intraobserver reliability for determining NTPA were near perfect with kappa 0.95-0.97 and 0.94-1.00, respectively. The NTPA was independently associated with patient gender and body mass index (BMI) but not frailty (mFI). Age, BMI, mFI, and American Anesthesiologists' Society score were not associated with incidence of postoperative AEs. The NTPA did not predict the occurrence of AE (odds ratio [OR] 1.06 per 100 mm(2)/m(2), 95% confidence interval ["
2018 Jan,The spine journal : official journal of the North American Spine Society,Spine J. 2018 Jan;18(1):88-98. doi: 10.1016/j.spinee.2017.06.032. Epub 2017 Jul ,"['Paquet, Jérôme', 'Rivers, Carly S', 'Kurban, Dilnur', 'Finkelstein, Joel', 'Tee, Jin W', 'Noonan, Vanessa K', 'Kwon, Brian K', 'Hurlbert, R John', 'Christie, Sean', 'Tsai, Eve C', 'Ahn, Henry', 'Drew, Brian', 'Bailey, Christopher S', 'Fourney, Daryl R', 'Attabib, Najmedden', 'Johnson, Michael G', 'Fehlings, Michael G', 'Parent, Stefan', 'Dvorak, Marcel F']","['adult', 'aged', 'canada', 'cervical cord  injuries', 'female', 'hospital mortality', 'hospitalization', 'humans', 'male', 'middle aged', 'registries  statistics & numerical data', 'spinal cord injuries  epidemiology', 'central cord syndrome', 'cervical spinal cord injury', 'decompressive surgery', 'incomplete spinal cord injury', 'spinal cord injury', 'spine stability', 'spondylosis']","The impact of spine stability on cervical spinal cord injury with respect to demographics, management, and outcome: a prospective cohort from a national spinal cord injury registry.",BACKGROUND CONTEXT: Emergent surgery for patients with a traumatic spinal cord injury (S
2017 May,Neural regeneration research,Neural Regen Res. 2017 May;12(5):674. doi: 10.4103/1673-5374.206661.,"['Elizei, Sanam Salimi', 'Kwon, Brian K']",[],Correction: The translational importance of establishing biomarkers of human spinal cord injury.,"[This corrects the article on p. 385 in vol. 12, PMID: 28469645.]."
2017 Oct 15,Journal of neurotrauma,J Neurotrauma. 2017 Oct 15;34(20):2883-2891. doi: 10.1089/neu.2016.4933. Epub ,"['Marion, Travis E', 'Rivers, Carly S', 'Kurban, Dilnur', 'Cheng, Christiana L', 'Fallah, Nader', 'Batke, Juliet', 'Dvorak, Marcel F', 'Fisher, Charles G', 'Kwon, Brian K', 'Noonan, Vanessa K', 'Street, John T']","['adult', 'aged', 'canada epidemiology', 'cohort studies', ' comorbidity', 'female', 'humans', 'male', 'middle aged', 'prospective studies', 'registries', 'risk factors', 'spinal cord injuries  complications  epidemiology', 'spine adverse events severity system', 'adverse events', 'comorbidities', 'complications', 'spinal cord injury']",Previously Identified Common Post-Injury Adverse Events in Traumatic Spinal Cord Injury-Validation of Existing Literature and Relation to Selected Potentially Modifiable Comorbidities: A Prospective Canadian Cohort Study.,Adverse events (AEs) are common during care in patients with traumatic spinal cord injury (tS
2017 Mar,Neural regeneration research,Neural Regen Res. 2017 Mar;12(3):385-388. doi: 10.4103/1673-5374.202933.,"['Elizei, Sanam Salimi', 'Kwon, Brian K']","['biomarkers', 'cerebrospinal fluid', 'injury severity', 'neurological recovery', 'spinal cord injury']",The translational importance of establishing biomarkers of human spinal cord injury.,The evaluation of such novel therapies for acute spinal cord injury in clinical trials is extremely challenging. Our current dependence upon the clinical assessment of neurologic impairment renders many acute S
2017 May 3,Scientific reports,Sci Rep. 2017 May 3;7(1):1376. doi: 10.1038/s41598-017-01299-x.,"['Tigchelaar, Seth', 'Streijger, Femke', 'Sinha, Sunita', 'Flibotte, Stephane', 'Manouchehri, Neda', 'So, Kitty', 'Shortt, Katelyn', 'Okon, Elena', 'Rizzuto, Michael A', 'Malenica, Ivana', 'Courtright-Lim, Amanda', 'Eisen, Andrew', 'Keuren-Jensen, Kendall Van', 'Nislow, Corey', 'Kwon, Brian K']","['animals', 'biomarkers blood', 'disease models, animal', 'female', 'micrornas  blood', 'roc curve', 'severity of illness index', 'spinal cord', 'spinal cord injuries  blood  diagnosis', 'swine']",Serum MicroRNAs Reflect Injury Severity in a Large Animal Model of Thoracic Spinal Cord Injury.,"Therapeutic development for spinal cord injury is hindered by the difficulty in conducting clinical trials, which to date have relied solely on functional outcome measures for patient enrollment, stratification, and evaluation. Biological biomarkers that accurately classify injury severity and predict neurologic outcome would represent a paradigm shift in the way spinal cord injury clinical trials could be conducted. MicroRNAs have emerged as attractive biomarker candidates due to their stability in biological fluids, their phylogenetic similarities, and their tissue specificity. Here we characterized a porcine model of spinal cord injury using a combined behavioural, histological, and molecular approach. We performed next-generation sequencing on microRNAs in serum samples collected before injury and then at 1, 3, and 5 days post injury. We identified 58, 21, 9, and 7 altered miRNA after severe, moderate, and mild spinal cord injury, and SHAM surgery, respectively. These data were combined with behavioural and histological analysis. Overall miRNA expression at 1 and 3 days post injury strongly correlates with outcome measures at 12 weeks post injury. The data presented here indicate that serum miRNAs are promising candidates as biomarkers for the evaluation of injury severity for spinal cord injury or other forms of traumatic, acute, neurologic injury."
2017 Oct 15,Journal of neurotrauma,J Neurotrauma. 2017 Oct 15;34(20):2877-2882. doi: 10.1089/neu.2016.4931. Epub ,"['Glennie, R Andrew', 'Batke, Juliet', 'Fallah, Nader', 'Cheng, Christiana L', 'Rivers, Carly S', 'Noonan, Vanessa K', 'Dvorak, Marcel F', 'Fisher, Charles G', 'Kwon, Brian K', 'Street, John T']","['adult', 'canada epidemiology', 'cohort studies', 'female', 'health services accessibility', 'health status', 'humans', 'male', 'middle aged', ' population dynamics', 'quality of life', ' rural population', 'spinal cord injuries  epidemiology psychology', ' urban population', 'community needs', 'follow-up studies', 'quality of life', 'rural urban migration', 'spinal cord injury']","Rural and Urban Living in Persons with Spinal Cord Injury and Comparing Environmental Barriers, Their Health, and Quality-of-Life Outcomes.",There is worldwide geographic variation in the epidemiology of traumatic spinal cord injury (tS
