time,journal,doi_info,authors,key words,title,abstract
2022 Aug 15,Spine,Spine (Phila Pa 1976). 2022 Aug 15;47(16):1128-1136. doi: ,"['Karim, S Mohammed', 'Fisher, Charles', 'Glennie, Andrew', 'Rampersaud, Raja', 'Street, John', 'Dvorak, Marcel', 'Paquette, Scott', 'Kwon, Brian K', 'Charest-Morin, Raphaele', 'Ailon, Tamir', 'Manson, Neil', 'Abraham, Edward', 'Thomas, Ken', 'Urquhart, Jennifer', 'Bailey, Christopher S']","['adult', 'aged', 'back pain diagnostic imaging etiology surgery', 'canada', 'female', 'humans', 'lumbar vertebrae diagnostic imaging surgery', 'male', 'patient reported outcome measures', 'prospective studies', 'retrospective studies', ' spondylolisthesis diagnostic imaging surgery']",Preoperative Patient-reported Outcomes are not Associated With Sagittal and Spinopelvic Alignment in Degenerative Lumbar Spondylolisthesis.,"STUDY DESIGN: Prospective cohort study. OBJECTIVE: The aim of this study was to evaluate whether sagittal and spinopelvic alignment correlate with preoperative patient-reported outcomes (PROs) in degenerative lumbar spondylolisthesis (DLS) with spinal stenosis. SUMMARY OF BACKGROUND DATA: Positive global sagittal balance and spinopelvic malalignment are strongly correlated with symptom severity in adult spinal deformity, but this correlation has not been evaluated in DLS. METHODS: Patients were enrolled in the Canadian Spine Outcomes Research Network (CSORN) prospective DLS study at seven centers between January 2015 and May 2018. Correlation was assessed between the following preoperative PROs: Oswestry Disability Index (ODI), numeric rating scale (NRS) leg pain, and NRS back pain and the following preoperative sagittal radiographic parameters SS, PT, PI, SVA, LL, TK, T1SPI, T9SPI, and PI-LL. Patients were further divided into groups based on spinopelvic alignment: Group 1 PI-LL<10°; Group 2 PI-LL ≥10° with PT <30°; and Group 3 PI-LL ≥10° with PT ≥30°. Preoperative PROs were compared among these three groups and were further stratified by those with SVA <50 mm and SVA ≥50 mm. RESULTS: A total of 320 patients (61% female) with mean age of 66.1 years were included. Mean (SD) preoperative PROs were: NRS leg pain 7.4 (2.1), NRS back pain 7.1 (2.0), and ODI 45.5 (14.5). Preoperative radiographic parameters included: SVA 27.1 (33.4) mm, LL 45.7 (13.4°), PI 57.6 (11.9), and PI-LL 11.8 (14.0°). Weak but statistically significant correlations were observed between leg pain and PT (r = -0.114) and PI (ρ = -0.130), and T9SPI with back pain ( r = 0.130). No significant differences were observed among the three groups stratified by PI-LL and PT. No significant differences in PROs were observed between patients with SVA <50 mm compared to those with SVA ≥50 mm. CONCLUSION: Sagittal and spinopelvic malalignment do not appear to significantly influence baseline PROs in patients with DLS. LEVEL OF EVIDENCE: Prognostic level II."
2022 May,Spinal cord,Spinal Cord. 2022 May;60(5):470-475. doi: 10.1038/s41393-022-00802-0. Epub 2022 ,"['Gee, Cameron M', 'Tsang, Angela', 'Bélanger, Lise M', 'Ritchie, Leanna', 'Ailon, Tamir', 'Paquette, Scott', 'Charest-Morin, Raphaele', 'Dea, Nicolas', 'Street, John', 'Fisher, Charles G', 'Dvorak, Marcel F', 'Kwon, Brian K']","['arterial pressure', 'hemodynamics', 'humans', 'spinal cord', ' spinal cord injuries drug therapy', 'vasoconstrictor agents therapeutic use']",All over the MAP: describing pressure variability in acute spinal cord injury.,STUDY DESIGN: Observational study. OBJECTIVES: To examine the feasibility of meeting the current clinical guidelines for the hemodynamic management of acute spinal cord injury (S
2022 Feb 17,"Antioxidants (Basel, Switzerland)",Antioxidants (Basel). 2022 Feb 17;11(2):408. doi: 10.3390/antiox11020408.,"['Ashok, Anushruti', 'Andrabi, Syed Suhail', 'Mansoor, Saffar', 'Kuang, Youzhi', 'Kwon, Brian K', 'Labhasetwar, Vinod']","['cns', 'antioxidant enzymes', 'inflammation', 'neurodegeneration', 'polymers', 'reactive oxygen species']",Antioxidant Therapy in Oxidative Stress-Induced Neurodegenerative Diseases: Role of Nanoparticle-Based Drug Delivery Systems in Clinical Translation.,"Free radicals are formed as a part of normal metabolic activities but are neutralized by the endogenous antioxidants present in cells/tissue, thus maintaining the redox balance. This redox balance is disrupted in certain neuropathophysiological conditions, causing oxidative stress, which is implicated in several progressive neurodegenerative diseases. Following neuronal injury, secondary injury progression is also caused by excessive production of free radicals. Highly reactive free radicals, mainly the reactive oxygen species (ROS) and reactive nitrogen species (RNS), damage the cell membrane, proteins, and DNA, which triggers a self-propagating inflammatory cascade of degenerative events. Dysfunctional mitochondria under oxidative stress conditions are considered a key mediator in progressive neurodegeneration. Exogenous delivery of antioxidants holds promise to alleviate oxidative stress to regain the redox balance. In this regard, natural and synthetic antioxidants have been evaluated. Despite promising results in preclinical studies, clinical translation of antioxidants as a therapy to treat neurodegenerative diseases remains elusive. The issues could be their low bioavailability, instability, limited transport to the target tissue, and/or poor antioxidant capacity, requiring repeated and high dosing, which cannot be administered to humans because of dose-limiting toxicity. Our laboratory is investigating nanoparticle-mediated delivery of antioxidant enzymes to address some of the above issues. Apart from being endogenous, the main advantage of antioxidant enzymes is their catalytic mechanism of action; hence, they are significantly more effective at lower doses in detoxifying the deleterious effects of free radicals than nonenzymatic antioxidants. This review provides a comprehensive analysis of the potential of antioxidant therapy, challenges in their clinical translation, and the role nanoparticles/drug delivery systems could play in addressing these challenges."
2022 Feb,Global spine journal,Global Spine J. 2022 Feb;12(1_suppl):97S-108S. doi: 10.1177/21925682211050925.,"['Boerger, Timothy F', 'Hyngstrom, Allison S', 'Furlan, Julio C', 'Kalsi-Ryan, Sukhvinder', 'Curt, Armin', 'Kwon, Brian K', 'Kurpad, Shekar N', 'Fehlings, Michael G', 'Harrop, James S', 'Aarabi, Bizhan', 'Rahimi-Movaghar, Vafa', 'Guest, James D', 'Wilson, Jefferson R', 'Davies, Benjamin M', 'Kotter, Mark R N', 'Koljonen, Paul A']","['body weight support', 'cervical', 'gait', 'hand', 'myelopathy', 'rehabilitation', 'spondylosis', 'therapy', 'virtual reality']",Developing Peri-Operative Rehabilitation in Degenerative Cervical Myelopathy [AO Spine RECODE-DCM Research Priority Number 6]: An Unexplored Opportunity?,"STUDY DESIGN: Narrative review. OBJECTIVE: Degenerative cervical myelopathy is one of the most frequent impairments of the spinal cord encountered internationally in adults. Currently, surgical decompression is the recommended treatment for people with DCM (PwCM) presenting with moderate to severe symptoms or neurological deficits. However, despite surgical intervention, not all patients make a complete recovery due to the irreversible tissue damage within the spinal cord. The objective of this review is to describe the state and gaps in the current literature on rehabilitation for PwCM and possible innovative rehabilitation strategies. METHODS: Literature search. RESULTS: In other neurological disorders such as stroke and acute traumatic spinal cord injury (S"
2022 Feb,Global spine journal,Global Spine J. 2022 Feb;12(1_suppl):28S-38S. doi: 10.1177/21925682211050927.,"['Davies, Benjamin M', 'Mowforth, Oliver', 'Wood, Helen', 'Karimi, Zahabiya', 'Sadler, Iwan', 'Tetreault, Lindsay', 'Milligan, Jamie', 'Wilson, Jamie R F', 'Kalsi-Ryan, Sukhvinder', 'Furlan, Julio C', 'Kawaguchi, Yoshiharu', 'Ito, Manabu', 'Zipser, Carl Moritz', 'Boerger, Timothy F', 'Vaccaro, Alexander R', 'Murphy, Rory K J', 'Hutton, Mike', 'Rodrigues-Pinto, Ricardo', 'Koljonen, Paul A', 'Harrop, James S', 'Aarabi, Bizhan', 'Rahimi-Movaghar, Vafa', 'Kurpad, Shekar N', 'Guest, James D', 'Wilson, Jefferson R', 'Kwon, Brian K', 'Kotter, Mark R N', 'Fehlings, Michael G']","['cervical', 'degenerative cervical myelopathy', 'disability', 'disc herniation', 'myelopathy', 'ossification posterior longitudinal ligament', 'policy', 'prioritization', 'research prioritization', 'review', 'spondylosis', 'spondylotic', 'stenosis']",Improving Awareness Could Transform Outcomes in Degenerative Cervical Myelopathy [AO Spine RECODE-DCM Research Priority Number 1].,"STUDY DESIGN: Literature Review (Narrative). OBJECTIVE: To introduce the number one research priority for Degenerative Cervical Myelopathy (DCM): Raising Awareness. METHODS: Raising awareness has been recognized by AO Spine RECODE-DCM as the number one research priority. This article reviews the evidence that awareness is low, the potential drivers, and why this must be addressed. Case studies of success from other diseases are also reviewed, drawing potential parallels and opportunities for DCM. RESULTS: DCM may affect as many as 1 in 50 adults, yet few will receive a diagnosis and those that do will wait many years for it. This leads to poorer outcomes from surgery and greater disability. DCM is rarely featured in healthcare professional training programs and has received relatively little research funding (<2% of Amyotrophic Lateral Sclerosis or Multiple Sclerosis over the last 25 years). The transformation of stroke and acute coronary syndrome services, from a position of best supportive care with occasional surgery over 50 years ago, to avoidable disability today, represents transferable examples of success and potential opportunities for DCM. Central to this is raising awareness. CONCLUSION: Despite the devastating burden on the patient, recognition across research, clinical practice, and healthcare policy are limited. DCM represents a significant unmet need that must become an international public health priority."
2022 Feb,Global spine journal,Global Spine J. 2022 Feb;12(1_suppl):147S-158S. doi: 10.1177/21925682211062494.,"['Rodrigues-Pinto, Ricardo', 'Montenegro, Thiago S', 'Davies, Benjamin M', 'Kato, So', 'Kawaguchi, Yoshiharu', 'Ito, Manabu', 'Zileli, Mehmet', 'Kwon, Brian K', 'Fehlings, Michael G', 'Koljonen, Paul A', 'Kurpad, Shekar N', 'Guest, James D', 'Aarabi, Bizhan', 'Rahimi-Movaghar, Vafa', 'Wilson, Jefferson R', 'Kotter, Mark R N', 'Harrop, James S']","['cervical spine', 'cervical spondylotic myelopathy', 'degenerative cervical myelopathy', 'myelopathy', 'nontraumatic spinal cord injury', 'spondylosis']",Optimizing the Application of Surgery for Degenerative Cervical Myelopathy [AO Spine RECODE-DCM Research Priority Number 10].,"STUDY DESIGN: Literature Review (Narrative). OBJECTIVE: To introduce the number 10 research priority for Degenerative Cervical Myelopathy: Individualizing Surgery. METHODS: This article summarizes the current recommendations and indications for surgery, including how known prognostic factors such as injury time, age, disease severity, and associated comorbidities impact surgical outcome. It also considers key areas of uncertainty that should be the focus of future research. RESULTS: While a small proportion of conservatively managed patients may remain stable, the majority will deteriorate over time. To date, surgical decompression is the mainstay of treatment, able to halt disease progression and improve neurologic function and quality of life for most patients. Whilst this recognition has led to recommendations on when to offer surgery, there remain many uncertainties including the type of surgery, or timing in milder and/or asymptomatic cases. Their clarification has the potential to transform outcomes, by ensuring surgery offers each individual its maximum benefit. CONCLUSION: Developing the evidence to better guide surgical decision-making at the individual patient level is a research priority for Degenerative Cervical Myelopathy."
2022 Feb,Global spine journal,Global Spine J. 2022 Feb;12(1_suppl):5S-7S. doi: 10.1177/21925682211035379.,"['Davies, Benjamin M', 'Kwon, Brian K', 'Fehlings, Michael G', 'Kotter, Mark R N']",[],AO Spine RECODE-DCM: Why Prioritize Research in Degenerative Cervical Myelopathy?,
2022 Feb,Global spine journal,Global Spine J. 2022 Feb;12(1_suppl):19S-27S. doi: 10.1177/21925682211062501.,"['Tetreault, Lindsay', 'Mowforth, Oliver', 'Khan, Danyal Z', 'Gronlund, Toto', 'Garwood, Philip', 'Hazenbiller, Olesja', 'Harrop, James S', 'Aarabi, Bizhan', 'Rahimi-Movaghar, Vafa', 'Kurpad, Shekar N', 'Guest, James D', 'Wilson, Jefferson R', 'Kwon, Brian K', 'Fehlings, Michael G', 'Davies, Benjamin M', 'Kotter, Mark R N']","['james lind alliance', 'degenerative cervical myelopathy', 'priority setting partnership', 'research uncertainties', 'surveys and questionnaires']",James Lind Alliance Priority Setting Partnership for Degenerative Cervical Myelopathy [AO Spine RECODE-DCM]: An Overview of the Methodology Used to Process and Short-List Research Uncertainties.,"STUDY DESIGN: Overview of the methods used for a James Lind Alliance (JLA) Priority Setting Partnership (PSP). OBJECTIVES: The objectives of this article are to (i) provide a brief overview of the JLA-facilitated PSP process; (ii) outline how research uncertainties were initially processed in the AO Spine RECODE-DCM PSP; and (iii) delineate the methods for interim prioritization and the priority setting workshop. METHODS: A steering group was created to define the scope for the PSP, organize its activities, and establish protocols for decision-making. A survey was created asking what questions on the diagnosis, treatment, and long-term management of DCM should be answered by future research. Results from the survey were sorted into summary questions. Several databases were searched to identify literature that already answered these summary questions. The final list of summary questions was distributed by survey for interim prioritization. Participants were asked to select the top ten most important summary questions. The questions that were ranked the highest were discussed at an in-person consensus workshop. RESULTS: The initial survey yielded a total of 3404 potential research questions. Of the in-scope submissions, 988 were related to diagnosis, 1324 to treatment, and 615 to long-term management of DCM. A total of 76 summary questions were developed to reflect the original submissions. Following a second survey, a list of the top 26 interim priorities was generated and discussed at the in-person priority setting workshop. CONCLUSIONS: PSPs enable research priorities to be identified that consider the perspectives and interests of all relevant stakeholders."
2022 Feb,Global spine journal,Global Spine J. 2022 Feb;12(1_suppl):122S-129S. doi: 10.1177/21925682211039835.,"['Davies, Benjamin M', 'Phillips, Richard', 'Clarke, David', 'Furlan, Julio C', 'Demetriades, Andreas K', 'Milligan, Jamie', 'Witiw, Christopher D', 'Harrop, James S', 'Aarabi, Bizhan', 'Kurpad, Shekar N', 'Guest, James D', 'Wilson, Jefferson R', 'Kwon, Brian K', 'Vaccaro, Alexander R', 'Fehlings, Michael G', 'Rahimi-Movaghar, Vafa', 'Kotter, Mark R N']","['cervical myelopathy', 'cervical spondylosis', 'cervical stenosis', 'degeneration', 'disc herniation', 'health economics', 'ossification posterior longitudinal ligament', 'policy', 'research priorities', 'socioeconomics']",Establishing the Socio-Economic Impact of Degenerative Cervical Myelopathy Is Fundamental to Improving Outcomes [AO Spine RECODE-DCM Research Priority Number 8].,"STUDY DESIGN: Literature Review (Narrative). OBJECTIVE: To contextualize AO Spine RECODE-DCM research priority number 5: What is the socio-economic impact of DCM? (The financial impact of living with DCM to the individual, their supporters, and society as a whole). METHODS: In this review, we introduce the methodology of health-economic investigation, including potential techniques and approaches. We summarize the current health-economic evidence within DCM, so far focused on surgical treatment. We also cover the first national estimate, in partnership with Myelopathy.org from the United Kingdom, of the cost of DCM to society. We then demonstrate the significance of this question to advancing care and outcomes in the field. RESULTS: DCM is a common and often disabling condition, with a significant lack of recognition. While evidence demonstrates the cost-effectives of surgery, even among higher income countries, health inequalities exist. Further the prevalent residual disability in myelopathy, despite treatment affects both the individual and society as a whole. A report from the United Kingdom provides the first cost-estimate to their society; an annual cost of ∼£681.6 million per year, but this is likely a significant underestimate. CONCLUSION: A clear quantification of the impact of DCM is needed to raise the profile of a common and disabling condition. Current evidence suggests this is likely to be globally substantial."
2022 Feb,Global spine journal,Global Spine J. 2022 Feb;12(1_suppl):55S-63S. doi: 10.1177/21925682211030871.,"['Hilton, Bryn', 'Gardner, Emma L', 'Jiang, Zhilin', 'Tetreault, Lindsay', 'Wilson, Jamie R F', 'Zipser, Carl Moritz', 'Riew, K Daniel', 'Guest, James D', 'Harrop, James S', 'Fehlings, Michael G', 'Rodrigues-Pinto, Ricardo', 'Rahimi-Movaghar, Vafa', 'Aarabi, Bizhan', 'Koljonen, Paul A', 'Kotter, Mark R N', 'Davies, Benjamin M', 'Kwon, Brian K']","['cervical', 'criteria', 'degenerative', 'diagnostic', 'myelopathy', 'spine']",Establishing Diagnostic Criteria for Degenerative Cervical Myelopathy [AO Spine RECODE-DCM Research Priority Number 3].,"STUDY DESIGN: Narrative review. OBJECTIVES: To discuss the importance of establishing diagnostic criteria in Degenerative Cervical Myelopathy (DCM), including factors that must be taken into account and challenges that must be overcome in this process. METHODS: Literature review summarising current evidence of establishing diagnostic criteria for DCM. RESULTS: Degenerative Cervical Myelopathy (DCM) is characterised by a degenerative process of the cervical spine resulting in chronic spinal cord dysfunction and subsequent neurological disability. Diagnostic delays lead to progressive neurological decline with associated reduction in quality of life for patients. Surgical decompression may halt neurologic worsening and, in many cases, improves function. Therefore, making a prompt diagnosis of DCM in order to facilitate early surgical intervention is a clinical priority in DCM. CONCLUSION: There are often extensive delays in the diagnosis of DCM. Presently, no single set of diagnostic criteria exists for DCM, making it challenging for clinicians to make the diagnosis. Earlier diagnosis and subsequent specialist referral could lead to improved patient outcomes using existing treatment modalities."
2022 Feb,Global spine journal,Global Spine J. 2022 Feb;12(1_suppl):78S-96S. doi: 10.1177/21925682211057546.,"['Davies, Benjamin M', 'Mowforth, Oliver', 'Gharooni, Aref-Ali', 'Tetreault, Lindsay', 'Nouri, Aria', 'Dhillon, Rana S', 'Bednarik, Josef', 'Martin, Allan R', 'Young, Adam', 'Takahashi, Hitoshi', 'Boerger, Timothy F', 'Newcombe, Virginia Fj', 'Zipser, Carl Moritz', 'Freund, Patrick', 'Koljonen, Paul Aarne', 'Rodrigues-Pinto, Ricardo', 'Rahimi-Movaghar, Vafa', 'Wilson, Jefferson R', 'Kurpad, Shekar N', 'Fehlings, Michael G', 'Kwon, Brian K', 'Harrop, James S', 'Guest, James D', 'Curt, Armin', 'Kotter, Mark R N']","['cervical', 'degeneration', 'disability', 'disc herniation', 'myelopathy', 'ossification posterior longitudinal ligament', 'questionnaire', 'recovery', 'spondylosis', 'spondylotic', 'stenosis']","A New Framework for Investigating the Biological Basis of Degenerative Cervical Myelopathy [AO Spine RECODE-DCM Research Priority Number 5]: Mechanical Stress, Vulnerability and Time.","STUDY DESIGN: Literature Review (Narrative). OBJECTIVE: To propose a new framework, to support the investigation and understanding of the pathobiology of DCM, AO Spine RECODE-DCM research priority number 5. METHODS: Degenerative cervical myelopathy is a common and disabling spinal cord disorder. In this perspective, we review key knowledge gaps between the clinical phenotype and our biological models. We then propose a reappraisal of the key driving forces behind DCM and an individual's susceptibility, including the proposal of a new framework. RESULTS: Present pathobiological and mechanistic knowledge does not adequately explain the disease phenotype; why only a subset of patients with visualized cord compression show clinical myelopathy, and the amount of cord compression only weakly correlates with disability. We propose that DCM is better represented as a function of several interacting mechanical forces, such as shear, tension and compression, alongside an individual's vulnerability to spinal cord injury, influenced by factors such as age, genetics, their cardiovascular, gastrointestinal and nervous system status, and time. CONCLUSION: Understanding the disease pathobiology is a fundamental research priority. We believe a framework of mechanical stress, vulnerability, and time may better represent the disease as a whole. Whilst this remains theoretical, we hope that at the very least it will inspire new avenues of research that better encapsulate the full spectrum of disease."
2022 Feb,Global spine journal,Global Spine J. 2022 Feb;12(1_suppl):39S-54S. doi: 10.1177/21925682211036071.,"['Nouri, Aria', 'Tessitore, Enrico', 'Molliqaj, Granit', 'Meling, Torstein', 'Schaller, Karl', 'Nakashima, Hiroaki', 'Yukawa, Yasutsugu', 'Bednarik, Josef', 'Martin, Allan R', 'Vajkoczy, Peter', 'Cheng, Joseph S', 'Kwon, Brian K', 'Kurpad, Shekar N', 'Fehlings, Michael G', 'Harrop, James S', 'Aarabi, Bizhan', 'Rahimi-Movaghar, Vafa', 'Guest, James D', 'Davies, Benjamin M', 'Kotter, Mark R N', 'Wilson, Jefferson R']","['cervical spondylotic myelopathy (csm)', 'cord compression', 'ossification of the posterior longitudinal ligament (opll)', 'progression', 'risk factors']",Degenerative Cervical Myelopathy: Development and Natural History [AO Spine RECODE-DCM Research Priority Number 2].,"STUDY DESIGN: Narrative review. OBJECTIVES: To discuss the current understanding of the natural history of degenerative cervical myelopathy (DCM). METHODS: Literature review summarizing current evidence pertaining to the natural history and risk factors of DCM. RESULTS: DCM is a common condition in which progressive arthritic disease of the cervical spine leads to spinal cord compression resulting in a constellation of neurological symptoms, in particular upper extremity dysfunction and gait impairment. Anatomical factors including cord-canal mismatch, congenitally fused vertebrae and genetic factors may increase individuals' risk for DCM development. Non-myelopathic spinal cord compression (NMSCC) is a common phenomenon with a prevalence of 24.2% in the healthy population, and 35.3% among individuals >60 years of age. Clinical radiculopathy and/or electrophysiological signs of cervical cord dysfunction appear to be risk factors for myelopathy development. Radiological progression of incidental Ossification of the Posterior Longitudinal Ligament (OPLL) is estimated at 18.3% over 81-months and development of myelopathy ranges between 0-61.5% (follow-up ranging from 40 to 124 months between studies) among studies. In patients with symptomatic DCM undergoing non-operative treatment, 20-62% will experience neurological deterioration within 3-6 years. CONCLUSION: Current estimates surrounding the natural history of DCM, particularly those individuals with mild or minimal impairment, lack precision. Clear predictors of clinical deterioration for those treated with non-operative care are yet to be identified. Future studies are needed on this topic to help improve treatment counseling and clinical prognostication."
