time,journal,doi_info,authors,key words,title,abstract
2018 Jun 19,RSC advances,RSC Adv. 2018 Jun 20;8(40):22490-22497. doi: 10.1039/c8ra02764a. eCollection 2018 ,"['Pawar, Sandip V', 'Hallam, Steven J', 'Yadav, Vikramaditya G']",[],Metagenomic discovery of a novel transaminase for valorization of monoaromatic compounds.,"The profitability of next-generation biorefineries is acutely contingent on the discovery and utilization of biocatalysts that can valorize lignin. To this end, the metabolic catalogues of diverse microbiota have been mined previously using functional metagenomics in order to identify biocatalysts that can selectively degrade lignin into monoaromatic compounds. Herein, we have further improved the valorization factor of biorefining by deploying functional metagenomics toward the identification of a novel transaminase that can selectively functionalize lignin-derived monoaromatics to produce value-added feedstocks for pharmaceutical synthesis. We implemented a high-throughput colorimetric assay using o-xylylenediamine as the amino donor and successfully identified a transaminase that utilizes the canonical cofactor, pyridoxal 5'-phosphate, to aminate as many as 14 monoaromatic aldehydes and ketones. We subsequently identified the optimal conditions for enzyme activity towards the most favoured amino acceptor, benzaldehyde, including temperature, pH and choice of co-solvent. We also evaluated the specificity of the enzyme towards a variety of amino donors, as well as the optimal concentration of the most favoured amino donor. Significantly, the novel enzyme is markedly smaller than typical transaminases, and it is stably expressed in E. coli without any modifications to its amino acid sequence. Finally, we developed and implemented a computational methodology to assess the activity of the novel transaminase. The methodology is generalizable for assessing any transaminase and facilitates in silico screening of enzyme-substrate combinations in order to develop efficient biocatalytic routes to value-added amines. The computational pipeline is an ideal complement to metagenomics and opens new possibilities for biocatalyst discovery."
2018 Jun,"Small (Weinheim an der Bergstrasse, Germany)",Small. 2018 Jun;14(26):e1800729. doi: 10.1002/smll.201800729. Epub 2018 May 31.,"['Srivastava, Sarvesh Kumar', 'Piwek, Przemyslaw', 'Ayakar, Sonal R', 'Bonakdarpour, Arman', 'Wilkinson, David P', 'Yadav, Vikramaditya G']","['biocompatible materials  chemistry', 'electrochemistry', 'escherichia coli drug effects metabolism ultrastructure', 'lycopene analysis', ' solar energy', 'titanium pharmacology', 'x-ray diffraction', 'biogenic materials', 'biohybrid materials', 'biophotovoltaics', 'supramolecular assembly', 'synthetic biology']",A Biogenic Photovoltaic Material.,"A proof-of-concept for the fabrication of genetically customizable biogenic materials for photovoltaic applications is presented. E. coli is first genetically engineered to heterologously express the carotenoid biosynthetic pathway from plants. This modification yields a strain that overproduces the photoactive pigment lycopene. The pigment-producing cells are then coated with TiO(2) nanoparticles via a tryptophan-mediated supramolecular interface, and subsequent incorporation of the resulting biogenic material (cells@TiO(2) ) as an anode in an I(-) /I(3)(-) -based dye-sensitized solar cell yields an excellent photovoltaic (PV) response. This work lays strong foundations for the development of bio-PV materials and next-generation organic optoelectronics that are green, inexpensive, and easy to manufacture."
2018 Jun,Drug delivery and translational research,Drug Deliv Transl Res. 2018 Jun;8(3):484-495. doi: 10.1007/s13346-018-0504-x.,"['Kabiri, Maryam', 'Kamal, Syed H', 'Pawar, Sandip V', 'Roy, Protiva R', 'Derakhshandeh, Maziar', 'Kumar, Ujendra', 'Hatzikiriakos, Savvas G', 'Hossain, Sazzad', 'Yadav, Vikramaditya G']","['administration, ophthalmic', 'animals', 'benzoates  administration & dosage metabolism', 'cornea  metabolism', 'delayed-action preparations administration & dosage chemistry', 'drug compounding', 'escherichia coli genetics metabolism', 'hyaluronic acid administration & dosage chemistry', 'hydrogels  administration & dosage chemistry', 'methylcellulose administration & dosage chemistry', 'nanoparticles  administration & dosage chemistry', 'polyesters administration & dosage chemistry', 'polyethylene glycols administration & dosage chemistry', 'rheology', 'swine', 'cannabinoids', 'glaucoma', 'hydrogel', 'nanoparticles', 'switchable rheology', 'synthetic biology']","A stimulus-responsive, in situ-forming, nanoparticle-laden hydrogel for ocular drug delivery.","Most medications targeting optic neuropathies are administered as eye drops. However, their corneal penetration efficiencies are typically < 5%. There is a clear, unmet need for novel transcorneal drug delivery vehicles. To this end, we have developed a stimulus-responsive, in situ-forming, nanoparticle-laden hydrogel for controlled release of poorly bioavailable drugs into the aqueous humor of the eye. The hydrogel is formulated as a composite of hyaluronic acid (HA) and methylcellulose (MC). The amphiphilic nanoparticles are composed of poly(ethylene oxide) (PEO) and poly(lactic acid) (PLA). Experimental design aided the identification of hydrogel composition and nanoparticle content in the formulation, and the formulation reliably switched between thixotropy and temperature-dependent rheopexy when it was tested in a rheometer under conditions that simulate the ocular surface, including blinking. These properties should ensure that the formulation coats the cornea through blinking of the eyelid and facilitate application of the medication as an eye drop immediately prior to the patient's bedtime. We subsequently tested the efficacy of our formulation in whole-eye experiments by loading the nanoparticles with cannabigerolic acid (CBGA). Our formulation exhibits over a 300% increase in transcorneal penetration over control formulations. This work paves the way for the introduction of novel products targeting ocular diseases to the market."
2018 May,Trends in biotechnology,Trends Biotechnol. 2018 May;36(5):483-487. doi: 10.1016/j.tibtech.2017.11.002. ,"['Srivastava, Sarvesh Kumar', 'Yadav, Vikramaditya G']","[' artificial cells', 'artificial organs  trends', 'bionics  methods  trends', 'humans', 'biogenic design', 'bionic manufacturing', 'cyborg cells', 'microbial cell factories', 'micromotors', 'synthetic biology']",Bionic Manufacturing: Towards Cyborg Cells and Sentient Microbots.,"Bio-inspired engineering applies biological design principles towards developing engineering solutions but is not practical as a manufacturing paradigm. We advocate 'bionic manufacturing', a synergistic fusion of biotic and abiotic components, to transition away from bio-inspiration toward bio-augmentation to address current limitations in bio-inspired manufacturing."
2018 Feb 16,ACS synthetic biology,ACS Synth Biol. 2018 Feb 16;7(2):392-398. doi: 10.1021/acssynbio.7b00412. Epub ,"['Ho, Joe C H', 'Pawar, Sandip V', 'Hallam, Steven J', 'Yadav, Vikramaditya G']","['biosensing techniques  methods', ' escherichia coli enzymology genetics', 'escherichia coli proteins genetics metabolism', 'lignin  metabolism', 'membrane proteins genetics metabolism', ' metagenome', 'metagenomics  methods', 'operon', 'biosensors', 'functional metagenomic screening', 'lignin degradation']",An Improved Whole-Cell Biosensor for the Discovery of Lignin-Transforming Enzymes in Functional Metagenomic Screens.,"The discovery and utilization of biocatalysts that selectively valorize lignocellulose is critical to the profitability of next-generation biorefineries. Here, we report the development of a refactored, whole-cell, GFP-based biosensor for high-throughput identification of biocatalysts that transform lignin into specialty chemicals from environmental DNA of uncultivable archaea and bacteria. The biosensor comprises the transcriptional regulator and promoter of the emrRAB operon of E. coli, and the configuration of the biosensor was tuned with the aid of mathematical model. The biosensor sensitively and selectively detects vanillin and syringaldehyde, and responds linearly over a wide detection range. We employed the biosensor to screen 42 520 fosmid clones comprising environmental DNA isolated from two coal beds and successfully identified 147 clones that transform hardwood kraft lignin to vanillin and syringaldehyde."
2017 Sep 25,Journal of chemical information and modeling,J Chem Inf Model. 2017 Sep 25;57(9):2119-2131. doi: 10.1021/acs.jcim.7b00072. ,"['Varela, Julia Nogueira', 'Lammoglia Cobo, María Fernanda', 'Pawar, Sandip V', 'Yadav, Vikramaditya G']","['antimalarials chemistry  pharmacology therapeutic use', 'drug discovery  methods', 'drug resistance', 'informatics  methods', 'malaria, falciparum  drug therapy']",Cheminformatic Analysis of Antimalarial Chemical Space Illuminates Therapeutic Mechanisms and Offers Strategies for Therapy Development.,"The clear and present danger of malaria, which has been amplified in recent years by climate change, and the progressive thinning of our drug arsenal over the past two decades raise uncomfortable questions about the current state and future of antimalarial drug development. Besides suffering from many of the same technical challenges that affect drug development in other disease areas, the quest for new antimalarial therapies is also hindered by the complex, dynamic life cycle of the malaria parasite, P. falciparum, in its mosquito and human hosts, and its role thereof in the elicitation of drug resistance. New strategies are needed in order to ensure economical and expeditious development of new, more efficacious treatments. In the present study, we employ open-source cheminformatics tools to analyze the chemical space traversed by approved antimalarial drugs and promising candidates at various stages of development to uncover insights that could shape future endeavors in the field. Our scaffold-centric analysis reveals that the antimalarial chemical space is disjointed and segregated into a few dominant structural groups. In fact, the structures of antimalarial drugs and drug candidates are distributed according to Pareto's principle. This structural convergence can potentially be exploited for future drug discovery by incorporating it into bioinformatics workflows that are typically employed for solving problems in structural biology. Significantly, we demonstrate how molecular scaffold hunting can be applied to unearth putative mechanisms of action of drugs whose activities remain a mystery, and how scaffold-centric analysis of drug space can also provide a recipe for combination therapies that minimize the likelihood of emergence of drug resistance, as well as identify areas on which to focus efforts. Finally, we also observe that over half of the molecules in the antimalarial space bear no resemblance to other molecules in the collection, which suggests that the pharmacobiology of antimalarial drugs has not been entirely surveyed."
2017 Feb 5,"Molecules (Basel, Switzerland)",Molecules. 2017 Feb 5;22(2):235. doi: 10.3390/molecules22020235.,"['Bayly, Carmen L', 'Yadav, Vikramaditya G']","['catalysis', 'models, molecular', 'polyketide synthases  chemistry  metabolism', ' protein domains', ' protein engineering methods', 'structure-activity relationship', 'substrate specificity', 'antibiotics', 'polyketide synthases', 'protein engineering', 'structural biology', 'synthetic biology']",Towards Precision Engineering of Canonical Polyketide Synthase Domains: Recent Advances and Future Prospects.,"Modular polyketide synthases (mPKSs) build functionalized polymeric chains, some of which have become blockbuster therapeutics. Organized into repeating clusters (modules) of independently-folding domains, these assembly-line-like megasynthases can be engineered by introducing non-native components. However, poor introduction points and incompatible domain combinations can cause both unintended products and dramatically reduced activity. This limits the engineering and combinatorial potential of mPKSs, precluding access to further potential therapeutics. Different regions on a given mPKS domain determine how it interacts both with its substrate and with other domains. Within the assembly line, these interactions are crucial to the proper ordering of reactions and efficient polyketide construction. Achieving control over these domain functions, through precision engineering at key regions, would greatly expand our catalogue of accessible polyketide products. Canonical mPKS domains, given that they are among the most well-characterized, are excellent candidates for such fine-tuning. The current minireview summarizes recent advances in the mechanistic understanding and subsequent precision engineering of canonical mPKS domains, focusing largely on developments in the past year."
2017,Current topics in medicinal chemistry,Curr Top Med Chem. 2017;17(2):251-267. doi: 10.2174/1568026616666160530154649.,"['Pawar, Sandip V', 'Ho, Joe C H', 'Yadav, Ganapati D', 'Yadav, Vikramaditya G']","['anti-bacterial agents  chemistry', 'biological products  chemistry', ' drug discovery']",The Impending Renaissance in Discovery & Development of Natural Products.,"Antibiotics are wonder drugs. Unfortunately, owing to overuse, antibiotic resistance is now a serious problem. Society now finds itself in the post-antibiotic era, and the threat of infectious diseases is on the rise. New antibiotics are sorely needed. There is strong evidence that suggests natural products are an attractive source of new antimicrobials. They posses desirable structural and chemical properties that make them potent thearpeutics. However, steep tehnological challenges associated with screening and manufacturing these molecules has stifled the discovery, development and marketing of new antimicrobials. To this end, two recent scientific developments are poised to redress this situation. The recent development of metagenomics and ancillary high-throughput screening technologies has exponentiated the volume of useful genetic sequence information that can be screened for antimicrobial discovery. These approaches have been instrumental in the discovery of new antibiotics from soil and marine environments. Secondly, a new manufacturing paradigm employing metabolic engineering as its engine has greatly accelerated the path to market for these molecules, in addition to improving the atom and energy economy of antimicrobial manufacturing. We outine these developments in this review, and provide a perspective on integrating next-generation approaches such as metagenomics and metabolic engineering with traditional methodologies for discovering and manufacturing antimicrobial natural products in order to unleash a rennaissance in the discovery and development of antimicrobials."
