time,journal,doi_info,authors,key words,title,abstract
2020 Dec 2,International journal of molecular sciences,Int J Mol Sci. 2020 Dec 2;21(23):9185. doi: 10.3390/ijms21239185.,"['Singh, Amritpal', 'Walker, Kenneth T', 'Ledesma-Amaro, Rodrigo', 'Ellis, Tom']","['bacteria genetics  metabolism', 'biocompatible materials', 'cellulose  metabolism', 'genetic engineering', ' metabolic engineering methods', ' synthetic biology methods', 'bacterial cellulose', 'biomaterials', 'metabolic engineering', 'synthetic biology']",Engineering Bacterial Cellulose by Synthetic Biology.,"Synthetic biology is an advanced form of genetic manipulation that applies the principles of modularity and engineering design to reprogram cells by changing their DNA. Over the last decade, synthetic biology has begun to be applied to bacteria that naturally produce biomaterials, in order to boost material production, change material properties and to add new functionalities to the resulting material. Recent work has used synthetic biology to engineer several Komagataeibacter strains; bacteria that naturally secrete large amounts of the versatile and promising material bacterial cellulose (BC). In this review, we summarize how genetic engineering, metabolic engineering and now synthetic biology have been used in Komagataeibacter strains to alter BC, improve its production and begin to add new functionalities into this easy-to-grow material. As well as describing the milestone advances, we also look forward to what will come next from engineering bacterial cellulose by synthetic biology."
2020 Oct 14,Nature communications,Nat Commun. 2020 Oct 14;11(1):5174. doi: 10.1038/s41467-020-19092-2.,"['Meng, Fankang', 'Ellis, Tom']","['history, 21st century', 'synthetic biology  history methods trends']",The second decade of synthetic biology: 2010-2020.,"Synthetic biology is among the most hyped research topics this century, and in 2010 it entered its teenage years. But rather than these being a problematic time, we’ve seen synthetic biology blossom and deliver many new technologies and landmark achievements."
2019 Nov 7,Genes,Genes (Basel). 2019 Nov 7;10(11):902. doi: 10.3390/genes10110902.,"['Gowers, Glen-Oliver F', 'Vince, Oliver', 'Charles, John-Henry', 'Klarenberg, Ingeborg', 'Ellis, Tom', 'Edwards, Arwyn']","['electric power supplies', ' expeditions', 'ice cover  microbiology', 'iceland', ' metagenome', 'metagenomics instrumentation  methods', ' microbiota', 'nanopore sequencing instrumentation  methods', ' solar energy', 'expedition', 'metagenomics', 'microbial sequencing', 'nanopore', 'polar']",Entirely Off-Grid and Solar-Powered DNA Sequencing of Microbial Communities during an Ice Cap Traverse Expedition.,"Microbial communities in remote locations remain under-studied. This is particularly true on glaciers and icecaps, which cover approximately 11% of the Earth's surface. The principal reason for this is the inaccessibility of most of these areas due to their extreme isolation and challenging environmental conditions. While remote research stations have significantly lowered the barrier to studying the microbial communities on icecaps, their use has led to a bias for data collection in the near vicinity of these institutions. Here, miniaturisation of a DNA sequencing lab suitable for off-grid metagenomic studies is demonstrated. Using human power alone, this lab was transported across Europe's largest ice cap (Vatnajökull, Iceland) by ski and sledge. After 11 days of unsupported polar-style travel, a metagenomic study of a geothermal hot spring gorge was conducted on the remote northern edge of the ice cap. This tent-based metagenomic study resulted in over 24 h of Nanopore sequencing, powered by solar power alone. This study demonstrates the ability to conduct DNA sequencing in remote locations, far from civilised resources (mechanised transport, external power supply, internet connection, etc.), whilst greatly reducing the time from sample collection to data acquisition."
2019 Nov 15,ACS synthetic biology,ACS Synth Biol. 2019 Nov 15;8(11):2566-2575. doi: 10.1021/acssynbio.9b00243. Epub ,"['Gowers, Glen-Oliver F', 'Cameron, Simon J S', 'Perdones-Montero, Alvaro', 'Bell, David', 'Chee, Soo Mei', 'Kern, Marcelo', 'Tew, David', 'Ellis, Tom', 'Takáts, Zoltan']","['agar', 'chromatography, liquid methods', 'culture media', 'high-throughput screening assays  methods', 'metabolic engineering  methods', 'pentacyclic triterpenes', 'plasmids genetics', 'saccharomyces cerevisiae  genetics metabolism', 'spectrometry, mass, matrix-assisted laser desorption-ionization  methods', 'synthetic biology methods', 'transformation, genetic', 'triterpenes  chemical synthesis', 'betulinic acid', 'reims', 'ambient mass spectrometry', 'high throughput screening', 'metabolic engineering', 'synthetic biology']",Off-Colony Screening of Biosynthetic Libraries by Rapid Laser-Enabled Mass Spectrometry.,"By leveraging advances in DNA synthesis and molecular cloning techniques, synthetic biology increasingly makes use of large construct libraries to explore large design spaces. For biosynthetic pathway engineering, the ability to screen these libraries for a variety of metabolites of interest is essential. If the metabolite of interest or the metabolic phenotype is not easily measurable, screening soon becomes a major bottleneck involving time-consuming culturing, sample preparation, and extraction. To address this, we demonstrate the use of automated laser-assisted rapid evaporative ionization mass spectrometry (LA-REIMS)-a form of ambient laser desorption ionization mass spectrometry-to perform rapid mass spectrometry analysis direct from agar plate yeast colonies without sample preparation or extraction. We use LA-REIMS to assess production levels of violacein and betulinic acid directly from yeast colonies at a rate of 6 colonies per minute. We then demonstrate the throughput enabled by LA-REIMS by screening over 450 yeast colonies within <4 h, while simultaneously generating recoverable glycerol stocks of each colony in real time. This showcases LA-REIMS as a prescreening tool to complement downstream quantification methods such as liquid chromatography-mass spectroscopy (LCMS). By prescreening several hundred colonies with LA-REIMS, we successfully isolate and verify a strain with a 2.5-fold improvement in betulinic acid production. Finally, we show that LA-REIMS can detect 20 out of a panel of 27 diverse biological molecules, demonstrating the broad applicability of LA-REIMS to metabolite detection. The rapid and automated nature of LA-REIMS makes this a valuable new technology to complement existing screening technologies currently employed in academic and industrial workflows."
2019 Jun 3,Microbial cell factories,Microb Cell Fact. 2019 Jun 3;18(1):101. doi: 10.1186/s12934-019-1149-2.,"['Det-Udom, Rachatida', 'Gilbert, Charlie', 'Liu, Long', 'Prakitchaiwattana, Cheunjit', 'Ellis, Tom', 'Ledesma-Amaro, Rodrigo']","['bacillus subtilis genetics  metabolism', 'coculture techniques', ' fermentation', 'industrial microbiology', 'metabolic engineering  methods', 'microbiota', 'polymers  metabolism', ' soy foods', 'glycine max  microbiology', 'synthetic biology', 'xylose genetics  metabolism', 'industrial microbiome', 'metabolic engineering', 'soy sauce', 'synthetic biology', 'synthetic microbial communities']",Towards semi-synthetic microbial communities: enhancing soy sauce fermentation properties in B. subtilis co-cultures.,"BACKGROUND: Many fermented foods and beverages are produced through the action of complex microbial communities. Synthetic biology approaches offer the ability to genetically engineer these communities to improve the properties of these fermented foods. Soy sauce is a fermented condiment with a vast global market. Engineering members of the microbial communities responsible for soy sauce fermentation may therefore lead to the development of improved products. One important property is the colour of soy sauce, with recent evidence pointing to a consumer preference for more lightly-coloured soy sauce products for particular dishes. RESULTS: Here we show that a bacterial member of the natural soy sauce fermentation microbial community, Bacillus, can be engineered to reduce the 'browning' reaction during soy sauce production. We show that two approaches result in 'de-browning': engineered consumption of xylose, an important precursor in the browning reaction, and engineered degradation of melanoidins, the major brown pigments in soy sauce. Lastly, we show that these two strategies work synergistically using co-cultures to result in enhanced de-browning. CONCLUSIONS: Our results demonstrate the potential of using synthetic biology and metabolic engineering methods for fine-tuning the process of soy sauce fermentation and indeed for many other natural food and beverage fermentations for improved products."
2019 Apr 18,Cell,Cell. 2019 Apr 18;177(3):782-796.e27. doi: 10.1016/j.cell.2019.02.023. Epub 2019 ,"['Shaw, William M', 'Yamauchi, Hitoshi', 'Mead, Jack', 'Gowers, Glen-Oliver F', 'Bell, David J', 'Öling, David', 'Larsson, Niklas', 'Wigglesworth, Mark', 'Ladds, Graham', 'Ellis, Tom']","['gene expression drug effects', 'genetic engineering', 'humans', 'pheromones pharmacology', 'receptors, g-protein-coupled  metabolism', 'saccharomyces cerevisiae metabolism', 'saccharomyces cerevisiae proteins genetics metabolism', ' signal transduction drug effects', 'transcription factors genetics metabolism', 'g protein-coupled receptor', 'saccharomyces cerevisiae', 'biosensor', 'cell signaling', 'cell-to-cell communication', 'genome engineering', 'synthetic biology']",Engineering a Model Cell for Rational Tuning of GPCR Signaling.,"G protein-coupled receptor (GPCR) signaling is the primary method eukaryotes use to respond to specific cues in their environment. However, the relationship between stimulus and response for each GPCR is difficult to predict due to diversity in natural signal transduction architecture and expression. Using genome engineering in yeast, we constructed an insulated, modular GPCR signal transduction system to study how the response to stimuli can be predictably tuned using synthetic tools. We delineated the contributions of a minimal set of key components via computational and experimental refactoring, identifying simple design principles for rationally tuning the dose response. Using five different GPCRs, we demonstrate how this enables cells and consortia to be engineered to respond to desired concentrations of peptides, metabolites, and hormones relevant to human health. This work enables rational tuning of cell sensing while providing a framework to guide reprogramming of GPCR-based signaling in other systems."
2019 Apr 19,ACS synthetic biology,ACS Synth Biol. 2019 Apr 19;8(4):906-910. doi: 10.1021/acssynbio.9b00041. Epub ,"['McCarty, Nicholas S', 'Shaw, William M', 'Ellis, Tom', 'Ledesma-Amaro, Rodrigo']","['crispr-cas systems genetics', 'cloning, molecular methods', 'gene editing methods', 'gene expression genetics', 'polymerase chain reaction methods', 'promoter regions, genetic genetics', 'rna, guide, crispr-cas systems  genetics', 'saccharomyces cerevisiae  genetics', 'transcription, genetic genetics', 'crispr', 'golden gate assembly', 'moclo toolkit', 'assembly method', 'multiplex', 'yeast']",Rapid Assembly of gRNA Arrays via Modular Cloning in Yeast.,"CRISPR is a versatile technology for genomic editing and regulation, but the expression of multiple gRNAs in S. cerevisiae has thus far been limited. We present here a simple extension to the Yeast MoClo Toolkit, which enables the rapid assembly of gRNA arrays using a minimal set of parts. Using a dual-PCR, Type IIs restriction enzyme Golden Gate assembly approach, at least 12 gRNAs can be assembled and expressed from a single transcriptional unit. We demonstrate that these gRNA arrays can stably regulate gene expression in a synergistic manner via dCas9-mediated repression. This approach expands the number of gRNAs that can be expressed in this model organism and may enable the versatile editing or transcriptional regulation of a greater number of genes in vivo."
2019 Jan 18,ACS synthetic biology,ACS Synth Biol. 2019 Jan 18;8(1):1-15. doi: 10.1021/acssynbio.8b00423. Epub 2019 ,"['Gilbert, Charlie', 'Ellis, Tom']","['bioengineering  methods', 'biofilms growth & development', 'microscopy, electron, transmission', 'synthetic biology methods']",Biological Engineered Living Materials: Growing Functional Materials with Genetically Programmable Properties.,"Natural biological materials exhibit remarkable properties: self-assembly from simple raw materials, precise control of morphology, diverse physical and chemical properties, self-repair, and the ability to sense-and-respond to environmental stimuli. Despite having found numerous uses in human industry and society, the utility of natural biological materials is limited. But, could it be possible to genetically program microbes to create entirely new and useful biological materials? At the intersection between microbiology, material science, and synthetic biology, the emerging field of biological engineered living materials (ELMs) aims to answer this question. Here we review recent efforts to program cells to produce living materials with novel functional properties, focusing on microbial systems that can be engineered to grow materials and on new genetic circuits for pattern formation that could be used to produce the more complex systems of the future."
2018,"Synthetic biology (Oxford, England)",Synth Biol (Oxf). 2018 Nov 27;3(1):ysy020. doi: 10.1093/synbio/ysy020. ,"['Blount, Benjamin A', 'Ellis, Tom']","['crispr', 'scramble', 'sc2.0', 'synthetic genome', 'workshop']",The Synthetic Genome Summer Course.,"The Synthetic Genome Summer Course was convened with the aim of teaching a wide range of researchers the theory and practical skills behind recent advances in synthetic biology and synthetic genome science, with a focus on Sc2.0, the synthetic yeast genome project. Through software workshops, tutorials and research talks from leading members of the field, the 30 attendees learnt about relevant principles and techniques that they were then able to implement first-hand in laboratory-based practical sessions. Participants SCRaMbLEd semi-synthetic yeast strains to diversify heterologous pathways, used automation to build combinatorial pathway libraries and used CRISPR to debug fitness defects caused by synthetic chromosome design changes. Societal implications of synthetic chromosomes were explored and industrial stakeholders discussed synthetic biology from a commercial standpoint. Over the 5 days, participants gained valuable insight and acquired skills to aid them in future synthetic genome research."
2019 Jul,Microbial biotechnology,Microb Biotechnol. 2019 Jul;12(4):611-619. doi: 10.1111/1751-7915.13340. Epub ,"['Walker, Kenneth T', 'Goosens, Vivianne J', 'Das, Akashaditya', 'Graham, Alicia E', 'Ellis, Tom']","['acetobacteraceae genetics growth & development  metabolism', 'acyl-butyrolactones  metabolism', 'biofilms growth & development', 'cellulose  metabolism', 'gene expression regulation, bacterial drug effects', ' quorum sensing']",Engineered cell-to-cell signalling within growing bacterial cellulose pellicles.,"Bacterial cellulose is a strong and flexible biomaterial produced at high yields by Acetobacter species and has applications in health care, biotechnology and electronics. Naturally, bacterial cellulose grows as a large unstructured polymer network around the bacteria that produce it, and tools to enable these bacteria to respond to different locations are required to grow more complex structured materials. Here, we introduce engineered cell-to-cell communication into a bacterial cellulose-producing strain of Komagataeibacter rhaeticus to enable different cells to detect their proximity within growing material and trigger differential gene expression in response. Using synthetic biology tools, we engineer Sender and Receiver strains of K. rhaeticus to produce and respond to the diffusible signalling molecule, acyl-homoserine lactone. We demonstrate that communication can occur both within and between growing pellicles and use this in a boundary detection experiment, where spliced and joined pellicles sense and reveal their original boundary. This work sets the basis for synthetic cell-to-cell communication within bacterial cellulose and is an important step forward for pattern formation within engineered living materials."
2019 Jan,Microbial biotechnology,Microb Biotechnol. 2019 Jan;12(1):41-43. doi: 10.1111/1751-7915.13327. Epub 2018 ,"['Ellis, Tom']","[' adaptation, biological', 'bacteria  genetics  growth & development', 'biotechnology  methods', ' evolution, molecular', ' metabolic engineering', 'mutation', 'selection, genetic']",Predicting how evolution will beat us.,"In this Crystal Ball article, we look ahead to the possibility of model and tools that can predict the accumulation of mutations that inactivate engineered plasmids."
2018,"Synthetic biology (Oxford, England)",Synth Biol (Oxf). 2018 Oct 13;3(1):ysy019. doi: 10.1093/synbio/ysy019. ,"['Weenink, Tim', 'van der Hilst, Jelle', 'McKiernan, Robert M', 'Ellis, Tom']","['rna secondary structure', 'gene expression', 'modularity', 'translation', 'yeast']",Design of RNA hairpin modules that predictably tune translation in yeast.,"Modular parts for tuning translation are prevalent in prokaryotic synthetic biology but lacking for eukaryotic synthetic biology. Working in Saccharomyces cerevisiae yeast, we here describe how hairpin RNA structures inserted into the 5' untranslated region (5'UTR) of mRNAs can be used to tune expression levels by 100-fold by inhibiting translation. We determine the relationship between the calculated free energy of folding in the 5'UTR and in vivo protein abundance, and show that this enables rational design of hairpin libraries that give predicted expression outputs. Our approach is modular, working with different promoters and protein coding sequences, and outperforms promoter mutation as a way to predictably generate a library where a protein is induced to express at a range of different levels. With this new tool, computational RNA sequence design can be used to predictably fine-tune protein production for genes expressed in yeast."
2018 Oct 11,Nature biotechnology,Nat Biotechnol. 2018 Oct 11;36(10):934-935. doi: 10.1038/nbt.4257.,"['Gorochowski, Thomas E', 'Ellis, Tom']","[' escherichia coli', ' protein biosynthesis', 'rna, messenger']",Designing efficient translation.,
2018,Communications biology,Commun Biol. 2018 Jan 22;1:7. doi: 10.1038/s42003-017-0008-0. eCollection 2018.,"['Pothoulakis, Georgios', 'Ellis, Tom']",[],Synthetic gene regulation for independent external induction of the Saccharomyces cerevisiae pseudohyphal growth phenotype.,"Pseudohyphal growth is a multicellular phenotype naturally performed by wild budding yeast cells in response to stress. Unicellular yeast cells undergo gross changes in their gene regulation and elongate to form branched filament structures consisting of connected cells. Here, we construct synthetic gene regulation systems to enable external induction of pseudohyphal growth in Saccharomyces cerevisiae. By controlling the expression of the natural PHD1 and FLO8 genes we are able to trigger pseudohyphal growth in both diploid and haploid yeast, even in different types of rich media. Using this system, we also investigate how members of the BUD gene family control filamentation in haploid cells. Finally, we employ a synthetic genetic timer network to control pseudohyphal growth and further explore the reversibility of differentiation. Our work demonstrates that synthetic regulation can exert control over a complex multigene phenotype and offers opportunities for rationally modifying the resulting multicellular structure."
2018 Sep 21,ACS synthetic biology,ACS Synth Biol. 2018 Sep 21;7(9):2317-2321. doi: 10.1021/acssynbio.8b00118. Epub ,"['Öling, David', 'Lawenius, Lina', 'Shaw, William', 'Clark, Sonya', 'Kettleborough, Ross', 'Ellis, Tom', 'Larsson, Niklas', 'Wigglesworth, Mark']","['down-regulation drug effects', 'gene library', 'glucose  metabolism pharmacology', 'mutagenesis, site-directed', 'receptors, g-protein-coupled genetics  metabolism', 'saccharomyces cerevisiae  metabolism', 'saccharomyces cerevisiae proteins genetics  metabolism', 'signal transduction', 'up-regulation drug effects', 'beta-fructofuranosidase genetics']",Large Scale Synthetic Site Saturation GPCR Libraries Reveal Novel Mutations That Alter Glucose Signaling.,"Site saturation mutagenesis (SSM) is a powerful mutagenesis strategy for protein engineering and directed evolution experiments. However, limiting factors using this method are either biased representation of variants, or limiting library size. To overcome these hurdles, we generated large scale targeted synthetic SSM libraries using massively parallel oligonucleotide synthesis and benchmarked this against an error-prone (epPCR) library. The yeast glucose activated GPCR-Gpr1 was chosen as a prototype to evolve novel glucose sensors. We demonstrate superior variant representation and several unique hits in the synthetic library compared to the PCR generated library. Application of this mutational approach further builds the possibilities of synthetic biology in tuning of a response to known ligands and in generating biosensors for novel ligands."
2018 Aug,Nature reviews. Molecular cell biology,Nat Rev Mol Cell Biol. 2018 Aug;19(8):481-482. doi: 10.1038/s41580-018-0013-2.,"['Ceroni, Francesca', 'Ellis, Tom']","['animals', ' cell engineering', ' genetic engineering', 'humans', ' synthetic biology']",The challenges facing synthetic biology in eukaryotes.,
2018 Apr 13,Nature communications,Nat Commun. 2018 Apr 13;9(1):1457. doi: 10.1038/s41467-018-03970-x.,"['Borkowski, Olivier', 'Bricio, Carlos', 'Murgiano, Michela', 'Rothschild-Mancinelli, Brooke', 'Stan, Guy-Bart', 'Ellis, Tom']","[' cell-free system', 'computer simulation', 'dna, bacterial metabolism', 'escherichia coli  metabolism', 'escherichia coli proteins metabolism', 'gene library', 'green fluorescent proteins  metabolism', 'models, genetic', 'operon', 'plasmids metabolism', 'protein biosynthesis', 'proteomics', 'rna, messenger metabolism', 'software', 'beta carotene metabolism']",Cell-free prediction of protein expression costs for growing cells.,"Translating heterologous proteins places significant burden on host cells, consuming expression resources leading to slower cell growth and productivity. Yet predicting the cost of protein production for any given gene is a major challenge, as multiple processes and factors combine to determine translation efficiency. To enable prediction of the cost of gene expression in bacteria, we describe here a standard cell-free lysate assay that provides a relative measure of resource consumption when a protein coding sequence is expressed. These lysate measurements can then be used with a computational model of translation to predict the in vivo burden placed on growing E. coli cells for a variety of proteins of different functions and lengths. Using this approach, we can predict the burden of expressing multigene operons of different designs and differentiate between the fraction of burden related to gene expression compared to action of a metabolic pathway."
2018 May,Nature methods,Nat Methods. 2018 May;15(5):387-393. doi: 10.1038/nmeth.4635. Epub 2018 Mar 26.,"['Ceroni, Francesca', 'Boo, Alice', 'Furini, Simone', 'Gorochowski, Thomas E', 'Borkowski, Olivier', 'Ladak, Yaseen N', 'Awan, Ali R', 'Gilbert, Charlie', 'Stan, Guy-Bart', 'Ellis, Tom']","['escherichia coli genetics  physiology', 'gene expression regulation, bacterial  physiology', 'high-throughput nucleotide sequencing', 'plasmids', 'promoter regions, genetic', 'sequence analysis, rna', ' synthetic biology', 'transcription, genetic']",Burden-driven feedback control of gene expression.,"Cells use feedback regulation to ensure robust growth despite fluctuating demands for resources and differing environmental conditions. However, the expression of foreign proteins from engineered constructs is an unnatural burden that cells are not adapted for. Here we combined RNA-seq with an in vivo assay to identify the major transcriptional changes that occur in Escherichia coli when inducible synthetic constructs are expressed. We observed that native promoters related to the heat-shock response activated expression rapidly in response to synthetic expression, regardless of the construct. Using these promoters, we built a dCas9-based feedback-regulation system that automatically adjusts the expression of a synthetic construct in response to burden. Cells equipped with this general-use controller maintained their capacity for native gene expression to ensure robust growth and thus outperformed unregulated cells in terms of protein yield in batch production. This engineered feedback is to our knowledge the first example of a universal, burden-based biomolecular control system and is modular, tunable and portable."
