time,journal,doi_info,authors,key words,title,abstract
2018,PloS one,PLoS One. 2018 Mar 22;13(3):e0194588. doi: 10.1371/journal.pone.0194588. ,"['Pothoulakis, Georgios', 'Ellis, Tom']","['deoxyribonucleases, type ii site-specific genetics', 'galactokinase genetics metabolism', ' gene expression regulation, fungal', 'gene regulatory networks', 'haploidy', 'promoter regions, genetic  genetics', 'repressor proteins drug effects genetics', 'saccharomyces cerevisiae  genetics', 'saccharomyces cerevisiae proteins genetics metabolism', 'synthetic biology  methods', 'tetracycline pharmacology']",Construction of hybrid regulated mother-specific yeast promoters for inducible differential gene expression.,"Engineered promoters with predefined regulation are a key tool for synthetic biology that enable expression on demand and provide the logic for genetic circuits. To expand the availability of synthetic biology tools for S. cerevisiae yeast, we here used hybrid promoter engineering to construct tightly-controlled, externally-inducible promoters that only express in haploid mother cells that have contributed a daughter cell to the population. This is achieved by combining elements from the native HO promoter and from a TetR-repressible synthetic promoter, with the performance of these promoters characterized by both flow cytometry and microfluidics-based fluorescence microscopy. These new engineered promoters are provided as an enabling tool for future synthetic biology applications that seek to exploit differentiation within a yeast population."
2017 Oct,Current opinion in chemical biology,Curr Opin Chem Biol. 2017 Oct;40:A1-A3. doi: 10.1016/j.cbpa.2017.10.027.,"['Jewett, Michael C', 'Ellis, Tom']","['animals', 'biosynthetic pathways', 'genetic engineering methods', 'humans', 'protein engineering methods', 'synthetic biology methods  trends', 'therapeutics methods']",Editorial overview: Synthetic biology: Frontiers in synthetic biology.,
2017 Nov 14,eLife,Elife. 2017 Nov 14;6:e30247. doi: 10.7554/eLife.30247.,"['Wintle, Bonnie C', 'Boehm, Christian R', 'Rhodes, Catherine', 'Molloy, Jennifer C', 'Millett, Piers', 'Adam, Laura', 'Breitling, Rainer', 'Carlson, Rob', 'Casagrande, Rocco', 'Dando, Malcolm', 'Doubleday, Robert', 'Drexler, Eric', 'Edwards, Brett', 'Ellis, Tom', 'Evans, Nicholas G', 'Hammond, Richard', 'Haseloff, Jim', 'Kahl, Linda', 'Kuiken, Todd', 'Lichman, Benjamin R', 'Matthewman, Colette A', 'Napier, Johnathan A', 'ÓhÉigeartaigh, Seán S', 'Patron, Nicola J', 'Perello, Edward', 'Shapira, Philip', 'Tait, Joyce', 'Takano, Eriko', 'Sutherland, William J']","['bioengineering  trends', 'climate change', 'conservation of natural resources', 'humans', 'research  trends', 'biological engineering', 'biorisk', 'ecology', 'expert elicitation', 'foresight', 'horizon scanning', 'human biology', 'medicine', 'synthetic biology']",A transatlantic perspective on 20 emerging issues in biological engineering.,"Advances in biological engineering are likely to have substantial impacts on global society. To explore these potential impacts we ran a horizon scanning exercise to capture a range of perspectives on the opportunities and risks presented by biological engineering. We first identified 70 potential issues, and then used an iterative process to prioritise 20 issues that we considered to be emerging, to have potential global impact, and to be relatively unknown outside the field of biological engineering. The issues identified may be of interest to researchers, businesses and policy makers in sectors such as health, energy, agriculture and the environment."
2017 Oct 17,Proceedings of the National Academy of Sciences of the United States of America,Proc Natl Acad Sci U S A. 2017 Oct 17;114(42):11006-11008. doi: ,"['Mitchell, Leslie A', 'Ellis, Tom']","['communicable diseases', 'genetic engineering', ' genome', ' synthetic biology']",Synthetic genome engineering gets infectious.,
2017 May 4,Nature communications,Nat Commun. 2017 May 4;8:15202. doi: 10.1038/ncomms15202.,"['Awan, Ali R', 'Blount, Benjamin A', 'Bell, David J', 'Shaw, William M', 'Ho, Jack C H', 'McKiernan, Robert M', 'Ellis, Tom']","['anti-bacterial agents  biosynthesis', 'fermentation', 'genetic engineering  methods', 'penicillin g  metabolism', 'penicillins  biosynthesis', 'peptide biosynthesis, nucleic acid-independent  genetics physiology', 'saccharomyces cerevisiae enzymology  genetics  metabolism', 'streptococcus  growth & development']",Biosynthesis of the antibiotic nonribosomal peptide penicillin in baker's yeast.,"Fungi are a valuable source of enzymatic diversity and therapeutic natural products including antibiotics. Here we engineer the baker's yeast Saccharomyces cerevisiae to produce and secrete the antibiotic penicillin, a beta-lactam nonribosomal peptide, by taking genes from a filamentous fungus and directing their efficient expression and subcellular localization. Using synthetic biology tools combined with long-read DNA sequencing, we optimize productivity by 50-fold to produce bioactive yields that allow spent S. cerevisiae growth media to have antibacterial action against Streptococcus bacteria. This work demonstrates that S. cerevisiae can be engineered to perform the complex biosynthesis of multicellular fungi, opening up the possibility of using yeast to accelerate rational engineering of nonribosomal peptide antibiotics."
2017 Jun 16,ACS synthetic biology,ACS Synth Biol. 2017 Jun 16;6(6):957-967. doi: 10.1021/acssynbio.6b00292. Epub ,"['Gilbert, Charlie', 'Howarth, Mark', 'Harwood, Colin R', 'Ellis, Tom']","['bacillus subtilis genetics  metabolism', 'bacterial proteins chemistry genetics metabolism', 'endo-1,4-beta xylanases chemistry genetics metabolism', 'extracellular space  metabolism', 'hot temperature', 'protein engineering', 'recombinant fusion proteins  chemistry genetics  metabolism', 'synthetic biology  methods', 'spytag-spycatcher', 'extracellular self-assembly', 'microbial consortia', 'protein conjugation', 'thermotolerance', 'tunability']",Extracellular Self-Assembly of Functional and Tunable Protein Conjugates from Bacillus subtilis.,"The ability to stably and specifically conjugate recombinant proteins to one another is a powerful approach for engineering multifunctional enzymes, protein therapeutics, and novel biological materials. While many of these applications have been illustrated through in vitro and in vivo intracellular protein conjugation methods, extracellular self-assembly of protein conjugates offers unique advantages: simplifying purification, reducing toxicity and burden, and enabling tunability. Exploiting the recently described SpyTag-SpyCatcher system, we describe here how enzymes and structural proteins can be genetically encoded to covalently conjugate in culture media following programmable secretion from Bacillus subtilis. Using this approach, we demonstrate how self-conjugation of a secreted industrial enzyme, XynA, dramatically increases its resilience to boiling, and we show that cellular consortia can be engineered to self-assemble functional protein-protein conjugates with tunable composition. This novel genetically encoded modular system provides a flexible strategy for protein conjugation harnessing the substantial advantages of extracellular self-assembly."
2016 Oct 21,ACS synthetic biology,ACS Synth Biol. 2016 Oct 21;5(10):1033. doi: 10.1021/acssynbio.6b00265.,"['Ellis, Tom', 'Cai, Yizhi']","['europe', 'synthetic biology  methods  trends']",Synthetic Biology in Europe.,
2016 Oct,Current opinion in microbiology,Curr Opin Microbiol. 2016 Oct;33:123-130. doi: 10.1016/j.mib.2016.07.009. Epub ,"['Borkowski, Olivier', 'Ceroni, Francesca', 'Stan, Guy-Bart', 'Ellis, Tom']","['dna, bacterial genetics', 'escherichia coli  genetics growth & development metabolism', 'genetic engineering  methods', 'models, biological', 'synthetic biology  methods']",Overloaded and stressed: whole-cell considerations for bacterial synthetic biology.,"The predictability and robustness of engineered bacteria depend on the many interactions between synthetic constructs and their host cells. Expression from synthetic constructs is an unnatural load for the host that typically reduces growth, triggers stresses and leads to decrease in performance or failure of engineered cells. Work in systems and synthetic biology has now begun to address this through new tools, methods and strategies that characterise and exploit host-construct interactions in bacteria. Focusing on work in E. coli, we review here a selection of the recent developments in this area, highlighting the emerging issues and describing the new solutions that are now making the synthetic biology community consider the cell just as much as they consider the construct."
2017,"Methods in molecular biology (Clifton, N.J.)",Methods Mol Biol. 2017;1472:79-91. doi: 10.1007/978-1-4939-6343-0_6.,"['Storch, Marko', 'Casini, Arturo', 'Mackrow, Ben', 'Ellis, Tom', 'Baldwin, Geoff S']","['base sequence', ' cloning, molecular', 'escherichia coli genetics', 'polymerase chain reaction', 'transformation, bacterial', 'combinatorial', 'dna assembly', 'hierarchical', 'idempotent', 'pathway engineering']",BASIC: A Simple and Accurate Modular DNA Assembly Method.,"Biopart Assembly Standard for Idempotent Cloning (BASIC) is a simple, accurate, and robust DNA assembly method. The method is based on linker-mediated DNA assembly and provides highly accurate DNA assembly with 99 % correct assemblies for four parts and 90 % correct assemblies for seven parts [1]. The BASIC standard defines a single entry vector for all parts flanked by the same prefix and suffix sequences and its idempotent nature means that the assembled construct is returned in the same format. Once a part has been adapted into the BASIC format it can be placed at any position within a BASIC assembly without the need for reformatting. This allows laboratories to grow comprehensive and universal part libraries and to share them efficiently. The modularity within the BASIC framework is further extended by the possibility of encoding ribosomal binding sites (RBS) and peptide linker sequences directly on the linkers used for assembly. This makes BASIC a highly versatile library construction method for combinatorial part assembly including the construction of promoter, RBS, gene variant, and protein-tag libraries. In comparison with other DNA assembly standards and methods, BASIC offers a simple robust protocol; it relies on a single entry vector, provides for easy hierarchical assembly, and is highly accurate for up to seven parts per assembly round [2]."
2016 Aug,Cell systems,Cell Syst. 2016 Aug;3(2):116-117. doi: 10.1016/j.cels.2016.08.004.,"['Ceroni, Francesca', 'Blount, Benjamin A', 'Ellis, Tom']","['bacterial proteins genetics', 'escherichia coli  genetics', 'escherichia coli proteins  genetics', 'genetic engineering', 'metabolic engineering', 'quorum sensing']",Sensing the Right Time to Be Productive.,Engineered E. coli can be made to autonomously switch from growth to production by a modular two-gate system that reduces the burden of biosynthesis.
2016 Jul 29,"Science (New York, N.Y.)",Science. 2016 Jul 29;353(6298):444-5. doi: 10.1126/science.aah4438.,"['Borkowski, Olivier', 'Gilbert, Charlie', 'Ellis, Tom']","['dna', 'escherichia coli  genetics', 'genetic engineering', ' synthetic biology']",SYNTHETIC BIOLOGY. On the record with E. coli DNA.,
2016 Dec 16,ACS synthetic biology,ACS Synth Biol. 2016 Dec 16;5(12):1342-1347. doi: 10.1021/acssynbio.5b00298. Epub ,"['Reeve, Benjamin', 'Martinez-Klimova, Elena', 'de Jonghe, Joachim', 'Leak, David J', 'Ellis, Tom']","['cloning, molecular', 'dna copy number variations', 'escherichia coli genetics', ' genetic engineering', 'geobacillus  genetics metabolism', 'hot temperature', 'plasmids  genetics metabolism', 'promoter regions, genetic', 'synthetic biology  methods', 'geobacillus', 'genetic tools', 'plasmid', 'thermophile']",The Geobacillus Plasmid Set: A Modular Toolkit for Thermophile Engineering.,"Geobacillus thermoglucosidasius is a Gram-positive thermophile of industrial interest that exhibits rapid growth and can utilize a variety of plant-derived feedstocks. It is an attractive chassis organism for high temperature biotechnology and synthetic biology applications but is currently limited by a lack of available genetic tools. Here we describe a set of modular shuttle vectors, including a promoter library and reporter proteins. The compact plasmids are composed of interchangeable modules for molecular cloning in Escherichia coli and stable propagation in G. thermoglucosidasius and other Geobacillus species. Modules include two origins of replication, two selectable markers and three reporter proteins for characterization of gene expression. For fine-tuning heterologous expression from these plasmids, we include a characterized promoter library and test ribosome binding site design. Together, these gene expression tools and a standardized plasmid set can facilitate modularity and part exchange to make Geobacillus a thermophile chassis for synthetic biology."
2016 Jun 14,Proceedings of the National Academy of Sciences of the United States of America,Proc Natl Acad Sci U S A. 2016 Jun 14;113(24):E3431-40. doi: ,"['Florea, Michael', 'Hagemann, Henrik', 'Santosa, Gabriella', 'Abbott, James', 'Micklem, Chris N', 'Spencer-Milnes, Xenia', 'de Arroyo Garcia, Laura', 'Paschou, Despoina', 'Lazenbatt, Christopher', 'Kong, Deze', 'Chughtai, Haroon', 'Jensen, Kirsten', 'Freemont, Paul S', 'Kitney, Richard', 'Reeve, Benjamin', 'Ellis, Tom']","[' cellulose biosynthesis genetics', ' gram-positive asporogenous rods genetics isolation & purification metabolism', 'metabolic engineering  methods', 'bacterial cellulose', 'biomaterials', 'genetic engineering', 'genomics', 'synthetic biology']",Engineering control of bacterial cellulose production using a genetic toolkit and a new cellulose-producing strain.,"Bacterial cellulose is a strong and ultrapure form of cellulose produced naturally by several species of the Acetobacteraceae Its high strength, purity, and biocompatibility make it of great interest to materials science; however, precise control of its biosynthesis has remained a challenge for biotechnology. Here we isolate a strain of Komagataeibacter rhaeticus (K. rhaeticus iGEM) that can produce cellulose at high yields, grow in low-nitrogen conditions, and is highly resistant to toxic chemicals. We achieved external control over its bacterial cellulose production through development of a modular genetic toolkit that enables rational reprogramming of the cell. To further its use as an organism for biotechnology, we sequenced its genome and demonstrate genetic circuits that enable functionalization and patterning of heterologous gene expression within the cellulose matrix. This work lays the foundations for using genetic engineering to produce cellulose-based materials, with numerous applications in basic science, materials engineering, and biotechnology."
2016 May 31,Scientific reports,Sci Rep. 2016 May 31;6:26863. doi: 10.1038/srep26863.,"['Blount, Benjamin A', 'Driessen, Maureen R M', 'Ellis, Tom']","['dna, fungal  isolation & purification', ' genome, fungal', 'genomics', 'polymerase chain reaction', 'saccharomyces cerevisiae  genetics']",GC Preps: Fast and Easy Extraction of Stable Yeast Genomic DNA.,"Existing yeast genomic DNA extraction methods are not ideally suited to extensive screening of colonies by PCR, due to being too lengthy, too laborious or yielding poor quality DNA and inconsistent results. We developed the GC prep method as a solution to this problem. Yeast cells from colonies or liquid cultures are lysed by vortex mixing with glass beads and then boiled in the presence of a metal chelating resin. In around 12 minutes, multiple samples can be processed to extract high yields of genomic DNA. These preparations perform as effectively in PCR screening as DNA purified by organic solvent methods, are stable for up to 1 year at room temperature and can be used as the template for PCR amplification of fragments of at least 8 kb."
2016 Oct 1,Advanced drug delivery reviews,Adv Drug Deliv Rev. 2016 Oct 1;105(Pt A):96-106. doi: 10.1016/j.addr.2016.04.010. ,"['Awan, Ali R', 'Shaw, William M', 'Ellis, Tom']","['biological products  therapeutic use', 'humans', 'synthetic biology', 'alkaloids', 'natural products', 'nonribosomal peptides', 'polyketides', 'synthetic biology', 'terpenoids', 'therapeutics']",Biosynthesis of therapeutic natural products using synthetic biology.,"Natural products are a group of bioactive structurally diverse chemicals produced by microorganisms and plants. These molecules and their derivatives have contributed to over a third of the therapeutic drugs produced in the last century. However, over the last few decades traditional drug discovery pipelines from natural products have become far less productive and far more expensive. One recent development with promise to combat this trend is the application of synthetic biology to therapeutic natural product biosynthesis. Synthetic biology is a young discipline with roots in systems biology, genetic engineering, and metabolic engineering. In this review, we discuss the use of synthetic biology to engineer improved yields of existing therapeutic natural products. We further describe the use of synthetic biology to combine and express natural product biosynthetic genes in unprecedented ways, and how this holds promise for opening up completely new avenues for drug discovery and production."
2016 Mar 24,Scientific reports,Sci Rep. 2016 Mar 24;6:23635. doi: 10.1038/srep23635.,"['Florea, Michael', 'Reeve, Benjamin', 'Abbott, James', 'Freemont, Paul S', 'Ellis, Tom']","['cellulose  biosynthesis', ' genome, bacterial', 'gluconacetobacter classification genetics  metabolism', ' models, biological', 'phylogeny', ' plasmids', 'transformation, bacterial']",Genome sequence and plasmid transformation of the model high-yield bacterial cellulose producer Gluconacetobacter hansenii ATCC 53582.,"Bacterial cellulose is a strong, highly pure form of cellulose that is used in a range of applications in industry, consumer goods and medicine. Gluconacetobacter hansenii ATCC 53582 is one of the highest reported bacterial cellulose producing strains and has been used as a model organism in numerous studies of bacterial cellulose production and studies aiming to increased cellulose productivity. Here we present a high-quality draft genome sequence for G. hansenii ATCC 53582 and find that in addition to the previously described cellulose synthase operon, ATCC 53582 contains two additional cellulose synthase operons and several previously undescribed genes associated with cellulose production. In parallel, we also develop optimized protocols and identify plasmid backbones suitable for transformation of ATCC 53582, albeit with low efficiencies. Together, these results provide important information for further studies into cellulose synthesis and for future studies aiming to genetically engineer G. hansenii ATCC 53582 for increased cellulose productivity."
2015 Sep,Nature reviews. Molecular cell biology,Nat Rev Mol Cell Biol. 2015 Sep;16(9):568-76. doi: 10.1038/nrm4014. Epub 2015 Jun ,"['Casini, Arturo', 'Storch, Marko', 'Baldwin, Geoffrey S', 'Ellis, Tom']","['cloning, molecular  methods', 'endonucleases chemistry', 'genetic engineering methods standards', 'recombination, genetic', 'reference standards', 'synthetic biology']",Bricks and blueprints: methods and standards for DNA assembly.,"DNA assembly is a key part of constructing gene expression systems and even whole chromosomes. In the past decade, a plethora of powerful new DNA assembly methods - including Gibson Assembly, Golden Gate and ligase cycling reaction (LCR) - have been developed. In this Innovation article, we discuss these methods as well as standards such as the modular cloning (MoClo) system, GoldenBraid, modular overlap-directed assembly with linkers (MODAL) and PaperClip, which have been developed to facilitate a streamlined assembly workflow, to aid the exchange of material between research groups and to create modular reusable DNA parts."
2015 May,Nature methods,Nat Methods. 2015 May;12(5):415-8. doi: 10.1038/nmeth.3339. Epub 2015 Apr 6.,"['Ceroni, Francesca', 'Algar, Rhys', 'Stan, Guy-Bart', 'Ellis, Tom']","['bacterial proteins genetics  metabolism', 'chromobacterium enzymology', 'dna, bacterial', 'escherichia coli  metabolism', 'gene expression regulation, bacterial  physiology', 'genes, reporter', 'luminescent proteins metabolism', 'rna, messenger genetics metabolism', 'recombinant proteins genetics metabolism', 'riboswitch', 'vibrio  enzymology genetics metabolism', 'red fluorescent protein']",Quantifying cellular capacity identifies gene expression designs with reduced burden.,"Heterologous gene expression can be a significant burden for cells. Here we describe an in vivo monitor that tracks changes in the capacity of Escherichia coli in real time and can be used to assay the burden imposed by synthetic constructs and their parts. We identify construct designs with reduced burden that predictably outperformed less efficient designs, despite having equivalent output."
2015,Methods in enzymology,Methods Enzymol. 2015;550:173-85. doi: 10.1016/bs.mie.2014.10.047. Epub 2015 Jan ,"['Pothoulakis, Georgios', 'Ellis, Tom']","['binding sites', 'escherichia coli  genetics', 'flow cytometry', 'luminescent proteins genetics metabolism', 'microscopy, fluorescence', 'rna genetics metabolism', 'rna, messenger genetics  metabolism', 'spinacia oleracea  genetics', 'red fluorescent protein', 'aptamer', 'flow cytometry', 'fluorescence', 'live-cell imaging', 'measurement', 'promoter', 'ribosome binding site', 'spinach rna']",Using Spinach aptamer to correlate mRNA and protein levels in Escherichia coli.,"In vivo gene expression measurements have traditionally relied on fluorescent proteins such as green fluorescent protein (GFP) with the help of high-sensitivity equipment such as flow cytometers. However, fluorescent proteins report only on the protein level inside the cell without giving direct information about messenger RNA (mRNA) production. In 2011, an aptamer termed Spinach was presented that acts as an RNA mimic of GFP when produced in Escherichia coli and mammalian cells. It was later shown that coexpression of a red fluorescent protein (mRFP1) and the Spinach aptamer, when included into the same gene expression cassette, could be utilized for parallel in vivo measurements of mRNA and protein production. As accurate characterization of component biological parts is becoming increasingly important for fields such as synthetic biology, Spinach in combination with mRFP1 provide a great tool for the characterization of promoters and ribosome binding sites. In this chapter, we discuss how live-cell imaging and flow cytometry can be used to detect and measure fluorescence produced in E. coli cells by different constructs that contain the Spinach aptamer and the mRFP1 gene."
2014,Advances in biochemical engineering/biotechnology,Adv Biochem Eng Biotechnol. 2014;145:3-30. doi: 10.1007/978-3-662-43619-6_1.,"['Reeve, Benjamin', 'Sanderson, Theo', 'Ellis, Tom', 'Freemont, Paul']","['animals', 'bacteria enzymology', 'bioengineering  methods', 'fireflies physiology', 'lighting instrumentation  methods', 'luciferases, bacterial chemistry metabolism', 'luciferases, firefly chemistry metabolism', ' luminescence', 'luminescent measurements', 'plants, genetically modified physiology', 'scyphozoa physiology', 'synthetic biology  methods', 'systems biology methods']",How synthetic biology will reconsider natural bioluminescence and its applications.,"As our understanding of natural biological systems grows, so too does our ability to alter and rebuild them. Synthetic biology is the application of engineering principles to biology in order to design and construct novel biological systems for specific applications. Bioluminescent organisms offer a treasure trove of light-emitting enzymes that may have applications in many areas of bioengineering, from biosensors to lighting. A few select bioluminescent organisms have been well researched and the molecular and genetic basis of their luminescent abilities elucidated, with work underway to understand the basis of luminescence in many others. Synthetic biology will aim to package these light-emitting systems as self-contained biological modules, characterize their properties, and then optimize them for use in other chassis organisms. As this catalog of biological parts grows, synthetic biologists will be able to engineer complex biological systems with the ability to emit light. These may use luminescence for an array of disparate functions, from providing illumination to conveying information or allowing communication between organisms."
