time,journal,doi_info,authors,key words,title,abstract
2021 Jan,"Diabetes, obesity & metabolism",Diabetes Obes Metab. 2021 Jan;23(1):270-275. doi: 10.1111/dom.14207. Epub 2020 ,"['Hameed, Saira', 'Salem, Victoria', 'Alessimii, Haya', 'Scholtz, Samantha', 'Dar, Owais', 'Miras, Alexander D', 'Meeran, Karim', 'Bloom, Stephen R', 'Ahmed, Ahmed R', 'Purkayastha, Sanjay', 'Chahal, Harvinder', 'Tan, Tricia']","['delivery of health care', ' diabetes mellitus, type 2 therapy', 'humans', 'obesity therapy', 'weight loss', ' weight reduction programs', 'dietary intervention', 'obesity therapy', 'weight control']","Imperial Satiety Protocol: A new non-surgical weight-loss programme, delivered in a health care setting, produces improved clinical outcomes for people with obesity.","'Imperial Satiety Protocol' (I-SatPro) is a new multifaceted approach to weight loss for people with obesity (PwO), encompassing dietary advice, time-restricted eating, physical activity and coaching to support behaviour change. Participants (n = 84) attended fortnightly I-SatPro group sessions for 30 weeks, with 70% of participants completing. On completion at 30 weeks, the mean weight loss was 15.2 ± 1.1 kg (13.2 ± 0.8% from baseline, P < .0001), which was maintained to 52 weeks (16.6 ± 1.5 kg, 14.1 ± 1.2%, P < .0001). Weight loss was not associated with reduced energy expenditure. In participants with type 2 diabetes and pre-diabetes (n = 16), glycated haemoglobin fell from 50 to 43 mmol/mol (P < .01). Systolic blood pressure fell by 12 mmHg (P < .0001). Triglycerides fell by 0.37 mmol/L (P < .01) and high-density lipoprotein rose by 0.08 mmol/L (P < .01). Short Form-36 (SF-36) functioning and wellbeing scores increased in all domains post I-SatPro intervention. For selected PwO, I-SatPro delivers clinically meaningful weight loss, and the potential for long-term health and wellbeing improvements."
2020 Sep,Diabetes,Diabetes. 2020 Sep;69(9):e10-e11. doi: 10.2337/db20-0501.,"['Rutter, Guy A', 'Ninov, Nikolay', 'Salem, Victoria', 'Hodson, David J']","[' diabetes mellitus', 'electrophysiological phenomena', 'humans', ' islets of langerhans']","Comment on Satin et al. ""Take Me To Your Leader"": An Electrophysiological Appraisal of the Role of Hub Cells in Pancreatic Islets. Diabetes 2020;69:830-836.",
2019 Jun,Nature metabolism,Nat Metab. 2019 Jun;1(6):615-629. doi: 10.1038/s42255-019-0075-2. Epub 2019 Jun ,"['Salem, Victoria', 'Silva, Luis Delgadillo', 'Suba, Kinga', 'Georgiadou, Eleni', 'Neda Mousavy Gharavy, S', 'Akhtar, Nadeem', 'Martin-Alonso, Aldara', 'Gaboriau, David C A', 'Rothery, Stephen M', 'Stylianides, Theodoros', 'Carrat, Gaelle', 'Pullen, Timothy J', 'Singh, Sumeet Pal', 'Hodson, David J', 'Leclerc, Isabelle', 'Shapiro, A M James', 'Marchetti, Piero', 'Briant, Linford J B', 'Distaso, Walter', 'Ninov, Nikolay', 'Rutter, Guy A']","['animals', 'calcium  metabolism', 'glucose metabolism', 'in vitro techniques', 'insulin metabolism', 'insulin-secreting cells  metabolism', 'signal transduction', 'zebrafish metabolism']",Leader β-cells coordinate Ca(2+) dynamics across pancreatic islets in vivo.,"Pancreatic β-cells form highly connected networks within isolated islets. Whether this behaviour pertains to the situation in vivo, after innervation and during continuous perfusion with blood, is unclear. In the present study, we used the recombinant Ca(2+) sensor GCaMP6 to assess glucose-regulated connectivity in living zebrafish Danio rerio, and in murine or human islets transplanted into the anterior eye chamber. In each setting, Ca(2+) waves emanated from temporally defined leader β-cells, and three-dimensional connectivity across the islet increased with glucose stimulation. Photoablation of zebrafish leader cells disrupted pan-islet signalling, identifying these as likely pacemakers. Correspondingly, in engrafted mouse islets, connectivity was sustained during prolonged glucose exposure, and super-connected 'hub' cells were identified. Granger causality analysis revealed a controlling role for temporally defined leaders, and transcriptomic analyses revealed a discrete hub cell fingerprint. We thus define a population of regulatory β-cells within coordinated islet networks in vivo. This population may drive Ca(2+) dynamics and pulsatile insulin secretion."
2020 Oct,Molecular metabolism,Mol Metab. 2020 Oct;40:101015. doi: 10.1016/j.molmet.2020.101015. Epub 2020 May ,"['Carrat, Gaelle R', 'Haythorne, Elizabeth', 'Tomas, Alejandra', 'Haataja, Leena', 'Müller, Andreas', 'Arvan, Peter', 'Piunti, Alexandra', 'Cheng, Kaiying', 'Huang, Mutian', 'Pullen, Timothy J', 'Georgiadou, Eleni', 'Stylianides, Theodoros', 'Amirruddin, Nur Shabrina', 'Salem, Victoria', 'Distaso, Walter', 'Cakebread, Andrew', 'Heesom, Kate J', 'Lewis, Philip A', 'Hodson, David J', 'Briant, Linford J', 'Fung, Annie C H', 'Sessions, Richard B', 'Alpy, Fabien', 'Kong, Alice P S', 'Benke, Peter I', 'Torta, Federico', 'Teo, Adrian Kee Keong', 'Leclerc, Isabelle', 'Solimena, Michele', 'Wigley, Dale B', 'Rutter, Guy A']","['alleles', 'animals', 'carrier proteins metabolism', 'diabetes mellitus, type 2  genetics metabolism', 'disease models, animal', 'female', 'insulin metabolism', 'insulin secretion physiology', 'insulin-secreting cells metabolism', 'lipid metabolism genetics physiology', 'lipids physiology', 'male', 'mice', 'mice, inbred c57bl', 'mice, knockout', 'molecular docking simulation', 'phosphatidylinositols metabolism', 'phosphoproteins genetics  metabolism', 'protein binding', 'proteomics', 'risk factors', 'secretory vesicles metabolism', 'insulin granule biogenesis', 'lipid transporter', 'pancreatic β-cell', 'phosphoinositides', 'type 2 diabetes']",The type 2 diabetes gene product STARD10 is a phosphoinositide-binding protein that controls insulin secretory granule biogenesis.,"OBJECTIVE: Risk alleles for type 2 diabetes at the STARD10 locus are associated with lowered STARD10 expression in the β-cell, impaired glucose-induced insulin secretion, and decreased circulating proinsulin:insulin ratios. Although likely to serve as a mediator of intracellular lipid transfer, the identity of the transported lipids and thus the pathways through which STARD10 regulates β-cell function are not understood. The aim of this study was to identify the lipids transported and affected by STARD10 in the β-cell and the role of the protein in controlling proinsulin processing and insulin granule biogenesis and maturation. METHODS: We used isolated islets from mice deleted selectively in the β-cell for Stard10 (βStard10KO) and performed electron microscopy, pulse-chase, RNA sequencing, and lipidomic analyses. Proteomic analysis of STARD10 binding partners was executed in the INS1 (832/13) cell line. X-ray crystallography followed by molecular docking and lipid overlay assay was performed on purified STARD10 protein. RESULTS: βStard10KO islets had a sharply altered dense core granule appearance, with a dramatic increase in the number of ""rod-like"" dense cores. Correspondingly, basal secretion of proinsulin was increased versus wild-type islets. The solution of the crystal structure of STARD10 to 2.3 Å resolution revealed a binding pocket capable of accommodating polyphosphoinositides, and STARD10 was shown to bind to inositides phosphorylated at the 3' position. Lipidomic analysis of βStard10KO islets demonstrated changes in phosphatidylinositol levels, and the inositol lipid kinase PIP4K2C was identified as a STARD10 binding partner. Also consistent with roles for STARD10 in phosphoinositide signalling, the phosphoinositide-binding proteins Pirt and Synaptotagmin 1 were amongst the differentially expressed genes in βStard10KO islets. CONCLUSION: Our data indicate that STARD10 binds to, and may transport, phosphatidylinositides, influencing membrane lipid composition, insulin granule biosynthesis, and insulin processing."
2019 Sep,"Hormones (Athens, Greece)",Hormones (Athens). 2019 Sep;18(3):307-313. doi: 10.1007/s42000-019-00114-8.,"['Bhatt, Padmanabh S', 'Sam, Amir H', 'Meeran, Karim M', 'Salem, Victoria']","['adrenal cortex neoplasms complications diagnosis  metabolism', 'adrenocortical adenoma complications diagnosis  metabolism', 'adult', 'aldosterone  metabolism', 'dexamethasone pharmacology', 'diagnostic techniques, endocrine', 'female', 'humans', 'hydrocortisone  metabolism', 'hyperaldosteronism diagnosis etiology  metabolism', 'male', 'middle aged', 'prognosis', 'retrospective studies', 'secretory pathway', 'adrenal cortex', 'aldosterone', 'co-secretion', 'cortisol', 'cushing’s syndrome', 'hyperaldosteronism', 'metabolic profile']",The relevance of cortisol co-secretion from aldosterone-producing adenomas.,"AIMS AND OBJECTIVES: Adrenal adenomas are usually non-functioning, but can secrete aldosterone or cortisol. It has recently been suggested that many more adenomas than previously thought secrete more than one hormone. This has important implications for their clinical management. Our aim was to determine the frequency of cortisol co-secretion in primary hyperaldosteronism at our institution and investigate the difference in metabolic profiles and clinical outcomes between co-secreting and non-co-secreting patients. DESIGN AND PATIENTS: A retrospective study of 25 patients with primary hyperaldosteronism who also underwent formal dexamethasone suppression tests to determine cortisol co-secretion. MEASUREMENTS: Post-dexamethasone suppression test cortisol, serum ALT, total cholesterol, HDL-cholesterol, LDL-cholesterol, HbA1C (were recorded) and mean arterial pressure are reported in this cohort of patients with primary hyperaldosteronism. RESULTS: Four out of 25 patients with primary hyperaldosteronism failed dexamethasone suppression tests. This suggests a frequency of co-secretion ranging between 4 and 16%. No significant difference was found in serum ALT, total cholesterol, serum HDL-cholesterol, LDL-cholesterol and mean arterial blood pressure at presentation between co-secretors and non-co-secretors. CONCLUSION: A frequency range of 4-16% suggests that a significant proportion of patients with primary hyperaldosteronism co-secrete cortisol. Co-secretors did not have a worse metabolic profile than non-secretors. The impact of co-secretion on metabolic profile and surgical management remains unclear and warrants further study."
2018 Oct 18,JCI insight,JCI Insight. 2018 Oct 18;3(20):e121958. doi: 10.1172/jci.insight.121958.,"['Comninos, Alexander N', 'Demetriou, Lysia', 'Wall, Matthew B', 'Shah, Amar J', 'Clarke, Sophie A', 'Narayanaswamy, Shakunthala', 'Nesbitt, Alexander', 'Izzi-Engbeaya, Chioma', 'Prague, Julia K', 'Abbara, Ali', 'Ratnasabapathy, Risheka', 'Yang, Lisa', 'Salem, Victoria', 'Nijher, Gurjinder M', 'Jayasena, Channa N', 'Tanner, Mark', 'Bassett, Paul', 'Mehta, Amrish', 'McGonigle, John', 'Rabiner, Eugenii A', 'Bloom, Stephen R', 'Dhillo, Waljit S']","['administration, intravenous', 'adult', 'brain diagnostic imaging drug effects physiology', 'connectome', 'cross-over studies', 'double-blind method', 'emotions  drug effects physiology', 'female', 'healthy volunteers', 'humans', 'kisspeptins  administration & dosage', 'male', 'mental disorders drug therapy', 'nerve net drug effects physiology', 'placebos administration & dosage', 'psychometrics', 'rest physiology', 'sexual behavior  drug effects physiology', 'sexual dysfunction, physiological drug therapy', 'young adult', 'endocrinology', 'neuroendocrine regulation', 'neuroimaging', 'reproductive biology', 'sex hormones']",Modulations of human resting brain connectivity by kisspeptin enhance sexual and emotional functions.,"BACKGROUND: Resting brain connectivity is a crucial component of human behavior demonstrated by disruptions in psychosexual and emotional disorders. Kisspeptin, a recently identified critical reproductive hormone, can alter activity in certain brain structures but its effects on resting brain connectivity and networks in humans remain elusive. METHODS: We determined the effects of kisspeptin on resting brain connectivity (using functional neuroimaging) and behavior (using psychometric analyses) in healthy men, in a randomized double-blinded 2-way placebo-controlled study. RESULTS: Kisspeptin's modulation of the default mode network (DMN) correlated with increased limbic activity in response to sexual stimuli (globus pallidus r = 0.500, P = 0.005; cingulate r = 0.475, P = 0.009). Furthermore, kisspeptin's DMN modulation was greater in men with less reward drive (r = -0.489, P = 0.008) and predicted reduced sexual aversion (r = -0.499, P = 0.006), providing key functional significance. Kisspeptin also enhanced key mood connections including between the amygdala-cingulate, hippocampus-cingulate, and hippocampus-globus pallidus (all P < 0.05). Consistent with this, kisspeptin's enhancement of hippocampus-globus pallidus connectivity predicted increased responses to negative stimuli in limbic structures (including the thalamus and cingulate [all P < 0.01]). CONCLUSION: Taken together, our data demonstrate a previously unknown role for kisspeptin in the modulation of functional brain connectivity and networks, integrating these with reproductive hormones and behaviors. Our findings that kisspeptin modulates resting brain connectivity to enhance sexual and emotional processing and decrease sexual aversion, provide foundation for kisspeptin-based therapies for associated disorders of body and mind. FUNDING: NIHR, MRC, and Wellcome Trust."
2018,Journal of obesity,J Obes. 2018 Feb 14;2018:8419120. doi: 10.1155/2018/8419120. eCollection 2018.,"['Hameed, Saira', 'Salem, Victoria', 'Tan, Tricia M', 'Collins, Alma', 'Shah, Krishna', 'Scholtz, Samantha', 'Ahmed, Ahmed R', 'Chahal, Harvinder']","['adult', 'aged', ' bariatric surgery', 'female', 'humans', 'male', 'middle aged', ' needs assessment', 'obesity, morbid psychology  surgery', 'patient preference', 'retrospective studies', ' self-help groups', 'surveys and questionnaires', ' weight loss']",Beyond Weight Loss: Establishing a Postbariatric Surgery Patient Support Group-What Do Patients Want?,"PURPOSE: There are limited resources for long-term specialist follow-up after bariatric surgery. In selected centres, patients can access a postoperative support group, but there is no clear evidence to guide their delivery. MATERIALS AND METHODS: A retrospective study of bariatric surgery patients (n = 152) who had been discharged from specialist follow-up (mean time since surgery 5.5 years), covering weight history, physical and psychosocial comorbidities, and the need for a postoperative bariatric support group. RESULTS: Fifty-eight percent wanted a postbariatric surgery patient support group. This was not associated with operation type or the amount of weight lost or regained. However, those who wanted a support group were significantly more likely to be struggling to keep the weight off, to be unhappy with the way they look, or to be experiencing difficulties returning to work. CONCLUSIONS: These data point to an unmet patient requirement for a postoperative support group that is independent of weight loss success. More research is required to ascertain how such a group should be delivered, but our data would suggest that supporting patients with weight loss maintenance, body image, and return to work is an important part of postoperative care, and these needs extend well beyond the immediate period of specialist follow-up."
2017 Dec,Current opinion in pharmacology,Curr Opin Pharmacol. 2017 Dec;37:1-9. doi: 10.1016/j.coph.2017.07.004. Epub 2017 ,"['Bhatt, Padmanabh Shrikant', 'Dhillo, Waljit S', 'Salem, Victoria']","[' adipose tissue, brown anatomy & histology physiology', 'animals', 'humans', 'metabolic diseases drug therapy', 'weight loss']",Human brown adipose tissue-function and therapeutic potential in metabolic disease.,"There has been a resurgence of interest in brown adipose tissue (BAT) over the last decade. Key to this has been our ability to accurately image it, which has improved significantly. The role of BAT in regulating energy expenditure is important, and its pharmacological manipulation may hold therapeutic potential in metabolic disease. There is ample evidence of BAT activation by cold exposure, and pharmacological utilisation of similar pathways, using B3 receptor agonists holds promise since the development of selective agonists with limited cross-reactivity has rekindled interest. Endogenous agents like irisin, FGF21 and certain gut hormones may hold value as BAT activators. Other agents such as steroid hormones may also hold therapeutic potential, although short-term worsening of metabolic profile remains problematic. Clearly, pharmacological manipulation of BAT is important, and thanks to recent advances we may one day be able to add such agents to our anti-obesity arsenal."
2014 Nov,The Journal of clinical endocrinology and metabolism,J Clin Endocrinol Metab. 2014 Nov;99(11):E2317-24. doi: 10.1210/jc.2014-2143. ,"['Tan, Tricia M', 'Salem, Victoria', 'Troke, Rachel C', 'Alsafi, Ali', 'Field, Benjamin C T', 'De Silva, Akila', 'Misra, Shivani', 'Baynes, Kevin C R', 'Donaldson, Mandy', 'Minnion, James', 'Ghatei, Mohammad A', 'Godsland, Ian F', 'Bloom, Stephen R']","['adult', 'blood glucose', 'female', 'glucagon-like peptide 1  pharmacology', 'glucose  administration & dosage', 'glucose tolerance test', 'homeostasis drug effects', 'humans', 'insulin  blood', 'insulin resistance', 'male', 'middle aged', 'obesity  blood', 'overweight  blood', 'peptide fragments  pharmacology', 'peptide yy  pharmacology', 'young adult']",Combination of peptide YY3-36 with GLP-1(7-36) amide causes an increase in first-phase insulin secretion after IV glucose.,"CONTEXT: The combination of peptide YY (PYY) and glucagon-like peptide-1 (GLP-1) has been proposed as a potential treatment for diabetes and obesity. However, the combined effects of these hormones, PYY(3-36) and GLP-1(7-36 amide), on glucose homeostasis are unknown. OBJECTIVE: This study sought to investigate the acute effects of PYY(3-36) and GLP-1(7-36) amide, individually and in combination, on insulin secretion and sensitivity. SETTING AND DESIGN: Using a frequently sampled iv glucose tolerance test (FSIVGTT) and minimal modeling, this study measured the effects of PYY(3-36) alone, GLP-1(7-36) amide alone, and a combination of PYY(3-36) and GLP-1(7-36) amide on acute insulin response to glucose (AIRg) and insulin sensitivity index (SI) in 14 overweight human volunteers, studied in a clinical research facility. RESULTS: PYY(3-36) alone caused a small but nonsignificant increase in AIRg. GLP-1(7-36) amide alone and the combination of PYY(3-36) and GLP-1(7-36) amide did increase AIRg significantly. No significant differences in SI were observed with any intervention. CONCLUSIONS: PYY(3-36) lacks any significant acute effects on first-phase insulin secretion or SI when tested using an FSIVGTT. Both GLP-1(7-36) amide alone and the combination of PYY3-36 and GLP-1(7-36) amide increase first-phase insulin secretion. There does not seem to be any additive or synergistic effect between PYY(3-36) and GLP-1(7-36) amide on first-phase insulin secretion. Neither hormone alone nor the combination had any significant effects on SI."
