time,journal,doi_info,authors,key words,title,abstract
2017 Jul 26,Cell systems,Cell Syst. 2017 Jul 26;5(1):11-24.e12. doi: 10.1016/j.cels.2017.06.001. Epub 2017 ,"['Yeung, Enoch', 'Dy, Aaron J', 'Martin, Kyle B', 'Ng, Andrew H', 'Del Vecchio, Domitilla', 'Beck, James L', 'Collins, James J', 'Murray, Richard M']","['biophysical phenomena', 'dna, bacterial  genetics', 'dna, superhelical  genetics', 'gene expression regulation, bacterial', ' gene regulatory networks', ' genes, bacterial', ' genes, synthetic', 'peptide chain initiation, translational', 'promoter regions, genetic genetics', 'transcription, genetic', 'compositional context', 'genetic context', 'supercoiling', 'synthetic biology', 'transcriptional regulation']",Biophysical Constraints Arising from Compositional Context in Synthetic Gene Networks.,"Synthetic gene expression is highly sensitive to intragenic compositional context (promoter structure, spacing regions between promoter and coding sequences, and ribosome binding sites). However, much less is known about the effects of intergenic compositional context (spatial arrangement and orientation of entire genes on DNA) on expression levels in synthetic gene networks. We compare expression of induced genes arranged in convergent, divergent, or tandem orientations. Induction of convergent genes yielded up to 400% higher expression, greater ultrasensitivity, and dynamic range than divergent- or tandem-oriented genes. Orientation affects gene expression whether one or both genes are induced. We postulate that transcriptional interference in divergent and tandem genes, mediated by supercoiling, can explain differences in expression and validate this hypothesis through modeling and in vitro supercoiling relaxation experiments. Treatment with gyrase abrogated intergenic context effects, bringing expression levels within 30% of each other. We rebuilt the toggle switch with convergent genes, taking advantage of supercoiling effects to improve threshold detection and switch stability."
2017 Jan 25,Cell systems,Cell Syst. 2017 Jan 25;4(1):109-120.e11. doi: 10.1016/j.cels.2016.12.001. Epub ,"['Del Vecchio, Domitilla', 'Abdallah, Hussein', 'Qian, Yili', 'Collins, James J']","['cell differentiation', 'cellular reprogramming  genetics', 'cellular reprogramming techniques  methods', 'computer simulation', 'epigenesis, genetic genetics', 'gene regulatory networks  genetics', 'genes, synthetic genetics', 'humans', 'transcription factors genetics', 'cell fate', 'feedback control', 'gene regulatory network', 'multistability', 'reprogramming', 'synthetic biology']",A Blueprint for a Synthetic Genetic Feedback Controller to Reprogram Cell Fate.,"To artificially reprogram cell fate, experimentalists manipulate the gene regulatory networks (GRNs) that maintain a cell's phenotype. In practice, reprogramming is often performed by constant overexpression of specific transcription factors (TFs). This process can be unreliable and inefficient. Here, we address this problem by introducing a new approach to reprogramming based on mathematical analysis. We demonstrate that reprogramming GRNs using constant overexpression may not succeed in general. Instead, we propose an alternative reprogramming strategy: a synthetic genetic feedback controller that dynamically steers the concentration of a GRN's key TFs to any desired value. The controller works by adjusting TF expression based on the discrepancy between desired and actual TF concentrations. Theory predicts that this reprogramming strategy is guaranteed to succeed, and its performance is independent of the GRN's structure and parameters, provided that feedback gain is sufficiently high. As a case study, we apply the controller to a model of induced pluripotency in stem cells."
2016 Jul,"Journal of the Royal Society, Interface",J R Soc Interface. 2016 Jul;13(120):20160380. doi: 10.1098/rsif.2016.0380. Epub ,"['Del Vecchio, Domitilla', 'Dy, Aaron J', 'Qian, Yili']","['humans', ' models, theoretical', 'synthetic biology  methods trends', 'control theory', 'feedback', 'gene regulation', 'genetic circuits', 'robustness', 'synthetic biology']",Control theory meets synthetic biology.,"The past several years have witnessed an increased presence of control theoretic concepts in synthetic biology. This review presents an organized summary of how these control design concepts have been applied to tackle a variety of problems faced when building synthetic biomolecular circuits in living cells. In particular, we describe success stories that demonstrate how simple or more elaborate control design methods can be used to make the behaviour of synthetic genetic circuits within a single cell or across a cell population more reliable, predictable and robust to perturbations. The description especially highlights technical challenges that uniquely arise from the need to implement control designs within a new hardware setting, along with implemented or proposed solutions. Some engineering solutions employing complex feedback control schemes are also described, which, however, still require a deeper theoretical analysis of stability, performance and robustness properties. Overall, this paper should help synthetic biologists become familiar with feedback control concepts as they can be used in their application area. At the same time, it should provide some domain knowledge to control theorists who wish to enter the rising and exciting field of synthetic biology."
2016 Jul 21,Molecular cell,Mol Cell. 2016 Jul 21;63(2):329-336. doi: 10.1016/j.molcel.2016.06.006. Epub 2016 ,"['Lee, Jeong Wook', 'Gyorgy, Andras', 'Cameron, D Ewen', 'Pyenson, Nora', 'Choi, Kyeong Rok', 'Way, Jeffrey C', 'Silver, Pamela A', 'Del Vecchio, Domitilla', 'Collins, James J']","['energy metabolism', 'escherichia coli  genetics growth & development metabolism', 'escherichia coli proteins genetics metabolism', ' gene dosage', 'gene expression regulation, bacterial', 'genetic engineering  methods', ' genome, bacterial', 'lac repressors genetics metabolism', 'luminescent proteins genetics metabolism', ' models, genetic', 'plasmids  genetics metabolism', 'stochastic processes', 'synthetic biology  methods', ' transcription, genetic']",Creating Single-Copy Genetic Circuits.,"Synthetic biology is increasingly used to develop sophisticated living devices for basic and applied research. Many of these genetic devices are engineered using multi-copy plasmids, but as the field progresses from proof-of-principle demonstrations to practical applications, it is important to develop single-copy synthetic modules that minimize consumption of cellular resources and can be stably maintained as genomic integrants. Here we use empirical design, mathematical modeling, and iterative construction and testing to build single-copy, bistable toggle switches with improved performance and reduced metabolic load that can be stably integrated into the host genome. Deterministic and stochastic models led us to focus on basal transcription to optimize circuit performance and helped to explain the resulting circuit robustness across a large range of component expression levels. The design parameters developed here provide important guidance for future efforts to convert functional multi-copy gene circuits into optimized single-copy circuits for practical, real-world use."
2015 Aug 4,Biophysical journal,Biophys J. 2015 Aug 4;109(3):639-46. doi: 10.1016/j.bpj.2015.06.034.,"['Gyorgy, Andras', 'Jiménez, José I', 'Yazbek, John', 'Huang, Hsin-Ho', 'Chung, Hattie', 'Weiss, Ron', 'Del Vecchio, Domitilla']","['bacterial proteins  genetics metabolism', 'escherichia coli genetics metabolism', ' gene expression regulation, bacterial', ' gene regulatory networks', ' models, genetic', 'ribosomes metabolism']",Isocost Lines Describe the Cellular Economy of Genetic Circuits.,"Genetic circuits in living cells share transcriptional and translational resources that are available in limited amounts. This leads to unexpected couplings among seemingly unconnected modules, which result in poorly predictable circuit behavior. In this study, we determine these interdependencies between products of different genes by characterizing the economy of how transcriptional and translational resources are allocated to the production of proteins in genetic circuits. We discover that, when expressed from the same plasmid, the combinations of attainable protein concentrations are constrained by a linear relationship, which can be interpreted as an isocost line, a concept used in microeconomics. We created a library of circuits with two reporter genes, one constitutive and the other inducible in the same plasmid, without a regulatory path between them. In agreement with the model predictions, experiments reveal that the isocost line rotates when changing the ribosome binding site strength of the inducible gene and shifts when modifying the plasmid copy number. These results demonstrate that isocost lines can be employed to predict how genetic circuits become coupled when sharing resources and provide design guidelines for minimizing the effects of such couplings."
2015 Feb,Trends in biotechnology,Trends Biotechnol. 2015 Feb;33(2):111-9. doi: 10.1016/j.tibtech.2014.11.009. Epub ,"['Del Vecchio, Domitilla']","['cell compartmentation genetics', 'humans', 'metabolic engineering  methods', 'open reading frames', 'phosphorylation', 'promoter regions, genetic', ' protein biosynthesis', 'protein engineering  methods', ' synthetic biology']","Modularity, context-dependence, and insulation in engineered biological circuits.","The ability to link systems together such that they behave as predicted once they interact with each other is an essential requirement for the forward-engineering of robust synthetic biological circuits. Unfortunately, because of context-dependencies, parts and functional modules often behave unpredictably once interacting in the cellular environment. This paper reviews recent advances toward establishing a rigorous engineering framework for insulating parts and modules from their context to improve modularity. Overall, a synergy between engineering better parts and higher-level circuit design will be important to resolve the problem of context-dependence."
